"AnchorRepo","AnchorUrl","CandidateRepo","CandidateUrl","CandidateOwner","CandidateLanguage","CandidateStars","CandidateSubdomain","Rank","Score","Qualified","TopicJaccard","LexicalJaccard","LanguageMatch","StarSimilarity","RecencySimilarity","SubdomainMatch","QueryCoverage","SourceQueries","Description"
"jacobgil/pytorch-grad-cam","https://github.com/jacobgil/pytorch-grad-cam","deepinsight/insightface","https://github.com/deepinsight/insightface","deepinsight","Python","28583","deep-learning","0","604.05","False","0.0385","0","1","0.8254","1","0","0.3333","pytorch language:Python stars:>=50","State-of-the-art 2D and 3D Face Analysis Project"
"jacobgil/pytorch-grad-cam","https://github.com/jacobgil/pytorch-grad-cam","NVlabs/neuralangelo","https://github.com/NVlabs/neuralangelo","NVlabs","Python","4591","deep-learning","0","603.93","False","0.0476","0","1","0.7776","1","0","0.3333","topic:computer-vision language:Python stars:>=50","Official implementation of ""Neuralangelo: High-Fidelity Neural Surface Reconstruction"" (CVPR 2023)"
"jacobgil/pytorch-grad-cam","https://github.com/jacobgil/pytorch-grad-cam","PacktPublishing/Advanced-Deep-Learning-with-Keras","https://github.com/PacktPublishing/Advanced-Deep-Learning-with-Keras","PacktPublishing","Python","1993","deep-learning","0","599.83","False","0.0455","0.0455","1","0.5964","1","0","0.3333","advanced language:Python stars:>=50"," Advanced Deep Learning with Keras, published by Packt"
"jacobgil/pytorch-grad-cam","https://github.com/jacobgil/pytorch-grad-cam","s0md3v/XSStrike","https://github.com/s0md3v/XSStrike","s0md3v","Python","14934","computer-vision","0","594.11","False","0","0","1","0.9663","1","0","0.3333","advanced language:Python stars:>=50","Most advanced XSS scanner."
"jacobgil/pytorch-grad-cam","https://github.com/jacobgil/pytorch-grad-cam","codelucas/newspaper","https://github.com/codelucas/newspaper","codelucas","Python","15036","","0","593.85","False","0","0","1","0.9648","1","0","0.3333","advanced language:Python stars:>=50","newspaper3k is a news, full-text, and article metadata extraction in Python 3. Advanced docs:"
"jacobgil/pytorch-grad-cam","https://github.com/jacobgil/pytorch-grad-cam","Wan-Video/Wan2.2","https://github.com/Wan-Video/Wan2.2","Wan-Video","Python","15556","editor","0","592.55","False","0","0","1","0.9575","1","0","0.3333","advanced language:Python stars:>=50","Wan: Open and Advanced Large-Scale Video Generative Models"
"jacobgil/pytorch-grad-cam","https://github.com/jacobgil/pytorch-grad-cam","deepseek-ai/DeepSeek-VL2","https://github.com/deepseek-ai/DeepSeek-VL2","deepseek-ai","Python","5278","computer-vision","0","592.38","False","0","0.04","1","0.8079","1","0","0.3333","advanced language:Python stars:>=50","DeepSeek-VL2: Mixture-of-Experts Vision-Language Models for Advanced Multimodal Understanding"
"jacobgil/pytorch-grad-cam","https://github.com/jacobgil/pytorch-grad-cam","flatironinstitute/DeepFRI","https://github.com/flatironinstitute/DeepFRI","flatironinstitute","Python","350","deep-learning","0","591.94","False","0.1429","0","1","0.2192","1","0","0.3333","topic:class-activation-maps language:Python stars:>=50","Deep functional residue identification"
"jacobgil/pytorch-grad-cam","https://github.com/jacobgil/pytorch-grad-cam","Wan-Video/Wan2.1","https://github.com/Wan-Video/Wan2.1","Wan-Video","Python","15945","editor","0","591.62","False","0","0","1","0.9521","1","0","0.3333","advanced language:Python stars:>=50","Wan: Open and Advanced Large-Scale Video Generative Models"
"jacobgil/pytorch-grad-cam","https://github.com/jacobgil/pytorch-grad-cam","1038lab/ComfyUI-RMBG","https://github.com/1038lab/ComfyUI-RMBG","1038lab","Python","1915","computer-vision","0","591.28","False","0","0.0976","1","0.5878","1","0","0.3333","advanced language:Python stars:>=50","A ComfyUI custom node designed for advanced image background removal and object, face, clothes, and fashion segmentation, utilizing multiple models including RMBG-2.0, INSPYRENET, BEN, BEN2, BiRefNet, SDMatte, SAM, SAM2, SAM3 and GroundingDINO."
"jacobgil/pytorch-grad-cam","https://github.com/jacobgil/pytorch-grad-cam","KoljaB/RealtimeSTT","https://github.com/KoljaB/RealtimeSTT","KoljaB","Python","9755","computer-vision","0","589.71","False","0","0","1","0.9412","1","0","0.3333","advanced language:Python stars:>=50","A robust, efficient, low-latency speech-to-text library with advanced voice activity detection, wake word activation and instant transcription."
"jacobgil/pytorch-grad-cam","https://github.com/jacobgil/pytorch-grad-cam","hpcaitech/ColossalAI","https://github.com/hpcaitech/ColossalAI","hpcaitech","Python","41375","deep-learning","0","587.53","False","0.0357","0","1","0.745","1","0","0.3333","topic:deep-learning language:Python stars:>=50","Making large AI models cheaper, faster and more accessible"
"jacobgil/pytorch-grad-cam","https://github.com/jacobgil/pytorch-grad-cam","0xemmkty/QuantMuse","https://github.com/0xemmkty/QuantMuse","0xemmkty","Python","2451","data-science","0","584.6","False","0.0526","0","1","0.6413","1","0","0.3333","advanced language:Python stars:>=50","A comprehensive quantitative trading system with AI-powered analysis, real-time data processing, and advanced risk management"
"jacobgil/pytorch-grad-cam","https://github.com/jacobgil/pytorch-grad-cam","hugsy/gef","https://github.com/hugsy/gef","hugsy","Python","8142","data-science","0","582.85","False","0","0","1","0.902","1","0","0.3333","advanced language:Python stars:>=50","GEF (GDB Enhanced Features) - a modern experience for GDB with advanced debugging capabilities for exploit devs & reverse engineers on Linux"
"jacobgil/pytorch-grad-cam","https://github.com/jacobgil/pytorch-grad-cam","asgeirtj/system_prompts_leaks","https://github.com/asgeirtj/system_prompts_leaks","asgeirtj","","39415","llm","0","577.27","False","0.0294","0.0286","0","0.7556","1","1","0.3333","topic:llm stars:>=100","Extracted system prompts from ChatGPT (GPT-5.5 Thinking), Claude (Opus 4.7, Opus 4.6, Sonnet 4.6, Claude Code), Gemini (3.1 Pro, 3 Flash, Gemini CLI), Grok (4.3 beta), Perplexity, and more. Updated regularly."
"jacobgil/pytorch-grad-cam","https://github.com/jacobgil/pytorch-grad-cam","PowerDNS-Admin/PowerDNS-Admin","https://github.com/PowerDNS-Admin/PowerDNS-Admin","PowerDNS-Admin","Python","2780","","0","571.56","False","0","0.0455","1","0.6687","1","0","0.3333","advanced language:Python stars:>=50","A PowerDNS web interface with advanced features"
"jacobgil/pytorch-grad-cam","https://github.com/jacobgil/pytorch-grad-cam","ItzCrazyKns/Vane","https://github.com/ItzCrazyKns/Vane","ItzCrazyKns","TypeScript","34123","llm","0","567.71","False","0.0333","0","0","0.7869","1","1","0.3333","topic:llm stars:>=100","Vane is an AI-powered answering engine."
"jacobgil/pytorch-grad-cam","https://github.com/jacobgil/pytorch-grad-cam","tinygrad/tinygrad","https://github.com/tinygrad/tinygrad","tinygrad","Python","32610","deep-learning","0","564.43","False","0","0","1","0.7967","1","0","0.3333","pytorch language:Python stars:>=50","You like pytorch? You like micrograd? You love tinygrad! ❤️ "
"jacobgil/pytorch-grad-cam","https://github.com/jacobgil/pytorch-grad-cam","maitrix-org/llm-reasoners","https://github.com/maitrix-org/llm-reasoners","maitrix-org","Python","2343","","0","563.78","False","0","0.0435","1","0.6316","1","0","0.3333","advanced language:Python stars:>=50","A library for advanced large language model reasoning"
"jacobgil/pytorch-grad-cam","https://github.com/jacobgil/pytorch-grad-cam","conan7882/CNN-Visualization","https://github.com/conan7882/CNN-Visualization","conan7882","Python","199","deep-learning","0","563.42","False","0.1905","0","1","0.0971","0.6","0","0.3333","topic:class-activation-maps language:Python stars:>=50","TensorFlow implementations of visualization of convolutional neural networks, such as Grad-Class Activation Mapping and guided back propagation "
"jacobgil/pytorch-grad-cam","https://github.com/jacobgil/pytorch-grad-cam","Comfy-Org/ComfyUI","https://github.com/Comfy-Org/ComfyUI","Comfy-Org","Python","111195","deep-learning","0","558.72","False","0.0455","0","1","0.5304","1","0","0.3333","pytorch language:Python stars:>=50","The most powerful and modular diffusion model GUI, api and backend with a graph/nodes interface."
"jacobgil/pytorch-grad-cam","https://github.com/jacobgil/pytorch-grad-cam","joxeankoret/diaphora","https://github.com/joxeankoret/diaphora","joxeankoret","Python","4255","","0","558.19","False","0","0","1","0.7611","1","0","0.3333","advanced language:Python stars:>=50","Diaphora, the most advanced Free and Open Source program diffing tool."
"jacobgil/pytorch-grad-cam","https://github.com/jacobgil/pytorch-grad-cam","Alfredredbird/tookie-osint","https://github.com/Alfredredbird/tookie-osint","Alfredredbird","Python","2184","","0","557.85","False","0","0.0385","1","0.6163","1","0","0.3333","advanced language:Python stars:>=50","Tookie is a advanced OSINT information gathering tool that finds social media accounts based on inputs."
"jacobgil/pytorch-grad-cam","https://github.com/jacobgil/pytorch-grad-cam","r0oth3x49/ghauri","https://github.com/r0oth3x49/ghauri","r0oth3x49","Python","3991","","0","555.76","False","0","0","1","0.7472","1","0","0.3333","advanced language:Python stars:>=50","An advanced cross-platform tool that automates the process of detecting and exploiting SQL injection security flaws"
"jacobgil/pytorch-grad-cam","https://github.com/jacobgil/pytorch-grad-cam","apachecn/ailearning","https://github.com/apachecn/ailearning","apachecn","Python","42221","deep-learning","0","554.61","False","0","0","1","0.7406","1","0","0.3333","pytorch language:Python stars:>=50","AiLearning：数据分析+机器学习实战+线性代数+PyTorch+NLTK+TF2"
"jacobgil/pytorch-grad-cam","https://github.com/jacobgil/pytorch-grad-cam","mudler/LocalAI","https://github.com/mudler/LocalAI","mudler","Go","46029","llm","0","552.8","False","0.0294","0","0","0.7219","1","1","0.3333","topic:llm stars:>=100","LocalAI is the open-source AI engine. Run any model - LLMs, vision, voice, image, video - on any hardware. No GPU required."
"jacobgil/pytorch-grad-cam","https://github.com/jacobgil/pytorch-grad-cam","pgadmin-org/pgadmin4","https://github.com/pgadmin-org/pgadmin4","pgadmin-org","Python","3597","reinforcement","0","551.81","False","0","0","1","0.7246","1","0","0.3333","advanced language:Python stars:>=50","pgAdmin is the most popular and feature rich Open Source administration and development platform for PostgreSQL, the most advanced Open Source database in the world."
"jacobgil/pytorch-grad-cam","https://github.com/jacobgil/pytorch-grad-cam","atilaahmettaner/tradingview-mcp","https://github.com/atilaahmettaner/tradingview-mcp","atilaahmettaner","Python","2284","","0","550.41","False","0","0.0244","1","0.626","1","0","0.3333","advanced language:Python stars:>=50","Real-time crypto & stock screening, advanced technical indicators, Bollinger Bands intelligence, candlestick patterns + native Claude Desktop integration. Multi-exchange (Binance, KuCoin, Bybit+). Open-source AI trading infrastructure."
"jacobgil/pytorch-grad-cam","https://github.com/jacobgil/pytorch-grad-cam","H4ckForJob/dirmap","https://github.com/H4ckForJob/dirmap","H4ckForJob","Python","3362","","0","549.24","False","0","0","1","0.7099","1","0","0.3333","advanced language:Python stars:>=50","An advanced web directory & file scanning tool that will be more powerful than DirBuster, Dirsearch, cansina, and Yu Jian.一个高级web目录、文件扫描工具，功能将会强于DirBuster、Dirsearch、cansina、御剑。"
"jacobgil/pytorch-grad-cam","https://github.com/jacobgil/pytorch-grad-cam","CarterPerez-dev/Cybersecurity-Projects","https://github.com/CarterPerez-dev/Cybersecurity-Projects","CarterPerez-dev","Python","1940","","0","547.47","False","0","0.0294","1","0.5906","1","0","0.3333","advanced language:Python stars:>=50","Building 67 Projects ranging from beginner to advanced so anyone can — learn from, build upon, use as a reference, or even copy directly. Gamified Cybersecurity learning 👇"
"jacobgil/pytorch-grad-cam","https://github.com/jacobgil/pytorch-grad-cam","TeamUltroid/Ultroid","https://github.com/TeamUltroid/Ultroid","TeamUltroid","Python","2949","","0","544.26","False","0","0","1","0.6815","1","0","0.3333","advanced language:Python stars:>=50","Advanced Multi-Featured Telegram UserBot, Built in Python Using Telethon lib."
"jacobgil/pytorch-grad-cam","https://github.com/jacobgil/pytorch-grad-cam","cdgriffith/Box","https://github.com/cdgriffith/Box","cdgriffith","Python","2819","","0","542.55","False","0","0","1","0.6717","1","0","0.3333","advanced language:Python stars:>=50","Python dictionaries with advanced dot notation access"
"jacobgil/pytorch-grad-cam","https://github.com/jacobgil/pytorch-grad-cam","wizarrrr/wizarr","https://github.com/wizarrrr/wizarr","wizarrrr","Python","2814","","0","542.48","False","0","0","1","0.6713","1","0","0.3333","advanced language:Python stars:>=50","Wizarr is an advanced user invitation and management system for Jellyfin, Plex, Emby etc."
"jacobgil/pytorch-grad-cam","https://github.com/jacobgil/pytorch-grad-cam","bhavsec/reconspider","https://github.com/bhavsec/reconspider","bhavsec","Python","2675","","0","540.56","False","0","0","1","0.6603","1","0","0.3333","advanced language:Python stars:>=50","🔎 Most Advanced Open Source Intelligence (OSINT) Framework for scanning IP Address, Emails, Websites, Organizations."
"jacobgil/pytorch-grad-cam","https://github.com/jacobgil/pytorch-grad-cam","jupyterhub/binderhub","https://github.com/jupyterhub/binderhub","jupyterhub","Python","2666","data-science","0","540.43","False","0","0","1","0.6596","1","0","0.3333","advanced language:Python stars:>=50","Run your code in the cloud, with technology so advanced, it feels like magic!"
"jacobgil/pytorch-grad-cam","https://github.com/jacobgil/pytorch-grad-cam","PowerHouseMan/ComfyUI-AdvancedLivePortrait","https://github.com/PowerHouseMan/ComfyUI-AdvancedLivePortrait","PowerHouseMan","Python","2643","","0","540.1","False","0","0","1","0.6577","1","0","0.3333","advanced language:Python stars:>=50",""
"jacobgil/pytorch-grad-cam","https://github.com/jacobgil/pytorch-grad-cam","UnkL4b/GitMiner","https://github.com/UnkL4b/GitMiner","UnkL4b","Python","2150","","0","532.26","False","0","0","1","0.6129","1","0","0.3333","advanced language:Python stars:>=50","Tool for advanced mining for content on Github"
"jacobgil/pytorch-grad-cam","https://github.com/jacobgil/pytorch-grad-cam","rtk-ai/rtk","https://github.com/rtk-ai/rtk","rtk-ai","Rust","40553","llm","0","531.15","False","0","0","0","0.7494","1","1","0.3333","topic:llm stars:>=100","CLI proxy that reduces LLM token consumption by 60-90% on common dev commands. Single Rust binary, zero dependencies"
"jacobgil/pytorch-grad-cam","https://github.com/jacobgil/pytorch-grad-cam","janhq/jan","https://github.com/janhq/jan","janhq","TypeScript","42352","llm","0","529.5","False","0","0","0","0.74","1","1","0.3333","topic:llm stars:>=100","Jan is an open source alternative to ChatGPT that runs 100% offline on your computer."
"jacobgil/pytorch-grad-cam","https://github.com/jacobgil/pytorch-grad-cam","AzizKpln/Moriarty-Project","https://github.com/AzizKpln/Moriarty-Project","AzizKpln","Python","1977","","0","529.07","False","0","0","1","0.5947","1","0","0.3333","advanced language:Python stars:>=50","This tool gives information about the phone number that you entered."
"jacobgil/pytorch-grad-cam","https://github.com/jacobgil/pytorch-grad-cam","GitGuardian/ggshield","https://github.com/GitGuardian/ggshield","GitGuardian","Python","1950","computer-vision","0","528.55","False","0","0","1","0.5917","1","0","0.3333","advanced language:Python stars:>=50","Detect and validate 500+ types of hardcoded secrets with advanced checks. Use it as a pre-commit hook, GitHub Action, or CLI for proactive secret detection and security."
"jacobgil/pytorch-grad-cam","https://github.com/jacobgil/pytorch-grad-cam","LedFx/LedFx","https://github.com/LedFx/LedFx","LedFx","Python","1927","editor","0","528.1","False","0","0","1","0.5891","1","0","0.3333","advanced language:Python stars:>=50","LedFx is a network based LED effect engine designed to deliver advanced real-time audio effects to a wide variety of devices."
"jacobgil/pytorch-grad-cam","https://github.com/jacobgil/pytorch-grad-cam","milvus-io/milvus","https://github.com/milvus-io/milvus","milvus-io","Go","44103","llm","0","527.96","False","0","0","0","0.7312","1","1","0.3333","topic:llm stars:>=100","Milvus is a high-performance, cloud-native vector database built for scalable vector ANN search"
"jacobgil/pytorch-grad-cam","https://github.com/jacobgil/pytorch-grad-cam","jeecgboot/JeecgBoot","https://github.com/jeecgboot/JeecgBoot","jeecgboot","Java","46070","llm","0","526.3","False","0","0","0","0.7217","1","1","0.3333","topic:llm stars:>=100","AI低代码平台，支持「低代码 + 零代码」双模式：零代码 5 分钟搭建业务系统，低代码模式一键生成前后端代码。 内置AI 应用，支持AI聊天、知识库、流程编排、MCP与插件，支持各种模型。Skills能力实现：一句话画流程图、设计表单、生成系统。 引领 AI生成→在线配置→代码生成→手工合并的开发模式，解决Java项目80%的重复工作，快速提高效率，又不失灵活性。"
"jacobgil/pytorch-grad-cam","https://github.com/jacobgil/pytorch-grad-cam","upstash/context7","https://github.com/upstash/context7","upstash","TypeScript","54352","llm","0","520.02","False","0","0","0","0.6858","1","1","0.3333","topic:llm stars:>=100","Context7 Platform -- Up-to-date code documentation for LLMs and AI code editors"
"jacobgil/pytorch-grad-cam","https://github.com/jacobgil/pytorch-grad-cam","shareAI-lab/learn-claude-code","https://github.com/shareAI-lab/learn-claude-code","shareAI-lab","TypeScript","57933","llm","0","517.59","False","0","0","0","0.672","1","1","0.3333","topic:llm stars:>=100","Bash is all you need -  A nano claude code–like 「agent harness」, built from 0 to 1"
"jacobgil/pytorch-grad-cam","https://github.com/jacobgil/pytorch-grad-cam","Mintplex-Labs/anything-llm","https://github.com/Mintplex-Labs/anything-llm","Mintplex-Labs","JavaScript","59461","llm","0","516.6","False","0","0","0","0.6663","1","1","0.3333","topic:llm stars:>=100","The all-in-one AI productivity accelerator. On device and privacy first with no annoying setup or configuration."
"jacobgil/pytorch-grad-cam","https://github.com/jacobgil/pytorch-grad-cam","imatge-upc/retrieval-2017-cam","https://github.com/imatge-upc/retrieval-2017-cam","imatge-upc","Python","224","deep-learning","0","515.49","False","0.125","0.087","1","0.1227","0.2","0","0.3333","topic:class-activation-maps language:Python stars:>=50","Class-Weighted Convolutional Features for Image Retrieval (BMVC 2017)"
"jacobgil/pytorch-grad-cam","https://github.com/jacobgil/pytorch-grad-cam","firecrawl/firecrawl","https://github.com/firecrawl/firecrawl","firecrawl","TypeScript","114598","llm","0","491.67","False","0","0","0","0.5238","1","1","0.3333","topic:llm stars:>=100","🔥 The API to search, scrape, and interact with the web for AI"
"jacobgil/pytorch-grad-cam","https://github.com/jacobgil/pytorch-grad-cam","lmk123568/Paddle_Model_Analysis","https://github.com/lmk123568/Paddle_Model_Analysis","lmk123568","Python","50","computer-vision","0","490.13","False","0.0435","0.04","1","0","1","0","0.3333","topic:class-activation-maps language:Python stars:>=50","【一个小工具】用最短的代码完成对模型的分析，包含 ImageNet Val、FLOPs、Params、Throuthput、CAM 等"
"jacobgil/pytorch-grad-cam","https://github.com/jacobgil/pytorch-grad-cam","langgenius/dify","https://github.com/langgenius/dify","langgenius","TypeScript","139973","llm","0","484.07","False","0","0","0","0.4804","1","1","0.3333","topic:llm stars:>=100","Production-ready platform for agentic workflow development."
"jacobgil/pytorch-grad-cam","https://github.com/jacobgil/pytorch-grad-cam","ollama/ollama","https://github.com/ollama/ollama","ollama","Go","170609","llm","0","476.55","False","0","0","0","0.4374","1","1","0.3333","topic:llm stars:>=100","Get up and running with Kimi-K2.5, GLM-5, MiniMax, DeepSeek, gpt-oss, Qwen, Gemma and other models."
"jacobgil/pytorch-grad-cam","https://github.com/jacobgil/pytorch-grad-cam","affaan-m/everything-claude-code","https://github.com/affaan-m/everything-claude-code","affaan-m","JavaScript","172566","llm","0","476.11","False","0","0","0","0.4349","1","1","0.3333","topic:llm stars:>=100","The agent harness performance optimization system. Skills, instincts, memory, security, and research-first development for Claude Code, Codex, Opencode, Cursor and beyond."
