"FullName","Url","Owner","Language","Stars","Fork","Archived","CreatedAt","UpdatedAt","Description","Topics","SourceQueries"
"rasbt/LLMs-from-scratch","https://github.com/rasbt/LLMs-from-scratch","rasbt","Jupyter Notebook","91824","False","False","7/23/2023 6:15:57 PM","5/2/2026 3:32:05 PM","Implement a ChatGPT-like LLM in PyTorch from scratch, step by step","ai;artificial-intelligence;chatbot;chatgpt;deep-learning;from-scratch;generative-ai;gpt;language-model;large-language-models;llm;machine-learning;neural-networks;python;pytorch;transformers","topic:deep-learning stars:>=100"
"toger5/TheBoard","https://github.com/toger5/TheBoard","toger5","JavaScript","411","False","False","7/9/2021 11:59:19 PM","4/28/2026 5:25:09 AM","A collaborative Whiteboard powered by the [matrix] protocol and infrastucture.","","collaborate language:JavaScript stars:>=50"
"TencentARC/GFPGAN","https://github.com/TencentARC/GFPGAN","TencentARC","Python","37443","False","False","3/19/2021 6:18:20 AM","5/2/2026 5:00:11 PM","GFPGAN aims at developing Practical Algorithms for Real-world Face Restoration.","deep-learning;face-restoration;gan;gfpgan;image-restoration;pytorch;super-resolution","topic:deep-learning stars:>=100"
"DumbWareio/DumbPad","https://github.com/DumbWareio/DumbPad","DumbWareio","JavaScript","445","False","False","1/23/2025 8:54:53 PM","4/26/2026 6:16:53 PM","A Dumb Pad with collaborative editing, fuzzy search, & markdown preview functionality","dumbwareio;markdown;notepad","collaborate language:JavaScript stars:>=50"
"Level/level","https://github.com/Level/level","Level","JavaScript","1677","False","False","5/19/2013 11:33:49 AM","5/2/2026 9:59:20 AM","Universal abstract-level database for Node.js and browsers.","abstract-level;browsers;electron;javascript;level;leveldb;nodejs","universal language:JavaScript stars:>=50"
"proycon/flat","https://github.com/proycon/flat","proycon","JavaScript","113","False","False","1/2/2014 1:38:48 PM","7/9/2025 1:24:34 AM","FoLiA Linguistic Annotation Tool -- Flat is a web-based linguistic annotation environment based around the FoLiA format (http://proycon.github.io/folia), a rich XML-based format for linguistic annotation. Flat allows users to view annotated FoLiA documents and enrich these documents with new annotations, a wide variety of linguistic annotation types is supported through the FoLiA paradigm.","annotation-tool;clariah;clarin;computational-linguistics;folia;javascript;linguistic-annotation-framework;linguistics;nlp;python;web-application","topic:annotation-tool language:JavaScript stars:>=50"
"peer-base/peer-pad","https://github.com/peer-base/peer-pad","peer-base","JavaScript","691","False","False","7/15/2017 7:46:46 AM","5/2/2026 10:02:39 AM","📝 Online editor providing collaborative editing in really real-time using CRDTs and IPFS.","capabilities;crdt;ipfs;p2p;peer-star","collaborate language:JavaScript stars:>=50"
"mli/paper-reading","https://github.com/mli/paper-reading","mli","","32948","False","False","10/22/2021 6:34:51 AM","5/2/2026 3:07:46 PM","深度学习经典、新论文逐段精读","deep-learning;paper;reading-list","topic:deep-learning stars:>=100"
"vanila-io/wireflow","https://github.com/vanila-io/wireflow","vanila-io","JavaScript","4150","False","False","11/5/2017 3:40:07 PM","5/2/2026 12:11:29 AM","Wireflow - user flow chart real-time collaborative tool","collaboration;flowchart;hacktoberfest;javascript","collaborate language:JavaScript stars:>=50"
"jhuapl-bio/taxtriage","https://github.com/jhuapl-bio/taxtriage","jhuapl-bio","JavaScript","70","False","False","5/10/2022 8:54:27 PM","4/30/2026 6:44:17 PM","TaxTriage is a Nextflow workflow designed to agnostically identify and classify microbial organisms within short- or long-read metagenomic NGS data. This flexible tool was developed with various use-cases of mNGS in mind.","classification;metagenomics;multiqc;taxonomy;triage","topic:classification language:JavaScript stars:>=50"
"huggingface/diffusers","https://github.com/huggingface/diffusers","huggingface","Python","33521","False","False","5/30/2022 4:04:02 PM","5/2/2026 5:21:47 PM","🤗 Diffusers: State-of-the-art diffusion models for image, video, and audio generation in PyTorch.","deep-learning;diffusion;flux;image-generation;image2image;image2video;latent-diffusion-models;pytorch;qwen-image;score-based-generative-modeling;stable-diffusion;stable-diffusion-diffusers;text2image;text2video;video2video","topic:deep-learning stars:>=100"
"stared/interactive-machine-learning-list","https://github.com/stared/interactive-machine-learning-list","stared","JavaScript","453","False","False","5/31/2018 12:06:47 PM","4/28/2026 2:55:47 PM","A collaborative list of interactive Machine Learning, Deep Learning and Statistics websites","deep-learning;explorable-explanations;javascript;machine-learning;statistics;vue","collaborate language:JavaScript stars:>=50"
"microsoft/Windows-universal-samples","https://github.com/microsoft/Windows-universal-samples","microsoft","JavaScript","9692","False","False","3/6/2015 10:13:13 PM","5/1/2026 8:52:30 PM","API samples for the Universal Windows Platform.","","universal language:JavaScript stars:>=50"
"JaidedAI/EasyOCR","https://github.com/JaidedAI/EasyOCR","JaidedAI","Python","29388","False","False","3/14/2020 11:46:39 AM","5/2/2026 3:52:41 PM","Ready-to-use OCR with 80+ supported languages and all popular writing scripts including Latin, Chinese, Arabic, Devanagari, Cyrillic and etc.","cnn;crnn;data-mining;deep-learning;easyocr;image-processing;information-retrieval;lstm;machine-learning;ocr;optical-character-recognition;python;pytorch;scene-text;scene-text-recognition","topic:deep-learning stars:>=100"
"overdodactyl/ShadowFox","https://github.com/overdodactyl/ShadowFox","overdodactyl","JavaScript","1306","False","False","11/28/2017 6:49:23 AM","4/20/2026 6:09:01 PM","A universal dark theme for Firefox","dark;firefox;userchromecss;usercontentcss","universal language:JavaScript stars:>=50"
"fiduswriter/fiduswriter","https://github.com/fiduswriter/fiduswriter","fiduswriter","JavaScript","560","False","False","7/26/2013 5:38:22 PM","4/22/2026 12:24:03 PM","Fidus Writer is an online collaborative editor for academics.","academics;biblatex;bibtex;citations;docx;jats;jats-publishing;jats-xml;latex;math;opendocument;text-editor;word","collaborate language:JavaScript stars:>=50"
"microsoft/qlib","https://github.com/microsoft/qlib","microsoft","Python","41829","False","False","8/14/2020 6:46:00 AM","5/2/2026 5:54:04 PM","Qlib is an AI-oriented Quant investment platform that aims to use AI tech to empower Quant Research, from exploring ideas to implementing productions. Qlib supports diverse ML modeling paradigms, including supervised learning, market dynamics modeling, and RL, and is now equipped with https://github.com/microsoft/RD-Agent to automate R&D process.","algorithmic-trading;auto-quant;deep-learning;finance;fintech;investment;machine-learning;paper;platform;python;quant;quant-dataset;quant-models;quantitative-finance;quantitative-trading;research;research-paper;stock-data","topic:deep-learning stars:>=100"
"peaksandpies/universal-analytics","https://github.com/peaksandpies/universal-analytics","peaksandpies","JavaScript","961","False","False","2/7/2013 9:27:33 PM","4/30/2026 9:45:15 AM","A node module for Google's Universal Analytics and Measurement Protocol","","universal language:JavaScript stars:>=50"
"nytimes/library","https://github.com/nytimes/library","nytimes","JavaScript","1180","False","False","3/8/2019 5:15:19 PM","4/21/2026 9:06:03 PM","A collaborative documentation site, powered by Google Docs.","","collaborate language:JavaScript stars:>=50"
"Lightning-AI/pytorch-lightning","https://github.com/Lightning-AI/pytorch-lightning","Lightning-AI","Python","31103","False","False","3/31/2019 12:45:57 AM","5/2/2026 3:21:24 PM","Pretrain, finetune ANY AI model of ANY size on 1 or 10,000+ GPUs with zero code changes.","ai;artificial-intelligence;data-science;deep-learning;machine-learning;python;pytorch","topic:deep-learning stars:>=100"
"VineGlobal/Super-Lightweight-eCommerce-Platform","https://github.com/VineGlobal/Super-Lightweight-eCommerce-Platform","VineGlobal","JavaScript","57","False","False","4/24/2016 1:26:23 AM","4/29/2026 3:15:25 AM","Super Lightweight eCommerce Platform -- Built with AngularJS, PHP and Google Sheets API v3.  The eCommerce platform's data is stored in Google Sheets. The product catalog, category management, and multi-lingual support are maintained using Google Sheets. Real-time data updates to the storefront.","angularjs;angularjs-ecommerce;classification;digital-commerce;duties;ecommerce;ecommerce-framework;google-sheets;landed-cost;php;product-catalog;taxes","topic:classification language:JavaScript stars:>=50"
"fridays/next-routes","https://github.com/fridays/next-routes","fridays","JavaScript","2463","False","False","1/30/2017 12:44:41 PM","4/24/2026 4:20:03 AM","Universal dynamic routes for Next.js","nextjs;node;react;router;routes;routing;server-rendering;ssr;universal","universal language:JavaScript stars:>=50"
"markdalgleish/redial","https://github.com/markdalgleish/redial","markdalgleish","JavaScript","1096","False","False","11/2/2015 3:56:56 PM","3/28/2026 4:22:33 AM","Universal data fetching and route lifecycle management for React etc.","","universal language:JavaScript stars:>=50"
"KarchinLab/open-cravat","https://github.com/KarchinLab/open-cravat","KarchinLab","JavaScript","151","False","False","7/3/2018 5:31:00 PM","4/21/2026 11:11:24 AM","A modular annotation tool for genomic variants","annotation-tool;bioinformatics;bioinformatics-pipeline;bioinformatics-tool;genomic-data-analysis;genomics;javascript;python;python3;variant-analysis;variant-annotation;variant-annotations","topic:annotation-tool language:JavaScript stars:>=50"
"ray-project/ray","https://github.com/ray-project/ray","ray-project","Python","42401","False","False","10/25/2016 7:38:30 PM","5/2/2026 3:14:53 PM","Ray is an AI compute engine. Ray consists of a core distributed runtime and a set of AI Libraries for accelerating ML workloads.","data-science;deep-learning;deployment;distributed;hyperparameter-optimization;hyperparameter-search;large-language-models;llm;llm-inference;llm-serving;machine-learning;optimization;parallel;python;pytorch;ray;reinforcement-learning;rllib;serving;tensorflow","topic:deep-learning stars:>=100"
"coqui-ai/TTS","https://github.com/coqui-ai/TTS","coqui-ai","Python","45206","False","False","5/20/2020 3:45:28 PM","5/2/2026 5:04:28 PM","🐸💬 - a deep learning toolkit for Text-to-Speech, battle-tested in research and production","deep-learning;glow-tts;hifigan;melgan;multi-speaker-tts;python;pytorch;speaker-encoder;speaker-encodings;speech;speech-synthesis;tacotron;text-to-speech;tts;tts-model;vocoder;voice-cloning;voice-conversion;voice-synthesis","topic:deep-learning stars:>=100"
"andreekeberg/ml-classify-text-js","https://github.com/andreekeberg/ml-classify-text-js","andreekeberg","JavaScript","136","False","False","8/26/2020 8:27:29 PM","4/29/2026 7:32:23 AM","Machine learning based text classification in JavaScript using n-grams and cosine similarity","artificial-intelligence;classification;classifier;cosine-similarity;labels;library;machine-learning;n-gram;n-grams;natural-language-processing;predictions;sentiment-analysis;similarity;text-classification;text-classifier;training","topic:classification language:JavaScript stars:>=50"
"mantoni/beads-ui","https://github.com/mantoni/beads-ui","mantoni","JavaScript","591","False","False","10/22/2025 11:55:05 AM","5/1/2026 9:17:13 PM","Local UI for Beads — Collaborate on issues with your coding agent.","agent;ai-tools;issue-tracker;local-first","collaborate language:JavaScript stars:>=50"
"explosion/spaCy","https://github.com/explosion/spaCy","explosion","Python","33538","False","False","7/3/2014 3:15:40 PM","5/2/2026 1:36:51 PM","💫 Industrial-strength Natural Language Processing (NLP) in Python","ai;artificial-intelligence;cython;data-science;deep-learning;entity-linking;machine-learning;named-entity-recognition;natural-language-processing;neural-network;neural-networks;nlp;nlp-library;python;spacy;text-classification;tokenization","topic:deep-learning stars:>=100"
"its-a-feature/Mythic","https://github.com/its-a-feature/Mythic","its-a-feature","JavaScript","4440","False","False","7/5/2018 2:09:59 AM","5/1/2026 6:49:57 PM","A collaborative, multi-platform, red teaming framework","","collaborate language:JavaScript stars:>=50"
"dataqa/nlp-labelling","https://github.com/dataqa/nlp-labelling","dataqa","JavaScript","260","False","False","9/6/2021 8:49:10 AM","4/27/2026 8:19:46 AM","Labelling platform for text using weak supervision.","annotation-tool;data-labeling;data-science;learning-with-limited-labeled-data;learning-with-noisy-labels;natural-language-processing;ner;nlp;nlp-machine-learning;pseudo-labeling;search-engine;text-annotation-tool;text-classification;text-mining;weak-supervision","topic:annotation-tool language:JavaScript stars:>=50"
"BVLC/caffe","https://github.com/BVLC/caffe","BVLC","C++","34623","False","False","9/12/2013 6:39:48 PM","5/2/2026 7:12:47 AM","Caffe: a fast open framework for deep learning.","deep-learning;machine-learning;vision","topic:deep-learning stars:>=100"
"NirmalScaria/le-git-graph","https://github.com/NirmalScaria/le-git-graph","NirmalScaria","JavaScript","5883","False","False","7/27/2022 2:13:07 PM","5/2/2026 1:55:59 PM","Browser extension to add git graph to GitHub website.","chrome-extension;collaborate;git-graph;github;hacktoberfest","collaborate language:JavaScript stars:>=50"
"jaredpalmer/razzle","https://github.com/jaredpalmer/razzle","jaredpalmer","JavaScript","11049","False","False","2/10/2016 6:34:27 PM","5/2/2026 10:00:11 AM","✨ Create server-rendered universal JavaScript applications with no configuration","isomorphic;javascript;parallel;preact;react;typescript;universal;webpack","universal language:JavaScript stars:>=50"
"fastify/fastify-vite","https://github.com/fastify/fastify-vite","fastify","JavaScript","1118","False","False","3/6/2021 1:34:37 PM","5/1/2026 11:10:10 PM","Fastify plugin for Vite integration","fastify;fastify-plugin;isomorphic;react;server-rendering;server-side-rendering;solid;solidjs;ssr;svelte;sveltejs;universal;vue;vue3","universal language:JavaScript stars:>=50"
"shyamtawli/devFind","https://github.com/shyamtawli/devFind","shyamtawli","JavaScript","610","False","False","4/17/2023 2:03:41 PM","4/27/2026 4:10:44 PM","devFind is an open source project that aims to create a platform for developers to showcase their skills and connect with potential collaborators, all in a user-friendly and searchable format.","add-data;beginner;css;good-first-issue;gssoc24;javascript;nextjs;open-source;react;tailwindcss;vscode","collaborate language:JavaScript stars:>=50"
"gradio-app/gradio","https://github.com/gradio-app/gradio","gradio-app","Python","42481","False","False","12/19/2018 8:24:04 AM","5/2/2026 3:21:34 PM","Build and share delightful machine learning apps, all in Python. 🌟 Star to support our work!","data-analysis;data-science;data-visualization;deep-learning;deploy;gradio;gradio-interface;interface;machine-learning;models;python;python-notebook;ui;ui-components","topic:deep-learning stars:>=100"
"CMU-Perceptual-Computing-Lab/openpose","https://github.com/CMU-Perceptual-Computing-Lab/openpose","CMU-Perceptual-Computing-Lab","C++","34056","False","False","4/24/2017 2:06:31 PM","5/2/2026 5:32:30 AM","OpenPose: Real-time multi-person keypoint detection library for body, face, hands, and foot estimation","caffe;computer-vision;cpp;cvpr-2017;deep-learning;face;foot-estimation;hand-estimation;human-behavior-understanding;human-pose;human-pose-estimation;keypoint-detection;keypoints;machine-learning;multi-person;opencv;openpose;pose;pose-estimation;real-time","topic:deep-learning stars:>=100"
"lutzroeder/netron","https://github.com/lutzroeder/netron","lutzroeder","JavaScript","32832","False","False","12/26/2010 12:53:43 PM","5/2/2026 4:57:46 PM","Visualizer for neural network, deep learning and machine learning models","ai;coreml;deep-learning;deeplearning;keras;machine-learning;machinelearning;ml;neural-network;numpy;onnx;pytorch;safetensors;tensorflow;tensorflow-lite;visualizer","topic:deep-learning stars:>=100"
"AUTOMATIC1111/stable-diffusion-webui","https://github.com/AUTOMATIC1111/stable-diffusion-webui","AUTOMATIC1111","Python","162687","False","False","8/22/2022 2:05:26 PM","5/2/2026 5:14:31 PM","Stable Diffusion web UI","ai;ai-art;deep-learning;diffusion;gradio;image-generation;image2image;img2img;pytorch;stable-diffusion;text2image;torch;txt2img;unstable;upscaling;web","topic:deep-learning stars:>=100"
"lukeed/pwa","https://github.com/lukeed/pwa","lukeed","JavaScript","3130","False","False","6/21/2018 8:21:51 AM","4/30/2026 5:54:38 AM","(WIP) Universal PWA Builder","","universal language:JavaScript stars:>=50"
"nextcloud/text","https://github.com/nextcloud/text","nextcloud","JavaScript","632","False","False","3/17/2019 8:13:20 AM","5/2/2026 1:56:32 AM","📑 Collaborative document editing using Markdown","collaboration;collaborative;collaborative-editing;editor;hacktoberfest;javascript;js;markdown;nextcloud;nextcloud-app;nextcloud-text;prosemirror;rich-text;rich-text-editor;text;tiptap;vue;wysiwyg;wysiwyg-editor","collaborate language:JavaScript stars:>=50"
"eugeneyan/applied-ml","https://github.com/eugeneyan/applied-ml","eugeneyan","","28792","False","False","7/4/2020 6:57:47 PM","5/2/2026 12:44:13 AM","📚 Papers & tech blogs by companies sharing their work on data science & machine learning in production.","applied-data-science;applied-machine-learning;computer-vision;data-discovery;data-engineering;data-quality;data-science;deep-learning;machine-learning;natural-language-processing;production;recsys;reinforcement-learning;search","topic:deep-learning stars:>=100"
"simogeo/geostats","https://github.com/simogeo/geostats","simogeo","JavaScript","208","False","False","6/17/2011 8:13:10 AM","2/21/2026 4:04:57 AM","A tiny and standalone javascript library for classification and basic statistics :","classification;geo;geography;geostats;gis;javascript;library","topic:classification language:JavaScript stars:>=50"
"cryptpad/cryptpad","https://github.com/cryptpad/cryptpad","cryptpad","JavaScript","7540","False","False","10/31/2014 3:46:17 PM","5/1/2026 4:44:59 PM","Collaborative office suite, end-to-end encrypted and open-source.","chainpad;collaboration;collaborative-editing;cryptpad;e2ee;end-to-end-encryption;javascript;real-time","collaborate language:JavaScript stars:>=50"
"strapi/community-content","https://github.com/strapi/community-content","strapi","JavaScript","582","False","False","9/23/2019 11:08:30 AM","5/1/2026 3:58:04 AM","Contribute and collaborate on educational content for the Strapi Community","","collaborate language:JavaScript stars:>=50"
"LaserWeb/LaserWeb4","https://github.com/LaserWeb/LaserWeb4","LaserWeb","JavaScript","783","False","False","8/29/2016 9:53:23 AM","4/23/2026 6:51:28 AM","Collaborative effort on the next version of LaserWeb / CNCWeb","cam;cnc;cnc-controller;gcode;grbl;laser;smoothieware;tinyg;webgl","collaborate language:JavaScript stars:>=50"
"yahoo/fluxible","https://github.com/yahoo/fluxible","yahoo","JavaScript","1795","False","False","11/4/2014 9:25:38 PM","3/23/2026 9:24:42 PM","A pluggable container for universal flux applications.","flux;javascript;react;web","universal language:JavaScript stars:>=50"
"kunjgit/GameZone","https://github.com/kunjgit/GameZone","kunjgit","JavaScript","745","False","False","5/7/2023 4:21:21 AM","5/2/2026 11:12:23 AM","This open source repository contains collection of games build on basic tech stacks in web development  . Use your creativity and build your own game and contribute to the repository by making PR 🎮","bootstrap;collaborate;collaboration;contributions;css;css3;game;games;girlscript-foundation;github;hacktoberfest;html;iwoc2024;javascript;learning-by-doing;open-source;open-source-project","collaborate language:JavaScript stars:>=50"
"AsyncBanana/microdiff","https://github.com/AsyncBanana/microdiff","AsyncBanana","JavaScript","3801","False","False","10/31/2021 8:07:53 PM","4/28/2026 11:51:29 AM","A fast, zero dependency object and array comparison library. Significantly faster than most other deep comparison libraries and has full TypeScript support.","collaborate;comparison;deno;diff;github;javascript;typescript","collaborate language:JavaScript stars:>=50"
"hasura/graphqurl","https://github.com/hasura/graphqurl","hasura","JavaScript","3380","False","False","7/20/2018 10:15:46 AM","4/27/2026 5:46:12 PM","curl for GraphQL with autocomplete, subscriptions and GraphiQL. Also a dead-simple universal javascript GraphQL client.","autocomplete;cli;curl;graphql;mutations;query;subscription","universal language:JavaScript stars:>=50"
"opencv/opencv","https://github.com/opencv/opencv","opencv","C++","87315","False","False","7/19/2012 9:40:17 AM","5/2/2026 5:20:00 PM","Open Source Computer Vision Library","c-plus-plus;computer-vision;deep-learning;image-processing;opencv","topic:deep-learning stars:>=100"
"microsoft/AI-For-Beginners","https://github.com/microsoft/AI-For-Beginners","microsoft","Jupyter Notebook","47123","False","False","3/3/2021 4:27:36 PM","5/2/2026 4:55:07 PM","12 Weeks, 24 Lessons, AI for All!","ai;artificial-intelligence;cnn;computer-vision;deep-learning;gan;machine-learning;microsoft-for-beginners;nlp;rnn","topic:deep-learning stars:>=100"
"AgentMaker/WebAI.js","https://github.com/AgentMaker/WebAI.js","AgentMaker","JavaScript","58","False","False","1/12/2022 8:07:25 AM","1/23/2026 2:11:42 AM","A simple Web AI model deployment tool using JavaScript based on OpenCV.js and ONNXRuntime","ai;classification;computer-vision;detection;javascript;js;node;objectdetection;onnx;onnxruntime;onnxruntime-web;opencv;segmentation;web","topic:classification language:JavaScript stars:>=50"
"att/rcloud","https://github.com/att/rcloud","att","JavaScript","435","False","False","7/31/2012 7:32:52 PM","3/25/2026 11:30:30 PM","Collaborative data analysis and visualization","","collaborate language:JavaScript stars:>=50"
"lovasoa/whitebophir","https://github.com/lovasoa/whitebophir","lovasoa","JavaScript","2592","False","False","8/27/2013 5:35:17 PM","5/2/2026 1:25:57 AM","Online collaborative Whiteboard that is simple, free, easy to use and  to deploy","art;collaborative;draw;education;javascript;teaching;whiteboard","collaborate language:JavaScript stars:>=50"
"alabid/flylatex","https://github.com/alabid/flylatex","alabid","JavaScript","761","False","False","6/10/2012 10:30:23 PM","4/20/2026 1:17:18 PM","FlyLatex: A Realtime Collaborative Environment (with a concurrent editor) in node-js.","","collaborate language:JavaScript stars:>=50"
"deepakkumar55/ULTIMATE-JAVASCRIPT-PROJECT","https://github.com/deepakkumar55/ULTIMATE-JAVASCRIPT-PROJECT","deepakkumar55","JavaScript","1617","False","False","6/1/2024 1:54:55 AM","4/29/2026 6:11:46 PM","A comprehensive list of 500 JavaScript project ideas for developers of all skill levels. Open-source and community-driven.","collaborate;communityexchange;css;expressjs;html;javascript;mongodb;nodejs;opensource;reactjs;tailwindcss","collaborate language:JavaScript stars:>=50"
"shentao/vue-multiselect","https://github.com/shentao/vue-multiselect","shentao","JavaScript","6774","False","False","4/23/2016 1:02:33 PM","4/29/2026 11:29:35 AM","Universal select/multiselect/tagging component for Vue.js","component;dropdown;javascript;select;vue","universal language:JavaScript stars:>=50"
"digitallyinduced/thin-backend","https://github.com/digitallyinduced/thin-backend","digitallyinduced","JavaScript","1252","False","False","3/9/2022 7:39:35 AM","4/20/2026 6:52:19 PM","🔥 Thin Backend is a Blazing Fast, Universal Web App Backend for Making Realtime Single Page Apps","database;postgres;postgresql;react","universal language:JavaScript stars:>=50"
"faceyspacey/react-universal-component","https://github.com/faceyspacey/react-universal-component","faceyspacey","JavaScript","1692","False","False","6/4/2017 9:08:10 PM","4/22/2026 2:12:37 AM","🚀 The final answer to a React Universal Component: simultaneous SSR + Code Splitting","","universal language:JavaScript stars:>=50"
"marcelscruz/public-apis","https://github.com/marcelscruz/public-apis","marcelscruz","JavaScript","8872","False","False","5/11/2022 6:31:22 AM","5/2/2026 5:08:35 PM","A collaborative list of public APIs for developers","apis;awesome;awesome-list;hacktoberfest;lists;open-source;public-api;public-apis;resources","collaborate language:JavaScript stars:>=50"
"ritzyed/ritzy","https://github.com/ritzyed/ritzy","ritzyed","JavaScript","893","False","False","6/12/2015 2:01:58 PM","4/21/2026 8:41:56 AM","Collaborative web-based rich text editor","","collaborate language:JavaScript stars:>=50"
"lettier/interactiveknn","https://github.com/lettier/interactiveknn","lettier","JavaScript","83","False","False","5/16/2016 4:21:23 AM","8/18/2025 7:34:51 AM","Interactive K-Nearest Neighbors machine learning algorithm in JavaScript.","ai;classification;data-analysis;data-science;gui;html5;interactive-knearest-neighbors;javascript;k-nearest-neighbor;k-nearest-neighbors;k-nearest-neighbours;knn;machine-learning;machine-learning-algorithms;nearest-neighbor-search;scikit-learn;statistics;visualization","topic:classification language:JavaScript stars:>=50"
