"FullName","Url","Owner","Language","Stars","Fork","Archived","CreatedAt","UpdatedAt","Description","Topics","SourceQueries"
"infiniflow/ragflow","https://github.com/infiniflow/ragflow","infiniflow","Python","79495","False","False","12/12/2023 6:13:13 AM","5/3/2026 4:47:42 AM","RAGFlow is a leading open-source Retrieval-Augmented Generation (RAG) engine that fuses cutting-edge RAG with Agent capabilities to create a superior context layer for LLMs","llm-app","a language:Python stars:>=50"
"blackarrowsec/mssqlproxy","https://github.com/blackarrowsec/mssqlproxy","blackarrowsec","Python","770","False","False","2/12/2020 8:44:28 AM","4/14/2026 8:06:16 AM","mssqlproxy is a toolkit aimed to perform lateral movement in restricted environments through a compromised Microsoft SQL Server via socket reuse","lateral-movement;mssql;post-exploitation;proxy;security-tool","aim language:Python stars:>=50"
"QuivrHQ/quivr","https://github.com/QuivrHQ/quivr","QuivrHQ","Python","39123","False","False","5/12/2023 11:53:30 PM","5/3/2026 4:47:04 AM","Opiniated RAG for integrating GenAI in your apps 🧠   Focus on your product rather than the RAG. Easy integration in existing products with customisation!  Any LLM: GPT4, Groq, Llama. Any Vectorstore: PGVector, Faiss. Any Files. Anyway you want.","ai;api;chatbot;chatgpt;database;docker;framework;frontend;groq;html;javascript;llm;openai;postgresql;privacy;rag;react;security;typescript;vector","topic:ai language:Python stars:>=50 | topic:llm stars:>=100"
"superhedgy/AttackSurfaceMapper","https://github.com/superhedgy/AttackSurfaceMapper","superhedgy","Python","1399","False","False","8/7/2019 2:32:53 PM","5/1/2026 7:49:03 AM","AttackSurfaceMapper is a tool that aims to automate the reconnaissance process.","attack-surface;attacksurfacemapper;linkedin;osint;python;reconnaissance;subdomains","aim language:Python stars:>=50"
"Mintplex-Labs/anything-llm","https://github.com/Mintplex-Labs/anything-llm","Mintplex-Labs","JavaScript","59429","False","False","6/4/2023 2:29:14 AM","5/3/2026 4:07:00 AM","The all-in-one AI productivity accelerator. On device and privacy first with no annoying setup or configuration.","ai-agents;custom-ai-agents;deepseek;kimi;llama3;llm;lmstudio;local-llm;localai;mcp;mcp-servers;moonshot;multimodal;no-code;ollama;qwen3;rag;vector-database;web-scraping","topic:llm stars:>=100"
"mindsdb/mindsdb","https://github.com/mindsdb/mindsdb","mindsdb","Python","39094","False","False","8/2/2018 5:56:45 PM","5/3/2026 2:49:30 AM","AI Data Vault - A query engine for AI Agents to securely query data from any datasource","agents;ai;analytics;artificial-inteligence;bigquery;business-intelligence;databases;hacktoberfest;llms;mcp;mssql;mysql;postgresql;rag","topic:ai language:Python stars:>=50"
"lgienapp/aquarel","https://github.com/lgienapp/aquarel","lgienapp","Python","859","False","False","8/7/2022 8:42:41 AM","5/1/2026 5:36:01 PM","Styling matplotlib made easy","data-science;data-visualization;matplotlib;plotting;theme;theme-development;theming;visualization","topic:data-visualization language:Python stars:>=50"
"CubicZebra/informatics","https://github.com/CubicZebra/informatics","CubicZebra","Python","585","False","False","9/15/2023 6:52:58 AM","4/8/2026 9:24:14 AM","Framework of fast implementation data processing and operating pipelines","data-visualization;machine-learning;mathematical-statistics;neural-network;pipeline-framework;scientific-computing;transformer","topic:data-visualization language:Python stars:>=50"
"predict-idlab/plotly-resampler","https://github.com/predict-idlab/plotly-resampler","predict-idlab","Python","1196","False","False","11/20/2021 10:51:56 AM","4/30/2026 7:22:25 AM","Visualize large time series data with plotly.py","data-analysis;data-science;data-visualization;plotly;plotly-dash;python;time-series;visualization","topic:data-visualization language:Python stars:>=50"
"unslothai/unsloth","https://github.com/unslothai/unsloth","unslothai","Python","63471","False","False","11/29/2023 4:50:09 PM","5/3/2026 4:30:55 AM","Web UI for training and running open models like Gemma 4, Qwen3.6, DeepSeek, gpt-oss locally.","agent;deepseek;fine-tuning;gemma;gemma3;gpt-oss;llama;llama3;llm;llms;mistral;openai;qwen;reinforcement-learning;self-hosted;text-to-speech;tts;ui;unsloth","topic:llm stars:>=100"
"Passer1072/RookieAI_yolov8","https://github.com/Passer1072/RookieAI_yolov8","Passer1072","Python","696","False","False","3/3/2024 6:00:23 AM","5/2/2026 1:29:23 PM","基于yolov8实现的AI自瞄项目  AI self-aiming project based on yolov8","","aim language:Python stars:>=50"
"browser-use/browser-use","https://github.com/browser-use/browser-use","browser-use","Python","91746","False","False","10/31/2024 4:00:56 PM","5/3/2026 4:44:58 AM","🌐 Make websites accessible for AI agents. Automate tasks online with ease.","ai-agents;ai-tools;browser-automation;browser-use;llm;playwright;python","topic:llm stars:>=100"
"eriklindernoren/ML-From-Scratch","https://github.com/eriklindernoren/ML-From-Scratch","eriklindernoren","Python","31409","False","False","2/5/2017 12:11:23 PM","5/2/2026 10:59:13 PM","Machine Learning From Scratch. Bare bones NumPy implementations of machine learning models and algorithms with a focus on accessibility. Aims to cover everything from linear regression to deep learning.","data-mining;data-science;deep-learning;deep-reinforcement-learning;genetic-algorithm;machine-learning;machine-learning-from-scratch","topic:data-science language:Python stars:>=50 | aim language:Python stars:>=50"
"xinntao/facexlib","https://github.com/xinntao/facexlib","xinntao","Python","976","False","False","3/19/2021 9:06:02 AM","4/17/2026 4:40:37 AM","FaceXlib aims at providing ready-to-use face-related functions based on current STOA open-source methods.","alignment;assessment;deep-learning;detection;face;headpose;matting;parsing;pytorch;recognition;tracking","aim language:Python stars:>=50"
"dfm/corner.py","https://github.com/dfm/corner.py","dfm","Python","570","False","False","9/6/2012 6:51:44 PM","4/30/2026 2:58:11 AM","Make some beautiful corner plots","data-analysis;data-visualization;plotting;python","topic:data-visualization language:Python stars:>=50"
"AstrBotDevs/AstrBot","https://github.com/AstrBotDevs/AstrBot","AstrBotDevs","Python","31200","False","False","12/8/2022 1:27:46 PM","5/3/2026 4:43:44 AM","AI Agent Assistant that integrates lots of IM platforms, LLMs, plugins and AI feature, and can be your openclaw alternative. ✨","agent;ai;chatbot;chatgpt;discord;docker;gemini;gpt;llama;llm;mcp;openai;python;qq;qqbot;telegram","topic:ai language:Python stars:>=50"
"firecrawl/firecrawl","https://github.com/firecrawl/firecrawl","firecrawl","TypeScript","114346","False","False","4/15/2024 9:02:29 PM","5/3/2026 4:45:09 AM","🔥 The API to search, scrape, and interact with the web for AI","ai;ai-agents;ai-crawler;ai-scraping;ai-search;crawler;data-extraction;html-to-markdown;llm;markdown;scraper;scraping;web-crawler;web-data;web-data-extraction;web-scraper;web-scraping;web-search;webscraping","topic:llm stars:>=100"
"run-llama/llama_index","https://github.com/run-llama/llama_index","run-llama","Python","49100","False","False","11/2/2022 4:24:54 AM","5/3/2026 1:56:02 AM","LlamaIndex is the leading document agent and OCR platform","agents;application;data;fine-tuning;framework;llamaindex;llm;multi-agents;rag;vector-database","topic:llm stars:>=100"
"666ghj/MiroFish","https://github.com/666ghj/MiroFish","666ghj","Python","58849","False","False","11/26/2025 4:23:02 AM","5/3/2026 4:41:46 AM","A Simple and Universal Swarm Intelligence Engine, Predicting Anything. 简洁通用的群体智能引擎，预测万物","agent-memory;financial-forecasting;future-prediction;knowledge-graph;llms;multi-agent-simulation;public-opinion-analysis;python3;social-prediction;swarm-intelligence","a language:Python stars:>=50"
"ItzCrazyKns/Vane","https://github.com/ItzCrazyKns/Vane","ItzCrazyKns","TypeScript","34115","False","False","4/9/2024 10:51:32 AM","5/3/2026 4:42:38 AM","Vane is an AI-powered answering engine.","ai-agents;ai-search-engine;answering-engine;artificial-intelligence;llm;machine-learning;open-source-ai-search-engine;perplexica;rag;search-engine;searxng;searxng-copilot;self-hosted-ai;vane","topic:llm stars:>=100"
"agno-agi/agno","https://github.com/agno-agi/agno","agno-agi","Python","39877","False","False","5/4/2022 3:23:02 PM","5/3/2026 4:14:18 AM","Run agents as production software.","agents;ai;ai-agents;developer-tools;python","topic:ai language:Python stars:>=50"
"unclecode/crawl4ai","https://github.com/unclecode/crawl4ai","unclecode","Python","64921","False","False","5/9/2024 9:48:50 AM","5/3/2026 3:53:51 AM","🚀🤖 Crawl4AI: Open-source LLM Friendly Web Crawler & Scraper. Don't be shy, join here: https://discord.gg/jP8KfhDhyN","","a language:Python stars:>=50"
"keras-team/keras","https://github.com/keras-team/keras","keras-team","Python","64059","False","False","3/28/2015 12:35:42 AM","5/3/2026 1:11:59 AM","Deep Learning for humans","data-science;deep-learning;jax;machine-learning;neural-networks;python;pytorch;tensorflow","topic:data-science language:Python stars:>=50"
"electricitymaps/electricitymaps-contrib","https://github.com/electricitymaps/electricitymaps-contrib","electricitymaps","Python","3982","False","False","5/21/2016 4:36:17 PM","5/1/2026 12:44:51 AM","The open source repository for Electricity Maps data parsers that powers the world's most comprehensive electricity data platform","app;climate-change;data-visualization;electricity;electricity-consumption;electricity-prices;electricitymap;electricitymaps;hacktoberfest;map;sustainability","topic:data-visualization language:Python stars:>=50"
"langchain-ai/langgraph","https://github.com/langchain-ai/langgraph","langchain-ai","Python","31066","False","False","8/9/2023 6:33:12 PM","5/3/2026 4:21:58 AM","Build resilient language agents as graphs.","agents;ai;ai-agents;chatgpt;deepagents;enterprise;framework;gemini;generative-ai;langchain;langgraph;llm;multiagent;open-source;openai;pydantic;python;rag","topic:ai language:Python stars:>=50"
"sinaptik-ai/pandas-ai","https://github.com/sinaptik-ai/pandas-ai","sinaptik-ai","Python","23502","False","False","4/22/2023 12:58:01 PM","5/2/2026 5:05:22 PM","Chat with your database or your datalake (SQL, CSV, parquet). PandasAI makes data analysis conversational using LLMs and RAG.","ai;csv;data;data-analysis;data-science;data-visualization;database;datalake;gpt-4;llm;pandas;sql;text-to-sql","topic:ai language:Python stars:>=50 | topic:data-science language:Python stars:>=50 | topic:data-visualization language:Python stars:>=50"
"cleanlab/cleanlab","https://github.com/cleanlab/cleanlab","cleanlab","Python","11449","False","False","5/11/2018 1:55:21 AM","5/2/2026 8:06:12 AM","Cleanlab's open-source library is the standard data-centric AI package for data quality and machine learning with messy, real-world data and labels.","active-learning;annotation;anomaly-detection;data-annotation;data-centric-ai;data-cleaning;data-curation;data-labeling;data-profiling;data-quality;data-science;data-validation;datasets;exploratory-data-analysis;labeling;machine-learning;noisy-labels;out-of-distribution-detection;outlier-detection;weak-supervision","topic:data-science language:Python stars:>=50"
"langflow-ai/langflow","https://github.com/langflow-ai/langflow","langflow-ai","Python","147639","False","False","2/8/2023 10:28:03 PM","5/3/2026 4:17:33 AM","Langflow is a powerful tool for building and deploying AI-powered agents and workflows.","agents;chatgpt;generative-ai;large-language-models;multiagent;react-flow","a language:Python stars:>=50"
"OWASP/QRLJacking","https://github.com/OWASP/QRLJacking","OWASP","Python","1536","False","False","7/11/2016 11:00:06 PM","5/1/2026 6:52:58 AM"," QRLJacking or Quick Response Code Login Jacking is a simple-but-nasty attack vector affecting all the applications that relays on “Login with QR code” feature as a secure way to login into accounts which aims for hijacking users session by attackers.","","aim language:Python stars:>=50"
"augurlabs/augur","https://github.com/augurlabs/augur","augurlabs","Python","695","False","False","1/5/2017 5:34:54 PM","5/1/2026 6:45:19 PM","Python library and web service for Open Source Software Health and Sustainability metrics & data collection. You can find our documentation and new contributor information easily here: https://oss-augur.readthedocs.io/en/main/   ","alt-metrics;chaoss;data-collection;data-modeling;data-visualization;defined-metrics;facade;git;github;hacktoberfest2020;linux;linux-foundation;metrics;open-source;opensource;oss-governance;python-library;research;software;sustainability","topic:data-visualization language:Python stars:>=50"
"litaotao/IPython-Dashboard","https://github.com/litaotao/IPython-Dashboard","litaotao","Python","691","False","False","9/25/2015 8:37:27 AM","4/17/2026 10:06:12 AM","A stand alone, light-weight web server for building, sharing graphs created in ipython. Build for data science, data analysis guys. Aiming at building  an interactive visualization, collaborated dashboard, and real-time streaming graph. ","dashboard;data-science;ipython;ipython-dashboard;notebook;visualization","aim language:Python stars:>=50"
"rio-labs/rio","https://github.com/rio-labs/rio","rio-labs","Python","3391","False","False","4/13/2024 5:24:38 PM","5/3/2026 1:50:54 AM","WebApps in pure Python. No JavaScript, HTML and CSS needed","app;crud-application;data-analysis;data-science;data-visualization;developer-tools;framework;gui;machine-learning;python;web","topic:data-visualization language:Python stars:>=50"
"reflex-dev/reflex","https://github.com/reflex-dev/reflex","reflex-dev","Python","28354","False","False","10/25/2022 3:08:48 AM","5/3/2026 2:23:26 AM","🕸️ Web apps in pure Python 🐍","dashboard;data-analysis;data-science;data-visualization;developer-tools;framework;fullstack;gui;open-source;python;webapp","topic:data-science language:Python stars:>=50 | topic:data-visualization language:Python stars:>=50"
"treeverse/dvc","https://github.com/treeverse/dvc","treeverse","Python","15578","False","False","3/4/2017 8:16:33 AM","5/2/2026 11:43:01 PM","🦉 Data Versioning and ML Experiments","ai;data-science;data-version-control;developer-tools;machine-learning;reproducibility;unstructured-data","topic:data-science language:Python stars:>=50"
"pavelliavonau/cmakeconverter","https://github.com/pavelliavonau/cmakeconverter","pavelliavonau","Python","941","False","False","5/23/2016 9:14:47 AM","4/30/2026 3:34:21 PM","This project aims to facilitate the conversion of Visual Studio to CMake projects.","c-plus-plus;cmake;cmakelists;cpp;fortran;intel-fortran;vcxproj;vfproj;visual-studio","aim language:Python stars:>=50"
"LAION-AI/Open-Assistant","https://github.com/LAION-AI/Open-Assistant","LAION-AI","Python","37410","False","False","12/13/2022 5:24:17 AM","5/3/2026 3:54:03 AM","OpenAssistant is a chat-based assistant that understands tasks, can interact with third-party systems, and retrieve information dynamically to do so.","ai;assistant;chatgpt;discord-bot;language-model;machine-learning;nextjs;python;rlhf","topic:ai language:Python stars:>=50"
"NousResearch/hermes-agent","https://github.com/NousResearch/hermes-agent","NousResearch","Python","130013","False","False","7/22/2025 10:22:28 PM","5/3/2026 4:47:33 AM","The agent that grows with you","ai;ai-agent;ai-agents;anthropic;chatgpt;claude;claude-code;clawdbot;codex;hermes;hermes-agent;llm;moltbot;nous-research;openai;openclaw","topic:ai language:Python stars:>=50 | a language:Python stars:>=50 | topic:llm stars:>=100"
"hiyouga/LlamaFactory","https://github.com/hiyouga/LlamaFactory","hiyouga","Python","70848","False","False","5/28/2023 10:09:12 AM","5/3/2026 3:13:42 AM","Unified Efficient Fine-Tuning of 100+ LLMs & VLMs (ACL 2024)","agent;ai;deepseek;fine-tuning;gemma;gpt;instruction-tuning;large-language-models;llama;llama3;llm;lora;moe;nlp;peft;qlora;quantization;qwen;rlhf;transformers","topic:ai language:Python stars:>=50 | topic:llm stars:>=100"
"unytics/bigfunctions","https://github.com/unytics/bigfunctions","unytics","Python","758","False","False","8/24/2022 7:41:54 AM","4/14/2026 1:25:46 PM","Supercharge BigQuery with BigFunctions","bigquery;data;data-analytics;data-engineering;data-visualization;data-warehouse","topic:data-visualization language:Python stars:>=50"
"mlflow/mlflow","https://github.com/mlflow/mlflow","mlflow","Python","25689","False","False","6/5/2018 4:05:58 PM","5/3/2026 12:35:41 AM","The open source AI engineering platform for agents, LLMs, and ML models. MLflow enables teams of all sizes to debug, evaluate, monitor, and optimize production-quality AI applications while controlling costs and managing access to models and data.","agentops;agents;ai;ai-governance;apache-spark;evaluation;langchain;llm-evaluation;llmops;machine-learning;ml;mlflow;mlops;model-management;observability;open-source;openai;prompt-engineering","topic:ai language:Python stars:>=50"
"retentioneering/retentioneering-tools","https://github.com/retentioneering/retentioneering-tools","retentioneering","Python","882","False","False","7/2/2019 1:37:30 PM","4/24/2026 4:30:10 AM","Retentioneering: product analytics, data-driven CJM optimization, marketing analytics, web analytics, transaction analytics, graph visualization, process mining, and behavioral segmentation in Python. Predictive analytics over clickstream, AB tests, machine learning, and Markov Chain simulations.","behaviour-analysis;business-intelligence;clickstream;customer-journey-map;customer-segmentation;data-visualization;graph-visualizer;library;machine-learning;machinelearning;pandas;predictive-analytics;predictive-modeling;product-analytics;python;segmentation;user-trajectories;user-trajectories-analysis;web-analytics","topic:data-visualization language:Python stars:>=50"
"ZTE-AICloud/Co-Sight","https://github.com/ZTE-AICloud/Co-Sight","ZTE-AICloud","Python","985","False","False","4/29/2025 10:30:08 AM","4/27/2026 6:49:32 PM","","agent;aicloud;aim;zte","aim language:Python stars:>=50"
"polakowo/vectorbt","https://github.com/polakowo/vectorbt","polakowo","Python","7350","False","False","11/14/2017 11:56:32 AM","5/2/2026 11:50:09 PM","The backtesting engine that gives you an unfair advantage. Run thousands of trading ideas before others finish one.","algorithmic-trading;algorithmic-traiding;backtesting;cryptocurrency;data-science;data-visualization;finance;machine-learning;portfolio-optimization;quantitative-analysis;quantitative-finance;time-series;trading;trading-strategies","topic:data-visualization language:Python stars:>=50"
"AutoCodeRoverSG/auto-code-rover","https://github.com/AutoCodeRoverSG/auto-code-rover","AutoCodeRoverSG","Python","3071","False","False","4/8/2024 5:34:14 AM","4/28/2026 10:37:52 PM","A project structure aware autonomous software engineer aiming for autonomous program improvement. Resolved 37.3% tasks (pass@1) in SWE-bench lite and 46.2% tasks (pass@1) in SWE-bench verified with each task costs less than $0.7.","","aim language:Python stars:>=50"
"dagster-io/dagster","https://github.com/dagster-io/dagster","dagster-io","Python","15425","False","False","4/30/2018 4:30:04 PM","5/2/2026 8:23:27 PM","An orchestration platform for the development, production, and observation of data assets.","analytics;dagster;data-engineering;data-integration;data-orchestrator;data-pipelines;data-science;etl;metadata;mlops;orchestration;python;scheduler;workflow;workflow-automation","topic:data-science language:Python stars:>=50"
"vllm-project/vllm","https://github.com/vllm-project/vllm","vllm-project","Python","78892","False","False","2/9/2023 11:23:20 AM","5/3/2026 4:18:04 AM","A high-throughput and memory-efficient inference and serving engine for LLMs","amd;blackwell;cuda;deepseek;deepseek-v3;gpt;gpt-oss;inference;kimi;llama;llm;llm-serving;model-serving;moe;openai;pytorch;qwen;qwen3;tpu;transformer","a language:Python stars:>=50 | topic:llm stars:>=100"
"ollama/ollama","https://github.com/ollama/ollama","ollama","Go","170587","False","False","6/26/2023 7:39:32 PM","5/3/2026 4:04:28 AM","Get up and running with Kimi-K2.5, GLM-5, MiniMax, DeepSeek, gpt-oss, Qwen, Gemma and other models.","deepseek;gemma;gemma3;glm;go;golang;gpt-oss;llama;llama3;llm;llms;minimax;mistral;ollama;qwen","topic:llm stars:>=100"
"quic/aimet","https://github.com/quic/aimet","quic","Python","2607","False","False","4/21/2020 6:57:10 PM","5/2/2026 1:43:26 PM","AIMET is a library that provides advanced quantization and compression techniques for trained neural network models.","auto-ml;compression;deep-learning;deep-neural-networks;machine-learning;network-compression;network-quantization;open-source;opensource;pruning;quantization","aim language:Python stars:>=50"
"onyx-dot-app/onyx","https://github.com/onyx-dot-app/onyx","onyx-dot-app","Python","28872","False","False","4/27/2023 6:04:01 AM","5/3/2026 4:03:29 AM","Open Source AI Platform - AI Chat with advanced features that works with every LLM","ai;ai-chat;chatgpt;chatui;enterprise-search;gen-ai;information-retrieval;llm;llm-ui;nextjs;python;rag;self-hosted;vector-search","topic:ai language:Python stars:>=50"
"glato/emerge","https://github.com/glato/emerge","glato","Python","1077","False","False","9/10/2020 7:04:40 PM","5/2/2026 2:11:03 AM","Emerge is a browser-based interactive codebase and dependency visualization tool for many different programming languages. It supports some basic code quality and graph metrics and provides a simple and intuitive way to explore and analyze a codebase by using graph structures.","android-dependency-visualizer;c;code-metrics;code-visualization;data-visualization;dependency-graph;dependency-visualizer;golang;graph-visualization;java;javascript;kotlin;python;ruby;source-code-analysis;sourcegraph;swift;typescript;visualization","topic:data-visualization language:Python stars:>=50"
"sansan0/TrendRadar","https://github.com/sansan0/TrendRadar","sansan0","Python","56057","False","False","4/28/2025 11:42:16 AM","5/3/2026 4:48:16 AM","⭐AI-driven public opinion & trend monitor with multi-platform aggregation, RSS, and smart alerts.🎯 告别信息过载，你的 AI 舆情监控助手与热点筛选工具！聚合多平台热点 +  RSS 订阅，支持关键词精准筛选。AI 智能筛选新闻 + AI 翻译 +  AI 分析简报直推手机，也支持接入 MCP 架构，赋能 AI 自然语言对话分析、情感洞察与趋势预测等。支持 Docker ，数据本地/云端自持。集成微信/飞书/钉钉/Telegram/邮件/ntfy/bark/slack 等渠道智能推送。","ai;bark;data-analysis;docker;hot-news;llm;mail;mcp;mcp-server;news;ntfy;python;rss;trending-topics;wechat;wework","topic:ai language:Python stars:>=50 | topic:llm stars:>=100"
"assafelovic/gpt-researcher","https://github.com/assafelovic/gpt-researcher","assafelovic","Python","26835","False","False","5/12/2023 10:33:54 AM","5/2/2026 9:50:33 PM","An autonomous agent that conducts deep research on any data using any LLM providers","agent;ai;automation;deepresearch;llms;mcp;mcp-server;python;research;search;webscraping","topic:ai language:Python stars:>=50"
"BerriAI/litellm","https://github.com/BerriAI/litellm","BerriAI","Python","45512","False","False","7/27/2023 12:09:52 AM","5/3/2026 3:43:06 AM","Python SDK, Proxy Server (AI Gateway) to call 100+ LLM APIs in OpenAI (or native) format, with cost tracking, guardrails, loadbalancing and logging. [Bedrock, Azure, OpenAI, VertexAI, Cohere, Anthropic, Sagemaker, HuggingFace, VLLM, NVIDIA NIM]","ai-gateway;anthropic;azure-openai;bedrock;gateway;langchain;litellm;llm;llm-gateway;llmops;mcp-gateway;openai;openai-proxy;vertex-ai","topic:llm stars:>=100"
"Lightning-AI/pytorch-lightning","https://github.com/Lightning-AI/pytorch-lightning","Lightning-AI","Python","31101","False","False","3/31/2019 12:45:57 AM","5/3/2026 3:59:29 AM","Pretrain, finetune ANY AI model of ANY size on 1 or 10,000+ GPUs with zero code changes.","ai;artificial-intelligence;data-science;deep-learning;machine-learning;python;pytorch","topic:ai language:Python stars:>=50 | topic:data-science language:Python stars:>=50"
"mwaskom/seaborn","https://github.com/mwaskom/seaborn","mwaskom","Python","13836","False","False","6/18/2012 6:41:19 PM","5/2/2026 10:07:07 PM","Statistical data visualization in Python","data-science;data-visualization;matplotlib;pandas;python","topic:data-science language:Python stars:>=50 | topic:data-visualization language:Python stars:>=50"
"huggingface/transformers","https://github.com/huggingface/transformers","huggingface","Python","160190","False","False","10/29/2018 1:56:00 PM","5/3/2026 4:40:06 AM","🤗 Transformers: the model-definition framework for state-of-the-art machine learning models in text, vision, audio, and multimodal models, for both inference and training. ","audio;deep-learning;deepseek;gemma;glm;hacktoberfest;llm;machine-learning;model-hub;natural-language-processing;nlp;pretrained-models;python;pytorch;pytorch-transformers;qwen;speech-recognition;transformer;vlm","topic:llm stars:>=100"
"ictnlp/LLaMA-Omni","https://github.com/ictnlp/LLaMA-Omni","ictnlp","Python","3139","False","False","9/10/2024 12:21:53 PM","4/24/2026 7:14:01 AM","LLaMA-Omni is a low-latency and high-quality end-to-end speech interaction model built upon Llama-3.1-8B-Instruct, aiming to achieve speech capabilities at the GPT-4o level.","large-language-models;multimodal-large-language-models;speech-interaction;speech-language-model;speech-to-speech;speech-to-text","aim language:Python stars:>=50"
