"FullName","Url","Owner","Language","Stars","Fork","Archived","CreatedAt","UpdatedAt","Description","Topics","SourceQueries"
"AstrBotDevs/AstrBot","https://github.com/AstrBotDevs/AstrBot","AstrBotDevs","Python","31239","False","False","12/8/2022 1:27:46 PM","5/3/2026 6:17:26 PM","AI Agent Assistant that integrates lots of IM platforms, LLMs, plugins and AI feature, and can be your openclaw alternative. ✨","agent;ai;chatbot;chatgpt;discord;docker;gemini;gpt;llama;llm;mcp;openai;python;qq;qqbot;telegram","topic:ai language:Python stars:>=50"
"rasbt/LLMs-from-scratch","https://github.com/rasbt/LLMs-from-scratch","rasbt","Jupyter Notebook","91865","False","False","7/23/2023 6:15:57 PM","5/3/2026 7:01:51 PM","Implement a ChatGPT-like LLM in PyTorch from scratch, step by step","ai;artificial-intelligence;chatbot;chatgpt;deep-learning;from-scratch;generative-ai;gpt;language-model;large-language-models;llm;machine-learning;neural-networks;python;pytorch;transformers","topic:deep-learning stars:>=100"
"harry0703/MoneyPrinterTurbo","https://github.com/harry0703/MoneyPrinterTurbo","harry0703","Python","56678","False","False","3/11/2024 2:57:34 AM","5/3/2026 6:47:03 PM","利用AI大模型，一键生成高清短视频 Generate short videos with one click using AI LLM.","ai;automation;chatgpt;moviepy;python;shortvideo;tiktok","topic:ai language:Python stars:>=50"
"SciPhi-AI/R2R","https://github.com/SciPhi-AI/R2R","SciPhi-AI","Python","7797","False","False","2/12/2024 3:24:27 AM","5/3/2026 3:55:41 PM","SoTA production-ready AI retrieval system. Agentic Retrieval-Augmented Generation (RAG) with a RESTful API.","artificial-intelligence;large-language-models;python;question-answering;rag;retrieval-augmented-generation;retrieval-systems;search","topic:artificial-intelligence language:Python stars:>=50"
"OpenBMB/MiniCPM-o","https://github.com/OpenBMB/MiniCPM-o","OpenBMB","Python","24490","False","False","1/29/2024 5:30:33 AM","5/3/2026 3:17:45 PM","A Gemini 2.5 Flash Level MLLM for Vision, Speech, and Full-Duplex Multimodal Live Streaming on Your Phone","minicpm;minicpm-v;multi-modal","o language:Python stars:>=50"
"jundot/omlx","https://github.com/jundot/omlx","jundot","Python","12203","False","False","2/13/2026 2:13:27 PM","5/3/2026 7:04:12 PM","LLM inference server with continuous batching & SSD caching for Apple Silicon — managed from the macOS menu bar","apple-silicon;inference-server;llm;macos;mlx;openai-api","o language:Python stars:>=50"
"CMU-Perceptual-Computing-Lab/openpose","https://github.com/CMU-Perceptual-Computing-Lab/openpose","CMU-Perceptual-Computing-Lab","C++","34060","False","False","4/24/2017 2:06:31 PM","5/3/2026 1:59:40 PM","OpenPose: Real-time multi-person keypoint detection library for body, face, hands, and foot estimation","caffe;computer-vision;cpp;cvpr-2017;deep-learning;face;foot-estimation;hand-estimation;human-behavior-understanding;human-pose;human-pose-estimation;keypoint-detection;keypoints;machine-learning;multi-person;opencv;openpose;pose;pose-estimation;real-time","topic:deep-learning stars:>=100"
"LAION-AI/Open-Assistant","https://github.com/LAION-AI/Open-Assistant","LAION-AI","Python","37407","False","False","12/13/2022 5:24:17 AM","5/3/2026 3:37:14 PM","OpenAssistant is a chat-based assistant that understands tasks, can interact with third-party systems, and retrieve information dynamically to do so.","ai;assistant;chatgpt;discord-bot;language-model;machine-learning;nextjs;python;rlhf","topic:ai language:Python stars:>=50 | open language:Python stars:>=50 | o language:Python stars:>=50"
"D4Vinci/Scrapling","https://github.com/D4Vinci/Scrapling","D4Vinci","Python","42786","False","False","10/13/2024 8:29:53 PM","5/3/2026 7:10:05 PM","🕷️ An adaptive Web Scraping framework that handles everything from a single request to a full-scale crawl!","ai;ai-scraping;automation;crawler;crawling;crawling-python;data;data-extraction;mcp;mcp-server;playwright;python;scraping;selectors;stealth;web-scraper;web-scraping;web-scraping-python;webscraping;xpath","topic:ai language:Python stars:>=50"
"openai/gpt-oss","https://github.com/openai/gpt-oss","openai","Python","20066","False","False","6/23/2025 4:43:33 PM","5/3/2026 5:22:16 PM","gpt-oss-120b and gpt-oss-20b are two open-weight language models by OpenAI","","open language:Python stars:>=50 | o language:Python stars:>=50"
