"FullName","Url","Owner","Language","Stars","Fork","Archived","CreatedAt","UpdatedAt","Description","Topics","SourceQueries"
"streamlit/streamlit","https://github.com/streamlit/streamlit","streamlit","Python","44432","False","False","8/24/2019 12:14:52 AM","5/3/2026 6:55:12 PM","Streamlit — A faster way to build and share data apps.","data-analysis;data-science;data-visualization;deep-learning;developer-tools;machine-learning;python;streamlit","topic:deep-learning language:Python stars:>=50 | topic:deep-learning stars:>=100"
"comet-ml/opik","https://github.com/comet-ml/opik","comet-ml","Python","19178","False","False","5/10/2023 12:57:13 PM","5/3/2026 5:44:17 PM","Debug, evaluate, and monitor your LLM applications, RAG systems, and agentic workflows with comprehensive tracing, automated evaluations, and production-ready dashboards.","evaluation;hacktoberfest;hacktoberfest2025;langchain;llama-index;llm;llm-evaluation;llm-observability;llmops;open-source;openai;playground;prompt-engineering","o language:Python stars:>=50"
"letta-ai/letta","https://github.com/letta-ai/letta","letta-ai","Python","22417","False","False","10/11/2023 7:38:37 AM","5/3/2026 6:13:50 PM","Letta is the platform for building stateful agents: AI with advanced memory that can learn and self-improve over time.","ai;ai-agents;llm;llm-agent","topic:ai language:Python stars:>=50"
"infiniflow/ragflow","https://github.com/infiniflow/ragflow","infiniflow","Python","79553","False","False","12/12/2023 6:13:13 AM","5/3/2026 6:58:20 PM","RAGFlow is a leading open-source Retrieval-Augmented Generation (RAG) engine that fuses cutting-edge RAG with Agent capabilities to create a superior context layer for LLMs","llm-app","open language:Python stars:>=50"
"stitionai/devika","https://github.com/stitionai/devika","stitionai","Python","19505","False","False","3/21/2024 3:03:21 AM","5/3/2026 3:37:24 PM","Devika is the first open-source implementation of an Agentic Software Engineer. Initially started as an open-source alternative to Devin.","","open language:Python stars:>=50"
"opencv/opencv","https://github.com/opencv/opencv","opencv","C++","87330","False","False","7/19/2012 9:40:17 AM","5/3/2026 4:50:32 PM","Open Source Computer Vision Library","c-plus-plus;computer-vision;deep-learning;image-processing;opencv","topic:deep-learning stars:>=100"
"commaai/openpilot","https://github.com/commaai/openpilot","commaai","Python","60802","False","False","11/24/2016 1:33:30 AM","5/3/2026 6:49:55 PM","openpilot is an operating system for robotics. Currently, it upgrades the driver assistance system on 300+ supported cars.","advanced-driver-assistance-systems;driver-assistance-systems;robotics","open language:Python stars:>=50 | o language:Python stars:>=50"
"eugeneyan/applied-ml","https://github.com/eugeneyan/applied-ml","eugeneyan","","28793","False","False","7/4/2020 6:57:47 PM","5/3/2026 8:03:53 AM","📚 Papers & tech blogs by companies sharing their work on data science & machine learning in production.","applied-data-science;applied-machine-learning;computer-vision;data-discovery;data-engineering;data-quality;data-science;deep-learning;machine-learning;natural-language-processing;production;recsys;reinforcement-learning;search","topic:deep-learning stars:>=100"
"lm-sys/FastChat","https://github.com/lm-sys/FastChat","lm-sys","Python","39461","False","False","3/19/2023 12:18:02 AM","5/3/2026 2:40:20 PM","An open platform for training, serving, and evaluating large language models. Release repo for Vicuna and Chatbot Arena.","","open language:Python stars:>=50"
"HKUDS/OpenHarness","https://github.com/HKUDS/OpenHarness","HKUDS","Python","11798","False","False","4/1/2026 3:37:13 PM","5/3/2026 6:05:51 PM","""OpenHarness: Open Agent Harness with a Built-in Personal Agent--Ohmo!""","","o language:Python stars:>=50"
"Avik-Jain/100-Days-Of-ML-Code","https://github.com/Avik-Jain/100-Days-Of-ML-Code","Avik-Jain","","50832","False","False","7/5/2018 9:11:43 AM","5/3/2026 6:28:59 PM","100 Days of ML Coding","100-days-of-code-log;100daysofcode;deep-learning;implementation;infographics;linear-algebra;linear-regression;logistic-regression;machine-learning;machine-learning-algorithms;naive-bayes-classifier;python;scikit-learn;siraj-raval;siraj-raval-challenge;support-vector-machines;svm;tutorial","topic:deep-learning stars:>=100"
"naptha/tesseract.js","https://github.com/naptha/tesseract.js","naptha","JavaScript","38045","False","False","6/24/2015 2:49:52 AM","5/3/2026 3:53:58 PM","Pure Javascript OCR for more than 100 Languages 📖🎉🖥","deep-learning;javascript;ocr;tesseract;webassembly","topic:deep-learning stars:>=100"
"flwrlabs/flower","https://github.com/flwrlabs/flower","flwrlabs","Python","6873","False","False","2/17/2020 11:51:29 AM","5/3/2026 8:19:49 AM","Flower: A Friendly Federated AI Framework","ai;android;artificial-intelligence;cpp;deep-learning;federated-analytics;federated-learning;federated-learning-framework;fleet-intelligence;fleet-learning;flower;framework;grpc;ios;machine-learning;python;pytorch;raspberry-pi;scikit-learn;tensorflow","topic:artificial-intelligence language:Python stars:>=50"
"ultralytics/yolov5","https://github.com/ultralytics/yolov5","ultralytics","Python","57330","False","False","5/18/2020 3:45:11 AM","5/3/2026 3:06:59 PM","YOLOv5 🚀 in PyTorch > ONNX > CoreML > TFLite","coreml;deep-learning;ios;machine-learning;ml;object-detection;onnx;pytorch;tflite;ultralytics;yolo;yolov3;yolov5","topic:deep-learning language:Python stars:>=50 | topic:deep-learning stars:>=100"
"OpenHands/OpenHands","https://github.com/OpenHands/OpenHands","OpenHands","Python","72553","False","False","3/13/2024 3:33:31 AM","5/3/2026 5:48:20 PM","🙌 OpenHands: AI-Driven Development","agent;artificial-intelligence;chatgpt;claude-ai;cli;developer-tools;gpt;llm;openai","topic:artificial-intelligence language:Python stars:>=50 | open language:Python stars:>=50 | o language:Python stars:>=50"
"google-deepmind/sonnet","https://github.com/google-deepmind/sonnet","google-deepmind","Python","9919","False","False","4/3/2017 11:34:35 AM","4/29/2026 2:12:18 PM","TensorFlow-based neural network library","artificial-intelligence;deep-learning;machine-learning;neural-networks;tensorflow","topic:artificial-intelligence language:Python stars:>=50"
"anthropics/claude-plugins-official","https://github.com/anthropics/claude-plugins-official","anthropics","Python","18465","False","False","11/20/2025 6:36:20 PM","5/3/2026 6:44:05 PM","Official, Anthropic-managed directory of high quality Claude Code Plugins.","claude-code;mcp;skills","o language:Python stars:>=50"
"HKUDS/nanobot","https://github.com/HKUDS/nanobot","HKUDS","Python","41568","False","False","2/1/2026 7:16:15 AM","5/3/2026 7:05:29 PM","""🐈 nanobot: The Ultra-Lightweight Personal AI Agent""","ai;ai-agent;ai-agents;anthropic;chatgpt;claude;claude-code;codex;llm;nanobot;openai;openclaw","topic:ai language:Python stars:>=50"
"AsyncFuncAI/deepwiki-open","https://github.com/AsyncFuncAI/deepwiki-open","AsyncFuncAI","Python","16072","False","False","4/30/2025 6:01:29 AM","5/3/2026 6:56:48 PM","Open Source DeepWiki: AI-Powered Wiki Generator for GitHub/Gitlab/Bitbucket Repositories. Join the discord: https://discord.gg/gMwThUMeme","ai;gemini;github;ollama;open-source;openai;openrouter;self-hosted;wiki","o language:Python stars:>=50"
"ZuzooVn/machine-learning-for-software-engineers","https://github.com/ZuzooVn/machine-learning-for-software-engineers","ZuzooVn","","28760","False","False","10/9/2016 9:20:25 PM","5/3/2026 5:45:26 PM","A complete daily plan for studying to become a machine learning engineer.","artificial-intelligence;deep-learning;machine-learning;machine-learning-algorithms;software-engineer","topic:deep-learning stars:>=100"
"SYSTRAN/faster-whisper","https://github.com/SYSTRAN/faster-whisper","SYSTRAN","Python","22591","False","False","2/11/2023 9:17:27 AM","5/3/2026 7:06:01 PM","Faster Whisper transcription with CTranslate2","deep-learning;inference;openai;quantization;speech-recognition;speech-to-text;transformer;whisper","topic:deep-learning language:Python stars:>=50"
"jingyaogong/minimind-v","https://github.com/jingyaogong/minimind-v","jingyaogong","Python","7728","False","False","9/11/2024 5:53:54 AM","5/3/2026 4:11:21 PM","🚀 「大模型」2小时从0训练65M参数的视觉多模态VLM！🌏 Train a 65M-parameter VLM from scratch in just 2h! ","artificial-intelligence;chatgpt;vision-language-model","topic:artificial-intelligence language:Python stars:>=50"
"TransformerOptimus/SuperAGI","https://github.com/TransformerOptimus/SuperAGI","TransformerOptimus","Python","17501","False","False","5/13/2023 8:55:24 AM","5/3/2026 3:37:18 PM","<⚡️> SuperAGI - A dev-first open source autonomous AI agent framework. Enabling developers to build, manage & run useful autonomous agents quickly and reliably.","agents;agi;ai;artificial-general-intelligence;artificial-intelligence;autonomous-agents;gpt-4;hacktoberfest;llm;llmops;nextjs;openai;pinecone;python;superagi","topic:artificial-intelligence language:Python stars:>=50"
"dortania/OpenCore-Legacy-Patcher","https://github.com/dortania/OpenCore-Legacy-Patcher","dortania","Python","17315","False","False","11/24/2020 1:54:56 AM","5/3/2026 10:34:01 AM","Experience macOS just like before","big-sur;macos;opencore;patcher","o language:Python stars:>=50"
"deeppavlov/DeepPavlov","https://github.com/deeppavlov/DeepPavlov","deeppavlov","Python","6976","False","False","11/17/2017 2:35:29 PM","5/2/2026 2:57:42 PM","An open source library for deep learning end-to-end dialog systems and chatbots.","ai;artificial-intelligence;bot;chatbot;chitchat;deep-learning;deep-neural-networks;dialogue-agents;dialogue-manager;dialogue-systems;entity-extraction;intent-classification;intent-detection;machine-learning;named-entity-recognition;nlp;nlp-machine-learning;question-answering;slot-filling;tensorflow","topic:artificial-intelligence language:Python stars:>=50"
"Vision-CAIR/MiniGPT-4","https://github.com/Vision-CAIR/MiniGPT-4","Vision-CAIR","Python","25724","False","False","4/15/2023 10:17:09 PM","5/3/2026 5:41:39 PM","Open-sourced codes for MiniGPT-4 and MiniGPT-v2 (https://minigpt-4.github.io, https://minigpt-v2.github.io/)","","open language:Python stars:>=50"
"junyanz/pytorch-CycleGAN-and-pix2pix","https://github.com/junyanz/pytorch-CycleGAN-and-pix2pix","junyanz","Python","25104","False","False","4/18/2017 10:33:05 AM","5/3/2026 3:08:42 PM","Image-to-Image Translation in PyTorch","computer-graphics;computer-vision;cyclegan;deep-learning;gan;gans;generative-adversarial-network;image-generation;image-manipulation;pix2pix;pytorch","topic:deep-learning language:Python stars:>=50"
"xorbitsai/inference","https://github.com/xorbitsai/inference","xorbitsai","Python","9281","False","False","6/14/2023 7:05:04 AM","5/3/2026 5:13:48 PM","Swap GPT for any LLM by changing a single line of code. Xinference lets you run open-source, speech, and multimodal models on cloud, on-prem, or your laptop — all through one unified, production-ready inference API.","artificial-intelligence;chatglm;deployment;flan-t5;gemma;ggml;glm4;inference;llama;llama3;llamacpp;llm;machine-learning;mistral;openai-api;pytorch;qwen;vllm;whisper;wizardlm","topic:artificial-intelligence language:Python stars:>=50"
"frappe/erpnext","https://github.com/frappe/erpnext","frappe","Python","33515","False","False","6/8/2011 8:20:56 AM","5/3/2026 6:27:04 PM","Free and Open Source Enterprise Resource Planning (ERP)","accounting;asset-management;crm;distribution;erp;erpnext;frappe;healthcare;hrms;manufacturing;point-of-sale;procurement;project-management;python;retail;support","open language:Python stars:>=50"
"langchain-ai/langgraph","https://github.com/langchain-ai/langgraph","langchain-ai","Python","31111","False","False","8/9/2023 6:33:12 PM","5/3/2026 6:51:53 PM","Build resilient language agents as graphs.","agents;ai;ai-agents;chatgpt;deepagents;enterprise;framework;gemini;generative-ai;langchain;langgraph;llm;multiagent;open-source;openai;pydantic;python;rag","topic:ai language:Python stars:>=50"
"huggingface/transformers","https://github.com/huggingface/transformers","huggingface","Python","160213","False","False","10/29/2018 1:56:00 PM","5/3/2026 6:57:29 PM","🤗 Transformers: the model-definition framework for state-of-the-art machine learning models in text, vision, audio, and multimodal models, for both inference and training. ","audio;deep-learning;deepseek;gemma;glm;hacktoberfest;llm;machine-learning;model-hub;natural-language-processing;nlp;pretrained-models;python;pytorch;pytorch-transformers;qwen;speech-recognition;transformer;vlm","topic:deep-learning language:Python stars:>=50 | topic:deep-learning stars:>=100"
"oobabooga/textgen","https://github.com/oobabooga/textgen","oobabooga","Python","46924","False","False","12/21/2022 4:17:37 AM","5/3/2026 6:11:07 PM","Open-source desktop app for local LLMs. Text, vision, tool-calling, OpenAI/Anthropic-compatible API.","","open language:Python stars:>=50"
"eriklindernoren/ML-From-Scratch","https://github.com/eriklindernoren/ML-From-Scratch","eriklindernoren","Python","31413","False","False","2/5/2017 12:11:23 PM","5/3/2026 5:38:10 PM","Machine Learning From Scratch. Bare bones NumPy implementations of machine learning models and algorithms with a focus on accessibility. Aims to cover everything from linear regression to deep learning.","data-mining;data-science;deep-learning;deep-reinforcement-learning;genetic-algorithm;machine-learning;machine-learning-from-scratch","topic:deep-learning language:Python stars:>=50 | topic:deep-learning stars:>=100"
"ashishpatel26/500-AI-Machine-learning-Deep-learning-Computer-vision-NLP-Projects-with-code","https://github.com/ashishpatel26/500-AI-Machine-learning-Deep-learning-Computer-vision-NLP-Projects-with-code","ashishpatel26","","33413","False","False","1/2/2021 12:08:37 PM","5/3/2026 6:37:28 PM","500 AI Machine learning Deep learning Computer vision NLP Projects with code","artificial-intelligence;artificial-intelligence-projects;awesome;computer-vision;computer-vision-project;data-science;deep-learning;deep-learning-project;machine-learning;machine-learning-projects;nlp;nlp-projects;python","topic:deep-learning stars:>=100"
"WZMIAOMIAO/deep-learning-for-image-processing","https://github.com/WZMIAOMIAO/deep-learning-for-image-processing","WZMIAOMIAO","Python","26229","False","False","11/14/2019 3:02:27 PM","5/3/2026 9:19:26 AM","deep learning for image processing including classification and object-detection etc.","bilibili;classification;deep-learning;object-detection;pytorch;segmentation;tensorflow2","topic:deep-learning language:Python stars:>=50"
"openai/openai-python","https://github.com/openai/openai-python","openai","Python","30671","False","False","10/25/2020 11:23:54 PM","5/3/2026 4:50:04 PM","The official Python library for the OpenAI API","openai;python","open language:Python stars:>=50 | o language:Python stars:>=50"
"Alibaba-NLP/DeepResearch","https://github.com/Alibaba-NLP/DeepResearch","Alibaba-NLP","Python","18784","False","False","1/9/2025 11:07:35 AM","5/3/2026 5:21:38 PM","Tongyi Deep Research, the Leading Open-source Deep Research Agent","agent;alibaba;artificial-intelligence;deep-research;deepresearch;information-seeking;llm;tongyi;web-agent","topic:artificial-intelligence language:Python stars:>=50"
"wkentaro/labelme","https://github.com/wkentaro/labelme","wkentaro","Python","15813","False","False","5/9/2016 12:30:26 PM","5/3/2026 3:08:55 PM","Image annotation with Python. Supports polygon, rectangle, circle, line, point, and AI-assisted annotation.","annotations;classification;computer-vision;deep-learning;image-annotation;instance-segmentation;python;semantic-segmentation;video-annotation","topic:deep-learning language:Python stars:>=50"
"microsoft/JARVIS","https://github.com/microsoft/JARVIS","microsoft","Python","24688","False","False","3/30/2023 2:57:12 AM","5/3/2026 5:25:45 PM","JARVIS, a system to connect LLMs with ML community. Paper: https://arxiv.org/pdf/2303.17580.pdf","deep-learning;platform;pytorch","topic:deep-learning language:Python stars:>=50"
"Comfy-Org/ComfyUI","https://github.com/Comfy-Org/ComfyUI","Comfy-Org","Python","111196","False","False","1/17/2023 3:15:56 AM","5/3/2026 6:38:10 PM","The most powerful and modular diffusion model GUI, api and backend with a graph/nodes interface.","ai;comfy;comfyui;python;pytorch;stable-diffusion","topic:ai language:Python stars:>=50"
"JaidedAI/EasyOCR","https://github.com/JaidedAI/EasyOCR","JaidedAI","Python","29395","False","False","3/14/2020 11:46:39 AM","5/3/2026 4:59:12 PM","Ready-to-use OCR with 80+ supported languages and all popular writing scripts including Latin, Chinese, Arabic, Devanagari, Cyrillic and etc.","cnn;crnn;data-mining;deep-learning;easyocr;image-processing;information-retrieval;lstm;machine-learning;ocr;optical-character-recognition;python;pytorch;scene-text;scene-text-recognition","topic:deep-learning language:Python stars:>=50 | o language:Python stars:>=50 | topic:deep-learning stars:>=100"
"GokuMohandas/Made-With-ML","https://github.com/GokuMohandas/Made-With-ML","GokuMohandas","Jupyter Notebook","47486","False","False","11/5/2018 3:44:27 AM","5/3/2026 6:46:16 PM","Learn how to develop, deploy and iterate on production-grade ML applications.","data-engineering;data-quality;data-science;deep-learning;distributed-ml;distributed-training;llms;machine-learning;mlops;natural-language-processing;python;pytorch;ray","topic:deep-learning stars:>=100"
"crewAIInc/crewAI","https://github.com/crewAIInc/crewAI","crewAIInc","Python","50535","False","False","10/27/2023 3:26:59 AM","5/3/2026 6:55:25 PM","Framework for orchestrating role-playing, autonomous AI agents. By fostering collaborative intelligence, CrewAI empowers agents to work together seamlessly, tackling complex tasks.","agents;ai;ai-agents;aiagentframework;llms","topic:ai language:Python stars:>=50"
"alirezamika/autoscraper","https://github.com/alirezamika/autoscraper","alirezamika","Python","7149","False","False","8/31/2020 12:02:19 PM","5/3/2026 1:49:17 PM","A Smart, Automatic, Fast and Lightweight Web Scraper for Python","ai;artificial-intelligence;automation;crawler;machine-learning;python;scrape;scraper;scraping;web-scraping;webautomation;webscraping","topic:artificial-intelligence language:Python stars:>=50"
"QuivrHQ/quivr","https://github.com/QuivrHQ/quivr","QuivrHQ","Python","39125","False","False","5/12/2023 11:53:30 PM","5/3/2026 3:15:42 PM","Opiniated RAG for integrating GenAI in your apps 🧠   Focus on your product rather than the RAG. Easy integration in existing products with customisation!  Any LLM: GPT4, Groq, Llama. Any Vectorstore: PGVector, Faiss. Any Files. Anyway you want.","ai;api;chatbot;chatgpt;database;docker;framework;frontend;groq;html;javascript;llm;openai;postgresql;privacy;rag;react;security;typescript;vector","topic:ai language:Python stars:>=50"
"lutzroeder/netron","https://github.com/lutzroeder/netron","lutzroeder","JavaScript","32832","False","False","12/26/2010 12:53:43 PM","5/3/2026 6:11:05 PM","Visualizer for neural network, deep learning and machine learning models","ai;coreml;deep-learning;deeplearning;keras;machine-learning;machinelearning;ml;neural-network;numpy;onnx;pytorch;safetensors;tensorflow;tensorflow-lite;visualizer","topic:deep-learning stars:>=100"
"PKU-YuanGroup/Open-Sora-Plan","https://github.com/PKU-YuanGroup/Open-Sora-Plan","PKU-YuanGroup","Python","12161","False","False","2/20/2024 2:01:03 PM","5/3/2026 12:40:42 PM","This project aim to reproduce Sora (Open AI T2V model), we wish the open source community contribute to this project.","","o language:Python stars:>=50"
"XingangPan/DragGAN","https://github.com/XingangPan/DragGAN","XingangPan","Python","35886","False","False","5/18/2023 10:08:02 AM","5/3/2026 4:45:42 AM","Official Code for DragGAN (SIGGRAPH 2023)","artificial-intelligence;generative-adversarial-network;generative-models;image-manipulation","topic:artificial-intelligence language:Python stars:>=50"
"stanfordnlp/stanza","https://github.com/stanfordnlp/stanza","stanfordnlp","Python","7783","False","False","9/26/2017 8:00:56 AM","5/3/2026 1:48:04 PM","Stanford NLP Python library for tokenization, sentence segmentation, NER, and parsing of many human languages","artificial-intelligence;corenlp;deep-learning;machine-learning;named-entity-recognition;natural-language-processing;nlp;python;pytorch;universal-dependencies","topic:artificial-intelligence language:Python stars:>=50"
"hacksider/Deep-Live-Cam","https://github.com/hacksider/Deep-Live-Cam","hacksider","Python","92583","False","False","9/24/2023 1:19:31 PM","5/3/2026 6:47:46 PM","real time face swap and one-click video deepfake with only a single image","ai;ai-deep-fake;ai-face;ai-webcam;artificial-intelligence;deep-fake;deepfake;deepfake-webcam;faceswap;fake-webcam;gan;real-time-deepfake;realtime;realtime-deepfake;realtime-face-changer;video-deepfake;webcam;webcamera","topic:ai language:Python stars:>=50 | topic:artificial-intelligence language:Python stars:>=50"
"unclecode/crawl4ai","https://github.com/unclecode/crawl4ai","unclecode","Python","64948","False","False","5/9/2024 9:48:50 AM","5/3/2026 6:34:59 PM","🚀🤖 Crawl4AI: Open-source LLM Friendly Web Crawler & Scraper. Don't be shy, join here: https://discord.gg/jP8KfhDhyN","","open language:Python stars:>=50"
"usestrix/strix","https://github.com/usestrix/strix","usestrix","Python","24796","False","False","8/5/2025 9:28:30 PM","5/3/2026 6:27:51 PM","Open-source AI hackers to find and fix your app’s vulnerabilities.","agents;artificial-intelligence;cybersecurity;generative-ai;llm;penetration-testing","topic:artificial-intelligence language:Python stars:>=50 | open language:Python stars:>=50"
"JuliusBrussee/caveman","https://github.com/JuliusBrussee/caveman","JuliusBrussee","Python","52941","False","False","4/4/2026 10:03:00 AM","5/3/2026 7:08:24 PM","🪨 why use many token when few token do trick — Claude Code skill that cuts 65% of tokens by talking like caveman","ai;anthropic;caveman;claude;claude-code;llm;meme;prompt-engineering;skill;tokens","topic:ai language:Python stars:>=50"
"mlflow/mlflow","https://github.com/mlflow/mlflow","mlflow","Python","25702","False","False","6/5/2018 4:05:58 PM","5/3/2026 6:57:38 PM","The open source AI engineering platform for agents, LLMs, and ML models. MLflow enables teams of all sizes to debug, evaluate, monitor, and optimize production-quality AI applications while controlling costs and managing access to models and data.","agentops;agents;ai;ai-governance;apache-spark;evaluation;langchain;llm-evaluation;llmops;machine-learning;ml;mlflow;mlops;model-management;observability;open-source;openai;prompt-engineering","topic:ai language:Python stars:>=50 | open language:Python stars:>=50"
"1Panel-dev/MaxKB","https://github.com/1Panel-dev/MaxKB","1Panel-dev","Python","20872","False","False","9/14/2023 2:05:12 AM","5/3/2026 4:07:10 PM","🔥 MaxKB is an open-source platform for building enterprise-grade agents.  强大易用的开源企业级智能体平台。","agent;agentic-ai;chatbot;deepseek-r1;knowledgebase;langchain;llama3;llm;maxkb;mcp-server;ollama;pgvector;qwen3;rag","open language:Python stars:>=50"
"mlfoundations/open_clip","https://github.com/mlfoundations/open_clip","mlfoundations","Python","13764","False","False","7/28/2021 11:24:39 PM","5/3/2026 7:54:12 AM","An open source implementation of CLIP.","computer-vision;contrastive-loss;deep-learning;language-model;multi-modal-learning;pretrained-models;pytorch;zero-shot-classification","o language:Python stars:>=50"
"Asabeneh/30-Days-Of-Python","https://github.com/Asabeneh/30-Days-Of-Python","Asabeneh","Python","62000","False","False","11/19/2019 5:24:16 PM","5/3/2026 7:04:09 PM","The 30 Days of Python programming challenge is a step-by-step guide to learn the Python programming language in 30 days. This challenge may take more than 100 days. Follow your own pace. These videos may help too: https://www.youtube.com/channel/UC7PNRuno1rzYPb1xLa4yktw","30-days-of-python;data;data-science;database;flask;fullstack;github;heroku;matplotlib;ml;mongodb;numpy;pandas;python;python3","o language:Python stars:>=50"
"Datalux/Osintgram","https://github.com/Datalux/Osintgram","Datalux","Python","12738","False","False","6/7/2019 11:23:40 PM","5/3/2026 6:06:58 PM","Osintgram is a OSINT tool on Instagram. It offers an interactive shell to perform analysis on Instagram account of any users by its nickname","analysis;hacking;information-gathering;instagram;instagram-account;instagram-api;nickname;osint;osint-python;penetration-testing;python;python3;tool","o language:Python stars:>=50"
"guofei9987/scikit-opt","https://github.com/guofei9987/scikit-opt","guofei9987","Python","6529","False","False","12/5/2017 10:20:41 AM","5/3/2026 12:39:30 AM","Genetic Algorithm, Particle Swarm Optimization, Simulated Annealing, Ant Colony Optimization Algorithm,Immune Algorithm, Artificial Fish Swarm Algorithm, Differential Evolution and TSP(Traveling salesman) ","ant-colony-algorithm;artificial-intelligence;fish-swarms;genetic-algorithm;heuristic-algorithms;immune;immune-algorithm;optimization;particle-swarm-optimization;pso;simulated-annealing;travelling-salesman-problem;tsp","topic:artificial-intelligence language:Python stars:>=50"
"hpcaitech/Open-Sora","https://github.com/hpcaitech/Open-Sora","hpcaitech","Python","28927","False","False","2/20/2024 3:01:34 AM","5/3/2026 12:45:23 PM","Open-Sora: Democratizing Efficient Video Production for All","","open language:Python stars:>=50 | o language:Python stars:>=50"
