"AnchorRepo","AnchorUrl","CandidateRepo","CandidateUrl","CandidateOwner","CandidateLanguage","CandidateStars","CandidateSubdomain","Rank","Score","Qualified","TopicJaccard","LexicalJaccard","LanguageMatch","StarSimilarity","RecencySimilarity","SubdomainMatch","QueryCoverage","SourceQueries","Description"
"streamlit/streamlit","https://github.com/streamlit/streamlit","gradio-app/gradio","https://github.com/gradio-app/gradio","gradio-app","Python","42495","deep-learning","1","1260.81","True","0.375","0","1","0.9903","1","1","1","topic:data-analysis language:Python stars:>=50 | topic:data-science language:Python stars:>=50 | topic:data-visualization language:Python stars:>=50 | topic:deep-learning stars:>=100","Build and share delightful machine learning apps, all in Python. 🌟 Star to support our work!"
"streamlit/streamlit","https://github.com/streamlit/streamlit","Lightning-AI/pytorch-lightning","https://github.com/Lightning-AI/pytorch-lightning","Lightning-AI","Python","31104","deep-learning","2","1188.72","True","0.3636","0","1","0.9226","1","1","0.6667","topic:data-science language:Python stars:>=50 | topic:deep-learning stars:>=100","Pretrain, finetune ANY AI model of ANY size on 1 or 10,000+ GPUs with zero code changes."
"streamlit/streamlit","https://github.com/streamlit/streamlit","keras-team/keras","https://github.com/keras-team/keras","keras-team","Python","64057","deep-learning","3","1161.1","True","0.3333","0","1","0.9206","1","1","0.6667","topic:data-science language:Python stars:>=50 | topic:deep-learning stars:>=100","Deep Learning for humans"
"streamlit/streamlit","https://github.com/streamlit/streamlit","eriklindernoren/ML-From-Scratch","https://github.com/eriklindernoren/ML-From-Scratch","eriklindernoren","Python","31413","deep-learning","4","1136.82","True","0.25","0","1","0.9247","1","1","1","topic:data-science language:Python stars:>=50 | s language:Python stars:>=50 | topic:deep-learning stars:>=100","Machine Learning From Scratch. Bare bones NumPy implementations of machine learning models and algorithms with a focus on accessibility. Aims to cover everything from linear regression to deep learning."
"streamlit/streamlit","https://github.com/streamlit/streamlit","unit8co/darts","https://github.com/unit8co/darts","unit8co","Python","9355","deep-learning","5","1093.07","True","0.3636","0","1","0.6617","1","1","0.3333","topic:data-science language:Python stars:>=50","A python library for user-friendly forecasting and anomaly detection on time series."
"streamlit/streamlit","https://github.com/streamlit/streamlit","explosion/spaCy","https://github.com/explosion/spaCy","explosion","Python","33538","deep-learning","6","1085.74","True","0.1905","0","1","0.9389","1","1","1","topic:data-science language:Python stars:>=50 | s language:Python stars:>=50 | topic:deep-learning stars:>=100","💫 Industrial-strength Natural Language Processing (NLP) in Python"
"streamlit/streamlit","https://github.com/streamlit/streamlit","scikit-learn/scikit-learn","https://github.com/scikit-learn/scikit-learn","scikit-learn","Python","65966","data-science","7","1084.98","True","0.4444","0","1","0.9142","1","0","1","topic:data-analysis language:Python stars:>=50 | topic:data-science language:Python stars:>=50 | s language:Python stars:>=50","scikit-learn: machine learning in Python"
"streamlit/streamlit","https://github.com/streamlit/streamlit","Data-Centric-AI-Community/fg-data-profiling","https://github.com/Data-Centric-AI-Community/fg-data-profiling","Data-Centric-AI-Community","Python","13536","deep-learning","8","1025.49","True","0.2174","0","1","0.7419","1","1","0.6667","topic:data-analysis language:Python stars:>=50 | topic:data-science language:Python stars:>=50","1 Line of code data quality profiling & exploratory data analysis for Pandas and Spark DataFrames. "
"streamlit/streamlit","https://github.com/streamlit/streamlit","tflearn/tflearn","https://github.com/tflearn/tflearn","tflearn","Python","9589","deep-learning","9","1012.19","True","0.2727","0","1","0.6671","1","1","0.3333","topic:data-science language:Python stars:>=50","Deep learning library featuring a higher-level API for TensorFlow."
"streamlit/streamlit","https://github.com/streamlit/streamlit","d2l-ai/d2l-zh","https://github.com/d2l-ai/d2l-zh","d2l-ai","Python","77606","deep-learning","10","1011.5","True","0.2308","0","1","0.8789","1","1","0.3333","topic:deep-learning stars:>=100","《动手学深度学习》：面向中文读者、能运行、可讨论。中英文版被70多个国家的500多所大学用于教学。"
"streamlit/streamlit","https://github.com/streamlit/streamlit","reflex-dev/reflex","https://github.com/reflex-dev/reflex","reflex-dev","Python","28357","data-science","11","1004.36","True","0.3571","0","1","0.9025","1","0","1","topic:data-analysis language:Python stars:>=50 | topic:data-science language:Python stars:>=50 | topic:data-visualization language:Python stars:>=50","🕸️ Web apps in pure Python 🐍"
"streamlit/streamlit","https://github.com/streamlit/streamlit","pytorch/pytorch","https://github.com/pytorch/pytorch","pytorch","Python","99600","deep-learning","12","1002.02","True","0.2308","0","1","0.8247","1","1","0.3333","topic:deep-learning stars:>=100","Tensors and Dynamic neural networks in Python with strong GPU acceleration"
"streamlit/streamlit","https://github.com/streamlit/streamlit","voxel51/fiftyone","https://github.com/voxel51/fiftyone","voxel51","Python","10630","deep-learning","13","995.65","True","0.25","0","1","0.6894","1","1","0.3333","topic:data-science language:Python stars:>=50","Refine high-quality datasets and visual AI models"
"streamlit/streamlit","https://github.com/streamlit/streamlit","roboflow/supervision","https://github.com/roboflow/supervision","roboflow","Python","38299","deep-learning","14","981.86","True","0.125","0","1","0.9677","1","1","0.6667","s language:Python stars:>=50 | topic:deep-learning stars:>=100","We write your reusable computer vision tools. 💜"
"streamlit/streamlit","https://github.com/streamlit/streamlit","recommenders-team/recommenders","https://github.com/recommenders-team/recommenders","recommenders-team","Python","21665","deep-learning","15","969.13","True","0.1905","0","1","0.844","1","1","0.3333","topic:data-science language:Python stars:>=50","Best Practices on Recommendation Systems"
"streamlit/streamlit","https://github.com/streamlit/streamlit","deepspeedai/DeepSpeed","https://github.com/deepspeedai/DeepSpeed","deepspeedai","Python","42248","deep-learning","16","967.82","True","0.1053","0","1","0.9891","1","1","0.6667","s language:Python stars:>=50 | topic:deep-learning stars:>=100","DeepSpeed is a deep learning optimization library that makes distributed training and inference easy, efficient, and effective."
"streamlit/streamlit","https://github.com/streamlit/streamlit","rio-labs/rio","https://github.com/rio-labs/rio","rio-labs","Python","3392","data-science","17","967.64","True","0.4615","0","1","0.4414","1","0","0.6667","topic:data-analysis language:Python stars:>=50 | topic:data-visualization language:Python stars:>=50","WebApps in pure Python. No JavaScript, HTML and CSS needed"
"streamlit/streamlit","https://github.com/streamlit/streamlit","CorentinJ/Real-Time-Voice-Cloning","https://github.com/CorentinJ/Real-Time-Voice-Cloning","CorentinJ","Python","59711","deep-learning","18","963.77","True","0.1667","0","1","0.9358","1","1","0.3333","topic:deep-learning stars:>=100","Clone a voice in 5 seconds to generate arbitrary speech in real-time"
"streamlit/streamlit","https://github.com/streamlit/streamlit","NannyML/nannyml","https://github.com/NannyML/nannyml","NannyML","Python","2140","deep-learning","19","946.6","True","0.2632","0","1","0.3415","1","1","0.3333","topic:data-analysis language:Python stars:>=50","nannyml: post-deployment data science in python"
"streamlit/streamlit","https://github.com/streamlit/streamlit","JaidedAI/EasyOCR","https://github.com/JaidedAI/EasyOCR","JaidedAI","Python","29395","deep-learning","20","944.3","True","0.15","0","1","0.9103","1","1","0.3333","topic:deep-learning stars:>=100","Ready-to-use OCR with 80+ supported languages and all popular writing scripts including Latin, Chinese, Arabic, Devanagari, Cyrillic and etc."
"streamlit/streamlit","https://github.com/streamlit/streamlit","microsoft/qlib","https://github.com/microsoft/qlib","microsoft","Python","41915","deep-learning","21","940.18","True","0.1304","0","1","0.9873","1","1","0.3333","topic:deep-learning stars:>=100","Qlib is an AI-oriented Quant investment platform that aims to use AI tech to empower Quant Research, from exploring ideas to implementing productions. Qlib supports diverse ML modeling paradigms, including supervised learning, market dynamics modeling, and RL, and is now equipped with https://github.com/microsoft/RD-Agent to automate R&D process."
"streamlit/streamlit","https://github.com/streamlit/streamlit","scikit-learn-contrib/imbalanced-learn","https://github.com/scikit-learn-contrib/imbalanced-learn","scikit-learn-contrib","Python","7103","data-science","22","930.33","True","0.4444","0","1","0.6019","1","0","0.3333","topic:data-analysis language:Python stars:>=50"," A Python Package to Tackle the Curse of Imbalanced Datasets in Machine Learning"
"streamlit/streamlit","https://github.com/streamlit/streamlit","ultralytics/ultralytics","https://github.com/ultralytics/ultralytics","ultralytics","Python","56706","deep-learning","23","923.73","True","0.12","0","1","0.947","1","1","0.3333","topic:deep-learning stars:>=100","Ultralytics YOLO 🚀"
"streamlit/streamlit","https://github.com/streamlit/streamlit","piskvorky/gensim","https://github.com/piskvorky/gensim","piskvorky","Python","16405","deep-learning","24","922.14","True","0.15","0","1","0.7836","1","1","0.3333","topic:data-science language:Python stars:>=50","Topic Modelling for Humans"
"streamlit/streamlit","https://github.com/streamlit/streamlit","deezer/spleeter","https://github.com/deezer/spleeter","deezer","Python","28198","deep-learning","25","920.22","True","0.125","0","1","0.9013","1","1","0.3333","s language:Python stars:>=50","Deezer source separation library including pretrained models."
"streamlit/streamlit","https://github.com/streamlit/streamlit","autogluon/autogluon","https://github.com/autogluon/autogluon","autogluon","Python","10276","deep-learning","26","919.36","True","0.1667","0","1","0.6821","1","1","0.3333","topic:data-science language:Python stars:>=50","Fast and Accurate ML in 3 Lines of Code"
"streamlit/streamlit","https://github.com/streamlit/streamlit","ultralytics/yolov5","https://github.com/ultralytics/yolov5","ultralytics","Python","57330","deep-learning","27","910.05","True","0.1053","0","1","0.9447","1","1","0.3333","topic:deep-learning stars:>=100","YOLOv5 🚀 in PyTorch > ONNX > CoreML > TFLite"
"streamlit/streamlit","https://github.com/streamlit/streamlit","deepfakes/faceswap","https://github.com/deepfakes/faceswap","deepfakes","Python","55204","deep-learning","28","906.75","True","0.1","0","1","0.9529","1","1","0.3333","topic:deep-learning stars:>=100","Deepfakes Software For All"
"streamlit/streamlit","https://github.com/streamlit/streamlit","WenjieDu/PyPOTS","https://github.com/WenjieDu/PyPOTS","WenjieDu","Python","2005","deep-learning","29","896.75","False","0.2105","0","1","0.3273","1","1","0.3333","topic:data-analysis language:Python stars:>=50","A Python toolkit/library for reality-centric machine/deep learning & data mining on partially-observed time series, with 50+ SOTA neural network models for scientific analysis tasks (imputation, classification, clustering, forecasting, anomaly detection, cleaning) on incomplete industrial irregularly-sampled multivariate TS with NaN missing values"
"streamlit/streamlit","https://github.com/streamlit/streamlit","coqui-ai/TTS","https://github.com/coqui-ai/TTS","coqui-ai","Python","45211","deep-learning","30","896.34","False","0.08","0","1","0.9962","1","1","0.3333","topic:deep-learning stars:>=100","🐸💬 - a deep learning toolkit for Text-to-Speech, battle-tested in research and production"
"streamlit/streamlit","https://github.com/streamlit/streamlit","pandas-dev/pandas","https://github.com/pandas-dev/pandas","pandas-dev","Python","48651","data-science","0","892.01","False","0.2727","0","1","0.9803","1","0","0.6667","topic:data-analysis language:Python stars:>=50 | topic:data-science language:Python stars:>=50","Flexible and powerful data analysis / manipulation library for Python, providing labeled data structures similar to R data.frame objects, statistical functions, and much more"
"streamlit/streamlit","https://github.com/streamlit/streamlit","probabl-ai/skore","https://github.com/probabl-ai/skore","probabl-ai","Python","636","data-science","0","888.69","False","0.5","0","1","0.0782","1","0","0.3333","topic:data-visualization language:Python stars:>=50","Track your Data Science. Skore's open-source Python library accelerates ML model development with automated evaluation reports, smart methodological guidance, and comprehensive cross-validation analysis."
"streamlit/streamlit","https://github.com/streamlit/streamlit","babysor/MockingBird","https://github.com/babysor/MockingBird","babysor","Python","36901","deep-learning","0","887.17","False","0.0769","0","1","0.9597","1","1","0.3333","topic:deep-learning stars:>=100","🚀Clone a voice in 5 seconds to generate arbitrary speech in real-time"
"streamlit/streamlit","https://github.com/streamlit/streamlit","wandb/wandb","https://github.com/wandb/wandb","wandb","Python","11039","deep-learning","0","884.59","False","0.125","0","1","0.6976","1","1","0.3333","topic:data-science language:Python stars:>=50","The AI developer platform. Use Weights & Biases to train and fine-tune models, and manage models from experimentation to production."
"streamlit/streamlit","https://github.com/streamlit/streamlit","TencentARC/GFPGAN","https://github.com/TencentARC/GFPGAN","TencentARC","Python","37445","deep-learning","0","882.78","False","0.0714","0","1","0.9628","1","1","0.3333","topic:deep-learning stars:>=100","GFPGAN aims at developing Practical Algorithms for Real-world Face Restoration."
"streamlit/streamlit","https://github.com/streamlit/streamlit","yzhao062/pyod","https://github.com/yzhao062/pyod","yzhao062","Python","9836","deep-learning","0","880.2","False","0.125","0","1","0.6726","1","1","0.3333","topic:data-science language:Python stars:>=50","A Python library for anomaly detection across tabular, time series, graph, text, and image data. 60+ detectors, benchmark-backed ADEngine orchestration, and an agentic workflow for AI agents."
"streamlit/streamlit","https://github.com/streamlit/streamlit","mwaskom/seaborn","https://github.com/mwaskom/seaborn","mwaskom","Python","13837","data-science","0","875.67","False","0.3","0","1","0.7467","1","0","0.6667","topic:data-science language:Python stars:>=50 | topic:data-visualization language:Python stars:>=50","Statistical data visualization in Python"
"streamlit/streamlit","https://github.com/streamlit/streamlit","hpcaitech/ColossalAI","https://github.com/hpcaitech/ColossalAI","hpcaitech","Python","41375","deep-learning","0","869.66","False","0.0526","0","1","0.9845","1","1","0.3333","topic:deep-learning stars:>=100","Making large AI models cheaper, faster and more accessible"
"streamlit/streamlit","https://github.com/streamlit/streamlit","AUTOMATIC1111/stable-diffusion-webui","https://github.com/AUTOMATIC1111/stable-diffusion-webui","AUTOMATIC1111","Python","162703","deep-learning","0","864.81","False","0.0435","0","1","0.7182","1","1","0.6667","s language:Python stars:>=50 | topic:deep-learning stars:>=100","Stable Diffusion web UI"
"streamlit/streamlit","https://github.com/streamlit/streamlit","huggingface/diffusers","https://github.com/huggingface/diffusers","huggingface","Python","33529","deep-learning","0","855.21","False","0.0455","0","1","0.9389","1","1","0.3333","topic:deep-learning stars:>=100","🤗 Diffusers: State-of-the-art diffusion models for image, video, and audio generation in PyTorch."
"streamlit/streamlit","https://github.com/streamlit/streamlit","sepandhaghighi/pycm","https://github.com/sepandhaghighi/pycm","sepandhaghighi","Python","1500","deep-learning","0","846.26","False","0.1667","0","1","0.2643","1","1","0.3333","topic:data-analysis language:Python stars:>=50","Multi-class confusion matrix library in Python"
"streamlit/streamlit","https://github.com/streamlit/streamlit","nidhaloff/igel","https://github.com/nidhaloff/igel","nidhaloff","Python","3138","deep-learning","0","841.69","False","0.1304","0","1","0.4245","1","1","0.3333","topic:data-analysis language:Python stars:>=50","a delightful machine learning tool that allows you to train, test, and use models without writing code"
"streamlit/streamlit","https://github.com/streamlit/streamlit","ndleah/python-mini-project","https://github.com/ndleah/python-mini-project","ndleah","Python","4199","data-science","0","837.28","False","0.3077","0","1","0.4878","1","0","0.6667","topic:data-analysis language:Python stars:>=50 | topic:data-visualization language:Python stars:>=50","🙌 Welcome open-source Python mini-project contributions!"
"streamlit/streamlit","https://github.com/streamlit/streamlit","ResidentMario/missingno","https://github.com/ResidentMario/missingno","ResidentMario","Python","4204","data-science","0","830.41","False","0.3","0","1","0.488","1","0","0.6667","topic:data-analysis language:Python stars:>=50 | topic:data-visualization language:Python stars:>=50","Missing data visualization module for Python."
"streamlit/streamlit","https://github.com/streamlit/streamlit","fbdesignpro/sweetviz","https://github.com/fbdesignpro/sweetviz","fbdesignpro","Python","3096","data-science","0","830.03","False","0.3125","0","1","0.4216","1","0","0.6667","topic:data-analysis language:Python stars:>=50 | topic:data-visualization language:Python stars:>=50","Visualize and compare datasets, target values and associations, with one line of code."
"streamlit/streamlit","https://github.com/streamlit/streamlit","sinaptik-ai/pandas-ai","https://github.com/sinaptik-ai/pandas-ai","sinaptik-ai","Python","23500","llm","0","825.8","False","0.1667","0","1","0.8617","1","0","1","topic:data-analysis language:Python stars:>=50 | topic:data-science language:Python stars:>=50 | topic:data-visualization language:Python stars:>=50","Chat with your database or your datalake (SQL, CSV, parquet). PandasAI makes data analysis conversational using LLMs and RAG."
"streamlit/streamlit","https://github.com/streamlit/streamlit","matplotlib/matplotlib","https://github.com/matplotlib/matplotlib","matplotlib","Python","22764","data-science","0","817.44","False","0.2143","0","1","0.8548","1","0","0.6667","topic:data-science language:Python stars:>=50 | topic:data-visualization language:Python stars:>=50","matplotlib: plotting with Python"
"streamlit/streamlit","https://github.com/streamlit/streamlit","predict-idlab/plotly-resampler","https://github.com/predict-idlab/plotly-resampler","predict-idlab","Python","1196","data-science","0","812.66","False","0.3333","0","1","0.2152","1","0","0.6667","topic:data-analysis language:Python stars:>=50 | topic:data-visualization language:Python stars:>=50","Visualize large time series data with plotly.py"
"streamlit/streamlit","https://github.com/streamlit/streamlit","python-visualization/folium","https://github.com/python-visualization/folium","python-visualization","Python","7362","data-science","0","801.69","False","0.3","0","1","0.6097","1","0","0.3333","topic:data-visualization language:Python stars:>=50","Python Data. Leaflet.js Maps. "
"streamlit/streamlit","https://github.com/streamlit/streamlit","ray-project/ray","https://github.com/ray-project/ray","ray-project","Python","42411","llm","0","798.23","False","0.1667","0","1","0.9899","1","0","0.6667","topic:data-science language:Python stars:>=50 | topic:deep-learning stars:>=100","Ray is an AI compute engine. Ray consists of a core distributed runtime and a set of AI Libraries for accelerating ML workloads."
"streamlit/streamlit","https://github.com/streamlit/streamlit","openai/CLIP","https://github.com/openai/CLIP","openai","Jupyter Notebook","33391","deep-learning","0","789.14","False","0.25","0","0","0.938","1","1","0.3333","topic:deep-learning stars:>=100","CLIP (Contrastive Language-Image Pretraining),  Predict the most relevant text snippet given an image"
"streamlit/streamlit","https://github.com/streamlit/streamlit","treeverse/dvc","https://github.com/treeverse/dvc","treeverse","Python","15576","mlops","0","785.17","False","0.25","0","1","0.7724","1","0","0.3333","topic:data-science language:Python stars:>=50","🦉 Data Versioning and ML Experiments"
"streamlit/streamlit","https://github.com/streamlit/streamlit","ashishpatel26/500-AI-Machine-learning-Deep-learning-Computer-vision-NLP-Projects-with-code","https://github.com/ashishpatel26/500-AI-Machine-learning-Deep-learning-Computer-vision-NLP-Projects-with-code","ashishpatel26","","33413","deep-learning","0","775.93","False","0.2353","0","0","0.9381","1","1","0.3333","topic:deep-learning stars:>=100","500 AI Machine learning Deep learning Computer vision NLP Projects with code"
"streamlit/streamlit","https://github.com/streamlit/streamlit","ageitgey/face_recognition","https://github.com/ageitgey/face_recognition","ageitgey","Python","56368","computer-vision","0","770.96","False","0.2","0","1","0.9483","1","0","0.3333","s language:Python stars:>=50","The world's simplest facial recognition api for Python and the command line"
"streamlit/streamlit","https://github.com/streamlit/streamlit","BVLC/caffe","https://github.com/BVLC/caffe","BVLC","C++","34624","deep-learning","0","765.52","False","0.2222","0","0","0.9458","1","1","0.3333","topic:deep-learning stars:>=100","Caffe: a fast open framework for deep learning."
"streamlit/streamlit","https://github.com/streamlit/streamlit","statsmodels/statsmodels","https://github.com/statsmodels/statsmodels","statsmodels","Python","11391","data-science","0","748.28","False","0.1667","0","1","0.7044","1","0","0.6667","topic:data-analysis language:Python stars:>=50 | topic:data-science language:Python stars:>=50","Statsmodels: statistical modeling and econometrics in Python"
"streamlit/streamlit","https://github.com/streamlit/streamlit","plotly/dash","https://github.com/plotly/dash","plotly","Python","24170","data-science","0","744.26","False","0.1304","0","1","0.8678","1","0","0.6667","topic:data-science language:Python stars:>=50 | topic:data-visualization language:Python stars:>=50","Data Apps & Dashboards for Python. No JavaScript Required."
"streamlit/streamlit","https://github.com/streamlit/streamlit","dfm/corner.py","https://github.com/dfm/corner.py","dfm","Python","570","data-science","0","734.53","False","0.3333","0","1","0.0545","1","0","0.3333","topic:data-visualization language:Python stars:>=50","Make some beautiful corner plots"
"streamlit/streamlit","https://github.com/streamlit/streamlit","tensorflow/tensorflow","https://github.com/tensorflow/tensorflow","tensorflow","C++","194980","deep-learning","0","726.49","False","0.2308","0","0","0.6789","1","1","0.3333","topic:deep-learning stars:>=100","An Open Source Machine Learning Framework for Everyone"
"streamlit/streamlit","https://github.com/streamlit/streamlit","tatsu-lab/stanford_alpaca","https://github.com/tatsu-lab/stanford_alpaca","tatsu-lab","Python","30257","llm","0","725.4","False","0.1","0","1","0.9166","1","0","0.6667","s language:Python stars:>=50 | topic:deep-learning stars:>=100","Code and documentation to train Stanford's Alpaca models, and generate the data."
"streamlit/streamlit","https://github.com/streamlit/streamlit","ZuzooVn/machine-learning-for-software-engineers","https://github.com/ZuzooVn/machine-learning-for-software-engineers","ZuzooVn","","28760","deep-learning","0","722.11","False","0.1818","0","0","0.9055","1","1","0.3333","topic:deep-learning stars:>=100","A complete daily plan for studying to become a machine learning engineer."
"streamlit/streamlit","https://github.com/streamlit/streamlit","datajuicer/data-juicer","https://github.com/datajuicer/data-juicer","datajuicer","Python","6365","llm","0","718.27","False","0.1579","0","1","0.5781","1","0","0.6667","topic:data-analysis language:Python stars:>=50 | topic:data-visualization language:Python stars:>=50","Data processing for and with foundation models!  🍎 🍋 🌽 ➡️ ➡️🍸 🍹 🍷"
"streamlit/streamlit","https://github.com/streamlit/streamlit","ruc-datalab/DeepAnalyze","https://github.com/ruc-datalab/DeepAnalyze","ruc-datalab","Python","4109","llm","0","709.54","False","0.1667","0","1","0.4831","1","0","0.6667","topic:data-analysis language:Python stars:>=50 | topic:data-visualization language:Python stars:>=50","DeepAnalyze is the first agentic LLM for autonomous data science. 🎈你的AI数据分析师，自动分析大量数据，一键生成专业分析报告！"
"streamlit/streamlit","https://github.com/streamlit/streamlit","apache/airflow","https://github.com/apache/airflow","apache","Python","45272","mlops","0","707.29","False","0.12","0","1","0.9959","1","0","0.3333","topic:data-science language:Python stars:>=50","Apache Airflow - A platform to programmatically author, schedule, and monitor workflows"
"streamlit/streamlit","https://github.com/streamlit/streamlit","vaexio/vaex","https://github.com/vaexio/vaex","vaexio","Python","8503","data-science","0","705.92","False","0.1875","0","1","0.641","1","0","0.3333","topic:data-science language:Python stars:>=50","Out-of-Core hybrid Apache Arrow/NumPy DataFrame for Python, ML, visualization and exploration of big tabular data at a billion rows per second 🚀"
