"AnchorRepo","AnchorUrl","CandidateRepo","CandidateUrl","CandidateOwner","CandidateLanguage","CandidateStars","CandidateSubdomain","Rank","Score","Qualified","TopicJaccard","LexicalJaccard","LanguageMatch","StarSimilarity","RecencySimilarity","SubdomainMatch","QueryCoverage","SourceQueries","Description"
"streamlit/streamlit","https://github.com/streamlit/streamlit","deepakpadhi986/AI-Resume-Analyzer","https://github.com/deepakpadhi986/AI-Resume-Analyzer","deepakpadhi986","Python","846","editor","0","490.42","False","0.0455","0","1","0.1401","1","0","0.3333","streamlit language:Python stars:>=50","Ai Resume Analyzer is a tool which parses information from a resume using natural language processing and finds the keywords, cluster them onto sectors based on their keywords. And lastly show recommendations, predictions, analytics to the applicant based on keyword matching."
"streamlit/streamlit","https://github.com/streamlit/streamlit","kaarthik108/snowChat","https://github.com/kaarthik108/snowChat","kaarthik108","Python","553","llm","0","489.63","False","0.0625","0","1","0.0479","1","0","0.3333","streamlit language:Python stars:>=50","Chat snowflake - Text to SQL"
"streamlit/streamlit","https://github.com/streamlit/streamlit","JohnSnowLabs/nlu","https://github.com/JohnSnowLabs/nlu","JohnSnowLabs","Python","963","llm","0","487.77","False","0.037","0","1","0.1682","1","0","0.3333","streamlit language:Python stars:>=50","1 line for thousands of State of The Art NLP models in hundreds of languages  The fastest and most accurate way to solve text problems."
"streamlit/streamlit","https://github.com/streamlit/streamlit","augurlabs/augur","https://github.com/augurlabs/augur","augurlabs","Python","695","","0","475.39","False","0.037","0","1","0.0975","1","0","0.3333","topic:data-visualization language:Python stars:>=50","Python library and web service for Open Source Software Health and Sustainability metrics & data collection. You can find our documentation and new contributor information easily here: https://oss-augur.readthedocs.io/en/main/   "
"streamlit/streamlit","https://github.com/streamlit/streamlit","peterw/Chat-with-Github-Repo","https://github.com/peterw/Chat-with-Github-Repo","peterw","Python","1146","llm","0","461.04","False","0","0","1","0.2059","1","0","0.3333","streamlit language:Python stars:>=50","This repository contains two Python scripts that demonstrate how to create a chatbot using Streamlit, OpenAI GPT-3.5-turbo, and Activeloop's Deep Lake."
"streamlit/streamlit","https://github.com/streamlit/streamlit","cirediatpl/FigmaChain","https://github.com/cirediatpl/FigmaChain","cirediatpl","Python","977","llm","0","454.98","False","0","0","1","0.1713","1","0","0.3333","streamlit language:Python stars:>=50","FigmaChain is a set of Python scripts that generate HTML/CSS code based on Figma designs. Using OpenAI's GPT-3 model, FigmaChain enables developers to quickly generate HTML/CSS code from a Figma design input. It also includes a Streamlit-based chatbot interface for interactive code generation."
"streamlit/streamlit","https://github.com/streamlit/streamlit","rasbt/LLMs-from-scratch","https://github.com/rasbt/LLMs-from-scratch","rasbt","Jupyter Notebook","91864","llm","0","450.97","False","0.1429","0","0","0.8423","1","0","0.3333","topic:deep-learning stars:>=100","Implement a ChatGPT-like LLM in PyTorch from scratch, step by step"
"streamlit/streamlit","https://github.com/streamlit/streamlit","braincrew-lab/langgraph-mcp-agents","https://github.com/braincrew-lab/langgraph-mcp-agents","braincrew-lab","Python","700","reinforcement","0","442.33","False","0","0","1","0.099","1","0","0.3333","streamlit language:Python stars:>=50","LangGraph-powered ReAct agent with Model Context Protocol (MCP) integration. A Streamlit web interface for dynamically configuring, deploying, and interacting with AI agents capable of accessing various data sources and APIs through MCP tools."
"streamlit/streamlit","https://github.com/streamlit/streamlit","z3z1ma/dbt-osmosis","https://github.com/z3z1ma/dbt-osmosis","z3z1ma","Python","624","editor","0","437.97","False","0","0","1","0.0741","1","0","0.3333","streamlit language:Python stars:>=50","Provides automated YAML management and a streamlit workbench. Designed to optimize dev workflows."
"streamlit/streamlit","https://github.com/streamlit/streamlit","daniellewisDL/streamlit-cheat-sheet","https://github.com/daniellewisDL/streamlit-cheat-sheet","daniellewisDL","Python","584","","0","435.45","False","0","0","1","0.0597","1","0","0.3333","streamlit language:Python stars:>=50","A cheat sheet for streamlit"
"streamlit/streamlit","https://github.com/streamlit/streamlit","tvst/st-annotated-text","https://github.com/tvst/st-annotated-text","tvst","Python","570","","0","434.53","False","0","0","1","0.0545","1","0","0.3333","streamlit language:Python stars:>=50","A simple component to display annotated text in Streamlit apps."
"streamlit/streamlit","https://github.com/streamlit/streamlit","Mohamed-512/Extra-Streamlit-Components","https://github.com/Mohamed-512/Extra-Streamlit-Components","Mohamed-512","Python","563","","0","434.06","False","0","0","1","0.0518","1","0","0.3333","streamlit language:Python stars:>=50","An all in one place, to find complex or just not available components by default on streamlit."
"streamlit/streamlit","https://github.com/streamlit/streamlit","blackary/st_pages","https://github.com/blackary/st_pages","blackary","Python","525","mlops","0","406.41","False","0","0","1","0.0366","0.8","0","0.3333","streamlit language:Python stars:>=50","An experimental version of Streamlit Multi-Page Apps"
