"AnchorRepo","AnchorUrl","CandidateRepo","CandidateUrl","CandidateOwner","CandidateLanguage","CandidateStars","CandidateSubdomain","Rank","Score","Qualified","TopicJaccard","LexicalJaccard","LanguageMatch","StarSimilarity","RecencySimilarity","SubdomainMatch","QueryCoverage","SourceQueries","Description"
"streamlit/streamlit","https://github.com/streamlit/streamlit","ContextLab/hypertools","https://github.com/ContextLab/hypertools","ContextLab","Python","1884","","0","608.49","False","0.1429","0","1","0.3138","1","0","0.3333","topic:data-visualization language:Python stars:>=50","A Python toolbox for gaining geometric insights into high-dimensional data"
"streamlit/streamlit","https://github.com/streamlit/streamlit","K-Dense-AI/scientific-agent-skills","https://github.com/K-Dense-AI/scientific-agent-skills","K-Dense-AI","Python","19998","data-science","0","607.16","False","0.0417","0","1","0.8267","1","0","0.3333","topic:data-analysis language:Python stars:>=50","A set of ready to use Agent Skills for research, science, engineering, analysis, finance and writing."
"streamlit/streamlit","https://github.com/streamlit/streamlit","JoshuaC215/agent-service-toolkit","https://github.com/JoshuaC215/agent-service-toolkit","JoshuaC215","Python","4225","reinforcement","0","600.59","False","0.1","0","1","0.4891","1","0","0.3333","streamlit language:Python stars:>=50","Full toolkit for running an AI agent service built with LangGraph, FastAPI and Streamlit"
"streamlit/streamlit","https://github.com/streamlit/streamlit","SimplifyJobs/Summer2026-Internships","https://github.com/SimplifyJobs/Summer2026-Internships","SimplifyJobs","Python","44410","","0","599.98","False","0","0","1","0.9999","1","0","0.3333","s language:Python stars:>=50","Collection of Summer 2026 tech internships!"
"streamlit/streamlit","https://github.com/streamlit/streamlit","secretflow/secretflow","https://github.com/secretflow/secretflow","secretflow","Python","2656","mlops","0","598.84","False","0.1176","0","1","0.3883","1","0","0.3333","topic:data-analysis language:Python stars:>=50","A unified framework for privacy-preserving data analysis and machine learning"
"streamlit/streamlit","https://github.com/streamlit/streamlit","opengeos/streamlit-geospatial","https://github.com/opengeos/streamlit-geospatial","opengeos","Python","1019","data-science","0","598.68","False","0.1579","0","1","0.1804","1","0","0.3333","streamlit language:Python stars:>=50","A multi-page streamlit app for geospatial"
"streamlit/streamlit","https://github.com/streamlit/streamlit","minimaxir/big-list-of-naughty-strings","https://github.com/minimaxir/big-list-of-naughty-strings","minimaxir","Python","47631","","0","597.36","False","0","0","1","0.9849","1","0","0.3333","s language:Python stars:>=50","The Big List of Naughty Strings is a list of strings which have a high probability of causing issues when used as user-input data."
"streamlit/streamlit","https://github.com/streamlit/streamlit","chubin/cheat.sh","https://github.com/chubin/cheat.sh","chubin","Python","41319","reinforcement","0","597.24","False","0","0","1","0.9842","1","0","0.3333","s language:Python stars:>=50","the only cheat sheet you need"
"streamlit/streamlit","https://github.com/streamlit/streamlit","whitphx/streamlit-webrtc","https://github.com/whitphx/streamlit-webrtc","whitphx","Python","1701","computer-vision","0","596.03","False","0.1333","0","1","0.2916","1","0","0.3333","streamlit language:Python stars:>=50","Real-time video and audio processing on Streamlit"
"streamlit/streamlit","https://github.com/streamlit/streamlit","RVC-Boss/GPT-SoVITS","https://github.com/RVC-Boss/GPT-SoVITS","RVC-Boss","Python","57146","","0","590.44","False","0","0","1","0.9454","1","0","0.3333","s language:Python stars:>=50","1 min voice data can also be used to train a good TTS model! (few shot voice cloning)"
"streamlit/streamlit","https://github.com/streamlit/streamlit","pydata/pandas-datareader","https://github.com/pydata/pandas-datareader","pydata","Python","3194","editor","0","589.97","False","0.1","0","1","0.4284","1","0","0.3333","topic:data-analysis language:Python stars:>=50","Extract data from a wide range of Internet sources into a pandas DataFrame."
"streamlit/streamlit","https://github.com/streamlit/streamlit","ZhuLinsen/daily_stock_analysis","https://github.com/ZhuLinsen/daily_stock_analysis","ZhuLinsen","Python","33845","llm","0","589.66","False","0","0","1","0.9409","1","0","0.3333","s language:Python stars:>=50","LLM驱动的 A/H/美股智能分析器：多数据源行情 + 实时新闻 + LLM决策仪表盘 + 多渠道推送，零成本定时运行，纯白嫖. LLM-powered stock analysis system for A/H/US markets."
"streamlit/streamlit","https://github.com/streamlit/streamlit","shadowsocks/shadowsocks","https://github.com/shadowsocks/shadowsocks","shadowsocks","Python","33592","","0","589.37","False","0","0","1","0.9393","1","0","0.3333","s language:Python stars:>=50",""
"streamlit/streamlit","https://github.com/streamlit/streamlit","fishaudio/fish-speech","https://github.com/fishaudio/fish-speech","fishaudio","Python","30055","llm","0","585.14","False","0","0","1","0.9151","1","0","0.3333","s language:Python stars:>=50","SOTA Open Source TTS"
"streamlit/streamlit","https://github.com/streamlit/streamlit","hi-primus/optimus","https://github.com/hi-primus/optimus","hi-primus","Python","1534","data-science","0","584.61","False","0.125","0","1","0.2692","1","0","0.3333","topic:data-analysis language:Python stars:>=50",":truck: Agile Data Preparation Workflows made easy with Pandas, Dask, cuDF, Dask-cuDF, Vaex and PySpark"
"streamlit/streamlit","https://github.com/streamlit/streamlit","SpiderClub/weibospider","https://github.com/SpiderClub/weibospider","SpiderClub","Python","4791","editor","0","584.6","False","0.0769","0","1","0.5164","1","0","0.3333","topic:data-analysis language:Python stars:>=50",":zap: A distributed crawler for weibo, building with celery and requests."
"streamlit/streamlit","https://github.com/streamlit/streamlit","hpcaitech/Open-Sora","https://github.com/hpcaitech/Open-Sora","hpcaitech","Python","28927","computer-vision","0","583.69","False","0","0","1","0.9068","1","0","0.3333","s language:Python stars:>=50","Open-Sora: Democratizing Efficient Video Production for All"
"streamlit/streamlit","https://github.com/streamlit/streamlit","Ebazhanov/linkedin-skill-assessments-quizzes","https://github.com/Ebazhanov/linkedin-skill-assessments-quizzes","Ebazhanov","Python","28730","","0","583.43","False","0","0","1","0.9053","1","0","0.3333","s language:Python stars:>=50","Full reference of LinkedIn answers 2024 for skill assessments (aws-lambda, rest-api, javascript, react, git, html, jquery, mongodb, java, Go, python, machine-learning, power-point) linkedin excel test lösungen, linkedin machine learning test LinkedIn test questions and answers "
"streamlit/streamlit","https://github.com/streamlit/streamlit","run-llama/rags","https://github.com/run-llama/rags","run-llama","Python","6531","llm","0","583.39","False","0.0625","0","1","0.5837","1","0","0.3333","streamlit language:Python stars:>=50","Build ChatGPT over your data, all with natural language"
"streamlit/streamlit","https://github.com/streamlit/streamlit","stanford-oval/storm","https://github.com/stanford-oval/storm","stanford-oval","Python","28156","llm","0","582.66","False","0","0","1","0.9009","1","0","0.3333","s language:Python stars:>=50","An LLM-powered knowledge curation system that researches a topic and generates a full-length report with citations."
"streamlit/streamlit","https://github.com/streamlit/streamlit","great-expectations/great_expectations","https://github.com/great-expectations/great_expectations","great-expectations","Python","11456","mlops","0","581.83","False","0.037","0","1","0.7057","1","0","0.3333","topic:data-science language:Python stars:>=50","Always know what to expect from your data."
"streamlit/streamlit","https://github.com/streamlit/streamlit","huggingface/smolagents","https://github.com/huggingface/smolagents","huggingface","Python","27059","reinforcement","0","581.15","False","0","0","1","0.8923","1","0","0.3333","s language:Python stars:>=50","🤗 smolagents: a barebones library for agents that think in code."
"streamlit/streamlit","https://github.com/streamlit/streamlit","sgl-project/sglang","https://github.com/sgl-project/sglang","sgl-project","Python","27001","llm","0","581.07","False","0","0","1","0.8918","1","0","0.3333","s language:Python stars:>=50","SGLang is a high-performance serving framework for large language models and multimodal models."
"streamlit/streamlit","https://github.com/streamlit/streamlit","nextlevelbuilder/ui-ux-pro-max-skill","https://github.com/nextlevelbuilder/ui-ux-pro-max-skill","nextlevelbuilder","Python","73551","editor","0","580.85","False","0","0","1","0.8906","1","0","0.3333","s language:Python stars:>=50","An AI SKILL that provide design intelligence for building professional UI/UX multiple platforms"
"streamlit/streamlit","https://github.com/streamlit/streamlit","Fosowl/agenticSeek","https://github.com/Fosowl/agenticSeek","Fosowl","Python","26184","llm","0","579.91","False","0","0","1","0.8852","1","0","0.3333","s language:Python stars:>=50","Fully Local Manus AI. No APIs, No $200 monthly bills. Enjoy an autonomous agent that thinks, browses the web, and code for the sole cost of electricity. 🔔 Official updates only via twitter @Martin993886460 (Beware of fake account)"
"streamlit/streamlit","https://github.com/streamlit/streamlit","lgienapp/aquarel","https://github.com/lgienapp/aquarel","lgienapp","Python","860","data-science","0","578.71","False","0.1429","0","1","0.1436","1","0","0.3333","topic:data-visualization language:Python stars:>=50","Styling matplotlib made easy"
"streamlit/streamlit","https://github.com/streamlit/streamlit","usestrix/strix","https://github.com/usestrix/strix","usestrix","Python","24796","llm","0","577.84","False","0","0","1","0.8733","1","0","0.3333","s language:Python stars:>=50","Open-source AI hackers to find and fix your app’s vulnerabilities."
"streamlit/streamlit","https://github.com/streamlit/streamlit","mvanhorn/last30days-skill","https://github.com/mvanhorn/last30days-skill","mvanhorn","Python","24651","llm","0","577.61","False","0","0","1","0.8721","1","0","0.3333","s language:Python stars:>=50","AI agent skill that researches any topic across Reddit, X, YouTube, HN, Polymarket, and the web - then synthesizes a grounded summary"
"streamlit/streamlit","https://github.com/streamlit/streamlit","oraios/serena","https://github.com/oraios/serena","oraios","Python","23773","editor","0","576.23","False","0","0","1","0.8642","1","0","0.3333","s language:Python stars:>=50","A powerful MCP toolkit for coding, providing semantic retrieval and editing capabilities  - the IDE for your agent"
"streamlit/streamlit","https://github.com/streamlit/streamlit","yuka-friends/Windrecorder","https://github.com/yuka-friends/Windrecorder","yuka-friends","Python","3832","computer-vision","0","576.12","False","0.0769","0","1","0.4679","1","0","0.3333","streamlit language:Python stars:>=50","Windrecorder is a memory search app by records everything on your screen in small size, to let you rewind what you have seen, query through OCR text or image description, and get activity statistics, like Microsoft's Windows Recall or Rewind."
"streamlit/streamlit","https://github.com/streamlit/streamlit","redis-developer/ArXivChatGuru","https://github.com/redis-developer/ArXivChatGuru","redis-developer","Python","561","llm","0","576.03","False","0.1579","0","1","0.051","1","0","0.3333","streamlit language:Python stars:>=50","Use ArXiv ChatGuru to talk to research papers. This app uses LangChain, OpenAI, Streamlit, and Redis as a vector database/semantic cache."
"streamlit/streamlit","https://github.com/streamlit/streamlit","ScrapeGraphAI/Scrapegraph-ai","https://github.com/ScrapeGraphAI/Scrapegraph-ai","ScrapeGraphAI","Python","23444","llm","0","575.71","False","0","0","1","0.8612","1","0","0.3333","s language:Python stars:>=50","Python scraper based on AI"
"streamlit/streamlit","https://github.com/streamlit/streamlit","deepseek-ai/DeepSeek-Coder","https://github.com/deepseek-ai/DeepSeek-Coder","deepseek-ai","Python","23229","","0","575.36","False","0","0","1","0.8592","1","0","0.3333","s language:Python stars:>=50","DeepSeek Coder: Let the Code Write Itself"
"streamlit/streamlit","https://github.com/streamlit/streamlit","gyli/PyWaffle","https://github.com/gyli/PyWaffle","gyli","Python","602","","0","575.07","False","0.1538","0","1","0.0663","1","0","0.3333","topic:data-visualization language:Python stars:>=50","🧇 Make Waffle Charts in Python."
"streamlit/streamlit","https://github.com/streamlit/streamlit","deepseek-ai/DeepSeek-OCR","https://github.com/deepseek-ai/DeepSeek-OCR","deepseek-ai","Python","23038","","0","575.04","False","0","0","1","0.8574","1","0","0.3333","s language:Python stars:>=50","Contexts Optical Compression"
"streamlit/streamlit","https://github.com/streamlit/streamlit","CubicZebra/informatics","https://github.com/CubicZebra/informatics","CubicZebra","Python","585","llm","0","573.98","False","0.1538","0","1","0.0601","1","0","0.3333","topic:data-visualization language:Python stars:>=50","Framework of fast implementation data processing and operating pipelines"
"streamlit/streamlit","https://github.com/streamlit/streamlit","ARM-DOE/pyart","https://github.com/ARM-DOE/pyart","ARM-DOE","Python","582","","0","573.78","False","0.1538","0","1","0.059","1","0","0.3333","topic:data-visualization language:Python stars:>=50","The Python-ARM Radar Toolkit. A data model driven interactive toolkit for working with weather radar data. "
"streamlit/streamlit","https://github.com/streamlit/streamlit","github/spec-kit","https://github.com/github/spec-kit","github","Python","92303","","0","572.22","False","0","0","1","0.8412","1","0","0.3333","s language:Python stars:>=50","💫 Toolkit to help you get started with Spec-Driven Development"
"streamlit/streamlit","https://github.com/streamlit/streamlit","bellingcat/octosuite","https://github.com/bellingcat/octosuite","bellingcat","Python","1892","data-science","0","570.08","False","0.1","0","1","0.3147","1","0","0.3333","topic:data-analysis language:Python stars:>=50","Terminal-based toolkit for GitHub data analysis."
"streamlit/streamlit","https://github.com/streamlit/streamlit","scikit-tda/kepler-mapper","https://github.com/scikit-tda/kepler-mapper","scikit-tda","Python","652","data-science","0","568.2","False","0.1429","0","1","0.0836","1","0","0.3333","topic:data-visualization language:Python stars:>=50","Kepler Mapper: A flexible Python implementation of the Mapper algorithm."
"streamlit/streamlit","https://github.com/streamlit/streamlit","deepseek-ai/DeepSeek-V3","https://github.com/deepseek-ai/DeepSeek-V3","deepseek-ai","Python","103362","","0","567.92","False","0","0","1","0.8167","1","0","0.3333","s language:Python stars:>=50",""
"streamlit/streamlit","https://github.com/streamlit/streamlit","randyzwitch/streamlit-folium","https://github.com/randyzwitch/streamlit-folium","randyzwitch","Python","583","","0","563.96","False","0.1429","0","1","0.0594","1","0","0.3333","streamlit language:Python stars:>=50","Streamlit Component for rendering Folium maps"
"streamlit/streamlit","https://github.com/streamlit/streamlit","retentioneering/retentioneering-tools","https://github.com/retentioneering/retentioneering-tools","retentioneering","Python","883","computer-vision","0","563.64","False","0.125","0","1","0.1494","1","0","0.3333","topic:data-visualization language:Python stars:>=50","Retentioneering: product analytics, data-driven CJM optimization, marketing analytics, web analytics, transaction analytics, graph visualization, process mining, and behavioral segmentation in Python. Predictive analytics over clickstream, AB tests, machine learning, and Markov Chain simulations."
"streamlit/streamlit","https://github.com/streamlit/streamlit","JosephLai241/URS","https://github.com/JosephLai241/URS","JosephLai241","Python","989","data-science","0","563.44","False","0.12","0","1","0.174","1","0","0.3333","topic:data-analysis language:Python stars:>=50","Universal Reddit Scraper - A comprehensive Reddit scraping/archival command-line tool."
"streamlit/streamlit","https://github.com/streamlit/streamlit","anthropics/skills","https://github.com/anthropics/skills","anthropics","Python","127639","reinforcement","0","559.9","False","0","0","1","0.7709","1","0","0.3333","s language:Python stars:>=50","Public repository for Agent Skills"
"streamlit/streamlit","https://github.com/streamlit/streamlit","GokuMohandas/Made-With-ML","https://github.com/GokuMohandas/Made-With-ML","GokuMohandas","Jupyter Notebook","47486","llm","0","559.24","False","0.2353","0","0","0.9856","1","0","0.3333","topic:deep-learning stars:>=100","Learn how to develop, deploy and iterate on production-grade ML applications."
"streamlit/streamlit","https://github.com/streamlit/streamlit","electricitymaps/electricitymaps-contrib","https://github.com/electricitymaps/electricitymaps-contrib","electricitymaps","Python","3982","reinforcement","0","558.34","False","0.0556","0","1","0.4763","1","0","0.3333","topic:data-visualization language:Python stars:>=50","The open source repository for Electricity Maps data parsers that powers the world's most comprehensive electricity data platform"
"streamlit/streamlit","https://github.com/streamlit/streamlit","dot-agent/nextpy","https://github.com/dot-agent/nextpy","dot-agent","Python","2336","llm","0","557.31","False","0.0769","0","1","0.3605","1","0","0.3333","streamlit language:Python stars:>=50","🤖Self-Modifying Framework from the Future 🔮 World's First AMS"
"streamlit/streamlit","https://github.com/streamlit/streamlit","chrieke/prettymapp","https://github.com/chrieke/prettymapp","chrieke","Python","2751","","0","554.29","False","0.0667","0","1","0.396","1","0","0.3333","streamlit language:Python stars:>=50","🖼️ Create beautiful maps from OpenStreetMap data in a streamlit webapp"
"streamlit/streamlit","https://github.com/streamlit/streamlit","melih-unsal/DemoGPT","https://github.com/melih-unsal/DemoGPT","melih-unsal","Python","1895","llm","0","549.37","False","0.0769","0","1","0.3151","1","0","0.3333","streamlit language:Python stars:>=50","🤖 Everything you need to create an LLM Agent—tools, prompts, frameworks, and models—all in one place."
"streamlit/streamlit","https://github.com/streamlit/streamlit","moshi4/pyCirclize","https://github.com/moshi4/pyCirclize","moshi4","Python","1074","","0","548.57","False","0.1","0","1","0.1919","1","0","0.3333","topic:data-visualization language:Python stars:>=50","Circular visualization in Python (Circos Plot, Chord Diagram, Radar Chart)"
"streamlit/streamlit","https://github.com/streamlit/streamlit","lukasmasuch/streamlit-pydantic","https://github.com/lukasmasuch/streamlit-pydantic","lukasmasuch","Python","592","","0","548.47","False","0.125","0","1","0.0627","1","0","0.3333","streamlit language:Python stars:>=50","🪄 Auto-generate Streamlit UI from Pydantic Models and Dataclasses."
"streamlit/streamlit","https://github.com/streamlit/streamlit","PablocFonseca/streamlit-aggrid","https://github.com/PablocFonseca/streamlit-aggrid","PablocFonseca","Python","1293","","0","547.44","False","0.0909","0","1","0.2321","1","0","0.3333","streamlit language:Python stars:>=50","Implementation of Ag-Grid component for Streamlit"
"streamlit/streamlit","https://github.com/streamlit/streamlit","explosion/spacy-streamlit","https://github.com/explosion/spacy-streamlit","explosion","Python","854","nlp","0","539.87","False","0.1","0","1","0.1421","1","0","0.3333","streamlit language:Python stars:>=50","👑 spaCy building blocks and visualizers for Streamlit apps"
"streamlit/streamlit","https://github.com/streamlit/streamlit","DataBrewery/cubes","https://github.com/DataBrewery/cubes","DataBrewery","Python","1480","data-science","0","535.04","False","0.0714","0","1","0.2614","1","0","0.3333","topic:data-analysis language:Python stars:>=50","[NOT MAINTAINED] Light-weight Python OLAP framework for multi-dimensional data analysis"
"streamlit/streamlit","https://github.com/streamlit/streamlit","glato/emerge","https://github.com/glato/emerge","glato","Python","1077","editor","0","530.68","False","0.08","0","1","0.1925","1","0","0.3333","topic:data-visualization language:Python stars:>=50","Emerge is a browser-based interactive codebase and dependency visualization tool for many different programming languages. It supports some basic code quality and graph metrics and provides a simple and intuitive way to explore and analyze a codebase by using graph structures."
"streamlit/streamlit","https://github.com/streamlit/streamlit","andfanilo/streamlit-echarts","https://github.com/andfanilo/streamlit-echarts","andfanilo","Python","610","","0","527.1","False","0.1","0","1","0.0692","1","0","0.3333","streamlit language:Python stars:>=50","A Streamlit component to render ECharts."
"streamlit/streamlit","https://github.com/streamlit/streamlit","JohnYan2017/SmartCharts","https://github.com/JohnYan2017/SmartCharts","JohnYan2017","Python","747","","0","526.61","False","0.0909","0","1","0.1131","1","0","0.3333","topic:data-visualization language:Python stars:>=50","🔥数据可视化,大屏, 支持Echarts,SQL,API,VUE,可用于Jupyter, 比pyecharts容易, 极低门槛,拿来即用,比拖拽方便,项目插件或独立平台皆可, 简单, 敏捷, 高效, 通用化, 高度可定制化,为你完全打通前后端, 图形数据联动, 筛选开发毫无压力, 数据缓存处理机制让报表快人一步"
"streamlit/streamlit","https://github.com/streamlit/streamlit","developmentseed/lonboard","https://github.com/developmentseed/lonboard","developmentseed","Python","940","data-science","0","525.51","False","0.08","0","1","0.1629","1","0","0.3333","topic:data-visualization language:Python stars:>=50","Fast, interactive geospatial data visualization in Jupyter."
"streamlit/streamlit","https://github.com/streamlit/streamlit","strnad/CrewAI-Studio","https://github.com/strnad/CrewAI-Studio","strnad","Python","1250","reinforcement","0","524.34","False","0.0667","0","1","0.2248","1","0","0.3333","streamlit language:Python stars:>=50","A user-friendly, multi-platform GUI for managing and running CrewAI agents and tasks. Supports Conda and virtual environments, no coding needed. "
"streamlit/streamlit","https://github.com/streamlit/streamlit","iusztinpaul/energy-forecasting","https://github.com/iusztinpaul/energy-forecasting","iusztinpaul","Python","969","mlops","0","523.9","False","0.0769","0","1","0.1695","1","0","0.3333","streamlit language:Python stars:>=50","🌀 𝗧𝗵𝗲 𝗙𝘂𝗹𝗹 𝗦𝘁𝗮𝗰𝗸 𝟳-𝗦𝘁𝗲𝗽𝘀 𝗠𝗟𝗢𝗽𝘀 𝗙𝗿𝗮𝗺𝗲𝘄𝗼𝗿𝗸 | 𝗟𝗲𝗮𝗿𝗻 𝗠𝗟𝗘 & 𝗠𝗟𝗢𝗽𝘀 for free by designing, building and deploying an end-to-end ML batch system ~ 𝘴𝘰𝘶𝘳𝘤𝘦 𝘤𝘰𝘥𝘦 + 2.5 𝘩𝘰𝘶𝘳𝘴 𝘰𝘧 𝘳𝘦𝘢𝘥𝘪𝘯𝘨 & 𝘷𝘪𝘥𝘦𝘰 𝘮𝘢𝘵𝘦𝘳𝘪𝘢𝘭𝘴"
"streamlit/streamlit","https://github.com/streamlit/streamlit","panaverse/learn-generative-ai","https://github.com/panaverse/learn-generative-ai","panaverse","Python","795","llm","0","519.16","False","0.08","0","1","0.1266","1","0","0.3333","streamlit language:Python stars:>=50","Learn Cloud Applied Generative AI Engineering (GenEng) using OpenAI, Gemini, Streamlit, Containers, Serverless, Postgres, LangChain, Pinecone, and Next.js"
"streamlit/streamlit","https://github.com/streamlit/streamlit","unytics/bigfunctions","https://github.com/unytics/bigfunctions","unytics","Python","758","","0","514.58","False","0.0769","0","1","0.1163","1","0","0.3333","topic:data-visualization language:Python stars:>=50","Supercharge BigQuery with BigFunctions"
"streamlit/streamlit","https://github.com/streamlit/streamlit","yvann-ba/Robby-chatbot","https://github.com/yvann-ba/Robby-chatbot","yvann-ba","Python","814","llm","0","512.34","False","0.0714","0","1","0.1317","1","0","0.3333","streamlit language:Python stars:>=50","AI chatbot 🤖 for chat with CSV, PDF, TXT files 📄 and YTB videos 🎥 | using Langchain🦜 | OpenAI | Streamlit ⚡"
"streamlit/streamlit","https://github.com/streamlit/streamlit","mobarski/ask-my-pdf","https://github.com/mobarski/ask-my-pdf","mobarski","Python","599","llm","0","505.64","False","0.0769","0","1","0.0652","1","0","0.3333","streamlit language:Python stars:>=50","Question answering system for PDF files"
"streamlit/streamlit","https://github.com/streamlit/streamlit","Kitware/trame","https://github.com/Kitware/trame","Kitware","Python","670","","0","496.91","False","0.0625","0","1","0.0895","1","0","0.3333","topic:data-visualization language:Python stars:>=50","Trame lets you weave various components and technologies into a Web Application solely written in Python."
"streamlit/streamlit","https://github.com/streamlit/streamlit","krish-adi/barfi","https://github.com/krish-adi/barfi","krish-adi","Python","745","data-science","0","494.69","False","0.0556","0","1","0.1125","1","0","0.3333","streamlit language:Python stars:>=50","Framework to build a custom no-code platform. Comes with a Flow Based programming env and a GUI."
"streamlit/streamlit","https://github.com/streamlit/streamlit","marcelo-earth/generative-manim","https://github.com/marcelo-earth/generative-manim","marcelo-earth","Python","829","llm","0","491.6","False","0.0476","0","1","0.1357","1","0","0.3333","streamlit language:Python stars:>=50","🎨 GPT for video generation ⚡️"
