"AnchorRepo","AnchorUrl","CandidateRepo","CandidateUrl","CandidateOwner","CandidateLanguage","CandidateStars","CandidateSubdomain","Rank","Score","Qualified","TopicJaccard","LexicalJaccard","LanguageMatch","StarSimilarity","RecencySimilarity","SubdomainMatch","QueryCoverage","SourceQueries","Description"
"streamlit/streamlit","https://github.com/streamlit/streamlit","aimhubio/aim","https://github.com/aimhubio/aim","aimhubio","Python","6109","llm","0","704.6","False","0.2","0","1","0.5692","1","0","0.3333","topic:data-visualization language:Python stars:>=50","Aim 💫 — An easy-to-use & supercharged open-source experiment tracker."
"streamlit/streamlit","https://github.com/streamlit/streamlit","airbnb/knowledge-repo","https://github.com/airbnb/knowledge-repo","airbnb","Python","5536","data-science","0","700.86","False","0.2","0","1","0.5478","1","0","0.3333","topic:data-analysis language:Python stars:>=50","A next-generation curated knowledge sharing platform for data scientists and other technical professions."
"streamlit/streamlit","https://github.com/streamlit/streamlit","eugeneyan/applied-ml","https://github.com/eugeneyan/applied-ml","eugeneyan","","28793","deep-learning","0","700.62","False","0.1579","0","0","0.9058","1","1","0.3333","topic:deep-learning stars:>=100","📚 Papers & tech blogs by companies sharing their work on data science & machine learning in production."
"streamlit/streamlit","https://github.com/streamlit/streamlit","drivendataorg/cookiecutter-data-science","https://github.com/drivendataorg/cookiecutter-data-science","drivendataorg","Python","9816","data-science","0","692.62","False","0.1667","0","1","0.6721","1","0","0.3333","topic:data-science language:Python stars:>=50","A logical, reasonably standardized, but flexible project structure for doing and sharing data science work."
"streamlit/streamlit","https://github.com/streamlit/streamlit","akfamily/akshare","https://github.com/akfamily/akshare","akfamily","Python","18823","data-science","0","689.36","False","0.08","0","1","0.8135","1","0","0.6667","topic:data-analysis language:Python stars:>=50 | topic:data-science language:Python stars:>=50","AKShare is an elegant and simple financial data interface library for Python, built for human beings! 开源财经数据接口库"
"streamlit/streamlit","https://github.com/streamlit/streamlit","Avik-Jain/100-Days-Of-ML-Code","https://github.com/Avik-Jain/100-Days-Of-ML-Code","Avik-Jain","","50832","deep-learning","0","687.28","False","0.1304","0","0","0.9708","1","1","0.3333","topic:deep-learning stars:>=100","100 Days of ML Coding"
"streamlit/streamlit","https://github.com/streamlit/streamlit","microsoft/AI-For-Beginners","https://github.com/microsoft/AI-For-Beginners","microsoft","Jupyter Notebook","47148","deep-learning","0","685.25","False","0.125","0","0","0.9871","1","1","0.3333","topic:deep-learning stars:>=100","12 Weeks, 24 Lessons, AI for All!"
"streamlit/streamlit","https://github.com/streamlit/streamlit","justinzm/gopup","https://github.com/justinzm/gopup","justinzm","Python","2557","data-science","0","684.37","False","0.2143","0","1","0.3801","1","0","0.3333","topic:data-analysis language:Python stars:>=50","数据接口：百度、谷歌、头条、微博指数,宏观数据，利率数据，货币汇率，千里马、独角兽公司，新闻联播文字稿，影视票房数据，高校名单，疫情数据…"
"streamlit/streamlit","https://github.com/streamlit/streamlit","ipython/ipython","https://github.com/ipython/ipython","ipython","Python","16695","data-science","0","682.8","False","0.1333","0","1","0.7875","1","0","0.3333","topic:data-science language:Python stars:>=50","Official repository for IPython itself. Other repos in the IPython organization contain things like the website, documentation builds, etc."
"streamlit/streamlit","https://github.com/streamlit/streamlit","biolab/orange3","https://github.com/biolab/orange3","biolab","Python","5601","data-science","0","677.83","False","0.1739","0","1","0.5503","1","0","0.3333","topic:data-visualization language:Python stars:>=50","🍊 :bar_chart: :bulb: Orange: Interactive data analysis"
"streamlit/streamlit","https://github.com/streamlit/streamlit","pycaret/pycaret","https://github.com/pycaret/pycaret","pycaret","Python","9762","computer-vision","0","677.41","False","0.15","0","1","0.6709","1","0","0.3333","topic:data-science language:Python stars:>=50","Open-source, low-code AutoML platform for Python. PyCaret 4.0: sklearn-native engine + React control plane."
"streamlit/streamlit","https://github.com/streamlit/streamlit","has2k1/plotnine","https://github.com/has2k1/plotnine","has2k1","Python","4557","data-science","0","677.1","False","0.1818","0","1","0.5055","1","0","0.3333","topic:data-analysis language:Python stars:>=50","A Grammar of Graphics for Python"
"streamlit/streamlit","https://github.com/streamlit/streamlit","Avaiga/taipy","https://github.com/Avaiga/taipy","Avaiga","Python","19175","mlops","0","676.07","False","0.12","0","1","0.8175","1","0","0.3333","topic:data-visualization language:Python stars:>=50","Turns Data and AI algorithms into production-ready web applications in no time."
"streamlit/streamlit","https://github.com/streamlit/streamlit","polakowo/vectorbt","https://github.com/polakowo/vectorbt","polakowo","Python","7358","editor","0","673.78","False","0.1579","0","1","0.6096","1","0","0.3333","topic:data-visualization language:Python stars:>=50","The backtesting engine that gives you an unfair advantage. Run thousands of trading ideas before others finish one."
"streamlit/streamlit","https://github.com/streamlit/streamlit","Asabeneh/30-Days-Of-Python","https://github.com/Asabeneh/30-Days-Of-Python","Asabeneh","Python","61999","editor","0","673.05","False","0.0952","0","1","0.9277","1","0","0.3333","topic:data-science language:Python stars:>=50","The 30 Days of Python programming challenge is a step-by-step guide to learn the Python programming language in 30 days. This challenge may take more than 100 days. Follow your own pace. These videos may help too: https://www.youtube.com/channel/UC7PNRuno1rzYPb1xLa4yktw"
"streamlit/streamlit","https://github.com/streamlit/streamlit","sansan0/TrendRadar","https://github.com/sansan0/TrendRadar","sansan0","Python","56269","llm","0","672.84","False","0.0909","0","1","0.9487","1","0","0.3333","topic:data-analysis language:Python stars:>=50","⭐AI-driven public opinion & trend monitor with multi-platform aggregation, RSS, and smart alerts.🎯 告别信息过载，你的 AI 舆情监控助手与热点筛选工具！聚合多平台热点 +  RSS 订阅，支持关键词精准筛选。AI 智能筛选新闻 + AI 翻译 +  AI 分析简报直推手机，也支持接入 MCP 架构，赋能 AI 自然语言对话分析、情感洞察与趋势预测等。支持 Docker ，数据本地/云端自持。集成微信/飞书/钉钉/Telegram/邮件/ntfy/bark/slack 等渠道智能推送。"
"streamlit/streamlit","https://github.com/streamlit/streamlit","modin-project/modin","https://github.com/modin-project/modin","modin-project","Python","10384","data-science","0","664.76","False","0.1333","0","1","0.6844","1","0","0.3333","topic:data-science language:Python stars:>=50","Modin: Scale your Pandas workflows by changing a single line of code"
"streamlit/streamlit","https://github.com/streamlit/streamlit","MemPalace/mempalace","https://github.com/MemPalace/mempalace","MemPalace","Python","50936","llm","0","664.04","False","0.0769","0","1","0.9703","1","0","0.3333","s language:Python stars:>=50","The best-benchmarked open-source AI memory system. And it's free."
"streamlit/streamlit","https://github.com/streamlit/streamlit","PrefectHQ/prefect","https://github.com/PrefectHQ/prefect","PrefectHQ","Python","22290","mlops","0","663.79","False","0.1","0","1","0.8502","1","0","0.3333","topic:data-science language:Python stars:>=50","Prefect is a workflow orchestration framework for building resilient data pipelines in Python."
"streamlit/streamlit","https://github.com/streamlit/streamlit","huggingface/transformers","https://github.com/huggingface/transformers","huggingface","Python","160213","llm","0","663.76","False","0.125","0","1","0.7215","1","0","0.3333","topic:deep-learning stars:>=100","🤗 Transformers: the model-definition framework for state-of-the-art machine learning models in text, vision, audio, and multimodal models, for both inference and training. "
"streamlit/streamlit","https://github.com/streamlit/streamlit","yihong0618/running_page","https://github.com/yihong0618/running_page","yihong0618","Python","4444","data-science","0","662.51","False","0.1111","0","1","0.5001","1","0","0.6667","topic:data-analysis language:Python stars:>=50 | topic:data-visualization language:Python stars:>=50","Make your own running home page"
"streamlit/streamlit","https://github.com/streamlit/streamlit","hyperspy/hyperspy","https://github.com/hyperspy/hyperspy","hyperspy","Python","571","data-science","0","659.6","False","0.25","0","1","0.0548","1","0","0.3333","topic:data-visualization language:Python stars:>=50","Multidimensional data analysis"
"streamlit/streamlit","https://github.com/streamlit/streamlit","apachecn/python_data_analysis_and_mining_action","https://github.com/apachecn/python_data_analysis_and_mining_action","apachecn","Python","1800","data-science","0","658.18","False","0.2","0","1","0.3039","1","0","0.3333","topic:data-analysis language:Python stars:>=50","《python数据分析与挖掘实战》的代码笔记"
"streamlit/streamlit","https://github.com/streamlit/streamlit","ml-tooling/opyrator","https://github.com/ml-tooling/opyrator","ml-tooling","Python","3137","mlops","0","658.11","False","0.1765","0","1","0.4245","1","0","0.3333","streamlit language:Python stars:>=50","🪄 Turns your machine learning code into microservices with web API, interactive GUI, and more."
"streamlit/streamlit","https://github.com/streamlit/streamlit","certbot/certbot","https://github.com/certbot/certbot","certbot","Python","33019","","0","657.95","False","0.0769","0","1","0.9355","1","0","0.3333","s language:Python stars:>=50","Certbot is EFF's tool to obtain certs from Let's Encrypt and (optionally) auto-enable HTTPS on your server.  It can also act as a client for any other CA that uses the ACME protocol."
"streamlit/streamlit","https://github.com/streamlit/streamlit","ludwig-ai/ludwig","https://github.com/ludwig-ai/ludwig","ludwig-ai","Python","11683","llm","0","657.24","False","0.12","0","1","0.7099","1","0","0.3333","topic:data-science language:Python stars:>=50","Low-code framework for building custom LLMs, neural networks, and other AI models"
"streamlit/streamlit","https://github.com/streamlit/streamlit","mage-ai/mage-ai","https://github.com/mage-ai/mage-ai","mage-ai","Python","8712","mlops","0","655.48","False","0.1304","0","1","0.6462","1","0","0.3333","topic:data-science language:Python stars:>=50","🧙 Build, run, and manage data pipelines for integrating and transforming data."
"streamlit/streamlit","https://github.com/streamlit/streamlit","mli/paper-reading","https://github.com/mli/paper-reading","mli","","32952","deep-learning","0","653.64","False","0.1","0","0","0.9351","1","1","0.3333","topic:deep-learning stars:>=100","深度学习经典、新论文逐段精读"
"streamlit/streamlit","https://github.com/streamlit/streamlit","666ghj/BettaFish","https://github.com/666ghj/BettaFish","666ghj","Python","40729","llm","0","649.63","False","0.0588","0","1","0.9811","1","0","0.3333","topic:data-analysis language:Python stars:>=50","微舆：人人可用的多Agent舆情分析助手，打破信息茧房，还原舆情原貌，预测未来走向，辅助决策！从0实现，不依赖任何框架。"
"streamlit/streamlit","https://github.com/streamlit/streamlit","sqlmapproject/sqlmap","https://github.com/sqlmapproject/sqlmap","sqlmapproject","Python","37239","computer-vision","0","649.54","False","0.0625","0","1","0.9617","1","0","0.3333","s language:Python stars:>=50","Automatic SQL injection and database takeover tool"
"streamlit/streamlit","https://github.com/streamlit/streamlit","scrapy/scrapy","https://github.com/scrapy/scrapy","scrapy","Python","61535","","0","647.63","False","0.0667","0","1","0.9293","1","0","0.3333","s language:Python stars:>=50","Scrapy, a fast high-level web crawling & scraping framework for Python."
"streamlit/streamlit","https://github.com/streamlit/streamlit","dagster-io/dagster","https://github.com/dagster-io/dagster","dagster-io","Python","15426","mlops","0","645.51","False","0.0952","0","1","0.7703","1","0","0.3333","topic:data-science language:Python stars:>=50","An orchestration platform for the development, production, and observation of data assets."
"streamlit/streamlit","https://github.com/streamlit/streamlit","lutzroeder/netron","https://github.com/lutzroeder/netron","lutzroeder","JavaScript","32832","deep-learning","0","645.32","False","0.0909","0","0","0.9343","1","1","0.3333","topic:deep-learning stars:>=100","Visualizer for neural network, deep learning and machine learning models"
"streamlit/streamlit","https://github.com/streamlit/streamlit","google-ai-edge/mediapipe","https://github.com/google-ai-edge/mediapipe","google-ai-edge","C++","35048","deep-learning","0","644.25","False","0.087","0","0","0.9485","1","1","0.3333","topic:deep-learning stars:>=100","Cross-platform, customizable ML solutions for live and streaming media."
"streamlit/streamlit","https://github.com/streamlit/streamlit","naptha/tesseract.js","https://github.com/naptha/tesseract.js","naptha","JavaScript","38045","deep-learning","0","644.1","False","0.0833","0","0","0.9663","1","1","0.3333","topic:deep-learning stars:>=100","Pure Javascript OCR for more than 100 Languages 📖🎉🖥"
"streamlit/streamlit","https://github.com/streamlit/streamlit","mckinsey/vizro","https://github.com/mckinsey/vizro","mckinsey","Python","3676","","0","643.77","False","0.1538","0","1","0.4589","1","0","0.3333","topic:data-visualization language:Python stars:>=50","Vizro is a low-code toolkit for building high-quality data visualization apps."
"streamlit/streamlit","https://github.com/streamlit/streamlit","skrub-data/skrub","https://github.com/skrub-data/skrub","skrub-data","Python","1603","data-science","0","642.53","False","0.1875","0","1","0.2787","1","0","0.3333","topic:data-analysis language:Python stars:>=50","Machine learning with dataframes"
"streamlit/streamlit","https://github.com/streamlit/streamlit","proplot-dev/proplot","https://github.com/proplot-dev/proplot","proplot-dev","Python","1150","","0","641.17","False","0.2","0","1","0.2067","1","0","0.3333","topic:data-visualization language:Python stars:>=50","🎨 A succinct matplotlib wrapper for making beautiful, publication-quality graphics"
"streamlit/streamlit","https://github.com/streamlit/streamlit","airbytehq/airbyte","https://github.com/airbytehq/airbyte","airbytehq","Python","21175","mlops","0","641.07","False","0.0769","0","1","0.8391","1","0","0.3333","topic:data-analysis language:Python stars:>=50","The leading data integration platform for ETL / ELT data pipelines from APIs, databases & files to data warehouses, data lakes & data lakehouses. Both self-hosted and Cloud-hosted."
"streamlit/streamlit","https://github.com/streamlit/streamlit","getsentry/sentry","https://github.com/getsentry/sentry","getsentry","Python","43762","mlops","0","640.33","False","0.0455","0","1","0.9967","1","0","0.3333","s language:Python stars:>=50","Developer-first error tracking and performance monitoring"
"streamlit/streamlit","https://github.com/streamlit/streamlit","ranaroussi/yfinance","https://github.com/ranaroussi/yfinance","ranaroussi","Python","23355","data-science","0","635.56","False","0.0667","0","1","0.8603","1","0","0.3333","s language:Python stars:>=50","Download market data from Yahoo! Finance's API"
"streamlit/streamlit","https://github.com/streamlit/streamlit","CMU-Perceptual-Computing-Lab/openpose","https://github.com/CMU-Perceptual-Computing-Lab/openpose","CMU-Perceptual-Computing-Lab","C++","34060","deep-learning","0","634.13","False","0.0769","0","0","0.9423","1","1","0.3333","topic:deep-learning stars:>=100","OpenPose: Real-time multi-person keypoint detection library for body, face, hands, and foot estimation"
"streamlit/streamlit","https://github.com/streamlit/streamlit","mkhorasani/Streamlit-Authenticator","https://github.com/mkhorasani/Streamlit-Authenticator","mkhorasani","Python","2076","","0","633.6","False","0.1667","0","1","0.3349","1","0","0.3333","streamlit language:Python stars:>=50","A secure authentication module to manage user access in a Streamlit application."
"streamlit/streamlit","https://github.com/streamlit/streamlit","D4Vinci/Scrapling","https://github.com/D4Vinci/Scrapling","D4Vinci","Python","42779","","0","631.89","False","0.037","0","1","0.9918","1","0","0.3333","s language:Python stars:>=50","🕷️ An adaptive Web Scraping framework that handles everything from a single request to a full-scale crawl!"
"streamlit/streamlit","https://github.com/streamlit/streamlit","alan-turing-institute/CleverCSV","https://github.com/alan-turing-institute/CleverCSV","alan-turing-institute","Python","1325","computer-vision","0","630.18","False","0.1818","0","1","0.2374","1","0","0.3333","topic:data-analysis language:Python stars:>=50","CleverCSV is a Python package for handling messy CSV files. It provides a drop-in replacement for the builtin CSV module with improved dialect detection, and comes with a handy command line application for working with CSV files."
"streamlit/streamlit","https://github.com/streamlit/streamlit","sktime/sktime","https://github.com/sktime/sktime","sktime","Python","9753","computer-vision","0","628.09","False","0.0952","0","1","0.6707","1","0","0.3333","topic:data-science language:Python stars:>=50","A unified framework for machine learning with time series"
"streamlit/streamlit","https://github.com/streamlit/streamlit","MemeMeow-Studio/MemeMeow","https://github.com/MemeMeow-Studio/MemeMeow","MemeMeow-Studio","Python","1247","nlp","0","627.88","False","0.1818","0","1","0.2243","1","0","0.3333","streamlit language:Python stars:>=50","智能检索张维为表情包"
"streamlit/streamlit","https://github.com/streamlit/streamlit","pymupdf/PyMuPDF","https://github.com/pymupdf/PyMuPDF","pymupdf","Python","9604","computer-vision","0","627.51","False","0.0952","0","1","0.6674","1","0","0.3333","topic:data-science language:Python stars:>=50","PyMuPDF is a high performance Python library for data extraction, analysis, conversion & manipulation of PDF (and other) documents."
"streamlit/streamlit","https://github.com/streamlit/streamlit","chatchat-space/Langchain-Chatchat","https://github.com/chatchat-space/Langchain-Chatchat","chatchat-space","Python","37949","llm","0","627.34","False","0.037","0","1","0.9658","1","0","0.3333","streamlit language:Python stars:>=50","Langchain-Chatchat（原Langchain-ChatGLM）基于 Langchain 与 ChatGLM, Qwen 与 Llama 等语言模型的 RAG 与 Agent 应用 | Langchain-Chatchat (formerly langchain-ChatGLM), local knowledge based LLM (like ChatGLM, Qwen and Llama) RAG and Agent app with langchain "
"streamlit/streamlit","https://github.com/streamlit/streamlit","machow/siuba","https://github.com/machow/siuba","machow","Python","1184","data-science","0","625.91","False","0.1818","0","1","0.213","1","0","0.3333","topic:data-analysis language:Python stars:>=50","Python library for using dplyr like syntax with pandas and SQL"
"streamlit/streamlit","https://github.com/streamlit/streamlit","searxng/searxng","https://github.com/searxng/searxng","searxng","Python","29348","","0","625.15","False","0.0455","0","1","0.9099","1","0","0.3333","s language:Python stars:>=50","SearXNG is a free internet metasearch engine which aggregates results from various search services and databases. Users are neither tracked nor profiled."
"streamlit/streamlit","https://github.com/streamlit/streamlit","spotDL/spotify-downloader","https://github.com/spotDL/spotify-downloader","spotDL","Python","24625","","0","624.94","False","0.0526","0","1","0.8718","1","0","0.3333","s language:Python stars:>=50","Download your Spotify playlists and songs along with album art and metadata (from YouTube if a match is found)."
"streamlit/streamlit","https://github.com/streamlit/streamlit","opencv/opencv","https://github.com/opencv/opencv","opencv","C++","87330","deep-learning","0","624.32","False","0.0833","0","0","0.8533","1","1","0.3333","topic:deep-learning stars:>=100","Open Source Computer Vision Library"
"streamlit/streamlit","https://github.com/streamlit/streamlit","datapane/datapane","https://github.com/datapane/datapane","datapane","Python","1399","","0","623.61","False","0.2","0","1","0.2492","0.8","0","0.3333","topic:data-visualization language:Python stars:>=50","Build and share data reports in 100% Python"
"streamlit/streamlit","https://github.com/streamlit/streamlit","capitalone/DataProfiler","https://github.com/capitalone/DataProfiler","capitalone","Python","1554","nlp","0","622.6","False","0.1667","0","1","0.272","1","0","0.3333","topic:data-analysis language:Python stars:>=50","What's in your data? Extract schema, statistics and entities from datasets"
"streamlit/streamlit","https://github.com/streamlit/streamlit","writer/writer-framework","https://github.com/writer/writer-framework","writer","Python","1441","","0","619.74","False","0.1667","0","1","0.2556","1","0","0.3333","topic:data-visualization language:Python stars:>=50","No-code in the front, Python in the back. An open-source framework for creating data apps."
"streamlit/streamlit","https://github.com/streamlit/streamlit","nfstream/nfstream","https://github.com/nfstream/nfstream","nfstream","Python","1208","data-science","0","619.56","False","0.1739","0","1","0.2174","1","0","0.3333","topic:data-analysis language:Python stars:>=50","NFStream: a Flexible Network Data Analysis Framework."
"streamlit/streamlit","https://github.com/streamlit/streamlit","opengeos/leafmap","https://github.com/opengeos/leafmap","opengeos","Python","3696","data-science","0","618.01","False","0.125","0","1","0.4601","1","0","0.3333","streamlit language:Python stars:>=50","A Python package for interactive mapping and geospatial analysis with minimal coding in a Jupyter environment"
"streamlit/streamlit","https://github.com/streamlit/streamlit","arnaudmiribel/streamlit-extras","https://github.com/arnaudmiribel/streamlit-extras","arnaudmiribel","Python","959","","0","617.91","False","0.1818","0","1","0.1673","1","0","0.3333","streamlit language:Python stars:>=50","Discover, try, install and share Streamlit re-usable bits we call ""extras""!"
"streamlit/streamlit","https://github.com/streamlit/streamlit","cleanlab/cleanlab","https://github.com/cleanlab/cleanlab","cleanlab","Python","11449","computer-vision","0","617.7","False","0.0769","0","1","0.7055","1","0","0.3333","topic:data-science language:Python stars:>=50","Cleanlab's open-source library is the standard data-centric AI package for data quality and machine learning with messy, real-world data and labels."
"streamlit/streamlit","https://github.com/streamlit/streamlit","Kanaries/pygwalker","https://github.com/Kanaries/pygwalker","Kanaries","Python","15762","data-science","0","616.87","False","0.0625","0","1","0.775","1","0","0.3333","topic:data-analysis language:Python stars:>=50","PyGWalker: Turn your dataframe into an interactive UI for visual analysis"
"streamlit/streamlit","https://github.com/streamlit/streamlit","gee-community/geemap","https://github.com/gee-community/geemap","gee-community","Python","3936","computer-vision","0","615.9","False","0.12","0","1","0.4737","1","0","0.3333","streamlit language:Python stars:>=50","A Python package for interactive geospatial analysis and visualization with Google Earth Engine."
"streamlit/streamlit","https://github.com/streamlit/streamlit","sherlock-project/sherlock","https://github.com/sherlock-project/sherlock","sherlock-project","Python","82853","reinforcement","0","615.45","False","0.0435","0","1","0.8647","1","0","0.3333","s language:Python stars:>=50","Hunt down social media accounts by username across social networks"
"streamlit/streamlit","https://github.com/streamlit/streamlit","microsoft/RD-Agent","https://github.com/microsoft/RD-Agent","microsoft","Python","12771","llm","0","612.62","False","0.0667","0","1","0.7293","1","0","0.3333","topic:data-science language:Python stars:>=50","Research and development (R&D) is crucial for the enhancement of industrial productivity, especially in the AI era, where the core aspects of R&D are mainly focused on data and models. We are committed to automating these high-value generic R&D processes through R&D-Agent, which lets AI drive data-driven AI. 🔗https://aka.ms/RD-Agent-Tech-Report"
"streamlit/streamlit","https://github.com/streamlit/streamlit","starpig1129/DATAGEN","https://github.com/starpig1129/DATAGEN","starpig1129","Python","1719","llm","0","611.43","False","0.15","0","1","0.2939","1","0","0.3333","topic:data-analysis language:Python stars:>=50","DATAGEN: AI-driven multi-agent research assistant automating hypothesis generation, data analysis, and report writing. "
"streamlit/streamlit","https://github.com/streamlit/streamlit","uxlfoundation/scikit-learn-intelex","https://github.com/uxlfoundation/scikit-learn-intelex","uxlfoundation","Python","1338","data-science","0","609.02","False","0.1579","0","1","0.2395","1","0","0.3333","topic:data-analysis language:Python stars:>=50"," Extension for Scikit-learn is a seamless way to speed up your Scikit-learn application"
