"FullName","Url","Owner","Language","Stars","Fork","Archived","CreatedAt","UpdatedAt","Description","Topics","SourceQueries"
"streamlit/streamlit","https://github.com/streamlit/streamlit","streamlit","Python","44432","False","False","8/24/2019 12:14:52 AM","5/3/2026 6:55:12 PM","Streamlit — A faster way to build and share data apps.","data-analysis;data-science;data-visualization;deep-learning;developer-tools;machine-learning;python;streamlit","topic:data-science language:Python stars:>=50 | topic:deep-learning language:Python stars:>=50 | s language:Python stars:>=50 | topic:deep-learning stars:>=100"
"searxng/searxng","https://github.com/searxng/searxng","searxng","Python","29348","False","False","4/12/2021 3:18:15 PM","5/3/2026 6:40:20 PM","SearXNG is a free internet metasearch engine which aggregates results from various search services and databases. Users are neither tracked nor profiled.","bing;brave;degoogle;duckduckgo;google;metasearch;privacy;python;qwant;search;search-engine;searx;searxng;startpage;yahoo","s language:Python stars:>=50"
"opencv/opencv","https://github.com/opencv/opencv","opencv","C++","87330","False","False","7/19/2012 9:40:17 AM","5/3/2026 4:50:32 PM","Open Source Computer Vision Library","c-plus-plus;computer-vision;deep-learning;image-processing;opencv","topic:deep-learning stars:>=100"
"serengil/chefboost","https://github.com/serengil/chefboost","serengil","Python","486","False","False","3/6/2019 12:26:27 PM","4/7/2026 2:08:10 PM","A Lightweight Decision Tree Framework supporting regular algorithms: ID3, C4.5, CART, CHAID and Regression Trees; some advanced techniques: Gradient Boosting, Random Forest and Adaboost w/categorical features support for Python","adaboost;c45-trees;cart;categorical-features;data-mining;data-science;decision-trees;gbdt;gbm;gbrt;gradient-boosting;gradient-boosting-machine;gradient-boosting-machines;id3;kaggle;machine-learning;python;random-forest;regression-tree","topic:data-mining language:Python stars:>=50"
"nfstream/nfstream","https://github.com/nfstream/nfstream","nfstream","Python","1208","False","False","10/18/2019 3:14:39 PM","5/1/2026 6:20:30 AM","NFStream: a Flexible Network Data Analysis Framework.","artificial-intelligence;cybersecurity;data-analysis;data-mining;data-science;dataset-generation;deep-packet-inspection;machine-learning;ndpi;netflow;network-analysis;network-monitoring;network-security;packet-analyser;packet-capture;pcap;python;traffic-analysis;traffic-classification","topic:data-mining language:Python stars:>=50"
"huggingface/smolagents","https://github.com/huggingface/smolagents","huggingface","Python","27059","False","False","12/5/2024 11:28:04 AM","5/3/2026 6:06:12 PM","🤗 smolagents: a barebones library for agents that think in code.","","s language:Python stars:>=50"
"stanford-oval/storm","https://github.com/stanford-oval/storm","stanford-oval","Python","28156","False","False","3/24/2024 4:23:39 PM","5/3/2026 10:07:20 AM","An LLM-powered knowledge curation system that researches a topic and generates a full-length report with citations.","agentic-rag;deep-research;emnlp2024;knowledge-curation;large-language-models;naacl;nlp;report-generation;retrieval-augmented-generation","s language:Python stars:>=50"
"chubin/cheat.sh","https://github.com/chubin/cheat.sh","chubin","Python","41319","False","False","5/7/2017 9:40:56 PM","5/3/2026 3:10:42 PM","the only cheat sheet you need","cheatsheet;cli;command-line;curl;documentation;examples;hacktoberfest2021;help;terminal;tldr","s language:Python stars:>=50"
"getsentry/sentry","https://github.com/getsentry/sentry","getsentry","Python","43762","False","False","8/30/2010 10:06:41 PM","5/3/2026 6:15:06 PM","Developer-first error tracking and performance monitoring","apm;crash-reporting;crash-reports;csp-report;devops;django;error-logging;error-monitoring;fair-source;hacktoberfest;monitor;monitoring;python;sentry;tag-production","s language:Python stars:>=50"
"naptha/tesseract.js","https://github.com/naptha/tesseract.js","naptha","JavaScript","38045","False","False","6/24/2015 2:49:52 AM","5/3/2026 3:53:58 PM","Pure Javascript OCR for more than 100 Languages 📖🎉🖥","deep-learning;javascript;ocr;tesseract;webassembly","topic:deep-learning stars:>=100"
"alan-turing-institute/CleverCSV","https://github.com/alan-turing-institute/CleverCSV","alan-turing-institute","Python","1325","False","False","1/30/2019 11:15:17 AM","4/22/2026 8:23:26 AM","CleverCSV is a Python package for handling messy CSV files. It provides a drop-in replacement for the builtin CSV module with improved dialect detection, and comes with a handy command line application for working with CSV files.","csv;csv-converter;csv-export;csv-files;csv-format;csv-import;csv-parser;csv-parsing;csv-reader;csv-reading;data-analysis;data-mining;data-science;datascience;machine-learning;python;python-library;python3","topic:data-mining language:Python stars:>=50"
"PaddlePaddle/Research","https://github.com/PaddlePaddle/Research","PaddlePaddle","Python","1757","False","False","2/13/2020 9:49:34 AM","4/26/2026 10:41:07 PM","novel deep learning research works with PaddlePaddle","computer-vision;data-mining;deep-learning;knowledge-graph;nlp;spatial-temporal","topic:data-mining language:Python stars:>=50"
"unifyai/ivy","https://github.com/unifyai/ivy","unifyai","Python","14199","False","False","1/19/2021 8:37:25 AM","5/3/2026 6:38:58 AM","Convert Machine Learning Code Between Frameworks","jax;numpy;python;pytorch;tensorflow","machine language:Python stars:>=50"
"agilescientific/welly","https://github.com/agilescientific/welly","agilescientific","Python","362","False","False","11/9/2015 5:04:34 PM","4/25/2026 12:49:37 PM","Welly helps with well loading, wireline logs, log quality, data science","data-management;data-mining;geology;geophysics;petroleum;petrophysics;python;swung-stack","topic:data-mining language:Python stars:>=50"
"openai/CLIP","https://github.com/openai/CLIP","openai","Jupyter Notebook","33391","False","False","12/16/2020 11:24:42 AM","5/3/2026 5:39:20 PM","CLIP (Contrastive Language-Image Pretraining),  Predict the most relevant text snippet given an image","deep-learning;machine-learning","topic:deep-learning stars:>=100"
"Data-Centric-AI-Community/fg-data-profiling","https://github.com/Data-Centric-AI-Community/fg-data-profiling","Data-Centric-AI-Community","Python","13536","False","False","1/9/2016 11:47:55 PM","5/3/2026 5:25:23 PM","1 Line of code data quality profiling & exploratory data analysis for Pandas and Spark DataFrames. ","big-data-analytics;data-analysis;data-exploration;data-profiling;data-quality;data-science;deep-learning;eda;exploration;exploratory-data-analysis;hacktoberfest;html-report;jupyter;jupyter-notebook;machine-learning;pandas;pandas-dataframe;pandas-profiling;python;statistics","topic:data-science language:Python stars:>=50"
"mli/paper-reading","https://github.com/mli/paper-reading","mli","","32952","False","False","10/22/2021 6:34:51 AM","5/3/2026 3:54:12 PM","深度学习经典、新论文逐段精读","deep-learning;paper;reading-list","topic:deep-learning stars:>=100"
"great-expectations/great_expectations","https://github.com/great-expectations/great_expectations","great-expectations","Python","11456","False","False","9/11/2017 12:18:46 AM","5/2/2026 11:23:52 PM","Always know what to expect from your data.","cleandata;data-engineering;data-profilers;data-profiling;data-quality;data-science;data-unit-tests;datacleaner;datacleaning;dataquality;dataunittest;eda;exploratory-analysis;exploratory-data-analysis;exploratorydataanalysis;mlops;pipeline;pipeline-debt;pipeline-testing;pipeline-tests","topic:data-science language:Python stars:>=50"
"Trusted-AI/adversarial-robustness-toolbox","https://github.com/Trusted-AI/adversarial-robustness-toolbox","Trusted-AI","Python","5965","False","False","3/15/2018 2:40:43 PM","5/3/2026 2:21:56 PM","Adversarial Robustness Toolbox (ART) - Python Library for Machine Learning Security - Evasion, Poisoning, Extraction, Inference - Red and Blue Teams","adversarial-attacks;adversarial-examples;adversarial-machine-learning;ai;artificial-intelligence;attack;blue-team;evasion;extraction;inference;machine-learning;poisoning;privacy;python;red-team;trusted-ai;trustworthy-ai","machine language:Python stars:>=50"
"wandb/wandb","https://github.com/wandb/wandb","wandb","Python","11039","False","False","3/24/2017 5:46:23 AM","5/3/2026 11:00:04 AM","The AI developer platform. Use Weights & Biases to train and fine-tune models, and manage models from experimentation to production.","ai;collaboration;data-science;data-versioning;deep-learning;experiment-track;hyperparameter-optimization;hyperparameter-search;hyperparameter-tuning;jax;keras;machine-learning;ml-platform;mlops;model-versioning;pytorch;reinforcement-learning;reproducibility;tensorflow","topic:data-science language:Python stars:>=50"
"scrapy/scrapy","https://github.com/scrapy/scrapy","scrapy","Python","61535","False","False","2/22/2010 2:01:14 AM","5/3/2026 2:55:56 PM","Scrapy, a fast high-level web crawling & scraping framework for Python.","crawler;crawling;framework;hacktoberfest;python;scraping;web-scraping;web-scraping-python","s language:Python stars:>=50"
"agentscope-ai/QwenPaw","https://github.com/agentscope-ai/QwenPaw","agentscope-ai","Python","16263","False","False","2/24/2026 3:42:56 AM","5/3/2026 6:43:30 PM","Your Personal AI Assistant; easy to install, deploy on your own machine or on the cloud; supports multiple chat apps with easily extensible capabilities.","agent;agentscope;agentscope-runtime;llm-tools;llms;skills","machine language:Python stars:>=50"
"SYSTRAN/faster-whisper","https://github.com/SYSTRAN/faster-whisper","SYSTRAN","Python","22590","False","False","2/11/2023 9:17:27 AM","5/3/2026 4:41:25 PM","Faster Whisper transcription with CTranslate2","deep-learning;inference;openai;quantization;speech-recognition;speech-to-text;transformer;whisper","topic:deep-learning language:Python stars:>=50"
"microsoft/RD-Agent","https://github.com/microsoft/RD-Agent","microsoft","Python","12771","False","False","4/3/2024 3:39:33 AM","5/3/2026 4:50:49 PM","Research and development (R&D) is crucial for the enhancement of industrial productivity, especially in the AI era, where the core aspects of R&D are mainly focused on data and models. We are committed to automating these high-value generic R&D processes through R&D-Agent, which lets AI drive data-driven AI. 🔗https://aka.ms/RD-Agent-Tech-Report","agent;ai;automation;data-mining;data-science;development;llm;research","topic:data-mining language:Python stars:>=50 | topic:data-science language:Python stars:>=50"
"deepgraph/deepgraph","https://github.com/deepgraph/deepgraph","deepgraph","Python","339","False","False","10/27/2015 12:28:45 PM","4/29/2026 9:30:11 AM","Analyze Data with Pandas-based Networks. Documentation:","data-analysis;data-mining;data-science;data-structures;data-visualization;graph-database;graph-theory;graphs;graphviz;interfacing;iterative-methods;multilayer-networks;network;network-analysis;network-visualization;networkx;pandas;parallel;partitioning","topic:data-mining language:Python stars:>=50"
"Minqi824/ADBench","https://github.com/Minqi824/ADBench","Minqi824","Python","1014","False","False","6/5/2022 11:56:15 AM","4/27/2026 8:29:25 AM","Official Implement of ""ADBench: Anomaly Detection Benchmark"", NeurIPS 2022.","anomaly-detection;benchmark;data-mining;data-sicence;deep-learning;ensemble-learning;machine-learning;neural-networks;outlier-detection;python;semi-supervised-learning;supervised-learning;unsupervised-learning","topic:data-mining language:Python stars:>=50"
"junyanz/pytorch-CycleGAN-and-pix2pix","https://github.com/junyanz/pytorch-CycleGAN-and-pix2pix","junyanz","Python","25104","False","False","4/18/2017 10:33:05 AM","5/3/2026 3:08:42 PM","Image-to-Image Translation in PyTorch","computer-graphics;computer-vision;cyclegan;deep-learning;gan;gans;generative-adversarial-network;image-generation;image-manipulation;pix2pix;pytorch","topic:deep-learning language:Python stars:>=50"
"cleanlab/cleanlab","https://github.com/cleanlab/cleanlab","cleanlab","Python","11449","False","False","5/11/2018 1:55:21 AM","5/2/2026 8:06:12 AM","Cleanlab's open-source library is the standard data-centric AI package for data quality and machine learning with messy, real-world data and labels.","active-learning;annotation;anomaly-detection;data-annotation;data-centric-ai;data-cleaning;data-curation;data-labeling;data-profiling;data-quality;data-science;data-validation;datasets;exploratory-data-analysis;labeling;machine-learning;noisy-labels;out-of-distribution-detection;outlier-detection;weak-supervision","topic:data-science language:Python stars:>=50 | machine language:Python stars:>=50"
"aleju/imgaug","https://github.com/aleju/imgaug","aleju","Python","14737","False","False","7/10/2015 8:31:33 PM","5/3/2026 3:02:22 PM","Image augmentation for machine learning experiments.","affine-transformation;augment-images;augmentation;bounding-boxes;contrast;crop;deep-learning;heatmap;image-augmentation;images;keypoints;machine-learning;polygon;segmentation-maps","machine language:Python stars:>=50"
"sergioburdisso/pyss3","https://github.com/sergioburdisso/pyss3","sergioburdisso","Python","348","False","False","11/11/2019 4:14:14 PM","4/27/2026 7:30:31 AM","A Python library for Interpretable Machine Learning in Text Classification using the SS3 model, with easy-to-use visualization tools for Explainable AI :octocat:","artificial-intelligence;data-mining;document-categorization;document-classification;early-classification;explainable-artificial-intelligence;interpretability;interpretable-machine-learning;interpretable-ml;machine-learning;machine-learning-algorithms;multilabel-classification;natural-language-processing;nlp;sentence-classification;ss3-classifier;text-classification;text-labeling;text-mining;xai","topic:data-mining language:Python stars:>=50"
"OpenNMT/OpenNMT-py","https://github.com/OpenNMT/OpenNMT-py","OpenNMT","Python","7004","False","False","2/22/2017 7:01:50 PM","4/26/2026 8:59:52 AM","Open Source Neural Machine Translation and (Large) Language Models in PyTorch","deep-learning;language-model;llms;machine-translation;neural-machine-translation;pytorch","machine language:Python stars:>=50"
"huggingface/transformers","https://github.com/huggingface/transformers","huggingface","Python","160213","False","False","10/29/2018 1:56:00 PM","5/3/2026 6:57:29 PM","🤗 Transformers: the model-definition framework for state-of-the-art machine learning models in text, vision, audio, and multimodal models, for both inference and training. ","audio;deep-learning;deepseek;gemma;glm;hacktoberfest;llm;machine-learning;model-hub;natural-language-processing;nlp;pretrained-models;python;pytorch;pytorch-transformers;qwen;speech-recognition;transformer;vlm","topic:deep-learning language:Python stars:>=50 | machine language:Python stars:>=50 | topic:deep-learning stars:>=100"
"firmai/financial-machine-learning","https://github.com/firmai/financial-machine-learning","firmai","Python","8537","False","False","3/21/2019 9:00:35 PM","5/2/2026 8:05:56 PM","A curated list of practical financial machine learning tools and applications.","algorithmic-trading;cryptocurrency;finance;investment;quant;quantitative-finance;stock-market;trading-strategies","machine language:Python stars:>=50"
"bup/bup","https://github.com/bup/bup","bup","Python","7315","False","False","9/3/2012 10:51:40 PM","5/2/2026 9:56:36 PM","Very efficient backup system based on the git packfile format, providing fast incremental saves and global deduplication (among and within files, including virtual machine images). Please post problems or patches to the mailing list for discussion (see the end of the README below).","","machine language:Python stars:>=50"
"matrix-profile-foundation/matrixprofile","https://github.com/matrix-profile-foundation/matrixprofile","matrix-profile-foundation","Python","386","False","False","7/22/2019 12:33:37 AM","4/8/2026 4:46:27 PM","A Python 3 library making time series data mining tasks, utilizing matrix profile algorithms, accessible to everyone.","algorithms;anomaly-detection;clustering;data-mining;data-science;hacktoberfest;matrixprofile;motif-discovery;python;python2;python3;segmentation;time-series;time-series-analysis","topic:data-mining language:Python stars:>=50"
"ail-project/ail-framework","https://github.com/ail-project/ail-framework","ail-project","Python","937","False","False","4/20/2020 7:49:07 AM","5/3/2026 12:17:40 AM","AIL framework - Analysis Information Leak framework","ail-framework;darkweb;darkweb-scraping;data-mining;information-extraction;information-security;leak","topic:data-mining language:Python stars:>=50"
"WZMIAOMIAO/deep-learning-for-image-processing","https://github.com/WZMIAOMIAO/deep-learning-for-image-processing","WZMIAOMIAO","Python","26229","False","False","11/14/2019 3:02:27 PM","5/3/2026 9:19:26 AM","deep learning for image processing including classification and object-detection etc.","bilibili;classification;deep-learning;object-detection;pytorch;segmentation;tensorflow2","topic:deep-learning language:Python stars:>=50"
"ludwig-ai/ludwig","https://github.com/ludwig-ai/ludwig","ludwig-ai","Python","11683","False","False","12/27/2018 11:58:12 PM","5/3/2026 6:52:16 PM","Low-code framework for building custom LLMs, neural networks, and other AI models","computer-vision;data-centric;data-science;deep;deep-learning;deeplearning;fine-tuning;learning;llama;llama2;llm;llm-training;machine-learning;machinelearning;mistral;ml;natural-language;natural-language-processing;neural-network;pytorch","topic:data-science language:Python stars:>=50"
"dagster-io/dagster","https://github.com/dagster-io/dagster","dagster-io","Python","15426","False","False","4/30/2018 4:30:04 PM","5/3/2026 8:46:25 AM","An orchestration platform for the development, production, and observation of data assets.","analytics;dagster;data-engineering;data-integration;data-orchestrator;data-pipelines;data-science;etl;metadata;mlops;orchestration;python;scheduler;workflow;workflow-automation","topic:data-science language:Python stars:>=50"
"wkentaro/labelme","https://github.com/wkentaro/labelme","wkentaro","Python","15813","False","False","5/9/2016 12:30:26 PM","5/3/2026 3:08:55 PM","Image annotation with Python. Supports polygon, rectangle, circle, line, point, and AI-assisted annotation.","annotations;classification;computer-vision;deep-learning;image-annotation;instance-segmentation;python;semantic-segmentation;video-annotation","topic:deep-learning language:Python stars:>=50"
"microsoft/JARVIS","https://github.com/microsoft/JARVIS","microsoft","Python","24688","False","False","3/30/2023 2:57:12 AM","5/3/2026 5:25:45 PM","JARVIS, a system to connect LLMs with ML community. Paper: https://arxiv.org/pdf/2303.17580.pdf","deep-learning;platform;pytorch","topic:deep-learning language:Python stars:>=50"
"wepe/MachineLearning","https://github.com/wepe/MachineLearning","wepe","Python","5683","False","False","12/5/2014 2:53:17 PM","5/3/2026 12:05:10 PM","Basic Machine Learning and Deep Learning","","machine language:Python stars:>=50"
"JaidedAI/EasyOCR","https://github.com/JaidedAI/EasyOCR","JaidedAI","Python","29395","False","False","3/14/2020 11:46:39 AM","5/3/2026 4:59:12 PM","Ready-to-use OCR with 80+ supported languages and all popular writing scripts including Latin, Chinese, Arabic, Devanagari, Cyrillic and etc.","cnn;crnn;data-mining;deep-learning;easyocr;image-processing;information-retrieval;lstm;machine-learning;ocr;optical-character-recognition;python;pytorch;scene-text;scene-text-recognition","topic:data-mining language:Python stars:>=50 | topic:deep-learning language:Python stars:>=50 | topic:deep-learning stars:>=100"
"certbot/certbot","https://github.com/certbot/certbot","certbot","Python","33019","False","False","11/12/2014 2:52:20 AM","5/2/2026 2:31:59 PM","Certbot is EFF's tool to obtain certs from Let's Encrypt and (optionally) auto-enable HTTPS on your server.  It can also act as a client for any other CA that uses the ACME protocol.","acme;acme-client;certbot;certificate;letsencrypt;python","s language:Python stars:>=50"
"sherlock-project/sherlock","https://github.com/sherlock-project/sherlock","sherlock-project","Python","82853","False","False","12/24/2018 2:30:48 PM","5/3/2026 6:56:22 PM","Hunt down social media accounts by username across social networks","cli;cti;cybersecurity;forensics;hacktoberfest;information-gathering;infosec;linux;osint;pentesting;python;python3;reconnaissance;redteam;sherlock;tools","s language:Python stars:>=50"
"CorentinJ/Real-Time-Voice-Cloning","https://github.com/CorentinJ/Real-Time-Voice-Cloning","CorentinJ","Python","59711","False","False","5/26/2019 8:56:15 AM","5/3/2026 6:01:13 PM","Clone a voice in 5 seconds to generate arbitrary speech in real-time","deep-learning;python;pytorch;tensorflow;tts;voice-cloning","topic:deep-learning language:Python stars:>=50 | topic:deep-learning stars:>=100"
"K0lb3/UnityPy","https://github.com/K0lb3/UnityPy","K0lb3","Python","1304","False","False","7/23/2019 10:36:09 PM","5/2/2026 2:37:41 PM","UnityPy is python module that makes it possible to extract/unpack and edit Unity assets","assetstudio;data-mining;python;python3;unity;unity-asset;unity-asset-extractor;unitypack","topic:data-mining language:Python stars:>=50"
"MemPalace/mempalace","https://github.com/MemPalace/mempalace","MemPalace","Python","50938","False","False","4/5/2026 1:12:07 AM","5/3/2026 7:02:17 PM","The best-benchmarked open-source AI memory system. And it's free.","ai;chromadb;llm;mcp;memory;python","s language:Python stars:>=50"
"apache/tvm","https://github.com/apache/tvm","apache","Python","13324","False","False","10/12/2016 10:20:28 PM","5/3/2026 12:20:12 PM","Open Machine Learning Compiler Framework","compiler;deep-learning;gpu;javascript;machine-learning;metal;opencl;performance;rocm;spirv;tensor;tvm;vulkan","machine language:Python stars:>=50"
"Avik-Jain/100-Days-Of-ML-Code","https://github.com/Avik-Jain/100-Days-Of-ML-Code","Avik-Jain","","50832","False","False","7/5/2018 9:11:43 AM","5/3/2026 6:28:59 PM","100 Days of ML Coding","100-days-of-code-log;100daysofcode;deep-learning;implementation;infographics;linear-algebra;linear-regression;logistic-regression;machine-learning;machine-learning-algorithms;naive-bayes-classifier;python;scikit-learn;siraj-raval;siraj-raval-challenge;support-vector-machines;svm;tutorial","topic:deep-learning stars:>=100"
"pycaret/pycaret","https://github.com/pycaret/pycaret","pycaret","Python","9762","False","False","11/23/2019 6:40:48 PM","5/3/2026 4:06:00 PM","Open-source, low-code AutoML platform for Python. PyCaret 4.0: sklearn-native engine + React control plane.","anomaly-detection;automl;classification;clustering;data-science;fastapi;machine-learning;ml;mlops;open-source;pycaret;python;react;regression;scikit-learn","topic:data-science language:Python stars:>=50"
"usestrix/strix","https://github.com/usestrix/strix","usestrix","Python","24796","False","False","8/5/2025 9:28:30 PM","5/3/2026 6:27:51 PM","Open-source AI hackers to find and fix your app’s vulnerabilities.","agents;artificial-intelligence;cybersecurity;generative-ai;llm;penetration-testing","s language:Python stars:>=50"
"ipython/ipython","https://github.com/ipython/ipython","ipython","Python","16695","False","False","5/10/2010 4:46:06 AM","5/1/2026 8:34:30 PM","Official repository for IPython itself. Other repos in the IPython organization contain things like the website, documentation builds, etc.","closember;data-science;hacktoberfest;ipython;jupyter;notebook;python;repl;spec-0","topic:data-science language:Python stars:>=50"
"Asabeneh/30-Days-Of-Python","https://github.com/Asabeneh/30-Days-Of-Python","Asabeneh","Python","61999","False","False","11/19/2019 5:24:16 PM","5/3/2026 6:37:55 PM","The 30 Days of Python programming challenge is a step-by-step guide to learn the Python programming language in 30 days. This challenge may take more than 100 days. Follow your own pace. These videos may help too: https://www.youtube.com/channel/UC7PNRuno1rzYPb1xLa4yktw","30-days-of-python;data;data-science;database;flask;fullstack;github;heroku;matplotlib;ml;mongodb;numpy;pandas;python;python3","topic:data-science language:Python stars:>=50"
"hpcaitech/Open-Sora","https://github.com/hpcaitech/Open-Sora","hpcaitech","Python","28927","False","False","2/20/2024 3:01:34 AM","5/3/2026 12:45:23 PM","Open-Sora: Democratizing Efficient Video Production for All","","s language:Python stars:>=50"
"kk7nc/RMDL","https://github.com/kk7nc/RMDL","kk7nc","Python","428","False","False","10/23/2017 8:50:45 PM","3/26/2026 3:38:37 AM","RMDL: Random Multimodel Deep Learning for Classification","classification;cnn;convolutional-neural-networks;data-mining;deep-learning;deep-neural-networks;dnn;ensemble-learning;image-classification;information-retrieval;keras;machine-learning;multimodel;recurrent-neural-networks;rnn;tensorflow;text-classification;text-mining","topic:data-mining language:Python stars:>=50"
"aeon-toolkit/aeon","https://github.com/aeon-toolkit/aeon","aeon-toolkit","Python","1380","False","False","12/20/2022 12:44:09 PM","5/3/2026 11:58:31 AM","A toolkit for time series  machine learning and deep learning","aeon;ai;artificial-intelligence;data-mining;data-science;deep-learning;forecasting;machine-learning;neural-network;scikit-learn;time-series;time-series-analysis;time-series-anomaly-detection;time-series-classification;time-series-clustering;time-series-regression;time-series-segmentation","topic:data-mining language:Python stars:>=50"
