"AnchorRepo","AnchorUrl","CandidateRepo","CandidateUrl","CandidateOwner","CandidateLanguage","CandidateStars","CandidateSubdomain","Rank","Score","Qualified","TopicJaccard","LexicalJaccard","LanguageMatch","StarSimilarity","RecencySimilarity","SubdomainMatch","QueryCoverage","SourceQueries","Description"
"zenml-io/zenml","https://github.com/zenml-io/zenml","janhq/jan","https://github.com/janhq/jan","janhq","TypeScript","42335","llm","0","529.98","False","0.037","0","0","0.5523","1","1","0.3333","topic:llm stars:>=100","Jan is an open source alternative to ChatGPT that runs 100% offline on your computer."
"zenml-io/zenml","https://github.com/zenml-io/zenml","rtk-ai/rtk","https://github.com/rtk-ai/rtk","rtk-ai","Rust","40154","llm","0","526.78","False","0.0312","0","0","0.5638","1","1","0.3333","topic:llm stars:>=100","CLI proxy that reduces LLM token consumption by 60-90% on common dev commands. Single Rust binary, zero dependencies"
"zenml-io/zenml","https://github.com/zenml-io/zenml","github/spec-kit","https://github.com/github/spec-kit","github","Python","92209","","0","526.68","False","0.0385","0","1","0.3832","1","0","0.3333","topic:ai language:Python stars:>=50","💫 Toolkit to help you get started with Spec-Driven Development"
"zenml-io/zenml","https://github.com/zenml-io/zenml","upstash/context7","https://github.com/upstash/context7","upstash","TypeScript","54316","llm","0","526.31","False","0.0435","0","0","0.4982","1","1","0.3333","topic:llm stars:>=100","Context7 Platform -- Up-to-date code documentation for LLMs and AI code editors"
"zenml-io/zenml","https://github.com/zenml-io/zenml","milvus-io/milvus","https://github.com/milvus-io/milvus","milvus-io","Go","44097","llm","0","519.42","False","0.027","0","0","0.5434","1","1","0.3333","topic:llm stars:>=100","Milvus is a high-performance, cloud-native vector database built for scalable vector ANN search"
"zenml-io/zenml","https://github.com/zenml-io/zenml","AgentOps-AI/Spellcaster","https://github.com/AgentOps-AI/Spellcaster","AgentOps-AI","Python","98","reinforcement","0","517.36","False","0.0769","0","1","0.1322","1","0","0.3333","topic:agentops language:Python stars:>=50","AI agent to automatically check grammar and spelling on documentation files"
"zenml-io/zenml","https://github.com/zenml-io/zenml","tonykipkemboi/youtube_yapper_trapper","https://github.com/tonykipkemboi/youtube_yapper_trapper","tonykipkemboi","Python","67","reinforcement","0","516.86","False","0.12","0","1","0.0506","0.8","0","0.3333","topic:agentops language:Python stars:>=50","CrewAI agents that gather and analyze YouTube comments to generate insights to inform better content creation."
"zenml-io/zenml","https://github.com/zenml-io/zenml","hacksider/Deep-Live-Cam","https://github.com/hacksider/Deep-Live-Cam","hacksider","Python","92565","computer-vision","0","516.25","False","0.027","0","1","0.3824","1","0","0.3333","topic:ai language:Python stars:>=50","real time face swap and one-click video deepfake with only a single image"
"zenml-io/zenml","https://github.com/zenml-io/zenml","shareAI-lab/learn-claude-code","https://github.com/shareAI-lab/learn-claude-code","shareAI-lab","TypeScript","57847","llm","0","515.82","False","0.0345","0","0","0.4845","1","1","0.3333","topic:llm stars:>=100","Bash is all you need -  A nano claude code–like 「agent harness」, built from 0 to 1"
"zenml-io/zenml","https://github.com/zenml-io/zenml","firecrawl/firecrawl","https://github.com/firecrawl/firecrawl","firecrawl","TypeScript","114346","llm","0","507.54","False","0.0541","0","0","0.3365","1","1","0.3333","topic:llm stars:>=100","🔥 The API to search, scrape, and interact with the web for AI"
"zenml-io/zenml","https://github.com/zenml-io/zenml","Mintplex-Labs/anything-llm","https://github.com/Mintplex-Labs/anything-llm","Mintplex-Labs","JavaScript","59429","llm","0","507.44","False","0.0263","0","0","0.4786","1","1","0.3333","topic:llm stars:>=100","The all-in-one AI productivity accelerator. On device and privacy first with no annoying setup or configuration."
"zenml-io/zenml","https://github.com/zenml-io/zenml","affaan-m/everything-claude-code","https://github.com/affaan-m/everything-claude-code","affaan-m","JavaScript","172189","llm","0","476.67","False","0.037","0","0","0.2476","1","1","0.3333","topic:llm stars:>=100","The agent harness performance optimization system. Skills, instincts, memory, security, and research-first development for Claude Code, Codex, Opencode, Cursor and beyond."
"zenml-io/zenml","https://github.com/zenml-io/zenml","ollama/ollama","https://github.com/ollama/ollama","ollama","Go","170587","llm","0","470.16","False","0.0294","0","0","0.2497","1","1","0.3333","topic:llm stars:>=100","Get up and running with Kimi-K2.5, GLM-5, MiniMax, DeepSeek, gpt-oss, Qwen, Gemma and other models."
