"AnchorRepo","AnchorUrl","CandidateRepo","CandidateUrl","CandidateOwner","CandidateLanguage","CandidateStars","CandidateSubdomain","Rank","Score","Qualified","TopicJaccard","LexicalJaccard","LanguageMatch","StarSimilarity","RecencySimilarity","SubdomainMatch","QueryCoverage","SourceQueries","Description"
"explosion/spaCy","https://github.com/explosion/spaCy","stanfordnlp/stanza","https://github.com/stanfordnlp/stanza","stanfordnlp","Python","7784","deep-learning","1","1084.5","True","0.35","0","1","0.6828","1","1","0.3333","topic:artificial-intelligence language:Python stars:>=50","Stanford NLP Python library for tokenization, sentence segmentation, NER, and parsing of many human languages"
"explosion/spaCy","https://github.com/explosion/spaCy","recommenders-team/recommenders","https://github.com/recommenders-team/recommenders","recommenders-team","Python","21666","deep-learning","2","1001.25","True","0.2143","0","1","0.9051","1","1","0.3333","topic:artificial-intelligence language:Python stars:>=50","Best Practices on Recommendation Systems"
"explosion/spaCy","https://github.com/explosion/spaCy","d2l-ai/d2l-zh","https://github.com/d2l-ai/d2l-zh","d2l-ai","Python","77589","deep-learning","3","964.56","True","0.1905","0","1","0.8179","1","1","0.3333","topic:deep-learning stars:>=100","《动手学深度学习》：面向中文读者、能运行、可讨论。中英文版被70多个国家的500多所大学用于教学。"
"explosion/spaCy","https://github.com/explosion/spaCy","babysor/MockingBird","https://github.com/babysor/MockingBird","babysor","Python","36901","deep-learning","4","957.08","True","0.0952","0","1","0.9793","1","1","0.6667","topic:ai language:Python stars:>=50 | topic:deep-learning stars:>=100","🚀Clone a voice in 5 seconds to generate arbitrary speech in real-time"
"explosion/spaCy","https://github.com/explosion/spaCy","voxel51/fiftyone","https://github.com/voxel51/fiftyone","voxel51","Python","10630","deep-learning","5","936.51","True","0.1724","0","1","0.7505","1","1","0.3333","topic:artificial-intelligence language:Python stars:>=50","Refine high-quality datasets and visual AI models"
"explosion/spaCy","https://github.com/explosion/spaCy","JaidedAI/EasyOCR","https://github.com/JaidedAI/EasyOCR","JaidedAI","Python","29389","deep-learning","6","913.08","True","0.1034","0","1","0.9713","1","1","0.3333","topic:deep-learning stars:>=100","Ready-to-use OCR with 80+ supported languages and all popular writing scripts including Latin, Chinese, Arabic, Devanagari, Cyrillic and etc."
"explosion/spaCy","https://github.com/explosion/spaCy","flwrlabs/flower","https://github.com/flwrlabs/flower","flwrlabs","Python","6874","deep-learning","7","905.4","True","0.1562","0","1","0.6559","1","1","0.3333","topic:artificial-intelligence language:Python stars:>=50","Flower: A Friendly Federated AI Framework"
"explosion/spaCy","https://github.com/explosion/spaCy","deepfakes/faceswap","https://github.com/deepfakes/faceswap","deepfakes","Python","55202","deep-learning","8","902.49","True","0.1071","0","1","0.8918","1","1","0.3333","topic:deep-learning stars:>=100","Deepfakes Software For All"
"explosion/spaCy","https://github.com/explosion/spaCy","microsoft/qlib","https://github.com/microsoft/qlib","microsoft","Python","41856","deep-learning","9","900.96","True","0.0938","0","1","0.9519","1","1","0.3333","topic:deep-learning stars:>=100","Qlib is an AI-oriented Quant investment platform that aims to use AI tech to empower Quant Research, from exploring ideas to implementing productions. Qlib supports diverse ML modeling paradigms, including supervised learning, market dynamics modeling, and RL, and is now equipped with https://github.com/microsoft/RD-Agent to automate R&D process."
"explosion/spaCy","https://github.com/explosion/spaCy","CorentinJ/Real-Time-Voice-Cloning","https://github.com/CorentinJ/Real-Time-Voice-Cloning","CorentinJ","Python","59711","deep-learning","10","888.8","False","0.0952","0","1","0.8748","1","1","0.3333","topic:deep-learning stars:>=100","Clone a voice in 5 seconds to generate arbitrary speech in real-time"
"explosion/spaCy","https://github.com/explosion/spaCy","ultralytics/ultralytics","https://github.com/ultralytics/ultralytics","ultralytics","Python","56690","deep-learning","11","884.47","False","0.0882","0","1","0.886","1","1","0.3333","topic:deep-learning stars:>=100","Ultralytics YOLO 🚀"
"explosion/spaCy","https://github.com/explosion/spaCy","lucidrains/imagen-pytorch","https://github.com/lucidrains/imagen-pytorch","lucidrains","Python","8406","deep-learning","12","862.42","False","0.1","0","1","0.6995","1","1","0.3333","topic:artificial-intelligence language:Python stars:>=50","Implementation of Imagen, Google's Text-to-Image Neural Network, in Pytorch"
"explosion/spaCy","https://github.com/explosion/spaCy","OlafenwaMoses/ImageAI","https://github.com/OlafenwaMoses/ImageAI","OlafenwaMoses","Python","8866","deep-learning","13","856.26","False","0.0909","0","1","0.7111","1","1","0.3333","topic:artificial-intelligence language:Python stars:>=50","A python library built to empower developers to build applications and systems  with self-contained Computer Vision capabilities"
"explosion/spaCy","https://github.com/explosion/spaCy","huggingface/diffusers","https://github.com/huggingface/diffusers","huggingface","Python","33523","deep-learning","14","824.98","False","0","0","1","0.9999","1","1","0.3333","topic:deep-learning stars:>=100","🤗 Diffusers: State-of-the-art diffusion models for image, video, and audio generation in PyTorch."
"explosion/spaCy","https://github.com/explosion/spaCy","ultralytics/yolov5","https://github.com/ultralytics/yolov5","ultralytics","Python","57329","deep-learning","15","804.63","False","0","0","1","0.8836","1","1","0.3333","topic:deep-learning stars:>=100","YOLOv5 🚀 in PyTorch > ONNX > CoreML > TFLite"
"explosion/spaCy","https://github.com/explosion/spaCy","lucidrains/DALLE2-pytorch","https://github.com/lucidrains/DALLE2-pytorch","lucidrains","Python","11318","deep-learning","16","783.72","False","0","0","1","0.7641","1","1","0.3333","topic:artificial-intelligence language:Python stars:>=50","Implementation of DALL-E 2, OpenAI's updated text-to-image synthesis neural network,  in Pytorch"
"explosion/spaCy","https://github.com/explosion/spaCy","pytorch/pytorch","https://github.com/pytorch/pytorch","pytorch","Python","99591","deep-learning","17","783.64","False","0","0","1","0.7637","1","1","0.3333","topic:deep-learning stars:>=100","Tensors and Dynamic neural networks in Python with strong GPU acceleration"
"explosion/spaCy","https://github.com/explosion/spaCy","huggingface/datasets","https://github.com/huggingface/datasets","huggingface","Python","21482","llm","18","783.07","False","0.2222","0","1","0.9033","1","0","0.3333","topic:artificial-intelligence language:Python stars:>=50","🤗 The largest hub of ready-to-use datasets for AI models with fast, easy-to-use and efficient data manipulation tools"
"explosion/spaCy","https://github.com/explosion/spaCy","lucidrains/denoising-diffusion-pytorch","https://github.com/lucidrains/denoising-diffusion-pytorch","lucidrains","Python","10537","deep-learning","19","781","False","0","0","1","0.7486","1","1","0.3333","topic:artificial-intelligence language:Python stars:>=50","Implementation of Denoising Diffusion Probabilistic Model in Pytorch"
"explosion/spaCy","https://github.com/explosion/spaCy","google-deepmind/sonnet","https://github.com/google-deepmind/sonnet","google-deepmind","Python","9919","deep-learning","20","778.71","False","0","0","1","0.7355","1","1","0.3333","topic:artificial-intelligence language:Python stars:>=50","TensorFlow-based neural network library"
"explosion/spaCy","https://github.com/explosion/spaCy","microsoft/AI-For-Beginners","https://github.com/microsoft/AI-For-Beginners","microsoft","Jupyter Notebook","47131","deep-learning","21","766.62","False","0.2273","0","0","0.9261","1","1","0.3333","topic:deep-learning stars:>=100","12 Weeks, 24 Lessons, AI for All!"
"explosion/spaCy","https://github.com/explosion/spaCy","MemPalace/mempalace","https://github.com/MemPalace/mempalace","MemPalace","Python","50796","llm","22","719.94","False","0.0952","0","1","0.9099","1","0","0.6667","topic:ai language:Python stars:>=50 | s language:Python stars:>=50","The best-benchmarked open-source AI memory system. And it's free."
"explosion/spaCy","https://github.com/explosion/spaCy","Lightning-AI/pytorch-lightning","https://github.com/Lightning-AI/pytorch-lightning","Lightning-AI","Python","31101","","23","697.13","False","0","0","1","0.9836","1","0","1","topic:ai language:Python stars:>=50 | topic:artificial-intelligence language:Python stars:>=50 | topic:deep-learning stars:>=100","Pretrain, finetune ANY AI model of ANY size on 1 or 10,000+ GPUs with zero code changes."
"explosion/spaCy","https://github.com/explosion/spaCy","Lightning-AI/litgpt","https://github.com/Lightning-AI/litgpt","Lightning-AI","Python","13337","llm","24","693.53","False","0.1429","0","1","0.7998","1","0","0.3333","topic:artificial-intelligence language:Python stars:>=50","20+ high-performance LLMs with recipes to pretrain, finetune and deploy at scale."
"explosion/spaCy","https://github.com/explosion/spaCy","D4Vinci/Scrapling","https://github.com/D4Vinci/Scrapling","D4Vinci","Python","41921","","25","692.95","False","0.0571","0","1","0.9516","1","0","0.6667","topic:ai language:Python stars:>=50 | s language:Python stars:>=50","🕷️ An adaptive Web Scraping framework that handles everything from a single request to a full-scale crawl!"
"explosion/spaCy","https://github.com/explosion/spaCy","camel-ai/camel","https://github.com/camel-ai/camel","camel-ai","Python","16862","llm","26","691.26","False","0.1304","0","1","0.8507","1","0","0.3333","topic:artificial-intelligence language:Python stars:>=50","🐫 CAMEL: The first and the best multi-agent framework. Finding the Scaling Law of Agents. https://www.camel-ai.org"
"explosion/spaCy","https://github.com/explosion/spaCy","ZhuLinsen/daily_stock_analysis","https://github.com/ZhuLinsen/daily_stock_analysis","ZhuLinsen","Python","33729","llm","27","685.79","False","0.04","0","1","0.9988","1","0","0.6667","topic:ai language:Python stars:>=50 | s language:Python stars:>=50","LLM驱动的 A/H/美股智能分析器：多数据源行情 + 实时新闻 + LLM决策仪表盘 + 多渠道推送，零成本定时运行，纯白嫖. LLM-powered stock analysis system for A/H/US markets."
"explosion/spaCy","https://github.com/explosion/spaCy","openai/CLIP","https://github.com/openai/CLIP","openai","Jupyter Notebook","33387","deep-learning","28","680.71","False","0.1176","0","0","0.999","1","1","0.3333","topic:deep-learning stars:>=100","CLIP (Contrastive Language-Image Pretraining),  Predict the most relevant text snippet given an image"
"explosion/spaCy","https://github.com/explosion/spaCy","tensorflow/tensorflow","https://github.com/tensorflow/tensorflow","tensorflow","C++","194975","deep-learning","29","679.54","False","0.1905","0","0","0.6178","1","1","0.3333","topic:deep-learning stars:>=100","An Open Source Machine Learning Framework for Everyone"
"explosion/spaCy","https://github.com/explosion/spaCy","ageitgey/face_recognition","https://github.com/ageitgey/face_recognition","ageitgey","Python","56364","computer-vision","30","675.01","False","0.1053","0","1","0.8873","1","0","0.3333","s language:Python stars:>=50","The world's simplest facial recognition api for Python and the command line"
