"AnchorRepo","AnchorUrl","CandidateRepo","CandidateUrl","CandidateOwner","CandidateLanguage","CandidateStars","CandidateSubdomain","Rank","Score","Qualified","TopicJaccard","LexicalJaccard","LanguageMatch","StarSimilarity","RecencySimilarity","SubdomainMatch","QueryCoverage","SourceQueries","Description"
"hiyouga/LlamaFactory","https://github.com/hiyouga/LlamaFactory","sunmh207/AI-Codereview-Gitlab","https://github.com/sunmh207/AI-Codereview-Gitlab","sunmh207","Python","1654","llm","0","845.88","False","0.1818","0","1","0.1842","1","1","0.3333","topic:deepseek language:Python stars:>=50","基于大模型(DeepSeek,OpenAI等)的 GitLab 自动代码审查工具；支持钉钉/企业微信/飞书推送消息和生成日报；支持Docker部署；可视化 Dashboard。"
"hiyouga/LlamaFactory","https://github.com/hiyouga/LlamaFactory","huawei-csl/SINQ","https://github.com/huawei-csl/SINQ","huawei-csl","Python","615","llm","0","845.65","False","0.2174","0","1","0","1","1","0.3333","topic:deepseek language:Python stars:>=50","Welcome to the official repository of SINQ! A novel, fast and high-quality quantization method designed to make any Large Language Model smaller while preserving accuracy."
"hiyouga/LlamaFactory","https://github.com/hiyouga/LlamaFactory","haotian-liu/LLaVA","https://github.com/haotian-liu/LLaVA","haotian-liu","Python","24751","llm","0","843.1","False","0.0645","0","1","0.7716","1","1","0.3333","l language:Python stars:>=50","[NeurIPS'23 Oral] Visual Instruction Tuning (LLaVA) built towards GPT-4V level capabilities and beyond."
"hiyouga/LlamaFactory","https://github.com/hiyouga/LlamaFactory","bytedance/trae-agent","https://github.com/bytedance/trae-agent","bytedance","Python","11451","llm","0","841.46","False","0.0952","0","1","0.6043","1","1","0.3333","topic:agent language:Python stars:>=50","Trae Agent is an LLM-based agent for general purpose software engineering tasks."
"hiyouga/LlamaFactory","https://github.com/hiyouga/LlamaFactory","Alibaba-NLP/DeepResearch","https://github.com/Alibaba-NLP/DeepResearch","Alibaba-NLP","Python","18782","llm","0","841.22","False","0.0741","0","1","0.7117","1","1","0.3333","topic:agent language:Python stars:>=50","Tongyi Deep Research, the Leading Open-source Deep Research Agent"
"hiyouga/LlamaFactory","https://github.com/hiyouga/LlamaFactory","sinaptik-ai/pandas-ai","https://github.com/sinaptik-ai/pandas-ai","sinaptik-ai","Python","23502","llm","0","841.13","False","0.0645","0","1","0.7604","1","1","0.3333","topic:ai language:Python stars:>=50","Chat with your database or your datalake (SQL, CSV, parquet). PandasAI makes data analysis conversational using LLMs and RAG."
"hiyouga/LlamaFactory","https://github.com/hiyouga/LlamaFactory","MemoriLabs/Memori","https://github.com/MemoriLabs/Memori","MemoriLabs","Python","14039","llm","0","838.49","False","0.0833","0","1","0.6485","1","1","0.3333","topic:agent language:Python stars:>=50","Memori is agent-native memory infrastructure. A LLM-agnostic layer that turns agent execution and conversation into structured, persistent state for production systems."
"hiyouga/LlamaFactory","https://github.com/hiyouga/LlamaFactory","OpenBMB/UltraRAG","https://github.com/OpenBMB/UltraRAG","OpenBMB","Python","5532","llm","0","837.2","False","0.1212","0","1","0.4463","1","1","0.3333","topic:deepseek language:Python stars:>=50","[GitHub Trending #2] A Low-Code MCP Framework for Building Complex and Innovative RAG Pipelines"
"hiyouga/LlamaFactory","https://github.com/hiyouga/LlamaFactory","camel-ai/camel","https://github.com/camel-ai/camel","camel-ai","Python","16862","llm","0","837.12","False","0.0741","0","1","0.6883","1","1","0.3333","topic:agent language:Python stars:>=50","🐫 CAMEL: The first and the best multi-agent framework. Finding the Scaling Law of Agents. https://www.camel-ai.org"
"hiyouga/LlamaFactory","https://github.com/hiyouga/LlamaFactory","langflow-ai/langflow","https://github.com/langflow-ai/langflow","langflow-ai","Python","147645","llm","0","833.1","False","0.04","0","1","0.8406","1","1","0.3333","l language:Python stars:>=50","Langflow is a powerful tool for building and deploying AI-powered agents and workflows."
"hiyouga/LlamaFactory","https://github.com/hiyouga/LlamaFactory","Pythagora-io/gpt-pilot","https://github.com/Pythagora-io/gpt-pilot","Pythagora-io","Python","33771","llm","0","832.84","False","0.04","0","1","0.8391","1","1","0.3333","topic:ai language:Python stars:>=50","The first real AI developer"
"hiyouga/LlamaFactory","https://github.com/hiyouga/LlamaFactory","gpustack/gpustack","https://github.com/gpustack/gpustack","gpustack","Python","4951","llm","0","829.77","False","0.1176","0","1","0.4222","1","1","0.3333","topic:deepseek language:Python stars:>=50","A GPU cluster manager that configures and orchestrates inference engines like vLLM and SGLang for high-performance AI model deployment."
"hiyouga/LlamaFactory","https://github.com/hiyouga/LlamaFactory","datawhalechina/all-in-rag","https://github.com/datawhalechina/all-in-rag","datawhalechina","Python","6924","llm","0","829.74","False","0.1034","0","1","0.495","1","1","0.3333","topic:deepseek language:Python stars:>=50","🔍大模型应用开发实战一：RAG 技术全栈指南，在线阅读地址：https://datawhalechina.github.io/all-in-rag/"
"hiyouga/LlamaFactory","https://github.com/hiyouga/LlamaFactory","mindsdb/mindsdb","https://github.com/mindsdb/mindsdb","mindsdb","Python","39092","llm","0","829.68","False","0.0303","0","1","0.8709","1","1","0.3333","topic:ai language:Python stars:>=50","AI Data Vault - A query engine for AI Agents to securely query data from any datasource"
"hiyouga/LlamaFactory","https://github.com/hiyouga/LlamaFactory","shaxiu/XianyuAutoAgent","https://github.com/shaxiu/XianyuAutoAgent","shaxiu","Python","7374","llm","0","824.74","False","0.0952","0","1","0.5087","1","1","0.3333","topic:agent language:Python stars:>=50","智能闲鱼客服机器人系统：专为闲鱼平台打造的AI值守解决方案，实现闲鱼平台7×24小时自动化值守，支持多专家协同决策、智能议价和上下文感知对话。"
"hiyouga/LlamaFactory","https://github.com/hiyouga/LlamaFactory","mlc-ai/mlc-llm","https://github.com/mlc-ai/mlc-llm","mlc-ai","Python","22569","llm","0","820.66","False","0.0435","0","1","0.7516","1","1","0.3333","l language:Python stars:>=50","Universal LLM Deployment Engine with ML Compilation"
"hiyouga/LlamaFactory","https://github.com/hiyouga/LlamaFactory","microsoft/UFO","https://github.com/microsoft/UFO","microsoft","Python","8518","llm","0","819.5","False","0.0833","0","1","0.54","1","1","0.3333","topic:agent language:Python stars:>=50","UFO³: Weaving the Digital Agent Galaxy"
"hiyouga/LlamaFactory","https://github.com/hiyouga/LlamaFactory","GradientHQ/parallax","https://github.com/GradientHQ/parallax","GradientHQ","Python","1268","llm","0","812.77","False","0.1562","0","1","0.1266","1","1","0.3333","topic:deepseek language:Python stars:>=50","Parallax is a distributed model serving framework that lets you build your own AI cluster anywhere"
"hiyouga/LlamaFactory","https://github.com/hiyouga/LlamaFactory","ModelEngine-Group/nexent","https://github.com/ModelEngine-Group/nexent","ModelEngine-Group","Python","4389","llm","0","812.41","False","0.1034","0","1","0.3961","1","1","0.3333","unified language:Python stars:>=50","Nexent is a zero-code platform for auto-generating production-grade AI agents using Harness Engineering principles — unified tools, skills, memory, and orchestration with built-in constraints, feedback loops, and control planes."
"hiyouga/LlamaFactory","https://github.com/hiyouga/LlamaFactory","mlflow/mlflow","https://github.com/mlflow/mlflow","mlflow","Python","25693","llm","0","810.78","False","0.027","0","1","0.7797","1","1","0.3333","topic:ai language:Python stars:>=50","The open source AI engineering platform for agents, LLMs, and ML models. MLflow enables teams of all sizes to debug, evaluate, monitor, and optimize production-quality AI applications while controlling costs and managing access to models and data."
"hiyouga/LlamaFactory","https://github.com/hiyouga/LlamaFactory","TencentQQGYLab/AppAgent","https://github.com/TencentQQGYLab/AppAgent","TencentQQGYLab","Python","6701","llm","0","810.39","False","0.0833","0","1","0.4879","1","1","0.3333","topic:agent language:Python stars:>=50","AppAgent: Multimodal Agents as Smartphone Users, an LLM-based multimodal agent framework designed to operate smartphone apps."
"hiyouga/LlamaFactory","https://github.com/hiyouga/LlamaFactory","deepseek-ai/Janus","https://github.com/deepseek-ai/Janus","deepseek-ai","Python","17714","llm","0","808.33","False","0.04","0","1","0.699","1","1","0.3333","unified language:Python stars:>=50","Janus-Series: Unified Multimodal Understanding and Generation Models"
"hiyouga/LlamaFactory","https://github.com/hiyouga/LlamaFactory","fishaudio/Bert-VITS2","https://github.com/fishaudio/Bert-VITS2","fishaudio","Python","8739","llm","0","807.55","False","0.069","0","1","0.5456","1","1","0.3333","topic:agent language:Python stars:>=50","vits2 backbone with multilingual-bert"
"hiyouga/LlamaFactory","https://github.com/hiyouga/LlamaFactory","AgentOps-AI/agentops","https://github.com/AgentOps-AI/agentops","AgentOps-AI","Python","5512","llm","0","807.38","False","0.0882","0","1","0.4455","1","1","0.3333","topic:agent language:Python stars:>=50","Python SDK for AI agent monitoring, LLM cost tracking, benchmarking, and more. Integrates with most LLMs and agent frameworks including CrewAI, Agno, OpenAI Agents SDK, Langchain, Autogen, AG2, and CamelAI"
"hiyouga/LlamaFactory","https://github.com/hiyouga/LlamaFactory","adapter-hub/adapters","https://github.com/adapter-hub/adapters","adapter-hub","Python","2812","llm","0","806.24","False","0.1154","0","1","0.2994","1","1","0.3333","unified language:Python stars:>=50","A Unified Library for Parameter-Efficient and Modular Transfer Learning "
"hiyouga/LlamaFactory","https://github.com/hiyouga/LlamaFactory","agentscope-ai/QwenPaw","https://github.com/agentscope-ai/QwenPaw","agentscope-ai","Python","16240","llm","0","805.02","False","0.04","0","1","0.6801","1","1","0.3333","topic:agent language:Python stars:>=50","Your Personal AI Assistant; easy to install, deploy on your own machine or on the cloud; supports multiple chat apps with easily extensible capabilities."
"hiyouga/LlamaFactory","https://github.com/hiyouga/LlamaFactory","run-llama/rags","https://github.com/run-llama/rags","run-llama","Python","6531","llm","0","801.08","False","0.0741","0","1","0.4824","1","1","0.3333","topic:agent language:Python stars:>=50","Build ChatGPT over your data, all with natural language"
"hiyouga/LlamaFactory","https://github.com/hiyouga/LlamaFactory","llmware-ai/llmware","https://github.com/llmware-ai/llmware","llmware-ai","Python","14872","llm","0","797.82","False","0.0357","0","1","0.661","1","1","0.3333","unified language:Python stars:>=50","Unified framework for building enterprise RAG pipelines with small, specialized models"
"hiyouga/LlamaFactory","https://github.com/hiyouga/LlamaFactory","lss233/kirara-ai","https://github.com/lss233/kirara-ai","lss233","Python","18719","llm","0","797.5","False","0.0256","0","1","0.711","1","1","0.3333","topic:deepseek language:Python stars:>=50","🤖 可 DIY 的 多模态 AI 聊天机器人 | 🚀 快速接入 微信、 QQ、Telegram、等聊天平台 | 🦈支持DeepSeek、Grok、Claude、Ollama、Gemini、OpenAI | 工作流系统、网页搜索、AI画图、人设调教、虚拟女仆、语音对话 | "
"hiyouga/LlamaFactory","https://github.com/hiyouga/LlamaFactory","maziyarpanahi/openmed","https://github.com/maziyarpanahi/openmed","maziyarpanahi","Python","1078","llm","0","794.56","False","0.1429","0","1","0.0913","1","1","0.3333","topic:deepseek language:Python stars:>=50","open-source healthcare ai"
"hiyouga/LlamaFactory","https://github.com/hiyouga/LlamaFactory","HKUDS/AutoAgent","https://github.com/HKUDS/AutoAgent","HKUDS","Python","9256","llm","0","790.52","False","0.0476","0","1","0.5581","1","1","0.3333","topic:agent language:Python stars:>=50","""AutoAgent: Fully-Automated and Zero-Code LLM Agent Framework"""
"hiyouga/LlamaFactory","https://github.com/hiyouga/LlamaFactory","mvanhorn/last30days-skill","https://github.com/mvanhorn/last30days-skill","mvanhorn","Python","24618","llm","0","784.83","False","0","0","1","0.7705","1","1","0.3333","l language:Python stars:>=50","AI agent skill that researches any topic across Reddit, X, YouTube, HN, Polymarket, and the web - then synthesizes a grounded summary"
"hiyouga/LlamaFactory","https://github.com/hiyouga/LlamaFactory","thu-pacman/chitu","https://github.com/thu-pacman/chitu","thu-pacman","Python","3371","llm","0","784.29","False","0.0833","0","1","0.3388","1","1","0.3333","topic:deepseek language:Python stars:>=50","High-performance inference framework for large language models, focusing on efficiency, flexibility, and availability."
"hiyouga/LlamaFactory","https://github.com/hiyouga/LlamaFactory","Tencent/AngelSlim","https://github.com/Tencent/AngelSlim","Tencent","Python","890","llm","0","782.85","False","0.1379","0","1","0.0498","1","1","0.3333","topic:deepseek language:Python stars:>=50","Model compression toolkit engineered for enhanced usability, comprehensiveness, and efficiency."
"hiyouga/LlamaFactory","https://github.com/hiyouga/LlamaFactory","PromtEngineer/localGPT","https://github.com/PromtEngineer/localGPT","PromtEngineer","Python","22202","llm","0","780.91","False","0","0","1","0.748","1","1","0.3333","l language:Python stars:>=50","Chat with your documents on your local device using GPT models. No data leaves your device and 100% private. "
"hiyouga/LlamaFactory","https://github.com/hiyouga/LlamaFactory","RICHQAQ/PasteMD","https://github.com/RICHQAQ/PasteMD","RICHQAQ","Python","4733","llm","0","780.24","False","0.0645","0","1","0.4124","1","1","0.3333","topic:deepseek language:Python stars:>=50","一键将 Markdown 和网页 AI 对话（ChatGPT/DeepSeek等）完美粘贴到 Word、WPS 和 Excel 的效率工具 | One-click paste Markdown and AI responses (ChatGPT/DeepSeek) into Word, WPS, and Excel perfectly."
"hiyouga/LlamaFactory","https://github.com/hiyouga/LlamaFactory","aipotheosis-labs/aci","https://github.com/aipotheosis-labs/aci","aipotheosis-labs","Python","4761","llm","0","778.65","False","0.0625","0","1","0.4137","1","1","0.3333","unified language:Python stars:>=50","ACI.dev is the open source tool-calling platform that hooks up 600+ tools into any agentic IDE or custom AI agent through direct function calling or a unified MCP server. The birthplace of VibeOps."
"hiyouga/LlamaFactory","https://github.com/hiyouga/LlamaFactory","wwbin2017/bailing","https://github.com/wwbin2017/bailing","wwbin2017","Python","1681","llm","0","775.96","False","0.1034","0","1","0.1877","1","1","0.3333","topic:deepseek language:Python stars:>=50","百聆 是一个类似GPT-4o的语音对话机器人，通过ASR+LLM+TTS实现，集成DeepSeek R1等优秀大模型，接入openClaw，真正的个人语音助手，时延低至800ms，Mac等低配置也可运行，支持打断"
"hiyouga/LlamaFactory","https://github.com/hiyouga/LlamaFactory","X-PLUG/MobileAgent","https://github.com/X-PLUG/MobileAgent","X-PLUG","Python","8607","llm","0","773.93","False","0.0323","0","1","0.5423","1","1","0.3333","topic:agent language:Python stars:>=50"," Mobile-Agent: The Powerful GUI Agent Family"
"hiyouga/LlamaFactory","https://github.com/hiyouga/LlamaFactory","karpathy/llm-council","https://github.com/karpathy/llm-council","karpathy","Python","18126","llm","0","773.2","False","0","0","1","0.704","1","1","0.3333","l language:Python stars:>=50","LLM Council works together to answer your hardest questions"
"hiyouga/LlamaFactory","https://github.com/hiyouga/LlamaFactory","lukas-blecher/LaTeX-OCR","https://github.com/lukas-blecher/LaTeX-OCR","lukas-blecher","Python","16357","llm","0","769.3","False","0","0","1","0.6817","1","1","0.3333","l language:Python stars:>=50","pix2tex: Using a ViT to convert images of equations into LaTeX code."
"hiyouga/LlamaFactory","https://github.com/hiyouga/LlamaFactory","Upsonic/Upsonic","https://github.com/Upsonic/Upsonic","Upsonic","Python","7838","llm","0","767.81","False","0.0294","0","1","0.522","1","1","0.3333","topic:agent language:Python stars:>=50","Build autonomous AI agents in Python."
"hiyouga/LlamaFactory","https://github.com/hiyouga/LlamaFactory","bigcode-project/bigcodebench","https://github.com/bigcode-project/bigcodebench","bigcode-project","Python","498","llm","0","766.13","False","0.129","0","1","0","1","1","0.3333","topic:deepseek language:Python stars:>=50","[ICLR'25] BigCodeBench: Benchmarking Code Generation Towards AGI"
"hiyouga/LlamaFactory","https://github.com/hiyouga/LlamaFactory","gpt-open/rag-gpt","https://github.com/gpt-open/rag-gpt","gpt-open","Python","493","llm","0","762.5","False","0.125","0","1","0","1","1","0.3333","topic:deepseek language:Python stars:>=50","RAG-GPT, leveraging LLM and RAG technology, learns from user-customized knowledge bases to provide contextually relevant answers for a wide range of queries, ensuring rapid and accurate information retrieval."
"hiyouga/LlamaFactory","https://github.com/hiyouga/LlamaFactory","SanMuzZzZz/LuaN1aoAgent","https://github.com/SanMuzZzZz/LuaN1aoAgent","SanMuzZzZz","Python","746","llm","0","761.1","False","0.1212","0","1","0.0115","1","1","0.3333","topic:deepseek language:Python stars:>=50","LuaN1aoAgent is a cognitive-driven AI hacker. It is a fully autonomous AI penetration testing agent powered by DeepSeek V3.2. Using dual-graph reasoning, LuaN1ao achieves a success rate of over 90% on the XBOW Benchmark, with a median exploit cost of just $0.09."
"hiyouga/LlamaFactory","https://github.com/hiyouga/LlamaFactory","melih-unsal/DemoGPT","https://github.com/melih-unsal/DemoGPT","melih-unsal","Python","1897","llm","0","760.42","False","0.0811","0","1","0.214","1","1","0.3333","topic:deepseek language:Python stars:>=50","🤖 Everything you need to create an LLM Agent—tools, prompts, frameworks, and models—all in one place."
"hiyouga/LlamaFactory","https://github.com/hiyouga/LlamaFactory","szczyglis-dev/py-gpt","https://github.com/szczyglis-dev/py-gpt","szczyglis-dev","Python","1759","llm","0","757.55","False","0.0811","0","1","0.1976","1","1","0.3333","topic:deepseek language:Python stars:>=50","Desktop AI Assistant powered by GPT-5, GPT-4, o1, o3, Gemini, Claude, Ollama, DeepSeek, Perplexity, Grok, Bielik, chat, vision, voice, RAG, image and video generation, agents, tools, MCP, plugins, speech synthesis and recognition, web search, memory, presets, assistants,and more. Linux, Windows, Mac"
"hiyouga/LlamaFactory","https://github.com/hiyouga/LlamaFactory","xark-argo/argo","https://github.com/xark-argo/argo","xark-argo","Python","679","llm","0","750","False","0.1111","0","1","0","1","1","0.3333","topic:deepseek language:Python stars:>=50","ARGO is an open-source AI Agent platform that brings Local Manus to your desktop. With one-click model downloads, seamless closed LLM integration, and offline-first RAG knowledge bases, ARGO becomes a DeepResearch powerhouse for autonomous thinking, task planning, and 100% of your data stays locally. Support Win/Mac/Docker."
"hiyouga/LlamaFactory","https://github.com/hiyouga/LlamaFactory","Amm1rr/WebAI-to-API","https://github.com/Amm1rr/WebAI-to-API","Amm1rr","Python","1064","llm","0","740.49","False","0.0833","0","1","0.0885","1","1","0.3333","topic:deepseek language:Python stars:>=50","Gemini to API (Don't need API KEY) (ChatGPT, Claude, DeeepSeek, Grok and more)"
"hiyouga/LlamaFactory","https://github.com/hiyouga/LlamaFactory","Haohao-end/openagent","https://github.com/Haohao-end/openagent","Haohao-end","Python","798","llm","0","736.39","False","0.0909","0","1","0.0261","1","1","0.3333","topic:deepseek language:Python stars:>=50","AI Agent Development Platform - Supports multiple models (OpenAI/DeepSeek/Wenxin/Tongyi), knowledge base management, workflow automation, and enterprise-grade security. Built with Flask + Vue3 + LangChain, featuring one-click Docker deployment."
"hiyouga/LlamaFactory","https://github.com/hiyouga/LlamaFactory","IBM/mcp-context-forge","https://github.com/IBM/mcp-context-forge","IBM","Python","3650","llm","0","735.38","False","0.0256","0","1","0.356","1","1","0.3333","unified language:Python stars:>=50","An AI Gateway, registry, and proxy that sits in front of any MCP, A2A, or REST/gRPC APIs, exposing a unified endpoint with centralized discovery, guardrails and management. Optimizes Agent & Tool calling, and supports plugins."
"hiyouga/LlamaFactory","https://github.com/hiyouga/LlamaFactory","google-research/text-to-text-transfer-transformer","https://github.com/google-research/text-to-text-transfer-transformer","google-research","Python","6513","llm","0","734.31","False","0","0","1","0.4818","1","1","0.3333","unified language:Python stars:>=50","Code for the paper ""Exploring the Limits of Transfer Learning with a Unified Text-to-Text Transformer"""
"hiyouga/LlamaFactory","https://github.com/hiyouga/LlamaFactory","ChaokunHong/MetaScreener","https://github.com/ChaokunHong/MetaScreener","ChaokunHong","Python","1310","llm","0","733.39","False","0.0667","0","1","0.1336","1","1","0.3333","topic:deepseek language:Python stars:>=50","AI-powered tool for efficient abstract and PDF screening in systematic reviews."
"hiyouga/LlamaFactory","https://github.com/hiyouga/LlamaFactory","showlab/Show-o","https://github.com/showlab/Show-o","showlab","Python","1919","llm","0","728.79","False","0.0455","0","1","0.2165","1","1","0.3333","unified language:Python stars:>=50","[ICLR & NeurIPS 2025] Repository for Show-o series, One Single Transformer to Unify Multimodal Understanding and Generation."
"hiyouga/LlamaFactory","https://github.com/hiyouga/LlamaFactory","ollama/ollama","https://github.com/ollama/ollama","ollama","Go","170592","llm","0","727.81","False","0.2069","0","0","0.8092","1","1","0.3333","topic:llm stars:>=100","Get up and running with Kimi-K2.5, GLM-5, MiniMax, DeepSeek, gpt-oss, Qwen, Gemma and other models."
"hiyouga/LlamaFactory","https://github.com/hiyouga/LlamaFactory","Alpha-VLLM/Lumina-T2X","https://github.com/Alpha-VLLM/Lumina-T2X","Alpha-VLLM","Python","2253","llm","0","727.31","False","0.037","0","1","0.2513","1","1","0.3333","unified language:Python stars:>=50","Lumina-T2X is a unified framework for Text to Any Modality Generation"
"hiyouga/LlamaFactory","https://github.com/hiyouga/LlamaFactory","Flame-Code-VLM/Flame-Code-VLM","https://github.com/Flame-Code-VLM/Flame-Code-VLM","Flame-Code-VLM","Python","559","llm","0","725","False","0.0833","0","1","0","1","1","0.3333","topic:deepseek language:Python stars:>=50","Flame is an open-source multimodal AI system designed to translate UI design mockups into high-quality React code. It leverages vision-language modeling, automated data synthesis, and structured training workflows to bridge the gap between design and front-end development."
"hiyouga/LlamaFactory","https://github.com/hiyouga/LlamaFactory","MigoXLab/dingo","https://github.com/MigoXLab/dingo","MigoXLab","Python","691","llm","0","722.97","False","0.0811","0","1","0","1","1","0.3333","topic:deepseek language:Python stars:>=50","Dingo: A Comprehensive AI Data, Model and Application Quality Evaluation Tool"
"hiyouga/LlamaFactory","https://github.com/hiyouga/LlamaFactory","OpenMotionLab/MotionGPT","https://github.com/OpenMotionLab/MotionGPT","OpenMotionLab","Python","1910","llm","0","718.74","False","0.0345","0","1","0.2155","1","1","0.3333","unified language:Python stars:>=50","[NeurIPS 2023] MotionGPT: Human Motion as a Foreign Language, a unified motion-language generation model using LLMs"
"hiyouga/LlamaFactory","https://github.com/hiyouga/LlamaFactory","he-yufeng/CoreCoder","https://github.com/he-yufeng/CoreCoder","he-yufeng","Python","658","llm","0","714.29","False","0.0714","0","1","0","1","1","0.3333","topic:deepseek language:Python stars:>=50","Minimal AI coding agent (~1,400 LoC Python) inspired by Claude Code. Works with any LLM. Think NanoGPT for coding agents. Formerly NanoCoder."
"hiyouga/LlamaFactory","https://github.com/hiyouga/LlamaFactory","rasbt/LLMs-from-scratch","https://github.com/rasbt/LLMs-from-scratch","rasbt","Jupyter Notebook","91844","llm","0","710.3","False","0.1613","0","0","0.9436","1","1","0.3333","topic:llm stars:>=100","Implement a ChatGPT-like LLM in PyTorch from scratch, step by step"
"hiyouga/LlamaFactory","https://github.com/hiyouga/LlamaFactory","NVIDIA/Model-Optimizer","https://github.com/NVIDIA/Model-Optimizer","NVIDIA","Python","2594","llm","0","699.33","False","0","0","1","0.2819","1","1","0.3333","unified language:Python stars:>=50","A unified library of SOTA model optimization techniques like quantization, pruning, distillation, speculative decoding, etc. It compresses deep learning models for downstream deployment frameworks like TensorRT-LLM, TensorRT, vLLM, etc. to optimize inference speed."
"hiyouga/LlamaFactory","https://github.com/hiyouga/LlamaFactory","OFA-Sys/OFA","https://github.com/OFA-Sys/OFA","OFA-Sys","Python","2558","llm","0","698.8","False","0","0","1","0.2789","1","1","0.3333","unified language:Python stars:>=50","Official repository of OFA (ICML 2022). Paper: OFA: Unifying Architectures, Tasks, and Modalities Through a Simple Sequence-to-Sequence Learning Framework"
"hiyouga/LlamaFactory","https://github.com/hiyouga/LlamaFactory","bolna-ai/bolna","https://github.com/bolna-ai/bolna","bolna-ai","Python","635","llm","0","698.65","False","0.0541","0","1","0","1","1","0.3333","topic:deepseek language:Python stars:>=50","Conversational voice AI agents"
