"AnchorRepo","AnchorUrl","CandidateRepo","CandidateUrl","CandidateOwner","CandidateLanguage","CandidateStars","CandidateSubdomain","Rank","Score","Qualified","TopicJaccard","LexicalJaccard","LanguageMatch","StarSimilarity","RecencySimilarity","SubdomainMatch","QueryCoverage","SourceQueries","Description"
"hiyouga/LlamaFactory","https://github.com/hiyouga/LlamaFactory","aledipa/Free-GPT4-WEB-API","https://github.com/aledipa/Free-GPT4-WEB-API","aledipa","Python","694","llm","0","697.37","False","0.0526","0","1","0","1","1","0.3333","topic:deepseek language:Python stars:>=50","Not just GPT4! Easy to use, Self-Hosted, Unlimited and Free WEB API of the latest A.I. like Gemini, DeepSeek, Claude and GPT"
"hiyouga/LlamaFactory","https://github.com/hiyouga/LlamaFactory","uptrain-ai/uptrain","https://github.com/uptrain-ai/uptrain","uptrain-ai","Python","2346","llm","0","695.52","False","0","0","1","0.2601","1","1","0.3333","unified language:Python stars:>=50","UpTrain is an open-source unified platform to evaluate and improve Generative AI applications. We provide grades for 20+ preconfigured checks (covering language, code, embedding use-cases), perform root cause analysis on failure cases and give insights on how to resolve them."
"hiyouga/LlamaFactory","https://github.com/hiyouga/LlamaFactory","weiwill88/Local_Pdf_Chat_RAG","https://github.com/weiwill88/Local_Pdf_Chat_RAG","weiwill88","Python","890","llm","0","692.04","False","0.037","0","1","0.0498","1","1","0.3333","topic:deepseek language:Python stars:>=50","🧠 纯原生 Python 实现的 RAG 框架 | FAISS + BM25 混合检索 | 支持 Ollama / SiliconFlow | 适合新手入门学习"
"hiyouga/LlamaFactory","https://github.com/hiyouga/LlamaFactory","jd-opensource/JoyAI-Image","https://github.com/jd-opensource/JoyAI-Image","jd-opensource","Python","2094","llm","0","691.2","False","0","0","1","0.2354","1","1","0.3333","unified language:Python stars:>=50","JoyAI-Image is the unified multimodal foundation model for image understanding, text-to-image generation, and instruction-guided image editing."
"hiyouga/LlamaFactory","https://github.com/hiyouga/LlamaFactory","MarCmcbri1982/KawaiiGPT","https://github.com/MarCmcbri1982/KawaiiGPT","MarCmcbri1982","Python","841","llm","0","679.64","False","0.0256","0","1","0.0375","1","1","0.3333","topic:deepseek language:Python stars:>=50","KawaiiGPT — Open-source LLM gateway accessing DeepSeek, Gemini, and Kimi-K2 through reverse-engineered Pollinations API with no API keys required, built-in prompt injection capabilities for security research, Termux/Linux native support, and Rich console interface"
"hiyouga/LlamaFactory","https://github.com/hiyouga/LlamaFactory","oraios/serena","https://github.com/oraios/serena","oraios","Python","23750","editor","0","668.47","False","0.0667","0","1","0.7627","1","0","0.6667","topic:agent language:Python stars:>=50 | topic:ai language:Python stars:>=50","A powerful MCP toolkit for coding, providing semantic retrieval and editing capabilities  - the IDE for your agent"
"hiyouga/LlamaFactory","https://github.com/hiyouga/LlamaFactory","hacksider/Deep-Live-Cam","https://github.com/hacksider/Deep-Live-Cam","hacksider","Python","92573","computer-vision","0","664.16","False","0.027","0","1","0.9419","1","0","0.6667","topic:ai language:Python stars:>=50 | l language:Python stars:>=50","real time face swap and one-click video deepfake with only a single image"
"hiyouga/LlamaFactory","https://github.com/hiyouga/LlamaFactory","Lightning-AI/pytorch-lightning","https://github.com/Lightning-AI/pytorch-lightning","Lightning-AI","Python","31102","deep-learning","0","653.33","False","0.0385","0","1","0.8212","1","0","0.6667","topic:ai language:Python stars:>=50 | l language:Python stars:>=50","Pretrain, finetune ANY AI model of ANY size on 1 or 10,000+ GPUs with zero code changes."
"hiyouga/LlamaFactory","https://github.com/hiyouga/LlamaFactory","langgenius/dify","https://github.com/langgenius/dify","langgenius","TypeScript","139924","llm","0","649.14","False","0.1111","0","0","0.8522","1","1","0.3333","topic:llm stars:>=100","Production-ready platform for agentic workflow development."
"hiyouga/LlamaFactory","https://github.com/hiyouga/LlamaFactory","Mintplex-Labs/anything-llm","https://github.com/Mintplex-Labs/anything-llm","Mintplex-Labs","JavaScript","59434","llm","0","643.32","False","0.0833","0","0","0.9619","1","1","0.3333","topic:llm stars:>=100","The all-in-one AI productivity accelerator. On device and privacy first with no annoying setup or configuration."
"hiyouga/LlamaFactory","https://github.com/hiyouga/LlamaFactory","mudler/LocalAI","https://github.com/mudler/LocalAI","mudler","Go","46016","llm","0","635.74","False","0.0857","0","0","0.9063","1","1","0.3333","topic:llm stars:>=100","LocalAI is the open-source AI engine. Run any model - LLMs, vision, voice, image, video - on any hardware. No GPU required."
"hiyouga/LlamaFactory","https://github.com/hiyouga/LlamaFactory","jeecgboot/JeecgBoot","https://github.com/jeecgboot/JeecgBoot","jeecgboot","Java","46069","llm","0","631.62","False","0.0811","0","0","0.9065","1","1","0.3333","topic:llm stars:>=100","AI低代码平台，支持「低代码 + 零代码」双模式：零代码 5 分钟搭建业务系统，低代码模式一键生成前后端代码。 内置AI 应用，支持AI聊天、知识库、流程编排、MCP与插件，支持各种模型。Skills能力实现：一句话画流程图、设计表单、生成系统。 引领 AI生成→在线配置→代码生成→手工合并的开发模式，解决Java项目80%的重复工作，快速提高效率，又不失灵活性。"
"hiyouga/LlamaFactory","https://github.com/hiyouga/LlamaFactory","shareAI-lab/learn-claude-code","https://github.com/shareAI-lab/learn-claude-code","shareAI-lab","TypeScript","57867","llm","0","631.59","False","0.0714","0","0","0.9561","1","1","0.3333","topic:llm stars:>=100","Bash is all you need -  A nano claude code–like 「agent harness」, built from 0 to 1"
"hiyouga/LlamaFactory","https://github.com/hiyouga/LlamaFactory","asgeirtj/system_prompts_leaks","https://github.com/asgeirtj/system_prompts_leaks","asgeirtj","","39399","llm","0","629.84","False","0.0857","0","0","0.8726","1","1","0.3333","topic:llm stars:>=100","Extracted system prompts from ChatGPT (GPT-5.5 Thinking), Claude (Opus 4.7, Opus 4.6, Sonnet 4.6, Claude Code), Gemini (3.1 Pro, 3 Flash, Gemini CLI), Grok (4.3 beta), Perplexity, and more. Updated regularly."
"hiyouga/LlamaFactory","https://github.com/hiyouga/LlamaFactory","OpenBB-finance/OpenBB","https://github.com/OpenBB-finance/OpenBB","OpenBB-finance","Python","66899","reinforcement","0","625.95","False","0.0312","0","1","0.9875","1","0","0.3333","topic:ai language:Python stars:>=50","Financial data platform for analysts, quants and AI agents."
"hiyouga/LlamaFactory","https://github.com/hiyouga/LlamaFactory","janhq/jan","https://github.com/janhq/jan","janhq","TypeScript","42339","llm","0","624.67","False","0.0769","0","0","0.8882","1","1","0.3333","topic:llm stars:>=100","Jan is an open source alternative to ChatGPT that runs 100% offline on your computer."
"hiyouga/LlamaFactory","https://github.com/hiyouga/LlamaFactory","github/spec-kit","https://github.com/github/spec-kit","github","Python","92229","","0","624.59","False","0.0385","0","1","0.9427","1","0","0.3333","topic:ai language:Python stars:>=50","💫 Toolkit to help you get started with Spec-Driven Development"
"hiyouga/LlamaFactory","https://github.com/hiyouga/LlamaFactory","explosion/spaCy","https://github.com/explosion/spaCy","explosion","Python","33539","deep-learning","0","623.01","False","0.0571","0","1","0.8376","1","0","0.3333","topic:ai language:Python stars:>=50","💫 Industrial-strength Natural Language Processing (NLP) in Python"
"hiyouga/LlamaFactory","https://github.com/hiyouga/LlamaFactory","agent0ai/agent-zero","https://github.com/agent0ai/agent-zero","agent0ai","Python","17490","reinforcement","0","621.84","False","0.0833","0","1","0.6962","1","0","0.3333","topic:agent language:Python stars:>=50","Agent Zero AI framework"
"hiyouga/LlamaFactory","https://github.com/hiyouga/LlamaFactory","docling-project/docling","https://github.com/docling-project/docling","docling-project","Python","59031","","0","619.54","False","0.0294","0","1","0.9604","1","0","0.3333","topic:ai language:Python stars:>=50","Get your documents ready for gen AI"
"hiyouga/LlamaFactory","https://github.com/hiyouga/LlamaFactory","Comfy-Org/ComfyUI","https://github.com/Comfy-Org/ComfyUI","Comfy-Org","Python","111128","deep-learning","0","618.89","False","0.04","0","1","0.9023","1","0","0.3333","topic:ai language:Python stars:>=50","The most powerful and modular diffusion model GUI, api and backend with a graph/nodes interface."
"hiyouga/LlamaFactory","https://github.com/hiyouga/LlamaFactory","agno-agi/agno","https://github.com/agno-agi/agno","agno-agi","Python","39879","reinforcement","0","615.66","False","0.0417","0","1","0.8752","1","0","0.3333","topic:ai language:Python stars:>=50","Run agents as production software."
"hiyouga/LlamaFactory","https://github.com/hiyouga/LlamaFactory","babysor/MockingBird","https://github.com/babysor/MockingBird","babysor","Python","36901","deep-learning","0","611.21","False","0.04","0","1","0.8584","1","0","0.3333","topic:ai language:Python stars:>=50","🚀Clone a voice in 5 seconds to generate arbitrary speech in real-time"
"hiyouga/LlamaFactory","https://github.com/hiyouga/LlamaFactory","hpcaitech/ColossalAI","https://github.com/hpcaitech/ColossalAI","hpcaitech","Python","41374","deep-learning","0","608.59","False","0.0323","0","1","0.8832","1","0","0.3333","topic:ai language:Python stars:>=50","Making large AI models cheaper, faster and more accessible"
"hiyouga/LlamaFactory","https://github.com/hiyouga/LlamaFactory","hankcs/HanLP","https://github.com/hankcs/HanLP","hankcs","Python","36289","nlp","0","607.91","False","0.037","0","1","0.8547","1","0","0.3333","l language:Python stars:>=50","中文分词 词性标注 命名实体识别 依存句法分析 成分句法分析 语义依存分析 语义角色标注 指代消解 风格转换 语义相似度 新词发现 关键词短语提取 自动摘要 文本分类聚类 拼音简繁转换 自然语言处理"
"hiyouga/LlamaFactory","https://github.com/hiyouga/LlamaFactory","firecrawl/firecrawl","https://github.com/firecrawl/firecrawl","firecrawl","TypeScript","114393","llm","0","605.44","False","0.0541","0","0","0.896","1","1","0.3333","topic:llm stars:>=100","🔥 The API to search, scrape, and interact with the web for AI"
"hiyouga/LlamaFactory","https://github.com/hiyouga/LlamaFactory","upstash/context7","https://github.com/upstash/context7","upstash","TypeScript","54325","llm","0","604.04","False","0.0435","0","0","0.9423","1","1","0.3333","topic:llm stars:>=100","Context7 Platform -- Up-to-date code documentation for LLMs and AI code editors"
"hiyouga/LlamaFactory","https://github.com/hiyouga/LlamaFactory","zai-org/Open-AutoGLM","https://github.com/zai-org/Open-AutoGLM","zai-org","Python","25163","reinforcement","0","603.52","False","0.0476","0","1","0.7752","1","0","0.3333","topic:agent language:Python stars:>=50","An Open Phone Agent Model & Framework. Unlocking the AI Phone for Everyone"
"hiyouga/LlamaFactory","https://github.com/hiyouga/LlamaFactory","D4Vinci/Scrapling","https://github.com/D4Vinci/Scrapling","D4Vinci","Python","42090","","0","603.29","False","0.0256","0","1","0.8869","1","0","0.3333","topic:ai language:Python stars:>=50","🕷️ An adaptive Web Scraping framework that handles everything from a single request to a full-scale crawl!"
"hiyouga/LlamaFactory","https://github.com/hiyouga/LlamaFactory","facefusion/facefusion","https://github.com/facefusion/facefusion","facefusion","Python","28121","","0","599.5","False","0.0385","0","1","0.7994","1","0","0.3333","topic:ai language:Python stars:>=50","Industry leading face manipulation platform"
"hiyouga/LlamaFactory","https://github.com/hiyouga/LlamaFactory","scikit-learn/scikit-learn","https://github.com/scikit-learn/scikit-learn","scikit-learn","Python","65969","data-science","0","597.29","False","0","0","1","0.9845","1","0","0.3333","l language:Python stars:>=50","scikit-learn: machine learning in Python"
"hiyouga/LlamaFactory","https://github.com/hiyouga/LlamaFactory","d2l-ai/d2l-zh","https://github.com/d2l-ai/d2l-zh","d2l-ai","Python","77593","deep-learning","0","596.54","False","0","0","1","0.9803","1","0","0.3333","l language:Python stars:>=50","《动手学深度学习》：面向中文读者、能运行、可讨论。中英文版被70多个国家的500多所大学用于教学。"
"hiyouga/LlamaFactory","https://github.com/hiyouga/LlamaFactory","langchain-ai/deepagents","https://github.com/langchain-ai/deepagents","langchain-ai","Python","22145","reinforcement","0","594.94","False","0.0435","0","1","0.7475","1","0","0.3333","topic:ai language:Python stars:>=50","Agent harness built with LangChain and LangGraph. Equipped with a planning tool, a filesystem backend, and the ability to spawn subagents - well-equipped to handle complex agentic tasks."
"hiyouga/LlamaFactory","https://github.com/hiyouga/LlamaFactory","AUTOMATIC1111/stable-diffusion-webui","https://github.com/AUTOMATIC1111/stable-diffusion-webui","AUTOMATIC1111","Python","162698","deep-learning","0","594.12","False","0.0286","0","1","0.8195","1","0","0.3333","topic:ai language:Python stars:>=50","Stable Diffusion web UI"
"hiyouga/LlamaFactory","https://github.com/hiyouga/LlamaFactory","meta-llama/llama","https://github.com/meta-llama/llama","meta-llama","Python","59382","","0","593.29","False","0","0","1","0.9617","1","0","0.3333","l language:Python stars:>=50","Inference code for Llama models"
"hiyouga/LlamaFactory","https://github.com/hiyouga/LlamaFactory","camel-ai/owl","https://github.com/camel-ai/owl","camel-ai","Python","19728","reinforcement","0","588.92","False","0.0417","0","1","0.7224","1","0","0.3333","topic:agent language:Python stars:>=50","🦉 OWL: Optimized Workforce Learning for General Multi-Agent Assistance in Real-World Task Automation"
"hiyouga/LlamaFactory","https://github.com/hiyouga/LlamaFactory","yuruotong1/autoMate","https://github.com/yuruotong1/autoMate","yuruotong1","Python","3908","reinforcement","0","586.33","False","0.1071","0","1","0.3709","1","0","0.3333","topic:deepseek language:Python stars:>=50","Like Manus, Computer Use Agent(CUA) and Omniparser, we are computer-using agents.AI-driven local automation assistant that uses natural language to make computers work by themselves"
"hiyouga/LlamaFactory","https://github.com/hiyouga/LlamaFactory","minimaxir/big-list-of-naughty-strings","https://github.com/minimaxir/big-list-of-naughty-strings","minimaxir","Python","47631","","0","584.91","False","0","0","1","0.9138","1","0","0.3333","l language:Python stars:>=50","The Big List of Naughty Strings is a list of strings which have a high probability of causing issues when used as user-input data."
"hiyouga/LlamaFactory","https://github.com/hiyouga/LlamaFactory","rtk-ai/rtk","https://github.com/rtk-ai/rtk","rtk-ai","Rust","40236","llm","0","581.63","False","0.0312","0","0","0.8771","1","1","0.3333","topic:llm stars:>=100","CLI proxy that reduces LLM token consumption by 60-90% on common dev commands. Single Rust binary, zero dependencies"
"hiyouga/LlamaFactory","https://github.com/hiyouga/LlamaFactory","milvus-io/milvus","https://github.com/milvus-io/milvus","milvus-io","Go","44098","llm","0","581.31","False","0.027","0","0","0.897","1","1","0.3333","topic:llm stars:>=100","Milvus is a high-performance, cloud-native vector database built for scalable vector ANN search"
"hiyouga/LlamaFactory","https://github.com/hiyouga/LlamaFactory","affaan-m/everything-claude-code","https://github.com/affaan-m/everything-claude-code","affaan-m","JavaScript","172283","llm","0","574.57","False","0.037","0","0","0.807","1","1","0.3333","topic:llm stars:>=100","The agent harness performance optimization system. Skills, instincts, memory, security, and research-first development for Claude Code, Codex, Opencode, Cursor and beyond."
"hiyouga/LlamaFactory","https://github.com/hiyouga/LlamaFactory","ItzCrazyKns/Vane","https://github.com/ItzCrazyKns/Vane","ItzCrazyKns","TypeScript","34115","llm","0","574.5","False","0.0303","0","0","0.8413","1","1","0.3333","topic:llm stars:>=100","Vane is an AI-powered answering engine."
"hiyouga/LlamaFactory","https://github.com/hiyouga/LlamaFactory","Ebazhanov/linkedin-skill-assessments-quizzes","https://github.com/Ebazhanov/linkedin-skill-assessments-quizzes","Ebazhanov","Python","28729","","0","565.7","False","0","0","1","0.804","1","0","0.3333","l language:Python stars:>=50","Full reference of LinkedIn answers 2024 for skill assessments (aws-lambda, rest-api, javascript, react, git, html, jquery, mongodb, java, Go, python, machine-learning, power-point) linkedin excel test lösungen, linkedin machine learning test LinkedIn test questions and answers "
"hiyouga/LlamaFactory","https://github.com/hiyouga/LlamaFactory","locustio/locust","https://github.com/locustio/locust","locustio","Python","27749","","0","564.38","False","0","0","1","0.7965","1","0","0.3333","l language:Python stars:>=50","Write scalable load tests in plain Python 🚗💨"
"hiyouga/LlamaFactory","https://github.com/hiyouga/LlamaFactory","WZMIAOMIAO/deep-learning-for-image-processing","https://github.com/WZMIAOMIAO/deep-learning-for-image-processing","WZMIAOMIAO","Python","26228","deep-learning","0","562.24","False","0","0","1","0.7842","1","0","0.3333","l language:Python stars:>=50","deep learning for image processing including classification and object-detection etc."
"hiyouga/LlamaFactory","https://github.com/hiyouga/LlamaFactory","ErlichLiu/DeepClaude","https://github.com/ErlichLiu/DeepClaude","ErlichLiu","Python","2789","","0","558.9","False","0.0909","0","1","0.2976","1","0","0.3333","topic:deepseek language:Python stars:>=50","Unleash Next-Level AI! 🚀  💻 Code Generation: DeepSeek r1 + Claude 3.7 Sonnet - Unparalleled Performance! 📝 Content Creation: DeepSeek r1 + Gemini 2.5 Pro - Superior Quality! 🔌 OpenAI-Compatible. 🌊 Streaming & Non-Streaming Support.  ✨ Experience the Future of AI – Today! Click to Try Now! ✨"
"hiyouga/LlamaFactory","https://github.com/hiyouga/LlamaFactory","Delgan/loguru","https://github.com/Delgan/loguru","Delgan","Python","23850","","0","558.63","False","0","0","1","0.7636","1","0","0.3333","l language:Python stars:>=50","Python logging made (stupidly) simple"
"hiyouga/LlamaFactory","https://github.com/hiyouga/LlamaFactory","huggingface/lerobot","https://github.com/huggingface/lerobot","huggingface","Python","23709","","0","558.4","False","0","0","1","0.7623","1","0","0.3333","l language:Python stars:>=50","🤗 LeRobot: Making AI for Robotics more accessible with end-to-end learning"
"hiyouga/LlamaFactory","https://github.com/hiyouga/LlamaFactory","wistbean/learn_python3_spider","https://github.com/wistbean/learn_python3_spider","wistbean","Python","21623","editor","0","554.9","False","0","0","1","0.7423","1","0","0.3333","l language:Python stars:>=50","python爬虫教程系列、从0到1学习python爬虫，包括浏览器抓包，手机APP抓包，如 fiddler、mitmproxy，各种爬虫涉及的模块的使用，如：requests、beautifulSoup、selenium、appium、scrapy等，以及IP代理，验证码识别，Mysql，MongoDB数据库的python使用，多线程多进程爬虫的使用，css 爬虫加密逆向破解，JS爬虫逆向，分布式爬虫，爬虫项目实战实例等"
"hiyouga/LlamaFactory","https://github.com/hiyouga/LlamaFactory","aden-hive/hive","https://github.com/aden-hive/hive","aden-hive","Python","10208","reinforcement","0","553.65","False","0.0303","0","1","0.5793","1","0","0.3333","topic:agent language:Python stars:>=50","Multi-Agent Harness for Production AI"
"hiyouga/LlamaFactory","https://github.com/hiyouga/LlamaFactory","sktime/sktime","https://github.com/sktime/sktime","sktime","Python","9752","computer-vision","0","551.12","False","0.0294","0","1","0.5694","1","0","0.3333","unified language:Python stars:>=50","A unified framework for machine learning with time series"
"hiyouga/LlamaFactory","https://github.com/hiyouga/LlamaFactory","spotify/luigi","https://github.com/spotify/luigi","spotify","Python","18711","mlops","0","549.41","False","0","0","1","0.7109","1","0","0.3333","l language:Python stars:>=50","Luigi is a Python module that helps you build complex pipelines of batch jobs. It handles dependency resolution, workflow management, visualization etc. It also comes with Hadoop support built in. "
"hiyouga/LlamaFactory","https://github.com/hiyouga/LlamaFactory","MiroMindAI/MiroThinker","https://github.com/MiroMindAI/MiroThinker","MiroMindAI","Python","8191","reinforcement","0","549.05","False","0.0345","0","1","0.5315","1","0","0.3333","topic:agent language:Python stars:>=50","MiroThinker is a deep research agent optimized for complex research and prediction tasks. Our latest models, MiroThinker-1.7, achieves 74.0 and 75.3 on the BrowseComp and BrowseComp Zh, respectively."
"hiyouga/LlamaFactory","https://github.com/hiyouga/LlamaFactory","KlingAIResearch/LivePortrait","https://github.com/KlingAIResearch/LivePortrait","KlingAIResearch","Python","18249","computer-vision","0","548.46","False","0","0","1","0.7055","1","0","0.3333","l language:Python stars:>=50","Bring portraits to life!"
"hiyouga/LlamaFactory","https://github.com/hiyouga/LlamaFactory","dortania/OpenCore-Legacy-Patcher","https://github.com/dortania/OpenCore-Legacy-Patcher","dortania","Python","17315","","0","546.46","False","0","0","1","0.6941","1","0","0.3333","l language:Python stars:>=50","Experience macOS just like before"
"hiyouga/LlamaFactory","https://github.com/hiyouga/LlamaFactory","Huanshere/VideoLingo","https://github.com/Huanshere/VideoLingo","Huanshere","Python","16941","nlp","0","545.63","False","0","0","1","0.6893","1","0","0.3333","l language:Python stars:>=50","Netflix-level subtitle cutting, translation, alignment, and even dubbing - one-click fully automated AI video subtitle team | Netflix级字幕切割、翻译、对齐、甚至加上配音，一键全自动视频搬运AI字幕组"
"hiyouga/LlamaFactory","https://github.com/hiyouga/LlamaFactory","wzdnzd/harvester","https://github.com/wzdnzd/harvester","wzdnzd","Python","549","","0","542.39","False","0.1304","0","1","0","1","0","0.3333","topic:deepseek language:Python stars:>=50","Intelligent data acquisition framework for GitHub and web sources"
"hiyouga/LlamaFactory","https://github.com/hiyouga/LlamaFactory","nesquena/hermes-webui","https://github.com/nesquena/hermes-webui","nesquena","Python","5441","reinforcement","0","539.97","False","0.0417","0","1","0.4427","1","0","0.3333","topic:agent language:Python stars:>=50","Hermes WebUI: The best way to use Hermes Agent from the web or from your phone!"
"hiyouga/LlamaFactory","https://github.com/hiyouga/LlamaFactory","andrewyng/aisuite","https://github.com/andrewyng/aisuite","andrewyng","Python","13749","editor","0","537.7","False","0","0","1","0.644","1","0","0.3333","unified language:Python stars:>=50","Simple, unified interface to multiple Generative AI providers "
"hiyouga/LlamaFactory","https://github.com/hiyouga/LlamaFactory","Ucas-HaoranWei/GOT-OCR2.0","https://github.com/Ucas-HaoranWei/GOT-OCR2.0","Ucas-HaoranWei","Python","8116","computer-vision","0","517.67","False","0","0","1","0.5295","1","0","0.3333","unified language:Python stars:>=50","Official code implementation of General OCR Theory:  Towards OCR-2.0 via a Unified End-to-end Model"
"hiyouga/LlamaFactory","https://github.com/hiyouga/LlamaFactory","py-why/dowhy","https://github.com/py-why/dowhy","py-why","Python","8097","data-science","0","517.58","False","0","0","1","0.529","1","0","0.3333","unified language:Python stars:>=50","DoWhy is a Python library for causal inference that supports explicit modeling and testing of causal assumptions. DoWhy is based on a unified language for causal inference, combining causal graphical models and potential outcomes frameworks. "
"hiyouga/LlamaFactory","https://github.com/hiyouga/LlamaFactory","isaac-sim/IsaacLab","https://github.com/isaac-sim/IsaacLab","isaac-sim","Python","7080","","0","512.48","False","0","0","1","0.4999","1","0","0.3333","unified language:Python stars:>=50","Unified framework for robot learning built on NVIDIA Isaac Sim"
"hiyouga/LlamaFactory","https://github.com/hiyouga/LlamaFactory","batrachianai/toad","https://github.com/batrachianai/toad","batrachianai","Python","2998","reinforcement","0","511.97","False","0.0357","0","1","0.3133","1","0","0.3333","unified language:Python stars:>=50","A unified interface for AI in your terminal."
"hiyouga/LlamaFactory","https://github.com/hiyouga/LlamaFactory","Gozargah/Marzban","https://github.com/Gozargah/Marzban","Gozargah","Python","6622","","0","509.94","False","0","0","1","0.4854","1","0","0.3333","unified language:Python stars:>=50","Unified GUI Censorship Resistant Solution Powered by Xray"
"hiyouga/LlamaFactory","https://github.com/hiyouga/LlamaFactory","ByteDance-Seed/Bagel","https://github.com/ByteDance-Seed/Bagel","ByteDance-Seed","Python","5885","","0","505.46","False","0","0","1","0.4597","1","0","0.3333","unified language:Python stars:>=50","Open-source unified multimodal model"
"hiyouga/LlamaFactory","https://github.com/hiyouga/LlamaFactory","Layout-Parser/layout-parser","https://github.com/Layout-Parser/layout-parser","Layout-Parser","Python","5729","deep-learning","0","504.43","False","0","0","1","0.4539","1","0","0.3333","unified language:Python stars:>=50","A Unified Toolkit for Deep Learning Based Document Image Analysis"
