"AnchorRepo","AnchorUrl","CandidateRepo","CandidateUrl","CandidateOwner","CandidateLanguage","CandidateStars","CandidateSubdomain","Rank","Score","Qualified","TopicJaccard","LexicalJaccard","LanguageMatch","StarSimilarity","RecencySimilarity","SubdomainMatch","QueryCoverage","SourceQueries","Description"
"hiyouga/LlamaFactory","https://github.com/hiyouga/LlamaFactory","BigBodyCobain/Shadowbroker","https://github.com/BigBodyCobain/Shadowbroker","BigBodyCobain","Python","5620","computer-vision","0","503.7","False","0","0","1","0.4497","1","0","0.3333","unified language:Python stars:>=50","Open-source intelligence for the global theater. Track everything from the corporate/private jets of the wealthy, and spy satellites, to seismic events in one unified interface. The knowledge is available to all but rarely aggregated in the open, until now."
"hiyouga/LlamaFactory","https://github.com/hiyouga/LlamaFactory","RUCAIBox/RecBole","https://github.com/RUCAIBox/RecBole","RUCAIBox","Python","4414","deep-learning","0","494.53","False","0","0","1","0.3973","1","0","0.3333","unified language:Python stars:>=50","A unified, comprehensive and efficient recommendation library"
"hiyouga/LlamaFactory","https://github.com/hiyouga/LlamaFactory","FedML-AI/FedML","https://github.com/FedML-AI/FedML","FedML-AI","Python","4043","deep-learning","0","491.19","False","0","0","1","0.3782","1","0","0.3333","unified language:Python stars:>=50","FEDML - The unified and scalable ML library for large-scale distributed training, model serving, and federated learning. FEDML Launch, a cross-cloud scheduler, further enables running any AI jobs on any GPU cloud or on-premise cluster. Built on this library, TensorOpera AI (https://TensorOpera.ai) is your generative AI platform at scale."
"hiyouga/LlamaFactory","https://github.com/hiyouga/LlamaFactory","open-mmlab/mmtracking","https://github.com/open-mmlab/mmtracking","open-mmlab","Python","3879","computer-vision","0","489.62","False","0","0","1","0.3692","1","0","0.3333","unified language:Python stars:>=50","OpenMMLab Video Perception Toolbox. It supports Video Object Detection (VID), Multiple Object Tracking (MOT), Single Object Tracking (SOT), Video Instance Segmentation (VIS) with a unified framework."
"hiyouga/LlamaFactory","https://github.com/hiyouga/LlamaFactory","coala/coala","https://github.com/coala/coala","coala","Python","3593","editor","0","486.71","False","0","0","1","0.3526","1","0","0.3333","unified language:Python stars:>=50","coala provides a unified command-line interface for linting and fixing all your code, regardless of the programming languages you use."
"hiyouga/LlamaFactory","https://github.com/hiyouga/LlamaFactory","Tencent-Hunyuan/Hunyuan3D-1","https://github.com/Tencent-Hunyuan/Hunyuan3D-1","Tencent-Hunyuan","Python","3476","computer-vision","0","485.45","False","0","0","1","0.3454","1","0","0.3333","unified language:Python stars:>=50","Tencent Hunyuan3D-1.0: A Unified Framework for Text-to-3D and Image-to-3D Generation"
"hiyouga/LlamaFactory","https://github.com/hiyouga/LlamaFactory","hao-ai-lab/FastVideo","https://github.com/hao-ai-lab/FastVideo","hao-ai-lab","Python","3449","editor","0","485.15","False","0","0","1","0.3437","1","0","0.3333","unified language:Python stars:>=50","A unified inference and post-training framework for accelerated video generation."
"hiyouga/LlamaFactory","https://github.com/hiyouga/LlamaFactory","XinJingHao/DRL-Pytorch","https://github.com/XinJingHao/DRL-Pytorch","XinJingHao","Python","3377","deep-learning","0","484.35","False","0","0","1","0.3392","1","0","0.3333","unified language:Python stars:>=50","Clean, Robust, and Unified PyTorch implementation of popular Deep Reinforcement Learning (DRL) algorithms (Q-learning, Duel DDQN, PER, C51, Noisy DQN, PPO, DDPG, TD3, SAC, ASL)"
"hiyouga/LlamaFactory","https://github.com/hiyouga/LlamaFactory","Open-Wine-Components/umu-launcher","https://github.com/Open-Wine-Components/umu-launcher","Open-Wine-Components","Python","3272","","0","483.15","False","0","0","1","0.3323","1","0","0.3333","unified language:Python stars:>=50","Unified launcher for Windows games on Linux"
"hiyouga/LlamaFactory","https://github.com/hiyouga/LlamaFactory","NVlabs/FoundationPose","https://github.com/NVlabs/FoundationPose","NVlabs","Python","3152","mlops","0","481.73","False","0","0","1","0.3242","1","0","0.3333","unified language:Python stars:>=50","[CVPR 2024 Highlight] FoundationPose: Unified 6D Pose Estimation and Tracking of Novel Objects"
"hiyouga/LlamaFactory","https://github.com/hiyouga/LlamaFactory","mars-project/mars","https://github.com/mars-project/mars","mars-project","Python","2743","deep-learning","0","476.45","False","0","0","1","0.294","1","0","0.3333","unified language:Python stars:>=50","Mars is a tensor-based unified framework for large-scale data computation which scales numpy, pandas, scikit-learn and Python functions."
"hiyouga/LlamaFactory","https://github.com/hiyouga/LlamaFactory","secretflow/secretflow","https://github.com/secretflow/secretflow","secretflow","Python","2656","mlops","0","475.23","False","0","0","1","0.287","1","0","0.3333","unified language:Python stars:>=50","A unified framework for privacy-preserving data analysis and machine learning"
"hiyouga/LlamaFactory","https://github.com/hiyouga/LlamaFactory","iPERDance/iPERCore","https://github.com/iPERDance/iPERCore","iPERDance","Python","2401","computer-vision","0","471.4","False","0","0","1","0.2651","1","0","0.3333","unified language:Python stars:>=50","Liquid Warping GAN with Attention: A Unified Framework for Human Image Synthesis"
"hiyouga/LlamaFactory","https://github.com/hiyouga/LlamaFactory","fugue-project/fugue","https://github.com/fugue-project/fugue","fugue-project","Python","2156","data-science","0","467.31","False","0","0","1","0.2418","1","0","0.3333","unified language:Python stars:>=50","A unified interface for distributed computing. Fugue executes SQL, Python, Pandas, and Polars code on Spark, Dask and Ray without any rewrites."
"hiyouga/LlamaFactory","https://github.com/hiyouga/LlamaFactory","apache/libcloud","https://github.com/apache/libcloud","apache","Python","2116","editor","0","466.6","False","0","0","1","0.2377","1","0","0.3333","unified language:Python stars:>=50","Apache Libcloud is a Python library that hides differences between different cloud provider APIs and allows you to manage different cloud resources through a unified and easy-to-use API."
"hiyouga/LlamaFactory","https://github.com/hiyouga/LlamaFactory","autonomousvision/sdfstudio","https://github.com/autonomousvision/sdfstudio","autonomousvision","Python","2107","deep-learning","0","466.43","False","0","0","1","0.2368","1","0","0.3333","unified language:Python stars:>=50","A Unified Framework for Surface Reconstruction"
"hiyouga/LlamaFactory","https://github.com/hiyouga/LlamaFactory","WongKinYiu/yolor","https://github.com/WongKinYiu/yolor","WongKinYiu","Python","2007","deep-learning","0","464.59","False","0","0","1","0.2262","1","0","0.3333","unified language:Python stars:>=50","implementation of paper - You Only Learn One Representation: Unified Network for Multiple Tasks (https://arxiv.org/abs/2105.04206)"
"hiyouga/LlamaFactory","https://github.com/hiyouga/LlamaFactory","clementchadebec/benchmark_VAE","https://github.com/clementchadebec/benchmark_VAE","clementchadebec","Python","1989","deep-learning","0","464.25","False","0","0","1","0.2243","1","0","0.3333","unified language:Python stars:>=50","Unifying Variational Autoencoder (VAE) implementations in Pytorch (NeurIPS 2022)"
"hiyouga/LlamaFactory","https://github.com/hiyouga/LlamaFactory","NVlabs/GR00T-WholeBodyControl","https://github.com/NVlabs/GR00T-WholeBodyControl","NVlabs","Python","1808","","0","460.62","False","0","0","1","0.2036","1","0","0.3333","unified language:Python stars:>=50","Welcome to GR00T Whole-Body Control (WBC)! This is a unified platform for developing and deploying advanced humanoid controllers. This includes: Decoupled WBC models used in NVIDIA Isaac-Gr00t, Gr00t N1.5 and N1.6 and GEAR-SONIC "
"hiyouga/LlamaFactory","https://github.com/hiyouga/LlamaFactory","RoboVerseOrg/RoboVerse","https://github.com/RoboVerseOrg/RoboVerse","RoboVerseOrg","Python","1727","reinforcement","0","458.88","False","0","0","1","0.1936","1","0","0.3333","unified language:Python stars:>=50","RoboVerse: Towards a Unified Platform, Dataset and Benchmark for Scalable and Generalizable Robot Learning"
"hiyouga/LlamaFactory","https://github.com/hiyouga/LlamaFactory","svip-lab/impersonator","https://github.com/svip-lab/impersonator","svip-lab","Python","1722","deep-learning","0","458.77","False","0","0","1","0.193","1","0","0.3333","unified language:Python stars:>=50","PyTorch implementation of our ICCV 2019 paper:  Liquid Warping GAN: A Unified Framework for Human Motion Imitation, Appearance Transfer and Novel View Synthesis"
"hiyouga/LlamaFactory","https://github.com/hiyouga/LlamaFactory","turningpoint-ai/VisualThinker-R1-Zero","https://github.com/turningpoint-ai/VisualThinker-R1-Zero","turningpoint-ai","Python","622","reinforcement","0","454.03","False","0.0323","0","1","0","1","0","0.3333","topic:deepseek language:Python stars:>=50","Explore the Multimodal “Aha Moment” on 2B Model"
