"FullName","Url","Owner","Language","Stars","Fork","Archived","CreatedAt","UpdatedAt","Description","Topics","SourceQueries"
"PaddlePaddle/PaddleDetection","https://github.com/PaddlePaddle/PaddleDetection","PaddlePaddle","Python","14191","False","False","10/25/2019 7:21:14 AM","5/2/2026 6:02:36 PM","Object Detection toolkit based on PaddlePaddle. It supports object detection, instance segmentation, multiple object tracking and real-time multi-person keypoint detection.","blazeface;deepsort;detr;face-detection;fairmot;faster-rcnn;fcos;human-activity-recognition;human-pose-estimation;instance-segmentation;mask-rcnn;multi-object-tracking;object-detection;picodet;pp-yolo;rt-detr;yolov3;yolov5;yolov7;yolox","track language:Python stars:>=50"
"jkkummerfeld/irc-disentanglement","https://github.com/jkkummerfeld/irc-disentanglement","jkkummerfeld","Python","60","False","False","10/13/2018 9:48:19 PM","4/26/2026 6:32:26 AM","Dataset and model for disentangling chat on IRC","dataset;dialog;dialogue;disentanglement;dynet;irc;natural-language-processing;neural-network;nlp","topic:dialogue language:Python stars:>=50"
"ictnlp/StreamSpeech","https://github.com/ictnlp/StreamSpeech","ictnlp","Python","1263","False","False","6/4/2024 8:25:10 AM","4/29/2026 11:43:18 AM","StreamSpeech is an “All in One” seamless model for offline and simultaneous speech recognition, speech translation and speech synthesis.","all-in-one;asr;audio-processing;machine-translation;non-autoregressive;seamless;simultaneous-translation;speech;speech-enhancement;speech-processing;speech-recognition;speech-synthesis;speech-to-text;speech-translation;streaming-audio;text-to-audio;text-to-speech;translation;tts;voice","topic:machine-translation language:Python stars:>=50"
"dgtlmoon/changedetection.io","https://github.com/dgtlmoon/changedetection.io","dgtlmoon","Python","31322","False","False","1/27/2021 4:03:30 PM","5/3/2026 1:41:38 PM","Best and simplest tool for website change detection, web page monitoring, and website change alerts. Perfect for tracking content changes, price drops, restock alerts, and website defacement monitoring—all for free or enjoy our SaaS plan!","back-in-stock;change-alert;change-detection;change-monitoring;monitoring;notifications;restock-monitor;rss;self-hosted;url-monitor;web-scraping;website-change-detection;website-change-detector;website-change-monitor;website-change-notification;website-change-tracker;website-defacement-monitoring;website-monitor;website-monitoring;website-watcher","track language:Python stars:>=50"
"jfainberg/self_dialogue_corpus","https://github.com/jfainberg/self_dialogue_corpus","jfainberg","Python","107","False","False","11/4/2017 6:58:52 PM","1/18/2026 8:52:04 PM","The Self-dialogue Corpus - a collection of self-dialogues across music, movies and sports","corpora;dialogue;nlp","topic:dialogue language:Python stars:>=50"
"stanfordnlp/CoreNLP","https://github.com/stanfordnlp/CoreNLP","stanfordnlp","Java","10070","False","False","6/27/2013 9:13:49 PM","5/1/2026 7:40:06 PM","CoreNLP: A Java suite of core NLP tools for tokenization, sentence segmentation, NER, parsing, coreference, sentiment analysis, etc.","named-entity-recognition;natural-language-processing;nlp;nlp-parsing;stanford-nlp","topic:nlp stars:>=100"
"Helsinki-NLP/Opus-MT","https://github.com/Helsinki-NLP/Opus-MT","Helsinki-NLP","Python","810","False","False","8/21/2019 9:05:30 PM","5/2/2026 1:46:20 PM","Open neural machine translation models and web services","language-technology;language-translation-service;machine-learning;machine-translation;natural-language-processing;neural-machine-translation;translation-interface;translation-service","topic:machine-translation language:Python stars:>=50"
"bigscience-workshop/petals","https://github.com/bigscience-workshop/petals","bigscience-workshop","Python","10112","False","False","6/12/2022 12:10:27 AM","5/3/2026 5:15:38 PM","🌸 Run LLMs at home, BitTorrent-style. Fine-tuning and inference up to 10x faster than offloading","bloom;chatbot;deep-learning;distributed-systems;falcon;gpt;guanaco;language-models;large-language-models;llama;machine-learning;mixtral;neural-networks;nlp;pipeline-parallelism;pretrained-models;pytorch;tensor-parallelism;transformer;volunteer-computing","nlp language:Python stars:>=50 | topic:nlp stars:>=100"
"roboflow/trackers","https://github.com/roboflow/trackers","roboflow","Python","3377","False","False","4/14/2025 4:12:26 PM","5/3/2026 12:23:36 PM","Trackers gives you clean, modular re-implementations of leading multi-object tracking algorithms released under the permissive Apache 2.0 license. You combine them with any detection model you already use.","bot-sort;bytetrack;dancetrack;mot17;multi-object-tracking;oc-sort;soccernet;sort;sportsmot;trackeval","track language:Python stars:>=50"
"d2l-ai/d2l-zh","https://github.com/d2l-ai/d2l-zh","d2l-ai","Python","77606","False","False","8/23/2017 4:40:24 AM","5/3/2026 6:06:54 PM","《动手学深度学习》：面向中文读者、能运行、可讨论。中英文版被70多个国家的500多所大学用于教学。","book;chinese;computer-vision;deep-learning;machine-learning;natural-language-processing;notebook;python","topic:machine-learning language:Python stars:>=50"
"lvapeab/nmt-keras","https://github.com/lvapeab/nmt-keras","lvapeab","Python","532","False","False","11/22/2016 2:04:09 PM","3/26/2026 3:09:04 AM","Neural Machine Translation with Keras ","attention-is-all-you-need;attention-mechanism;attention-model;attention-seq2seq;deep-learning;gru;keras;lstm-networks;machine-learning;machine-translation;neural-machine-translation;nmt;sequence-to-sequence;tensorflow;theano;transformer;web-demo","topic:machine-translation language:Python stars:>=50"
"AccumulateMore/CV","https://github.com/AccumulateMore/CV","AccumulateMore","Jupyter Notebook","20604","False","False","3/31/2022 1:19:32 PM","5/3/2026 4:03:58 PM","✅（已完结）超级全面的 深度学习 笔记【土堆 Pytorch】【李沐 动手学深度学习】【吴恩达 深度学习】【大飞 大模型Agent】","agent;agents;book;chinese;computer-vision;cv;deep-learning;jupyter-notebook;llm;llms;machine-learning;natural-language-processing;nlp;notebook;python;rag","topic:nlp stars:>=100"
"nwojke/deep_sort","https://github.com/nwojke/deep_sort","nwojke","Python","6133","False","False","2/4/2017 1:17:42 PM","5/3/2026 4:23:34 PM","Simple Online Realtime Tracking with a Deep Association Metric","","track language:Python stars:>=50"
"OpenNMT/OpenNMT-tf","https://github.com/OpenNMT/OpenNMT-tf","OpenNMT","Python","1484","False","False","11/2/2017 10:53:22 AM","4/21/2026 9:11:20 AM","Neural machine translation and sequence learning using TensorFlow","deep-learning;machine-translation;natural-language-processing;neural-machine-translation;opennmt;python;tensorflow","topic:machine-translation language:Python stars:>=50"
"HunxByts/GhostTrack","https://github.com/HunxByts/GhostTrack","HunxByts","Python","12521","False","False","4/15/2023 7:20:47 AM","5/3/2026 6:50:49 PM","Useful tool to track location or mobile number","cybersecurity;fyp;hacking;hacking-tool;indonesia;information;information-gathering;ip-geolocation;linux;osint;osint-python;osint-tool;pentesting;phone-number;python;python-hacking;termux;termux-hacks;termux-tool","track language:Python stars:>=50"
"THUNLP-MT/THUMT","https://github.com/THUNLP-MT/THUMT","THUNLP-MT","Python","706","False","False","6/20/2017 10:56:45 AM","4/27/2026 8:58:38 AM","An open-source neural machine translation toolkit developed by Tsinghua Natural Language Processing Group","deep-learning;machine-translation;neural-machine-translation","topic:machine-translation language:Python stars:>=50"
"SwanHubX/SwanLab","https://github.com/SwanHubX/SwanLab","SwanHubX","Python","3896","False","False","11/24/2023 8:54:45 AM","5/3/2026 2:24:00 AM","⚡️SwanLab - an open-source, modern-design AI training tracking and visualization tool. Supports Cloud / Self-hosted use. Integrated with PyTorch / Transformers / verl / LLaMA Factory / ms-swift / Ultralytics / MMEngine / Keras etc.","ai-infra;data-science;deep-learning;llm;logging;machine-learning;mlops;model-versioning;python;pytorch;tensorboard;tensorflow;tracking;training;transformers;visualization","track language:Python stars:>=50"
"AI4Finance-Foundation/FinGPT","https://github.com/AI4Finance-Foundation/FinGPT","AI4Finance-Foundation","Jupyter Notebook","19923","False","False","2/11/2023 8:21:34 PM","5/3/2026 7:02:13 PM","FinGPT: Open-Source Financial Large Language Models!  Revolutionize 🔥    We release the trained model on HuggingFace.","chatgpt;finance;fingpt;fintech;large-language-models;machine-learning;nlp;prompt-engineering;pytorch;reinforcement-learning;robo-advisor;sentiment-analysis;technical-analysis","topic:nlp stars:>=100"
"Unstructured-IO/unstructured","https://github.com/Unstructured-IO/unstructured","Unstructured-IO","HTML","14617","False","False","9/26/2022 9:53:41 PM","5/3/2026 12:53:12 PM","Convert documents to structured data effortlessly. Unstructured is open-source ETL solution for transforming complex documents into clean, structured formats for language models.  Visit our website to learn more about our enterprise grade Platform product for production grade workflows, partitioning, enrichments, chunking and embedding.","data-pipelines;deep-learning;document-image-analysis;document-image-processing;document-parser;document-parsing;docx;donut;information-retrieval;langchain;llm;machine-learning;ml;natural-language-processing;nlp;ocr;pdf;pdf-to-json;pdf-to-text;preprocessing","topic:nlp stars:>=100"
"adbar/trafilatura","https://github.com/adbar/trafilatura","adbar","Python","5863","False","False","4/8/2019 11:38:48 AM","5/3/2026 5:15:38 PM","Python & Command-line tool to gather text and metadata on the Web: Crawling, scraping, extraction, output as CSV, JSON, HTML, MD, TXT, XML","article-extractor;corpus-builder;corpus-tools;crawler;html-to-markdown;html2text;llm;news-aggregator;news-crawler;nlp;rag;readability;rss-feed;scraping;tei;text-cleaning;text-extraction;text-mining;text-preprocessing;web-scraping","nlp language:Python stars:>=50"
"nlpdata/c3","https://github.com/nlpdata/c3","nlpdata","Python","171","False","False","12/18/2019 12:22:33 AM","1/9/2026 9:43:59 AM","Investigating Prior Knowledge for Challenging Chinese Machine Reading Comprehension","dataset;dialogue;machine-reading-comprehension","topic:dialogue language:Python stars:>=50"
"MaartenGr/BERTopic","https://github.com/MaartenGr/BERTopic","MaartenGr","Python","7578","False","False","9/22/2020 2:19:29 PM","5/2/2026 3:51:51 AM","Leveraging BERT and c-TF-IDF to create easily interpretable topics. ","bert;ldavis;machine-learning;nlp;sentence-embeddings;topic;topic-modeling;topic-modelling;topic-models;transformers","nlp language:Python stars:>=50"
"ray-project/ray","https://github.com/ray-project/ray","ray-project","Python","42411","False","False","10/25/2016 7:38:30 PM","5/3/2026 6:40:53 PM","Ray is an AI compute engine. Ray consists of a core distributed runtime and a set of AI Libraries for accelerating ML workloads.","data-science;deep-learning;deployment;distributed;hyperparameter-optimization;hyperparameter-search;large-language-models;llm;llm-inference;llm-serving;machine-learning;optimization;parallel;python;pytorch;ray;reinforcement-learning;rllib;serving;tensorflow","topic:machine-learning language:Python stars:>=50"
"BerriAI/litellm","https://github.com/BerriAI/litellm","BerriAI","Python","45560","False","False","7/27/2023 12:09:52 AM","5/3/2026 6:51:07 PM","Python SDK, Proxy Server (AI Gateway) to call 100+ LLM APIs in OpenAI (or native) format, with cost tracking, guardrails, loadbalancing and logging. [Bedrock, Azure, OpenAI, VertexAI, Cohere, Anthropic, Sagemaker, HuggingFace, VLLM, NVIDIA NIM]","ai-gateway;anthropic;azure-openai;bedrock;gateway;langchain;litellm;llm;llm-gateway;llmops;mcp-gateway;openai;openai-proxy;vertex-ai","track language:Python stars:>=50"
"declare-lab/MELD","https://github.com/declare-lab/MELD","declare-lab","Python","1041","False","False","9/29/2018 1:00:10 PM","5/3/2026 2:39:36 AM","MELD: A Multimodal Multi-Party Dataset for Emotion Recognition in Conversation","chatbot;conversational-ai;dialogue;dialogue-systems;emotion;emotion-detection;emotion-recognition;emotion-recognition-in-conversation;multimodal-emotion-recognition;multimodal-interactions;multimodal-sentiment-analysis;personality-profiling;personality-traits;sentiment-analysis","topic:dialogue language:Python stars:>=50"
"deepspeedai/DeepSpeed","https://github.com/deepspeedai/DeepSpeed","deepspeedai","Python","42248","False","False","1/23/2020 6:35:18 PM","5/3/2026 6:01:59 PM","DeepSpeed is a deep learning optimization library that makes distributed training and inference easy, efficient, and effective.","billion-parameters;compression;data-parallelism;deep-learning;gpu;inference;machine-learning;mixture-of-experts;model-parallelism;pipeline-parallelism;pytorch;trillion-parameters;zero","topic:machine-learning language:Python stars:>=50"
"LAION-AI/Open-Assistant","https://github.com/LAION-AI/Open-Assistant","LAION-AI","Python","37407","False","False","12/13/2022 5:24:17 AM","5/3/2026 3:37:14 PM","OpenAssistant is a chat-based assistant that understands tasks, can interact with third-party systems, and retrieve information dynamically to do so.","ai;assistant;chatgpt;discord-bot;language-model;machine-learning;nextjs;python;rlhf","topic:machine-learning language:Python stars:>=50"
"truera/trulens","https://github.com/truera/trulens","truera","Python","3286","False","False","11/2/2020 9:56:45 PM","5/3/2026 10:06:24 AM","Evaluation and Tracking for LLM Experiments and AI Agents","agent-evaluation;agentops;ai-agents;ai-monitoring;ai-observability;evals;explainable-ml;llm-eval;llm-evaluation;llmops;llms;machine-learning;neural-networks","track language:Python stars:>=50"
"FuzzyGrim/Yamtrack","https://github.com/FuzzyGrim/Yamtrack","FuzzyGrim","Python","2638","False","False","12/9/2022 10:58:21 PM","5/3/2026 5:57:42 PM","A self hosted media tracker.","django;docker;docker-compose;media-tracker;postgresql;self-hosted;sqlite;tailwindcss","track language:Python stars:>=50"
"Shark-NLP/CoNT","https://github.com/Shark-NLP/CoNT","Shark-NLP","Python","152","False","False","5/28/2022 8:31:36 AM","1/19/2026 6:24:04 AM","[NeurIPS'22 Spotlight] Data and code for our paper CoNT: Contrastive Neural Text Generation ","contrastive-learning;generation;machine-translation;pytorch;summarization","topic:machine-translation language:Python stars:>=50"
"skywalker023/prosocial-dialog","https://github.com/skywalker023/prosocial-dialog","skywalker023","Python","65","False","False","5/15/2022 7:52:21 AM","1/9/2026 9:38:22 AM","🐥 Code and Dataset for our EMNLP 2022 paper - ""ProsocialDialog: A Prosocial Backbone for Conversational Agents""","dataset;dialogue;dialogue-systems;nlp","topic:dialogue language:Python stars:>=50"
"Tomiinek/MultiWOZ_Evaluation","https://github.com/Tomiinek/MultiWOZ_Evaluation","Tomiinek","Python","59","False","False","4/27/2021 7:14:19 PM","6/9/2025 6:50:24 AM","Unified MultiWOZ evaluation scripts for the context-to-response task.","dialogue;dialogue-systems;evaluation;natural-language-processing;task-oriented-dialogue","topic:dialogue language:Python stars:>=50"
"treeverse/dvc","https://github.com/treeverse/dvc","treeverse","Python","15576","False","False","3/4/2017 8:16:33 AM","5/3/2026 4:48:17 PM","🦉 Data Versioning and ML Experiments","ai;data-science;data-version-control;developer-tools;machine-learning;reproducibility;unstructured-data","topic:machine-learning language:Python stars:>=50"
"recommenders-team/recommenders","https://github.com/recommenders-team/recommenders","recommenders-team","Python","21666","False","False","9/19/2018 10:06:07 AM","5/3/2026 7:00:17 PM","Best Practices on Recommendation Systems","ai;artificial-intelligence;data-science;deep-learning;jupyter-notebook;kubernetes;machine-learning;operationalization;python;ranking;rating;recommendation;recommendation-algorithm;recommendation-engine;recommendation-system;recommender;tutorial","topic:machine-learning language:Python stars:>=50"
"ufal/neuralmonkey","https://github.com/ufal/neuralmonkey","ufal","Python","418","False","False","6/16/2016 10:46:43 AM","4/20/2026 1:37:51 PM","An open-source tool for sequence learning in NLP built on TensorFlow.","deep-learning;encoder-decoder;gpu;image-captioning;machine-translation;mt;neural-machine-translation;neural-networks;nlp;nmt;python;sequence-to-sequence;tensorflow","topic:machine-translation language:Python stars:>=50"
"searxng/searxng","https://github.com/searxng/searxng","searxng","Python","29348","False","False","4/12/2021 3:18:15 PM","5/3/2026 6:40:20 PM","SearXNG is a free internet metasearch engine which aggregates results from various search services and databases. Users are neither tracked nor profiled.","bing;brave;degoogle;duckduckgo;google;metasearch;privacy;python;qwant;search;search-engine;searx;searxng;startpage;yahoo","track language:Python stars:>=50"
"Lightning-AI/pytorch-lightning","https://github.com/Lightning-AI/pytorch-lightning","Lightning-AI","Python","31104","False","False","3/31/2019 12:45:57 AM","5/3/2026 1:51:48 PM","Pretrain, finetune ANY AI model of ANY size on 1 or 10,000+ GPUs with zero code changes.","ai;artificial-intelligence;data-science;deep-learning;machine-learning;python;pytorch","topic:machine-learning language:Python stars:>=50"
"uzaymacar/attention-mechanisms","https://github.com/uzaymacar/attention-mechanisms","uzaymacar","Python","379","False","False","6/19/2019 5:17:55 PM","4/25/2026 2:37:23 AM","Implementations for a family of attention mechanisms, suitable for all kinds of natural language processing tasks and compatible with TensorFlow 2.0 and Keras.","attention-mechanism;keras;keras-layer;language-model;machine-translation;many-to-many;many-to-one;natural-language-processing;natural-language-understanding;recurrent-neural-networks;sentiment-classification;sequence-to-sequence-models;tensorflow;text-generation","topic:machine-translation language:Python stars:>=50"
"stanford-oval/storm","https://github.com/stanford-oval/storm","stanford-oval","Python","28156","False","False","3/24/2024 4:23:39 PM","5/3/2026 10:07:20 AM","An LLM-powered knowledge curation system that researches a topic and generates a full-length report with citations.","agentic-rag;deep-research;emnlp2024;knowledge-curation;large-language-models;naacl;nlp;report-generation;retrieval-augmented-generation","nlp language:Python stars:>=50 | topic:nlp stars:>=100"
"jcyk/gtos","https://github.com/jcyk/gtos","jcyk","Python","191","False","False","7/16/2019 8:54:47 AM","10/23/2025 3:25:43 AM","Code for AAAI2020 paper ""Graph Transformer for Graph-to-Sequence Learning""","amr;graph-neural-networks;graph-transformer;machine-translation","topic:machine-translation language:Python stars:>=50"
"tangyudi/Ai-Learn","https://github.com/tangyudi/Ai-Learn","tangyudi","","12947","False","False","1/28/2020 1:55:06 AM","5/3/2026 10:42:10 AM","人工智能学习路线图，整理近200个实战案例与项目，免费提供配套教材，零基础入门，就业实战！包括：Python，数学，机器学习，数据分析，深度学习，计算机视觉，自然语言处理，PyTorch tensorflow machine-learning,deep-learning data-analysis data-mining mathematics data-science artificial-intelligence python tensorflow tensorflow2 caffe keras pytorch algorithm numpy pandas matplotlib seaborn nlp cv等热门领域","algorithm;artificial-intelligence;caffe;cv;data-analysis;data-mining;data-science;deep-learning;keras;machine-learning;mathematics;matplotlib;nlp;numpy;pandas;python;pytorch;seaborn;tensorflow;tensorflow2","topic:nlp stars:>=100"
"prakharguptaz/Instructdial","https://github.com/prakharguptaz/Instructdial","prakharguptaz","Python","101","False","False","5/20/2022 6:57:34 PM","4/29/2026 8:39:48 PM","Code for the paper Code for the paper InstructDial: Improving Zero and Few-shot Generalization in Dialogue through Instruction Tuning","dialogue;dialogue-generation;dialogue-system;dialogue-understanding;few-shot-learning;multitask-learning;zero-shot-learning","topic:dialogue language:Python stars:>=50"
"rsennrich/subword-nmt","https://github.com/rsennrich/subword-nmt","rsennrich","Python","2271","False","False","9/1/2015 10:50:32 AM","4/21/2026 1:15:57 AM","Unsupervised Word Segmentation for Neural Machine Translation and Text Generation","bpe;machine-translation;neural-machine-translation;nmt;segmentation;subword-units","topic:machine-translation language:Python stars:>=50"
"chunyuanY/Dialogue","https://github.com/chunyuanY/Dialogue","chunyuanY","Python","63","False","False","8/29/2019 3:25:23 AM","8/7/2025 12:24:20 PM","","dialogue;nlp","topic:dialogue language:Python stars:>=50"
"ymcui/Chinese-LLaMA-Alpaca-2","https://github.com/ymcui/Chinese-LLaMA-Alpaca-2","ymcui","Python","7149","False","False","7/18/2023 11:09:10 PM","5/2/2026 5:11:10 AM","中文LLaMA-2 & Alpaca-2大模型二期项目 + 64K超长上下文模型 (Chinese LLaMA-2 & Alpaca-2 LLMs with 64K long context models)","64k;alpaca;alpaca-2;alpaca2;flash-attention;large-language-models;llama;llama-2;llama2;llm;nlp;rlhf;yarn","nlp language:Python stars:>=50"
"neuml/txtai","https://github.com/neuml/txtai","neuml","Python","12454","False","False","8/9/2020 7:14:59 PM","5/3/2026 5:36:29 PM","💡 All-in-one AI framework for semantic search, LLM orchestration and language model workflows","agents;ai;ai-agents;embeddings;information-retrieval;language-model;large-language-models;llm;nlp;python;rag;retrieval-augmented-generation;search;search-engine;semantic-search;sentence-embeddings;transformers;txtai;vector-database;vector-search","nlp language:Python stars:>=50 | topic:nlp stars:>=100"
"cylnlp/dialogsum","https://github.com/cylnlp/dialogsum","cylnlp","Python","184","False","False","5/12/2021 10:31:17 AM","4/30/2026 2:56:24 PM","DialogSum: A Real-life Scenario Dialogue Summarization Dataset - Findings of ACL 2021","dataset;dialogue;nlp;summarization","topic:dialogue language:Python stars:>=50"
"Unbabel/COMET","https://github.com/Unbabel/COMET","Unbabel","Python","743","False","False","5/28/2020 2:59:58 PM","5/2/2026 4:54:52 AM"," A Neural Framework for MT Evaluation","artificial-intelligence;evaluation-metrics;machine-learning;machine-translation;natural-language-processing;nlp","topic:machine-translation language:Python stars:>=50"
"dair-ai/AI-Papers-of-the-Week","https://github.com/dair-ai/AI-Papers-of-the-Week","dair-ai","","12378","False","False","1/8/2023 7:26:35 PM","5/3/2026 6:52:24 PM","🔥Highlighting the top ML papers every week.","ai;data-science;deeplearning;machine-learning;nlp","topic:nlp stars:>=100"
"espnet/espnet","https://github.com/espnet/espnet","espnet","Python","9824","False","False","12/13/2017 12:45:11 AM","5/3/2026 1:20:13 PM","End-to-End Speech Processing Toolkit","chainer;deep-learning;end-to-end;kaldi;machine-translation;pytorch;singing-voice-synthesis;speaker-diarization;speech-enhancement;speech-recognition;speech-separation;speech-synthesis;speech-translation;spoken-language-understanding;text-to-speech;voice-conversion","topic:machine-translation language:Python stars:>=50"
"argosopentech/argos-translate","https://github.com/argosopentech/argos-translate","argosopentech","Python","5928","False","False","4/7/2020 4:22:23 PM","5/3/2026 3:15:04 PM","Open-source offline translation library written in Python","language-models;linux;machine-translation;nlp;open-source;python;transformers;translation","topic:machine-translation language:Python stars:>=50 | nlp language:Python stars:>=50"
"aimhubio/aim","https://github.com/aimhubio/aim","aimhubio","Python","6109","False","False","5/31/2019 6:25:07 PM","5/2/2026 1:03:44 AM","Aim 💫 — An easy-to-use & supercharged open-source experiment tracker.","ai;data-science;data-visualization;experiment-tracking;machine-learning;metadata;metadata-tracking;ml;mlflow;mlops;prompt-engineering;python;pytorch;tensorboard;tensorflow;visualization","track language:Python stars:>=50"
"666ghj/BettaFish","https://github.com/666ghj/BettaFish","666ghj","Python","40728","False","False","7/1/2024 1:11:38 PM","5/3/2026 7:01:17 PM","微舆：人人可用的多Agent舆情分析助手，打破信息茧房，还原舆情原貌，预测未来走向，辅助决策！从0实现，不依赖任何框架。","agent-framework;data-analysis;deep-research;deep-search;llms;multi-agent-system;nlp;public-opinion-analysis;python3;sentiment-analysis","nlp language:Python stars:>=50 | topic:nlp stars:>=100"
"wxjiao/ParroT","https://github.com/wxjiao/ParroT","wxjiao","Python","177","False","False","3/22/2023 3:19:42 AM","3/17/2026 10:32:55 AM","The ParroT framework to enhance and regulate the Translation Abilities during Chat based on open-sourced LLMs (e.g., LLaMA-7b, Bloomz-7b1-mt) and human written translation and evaluation data.","bloomz;chatgpt;contrastive;error-guided;gpt-4;human-feedback;instruction-tuning;llama;lora;machine-translation","topic:machine-translation language:Python stars:>=50"
"EternalFeather/Chatbot-Training-Corpus","https://github.com/EternalFeather/Chatbot-Training-Corpus","EternalFeather","Python","118","False","False","7/25/2017 6:45:21 AM","5/2/2026 6:17:21 AM","总结了一些可以用作聊天机器人训练实作的文字语聊，包含中英文不同语言","chatbot;corpus;dialogue","topic:dialogue language:Python stars:>=50"
