"FullName","Url","Owner","Language","Stars","Fork","Archived","CreatedAt","UpdatedAt","Description","Topics","SourceQueries"
"DA-southampton/NLP_ability","https://github.com/DA-southampton/NLP_ability","DA-southampton","Python","7490","False","False","6/16/2020 3:20:02 AM","5/3/2026 2:33:53 PM","总结梳理自然语言处理工程师(NLP)需要积累的各方面知识，包括面试题，各种基础知识，工程能力等等，提升核心竞争力","","nlp language:Python stars:>=50"
"huggingface/tokenizers","https://github.com/huggingface/tokenizers","huggingface","Rust","10689","False","False","11/1/2019 5:52:20 PM","5/3/2026 5:31:34 PM","💥 Fast State-of-the-Art Tokenizers optimized for Research and Production","bert;gpt;language-model;natural-language-processing;natural-language-understanding;nlp;transformers","topic:nlp stars:>=100"
"asyml/texar-pytorch","https://github.com/asyml/texar-pytorch","asyml","Python","747","False","False","3/8/2019 1:04:09 AM","4/22/2026 4:36:38 PM","Integrating the Best of TF into PyTorch, for Machine Learning, Natural Language Processing, and Text Generation.  This is part of the CASL project: http://casl-project.ai/","bert;casl-project;data-processing;deep-learning;dialog-systems;gpt-2;machine-learning;machine-translation;natural-language-processing;python;pytorch;roberta;texar;texar-pytorch;text-data;text-generation;xlnet","topic:machine-translation language:Python stars:>=50"
"MVIG-SJTU/AlphaPose","https://github.com/MVIG-SJTU/AlphaPose","MVIG-SJTU","Python","8559","False","False","1/17/2018 2:33:17 AM","4/30/2026 8:22:18 AM","Real-Time and Accurate Full-Body Multi-Person Pose Estimation&Tracking System","accurate;alpha-pose;alphapose;crowdpose;full-body;gpu;human-computer-interaction;human-joints;human-pose-estimation;human-pose-tracking;human-tracking;keypoints;person-pose-estimation;pose-estimation;posetracking;pytorch;realtime;skeleton;tracking;whole-body","track language:Python stars:>=50"
"jlin816/dialop","https://github.com/jlin816/dialop","jlin816","Python","112","False","False","5/31/2023 5:28:43 PM","4/14/2026 3:45:25 AM","DialOp: Decision-oriented dialogue environments for collaborative language agents","agent;ai;artificial-intelligence;dialogue;gpt-3;large-language-models;llm;llm-agent;multi-agent;natural-language-processing","topic:dialogue language:Python stars:>=50"
"charles2gan/GDA-android-reversing-Tool","https://github.com/charles2gan/GDA-android-reversing-Tool","charles2gan","Python","4739","False","False","10/31/2017 8:18:29 AM","5/3/2026 2:23:50 PM","the fastest and most powerful android decompiler(native tool working without Java VM) for the APK, DEX, ODEX, OAT, JAR, AAR, and CLASS file. which supports malicious behavior detection, privacy leaking detection, vulnerability detection, path solving, packer identification, variable tracking, deobfuscation, python&java scripts, device memory extraction, data decryption, and encryption, etc. ","decompiler;malware-analysis;mobile-security;privacy-protection;security-audit;vulnerability-scanners","track language:Python stars:>=50"
"BigBodyCobain/Shadowbroker","https://github.com/BigBodyCobain/Shadowbroker","BigBodyCobain","Python","5637","False","False","3/5/2026 3:59:55 AM","5/3/2026 6:56:53 PM","Open-source intelligence for the global theater. Track everything from the corporate/private jets of the wealthy, and spy satellites, to seismic events in one unified interface. Hook an AI agent up to have it be your eyes and form previously unseen correlations. The knowledge is available to all but rarely aggregated in the open, until now.","air-force-one;airforce1;asdb;cctv;cctv-cameras;cctv-surveillance;earthquake-visualization;elonjet;osint;osint-resources;osint-tool;sattelite;sattelite-imagery;sdr","track language:Python stars:>=50"
"ageitgey/face_recognition","https://github.com/ageitgey/face_recognition","ageitgey","Python","56368","False","False","3/3/2017 9:52:39 PM","5/3/2026 4:37:34 PM","The world's simplest facial recognition api for Python and the command line","face-detection;face-recognition;machine-learning;python","topic:machine-learning language:Python stars:>=50"
"thu-coai/CDial-GPT","https://github.com/thu-coai/CDial-GPT","thu-coai","Python","1943","False","False","6/8/2020 1:01:49 PM","5/3/2026 1:52:33 PM"," A Large-scale Chinese Short-Text Conversation Dataset and Chinese pre-training dialog models ","dialogue;gpt;gpt-2;lccc;pytorch;text-generation","topic:dialogue language:Python stars:>=50"
"EdinburghNLP/nematus","https://github.com/EdinburghNLP/nematus","EdinburghNLP","Python","803","False","False","4/26/2016 1:34:49 PM","4/12/2026 6:03:28 PM","Open-Source Neural Machine Translation in Tensorflow","machine-translation;mt;neural-machine-translation;nmt;sequence-to-sequence","topic:machine-translation language:Python stars:>=50"
"microsoft/unilm","https://github.com/microsoft/unilm","microsoft","Python","22114","False","False","7/23/2019 4:15:28 AM","5/3/2026 2:16:58 AM","Large-scale Self-supervised Pre-training Across Tasks, Languages, and Modalities","beit;beit-3;bitnet;deepnet;document-ai;foundation-models;kosmos;kosmos-1;layoutlm;layoutxlm;llm;minilm;mllm;multimodal;nlp;pre-trained-model;textdiffuser;trocr;unilm;xlm-e","nlp language:Python stars:>=50 | topic:nlp stars:>=100"
"jina-ai/serve","https://github.com/jina-ai/serve","jina-ai","Python","21872","False","False","2/13/2020 5:04:44 PM","5/3/2026 8:33:46 AM","☁️ Build multimodal AI applications with cloud-native stack","cloud-native;cncf;deep-learning;docker;fastapi;framework;generative-ai;grpc;jaeger;kubernetes;llmops;machine-learning;microservice;mlops;multimodal;neural-search;opentelemetry;orchestration;pipeline;prometheus","topic:machine-learning language:Python stars:>=50"
"Maluuba/GeNeVA","https://github.com/Maluuba/GeNeVA","Maluuba","Python","85","False","False","9/18/2019 6:11:14 PM","8/12/2024 7:53:08 PM","Code to train and evaluate the GeNeVA-GAN model for the GeNeVA task proposed in our ICCV 2019 paper ""Tell, Draw, and Repeat: Generating and modifying images based on continual linguistic instruction""","chatpainter;codraw;dialogue;gan;generative-adversarial-networks;generative-neural-visual-artist;geneva;geneva-gan;i-clevr;iccv;iccv-2019;iccv2019;interactive-generative-art;interactive-image-generation;keep-drawing-it;tell-draw-repeat","topic:dialogue language:Python stars:>=50"
"cosmoquester/2021-dialogue-summary-competition","https://github.com/cosmoquester/2021-dialogue-summary-competition","cosmoquester","Python","128","False","False","12/17/2021 11:37:36 AM","1/31/2026 7:28:26 PM","[2021 훈민정음 한국어 음성•자연어 인공지능 경진대회] 대화요약 부문 알라꿍달라꿍 팀의 대화요약 학습 및 추론 코드를 공유하기 위한 레포입니다.","dialogue;huggingface-transformers;nlp;pytorch-lightning;summarization","topic:dialogue language:Python stars:>=50"
"tensorflow/lingvo","https://github.com/tensorflow/lingvo","tensorflow","Python","2864","False","False","7/24/2018 10:30:28 PM","5/3/2026 8:30:21 AM","Lingvo","asr;distributed;gpu-computing;language-model;lm;machine-translation;mnist;nlp;research;seq2seq;speech;speech-recognition;speech-synthesis;speech-to-text;tensorflow;translation;tts","topic:machine-translation language:Python stars:>=50"
"hhzrd/BEFAQ","https://github.com/hhzrd/BEFAQ","hhzrd","Python","77","False","False","7/6/2020 9:17:39 AM","12/27/2025 4:50:50 AM","FAQ-based Question Answering System using BERT","dialogue;dialogue-systems;es-elasticsearch;faq;faq-system;question;question-answering;sentence-bert;sentence-embeddings;sentence-transformers","topic:dialogue language:Python stars:>=50"
"Mirix-AI/MIRIX","https://github.com/Mirix-AI/MIRIX","Mirix-AI","Python","3530","False","False","4/11/2025 12:24:52 PM","5/1/2026 10:22:54 PM","Mirix is a multi-agent personal assistant designed to track on-screen activities and answer user questions intelligently. By capturing real-time visual data and consolidating it into structured memories, Mirix transforms raw inputs into a rich knowledge base that adapts to your digital experiences.","llm-agents;llm-memory;memory-agents;personal-assistant","track language:Python stars:>=50"
"GeeeekExplorer/nano-vllm","https://github.com/GeeeekExplorer/nano-vllm","GeeeekExplorer","Python","13237","False","False","6/9/2025 4:22:14 PM","5/3/2026 5:48:46 PM","Nano vLLM","deep-learning;inference;llm;nlp;pytorch;transformer","nlp language:Python stars:>=50 | topic:nlp stars:>=100"
"stanfordnlp/stanza","https://github.com/stanfordnlp/stanza","stanfordnlp","Python","7783","False","False","9/26/2017 8:00:56 AM","5/3/2026 1:48:04 PM","Stanford NLP Python library for tokenization, sentence segmentation, NER, and parsing of many human languages","artificial-intelligence;corenlp;deep-learning;machine-learning;named-entity-recognition;natural-language-processing;nlp;python;pytorch;universal-dependencies","nlp language:Python stars:>=50"
"open-mmlab/mmtracking","https://github.com/open-mmlab/mmtracking","open-mmlab","Python","3879","False","False","8/29/2020 6:16:56 AM","5/2/2026 2:44:25 PM","OpenMMLab Video Perception Toolbox. It supports Video Object Detection (VID), Multiple Object Tracking (MOT), Single Object Tracking (SOT), Video Instance Segmentation (VIS) with a unified framework.","multi-object-tracking;single-object-tracking;tracking;video-instance-segmentation;video-object-detection","track language:Python stars:>=50"
"cooelf/DeepUtteranceAggregation","https://github.com/cooelf/DeepUtteranceAggregation","cooelf","Python","304","False","False","5/25/2018 8:08:26 AM","5/1/2026 2:25:26 PM","Modeling Multi-turn Conversation with Deep Utterance Aggregation (COLING 2018)","dialogue;dua;multiturn;response;selection;utterance","topic:dialogue language:Python stars:>=50"
"NLP-LOVE/ML-NLP","https://github.com/NLP-LOVE/ML-NLP","NLP-LOVE","Jupyter Notebook","17650","False","False","7/5/2019 12:49:53 PM","5/3/2026 1:53:40 AM","此项目是机器学习(Machine Learning)、深度学习(Deep Learning)、NLP面试中常考到的知识点和代码实现，也是作为一个算法工程师必会的理论基础知识。","deep-learning;machine-learning;nlp","topic:nlp stars:>=100"
"wger-project/wger","https://github.com/wger-project/wger","wger-project","Python","6040","False","False","1/19/2013 4:34:38 PM","5/3/2026 5:12:23 PM","Self hosted FLOSS fitness/workout, nutrition and weight tracker","django;fitness;gym;hacktoberfest;python;self-hosted;workout","track language:Python stars:>=50"
"gradio-app/gradio","https://github.com/gradio-app/gradio","gradio-app","Python","42495","False","False","12/19/2018 8:24:04 AM","5/3/2026 5:33:59 PM","Build and share delightful machine learning apps, all in Python. 🌟 Star to support our work!","data-analysis;data-science;data-visualization;deep-learning;deploy;gradio;gradio-interface;interface;machine-learning;models;python;python-notebook;ui;ui-components","topic:machine-learning language:Python stars:>=50"
"outflanknl/RedELK","https://github.com/outflanknl/RedELK","outflanknl","Python","2633","False","False","10/3/2018 3:55:05 PM","4/28/2026 1:02:44 PM","Red Team's SIEM - tool for Red Teams used for tracking and alarming about Blue Team activities as well as better usability in long term operations.","elastic;elasticsearch;kibana;logstash;monitoring;red-teaming;security;siem","track language:Python stars:>=50"
"huggingface/datasets","https://github.com/huggingface/datasets","huggingface","Python","21483","False","False","3/26/2020 9:23:22 AM","5/3/2026 11:48:10 AM","🤗 The largest hub of ready-to-use datasets for AI models with fast, easy-to-use and efficient data manipulation tools","ai;artificial-intelligence;computer-vision;dataset-hub;datasets;deep-learning;huggingface;llm;machine-learning;natural-language-processing;nlp;numpy;pandas;pytorch;speech;tensorflow","topic:machine-learning language:Python stars:>=50 | nlp language:Python stars:>=50 | topic:nlp stars:>=100"
"PaddlePaddle/models","https://github.com/PaddlePaddle/models","PaddlePaddle","Python","6943","False","False","4/20/2017 1:30:15 PM","5/2/2026 1:34:25 PM","Officially maintained, supported by PaddlePaddle, including CV, NLP, Speech, Rec, TS, big models and so on.","computer-vision;cv;deep-learning;models;natural-language-processing;neural-network;nlp;paddlepaddle;recommendation;speech","nlp language:Python stars:>=50"
"deepfakes/faceswap","https://github.com/deepfakes/faceswap","deepfakes","Python","55204","False","False","12/19/2017 9:44:13 AM","5/3/2026 1:10:29 PM","Deepfakes Software For All","deep-face-swap;deep-learning;deep-neural-networks;deepface;deepfakes;deeplearning;face-swap;faceswap;fakeapp;machine-learning;myfakeapp;neural-nets;neural-networks;openfaceswap","topic:machine-learning language:Python stars:>=50"
"xingyizhou/CenterTrack","https://github.com/xingyizhou/CenterTrack","xingyizhou","Python","2477","False","False","4/2/2020 9:11:47 PM","5/3/2026 5:19:18 PM","Simultaneous object detection and tracking using center points.","","track language:Python stars:>=50"
"OpenBB-finance/OpenBB","https://github.com/OpenBB-finance/OpenBB","OpenBB-finance","Python","66927","False","False","12/20/2020 10:46:38 AM","5/3/2026 6:59:18 PM","Financial data platform for analysts, quants and AI agents.","ai;crypto;derivatives;economics;equity;finance;fixed-income;machine-learning;openbb;options;python;quantitative-finance;stocks","topic:machine-learning language:Python stars:>=50"
"openstack/openstack","https://github.com/openstack/openstack","openstack","Python","5898","False","False","10/24/2013 5:38:08 PM","5/3/2026 6:17:03 PM","Repository tracking all OpenStack repositories as submodules. Mirror of code maintained at opendev.org.","","track language:Python stars:>=50"
"piskvorky/gensim","https://github.com/piskvorky/gensim","piskvorky","Python","16405","False","False","2/10/2011 7:43:04 AM","5/3/2026 5:51:04 PM","Topic Modelling for Humans","data-mining;data-science;document-similarity;fasttext;gensim;information-retrieval;machine-learning;natural-language-processing;neural-network;nlp;python;topic-modeling;word-embeddings;word-similarity;word2vec","topic:machine-learning language:Python stars:>=50 | nlp language:Python stars:>=50 | topic:nlp stars:>=100"
"silverriver/MMChat","https://github.com/silverriver/MMChat","silverriver","Python","108","False","False","4/6/2022 7:54:24 AM","11/9/2025 2:33:49 PM","[LREC] MMChat: Multi-Modal Chat Dataset on Social Media","dataset;dialogue;multimodal","topic:dialogue language:Python stars:>=50"
"oswaldoludwig/Seq2seq-Chatbot-for-Keras","https://github.com/oswaldoludwig/Seq2seq-Chatbot-for-Keras","oswaldoludwig","Python","330","False","False","7/10/2017 12:35:33 AM","10/8/2025 12:40:32 PM","This repository contains a new generative model of chatbot based on seq2seq modeling.","chatbot;conversational-agents;deep-learning;dialogue;dialogue-generation;gan;generative-adversarial-network;glove;keras;nlp;seq2seq","topic:dialogue language:Python stars:>=50"
"jasonwu0731/trade-dst","https://github.com/jasonwu0731/trade-dst","jasonwu0731","Python","394","False","False","5/19/2019 7:37:03 PM","11/23/2025 6:17:22 AM","Source code for transferable dialogue state generator (TRADE, Wu et al., 2019). https://arxiv.org/abs/1905.08743 ","dialogue;dialogue-state-tracking;machine-learning;multi-domain;natural-language-processing;seq2seq","topic:dialogue language:Python stars:>=50"
"yistLin/pytorch-dual-learning","https://github.com/yistLin/pytorch-dual-learning","yistLin","Python","164","False","False","11/25/2017 3:08:03 AM","1/30/2026 3:45:24 AM","Implementation of Dual Learning NMT on PyTorch","dual-learning;machine-translation;pytorch","topic:machine-translation language:Python stars:>=50"
"serengil/deepface","https://github.com/serengil/deepface","serengil","Python","22662","False","False","2/8/2020 8:42:28 PM","5/3/2026 11:18:29 AM","A Lightweight Face Recognition and Facial Attribute Analysis (Age, Gender, Emotion and Race) Library for Python","age-prediction;arcface;deep-learning;deepface;deepid;emotion-recognition;face-analysis;face-recognition;facenet;facial-expression-recognition;facial-recognition;gender-prediction;machine-learning;openface;python;race-classification;vgg-face","topic:machine-learning language:Python stars:>=50"
"csebuetnlp/banglanmt","https://github.com/csebuetnlp/banglanmt","csebuetnlp","Python","153","False","False","10/5/2020 2:45:18 PM","3/7/2026 7:54:17 PM","This repository contains the code and data of the paper titled ""Not Low-Resource Anymore: Aligner Ensembling, Batch Filtering, and New Datasets for Bengali-English Machine Translation"" published in Proceedings of the 2020 Conference on Empirical Methods in Natural Language Processing (EMNLP 2020), November 16 - November 20, 2020.","bangla-dataset-machine-translation;bangla-machine-translation;bangla-nlp;emnlp-2020;low-resource-languages;low-resource-machine-translation;low-resource-nlp;machine-translation;neural-machine-translation;parallel-corpora;parallel-corpus","topic:machine-translation language:Python stars:>=50"
"scikit-learn/scikit-learn","https://github.com/scikit-learn/scikit-learn","scikit-learn","Python","65966","False","False","8/17/2010 9:43:38 AM","5/3/2026 6:57:40 PM","scikit-learn: machine learning in Python","data-analysis;data-science;machine-learning;python;statistics","topic:machine-learning language:Python stars:>=50"
"STVIR/pysot","https://github.com/STVIR/pysot","STVIR","Python","4602","False","False","5/7/2019 12:37:56 PM","5/2/2026 7:03:09 PM","SenseTime Research platform for single object tracking, implementing algorithms like SiamRPN and SiamMask.","computer-vision;siamese-network;tracking","track language:Python stars:>=50"
"vi3k6i5/flashtext","https://github.com/vi3k6i5/flashtext","vi3k6i5","Python","5711","False","False","8/15/2017 6:03:01 PM","5/1/2026 12:02:09 AM","Extract Keywords from sentence or Replace keywords in sentences.","data-extraction;keyword-extraction;nlp;search-in-text;word2vec","nlp language:Python stars:>=50"
"hankcs/HanLP","https://github.com/hankcs/HanLP","hankcs","Python","36293","False","False","10/9/2014 6:36:16 AM","5/3/2026 5:27:42 PM","Natural Language Processing for the next decade. Tokenization, Part-of-Speech Tagging, Named Entity Recognition, Syntactic & Semantic Dependency Parsing, Document Classification","dependency-parser;hanlp;named-entity-recognition;natural-language-processing;nlp;pos-tagging;semantic-parsing;text-classification","nlp language:Python stars:>=50 | topic:nlp stars:>=100"
"openvinotoolkit/openvino","https://github.com/openvinotoolkit/openvino","openvinotoolkit","C++","10169","False","False","10/15/2018 10:54:40 AM","5/3/2026 7:12:08 AM","OpenVINO™ is an open source toolkit for optimizing and deploying AI inference","ai;computer-vision;deep-learning;deploy-ai;diffusion-models;generative-ai;good-first-issue;inference;llm-inference;natural-language-processing;nlp;openvino;optimize-ai;performance-boost;recommendation-system;speech-recognition;stable-diffusion;transformers;yolo","topic:nlp stars:>=100"
"joeynmt/joeynmt","https://github.com/joeynmt/joeynmt","joeynmt","Python","712","False","False","10/15/2018 3:00:57 PM","4/12/2026 8:13:12 PM","Minimalist NMT for educational purposes","education;joey-nmt;machine-translation;neural-machine-translation;nmt;nmt-frameworks;nmt-tutorial;pytorch-transformers;rnn-pytorch;seq2seq;seq2seq-pytorch;transformer;transformer-architecture","topic:machine-translation language:Python stars:>=50"
"gaomingqi/Track-Anything","https://github.com/gaomingqi/Track-Anything","gaomingqi","Python","6949","False","False","4/12/2023 12:19:57 AM","5/2/2026 6:09:42 PM","Track-Anything is a flexible and interactive tool for video object tracking and segmentation, based on Segment Anything, XMem, and E2FGVI.","inpaint-anything;interactive-tracking;segment-anything;track-anything;video-object-segmentation;video-object-tracking","track language:Python stars:>=50"
"ymcui/Chinese-LLaMA-Alpaca","https://github.com/ymcui/Chinese-LLaMA-Alpaca","ymcui","Python","18944","False","False","3/15/2023 11:09:39 AM","5/3/2026 3:11:47 PM","中文LLaMA&Alpaca大语言模型+本地CPU/GPU训练部署 (Chinese LLaMA & Alpaca LLMs)","alpaca;alpaca-2;large-language-models;llama;llama-2;llm;lora;nlp;plm;pre-trained-language-models;quantization","nlp language:Python stars:>=50 | topic:nlp stars:>=100"
"Tautulli/Tautulli","https://github.com/Tautulli/Tautulli","Tautulli","Python","6464","False","False","2/22/2015 4:36:06 PM","5/2/2026 4:39:54 PM","A Python based monitoring and tracking tool for Plex Media Server.","analytics;monitoring;notifications;plex;plexpy;python;statistics;stats;tautulli","track language:Python stars:>=50"
"ifzhang/FairMOT","https://github.com/ifzhang/FairMOT","ifzhang","Python","4240","False","False","4/4/2020 7:48:48 AM","5/1/2026 9:46:19 PM","[IJCV-2021] FairMOT: On the Fairness of Detection and Re-Identification in Multi-Object Tracking","joint-detection-and-tracking;multi-object-tracking;one-shot-tracker;real-time","track language:Python stars:>=50"
"rohitg00/ai-engineering-from-scratch","https://github.com/rohitg00/ai-engineering-from-scratch","rohitg00","Python","6262","False","False","3/18/2026 6:38:02 PM","5/3/2026 7:06:13 PM","Learn it. Build it. Ship it for others.","agents;ai;ai-agents;ai-engineering;computer-vision;course;deep-learning;from-scratch;generative-ai;llm;machine-learning;mcp;nlp;python;reinforcement-learning;rust;swarm-intelligence;transformers;tutorial;typescript","nlp language:Python stars:>=50"
"babybuddy/babybuddy","https://github.com/babybuddy/babybuddy","babybuddy","Python","2756","False","False","10/22/2017 8:02:57 PM","5/3/2026 9:26:44 AM","A :baby: buddy to help caregivers track sleep, feedings, diaper changes, tummy time and more to learn about and predict baby's needs without (as much) guess work.","baby;dashboard;django;parenting;parents;python;self-hosted;tracker","track language:Python stars:>=50"
"onnx/onnx","https://github.com/onnx/onnx","onnx","Python","20762","False","False","9/7/2017 4:53:45 AM","5/3/2026 6:27:35 PM","Open standard for machine learning interoperability","ai;artificial-intelligence;deep-learning;deep-neural-networks;dnn;keras;machine-learning;ml;neural-network;onnx;pytorch;scikit-learn;tensorflow","topic:machine-learning language:Python stars:>=50"
"thammegowda/mtdata","https://github.com/thammegowda/mtdata","thammegowda","Python","163","False","False","4/6/2020 7:07:25 AM","4/13/2026 9:09:44 PM","A tool that locates, downloads, and extracts machine translation corpora","dataset;machine-translation;multilingual;natural-language-generation;natural-language-processing;parallel-data","topic:machine-translation language:Python stars:>=50"
"foolwood/SiamMask","https://github.com/foolwood/SiamMask","foolwood","Python","3547","False","False","3/4/2019 11:34:17 AM","4/28/2026 9:04:07 AM","[CVPR19/TPAMI23] SiamMask: A Framework for Fast Online Object Tracking and Segmentation","computer-vision;cvpr2019;deep-learning;object-tracking;pytorch;read-time;video-object-segmentation;visual-tracking","track language:Python stars:>=50"
"zihangdai/xlnet","https://github.com/zihangdai/xlnet","zihangdai","Python","6177","False","False","6/19/2019 8:16:46 AM","4/14/2026 2:34:18 AM","XLNet: Generalized Autoregressive Pretraining for Language Understanding","deep-learning;nlp;tensorflow","nlp language:Python stars:>=50"
"Fincept-Corporation/FinceptTerminal","https://github.com/Fincept-Corporation/FinceptTerminal","Fincept-Corporation","Python","19469","False","False","8/29/2024 2:38:08 PM","5/3/2026 7:05:42 PM","FinceptTerminal is a modern finance application offering advanced market analytics, investment research, and economic data tools, designed for interactive exploration and data-driven decision-making in a user-friendly environment.","ai-agents;algorithmic-trading;bloomberg-terminal;cpp;finance;financial-markets;fintech;good-first-issue;investment;investment-research;machine-learning;opensource;python;qt;quantitative-finance;stock-market;trading","topic:machine-learning language:Python stars:>=50"
"apache/airflow","https://github.com/apache/airflow","apache","Python","45272","False","False","4/13/2015 6:04:58 PM","5/3/2026 6:56:38 PM","Apache Airflow - A platform to programmatically author, schedule, and monitor workflows","airflow;apache;apache-airflow;automation;dag;data-engineering;data-integration;data-orchestrator;data-pipelines;data-science;elt;etl;machine-learning;mlops;orchestration;python;scheduler;workflow;workflow-engine;workflow-orchestration","topic:machine-learning language:Python stars:>=50"
