"FullName","Url","Owner","Language","Stars","Fork","Archived","CreatedAt","UpdatedAt","Description","Topics","SourceQueries"
"streamlit/streamlit","https://github.com/streamlit/streamlit","streamlit","Python","44432","False","False","8/24/2019 12:14:52 AM","5/3/2026 6:55:12 PM","Streamlit — A faster way to build and share data apps.","data-analysis;data-science;data-visualization;deep-learning;developer-tools;machine-learning;python;streamlit","topic:machine-learning language:Python stars:>=50"
"botpress/botpress","https://github.com/botpress/botpress","botpress","TypeScript","14666","False","False","11/16/2016 9:57:59 PM","5/3/2026 1:39:04 PM","The open-source hub to build & deploy GPT/LLM Agents ⚡️","agent;ai;botpress;chatbot;chatgpt;gpt;gpt-4;langchain;llm;nlp;openai;prompt","topic:nlp stars:>=100"
"jessevig/bertviz","https://github.com/jessevig/bertviz","jessevig","Python","8039","False","False","12/16/2018 4:50:42 PM","5/3/2026 3:22:33 AM","BertViz: Visualize Attention in Transformer Models","bert;gpt2;machine-learning;natural-language-processing;neural-network;nlp;pytorch;roberta;transformer;transformers;visualization","nlp language:Python stars:>=50"
"google/langextract","https://github.com/google/langextract","google","Python","36361","False","False","7/8/2025 8:46:06 PM","5/3/2026 5:17:38 PM","A Python library for extracting structured information from unstructured text using LLMs with precise source grounding and interactive visualization.","gemini;gemini-ai;gemini-api;gemini-flash;gemini-pro;information-extration;large-language-models;llm;nlp;python;structured-data","nlp language:Python stars:>=50 | topic:nlp stars:>=100"
"yangchris11/samurai","https://github.com/yangchris11/samurai","yangchris11","Python","7062","False","False","11/6/2024 10:46:05 PM","5/3/2026 9:28:29 AM","Official repository of ""SAMURAI: Adapting Segment Anything Model for Zero-Shot Visual Tracking with Motion-Aware Memory""","","track language:Python stars:>=50"
"deepset-ai/haystack","https://github.com/deepset-ai/haystack","deepset-ai","MDX","25065","False","False","11/14/2019 9:05:28 AM","5/3/2026 6:54:33 PM","Open-source AI orchestration framework for building context-engineered, production-ready LLM applications. Design modular pipelines and agent workflows with explicit control over retrieval, routing, memory, and generation. Built for scalable agents, RAG, multimodal applications, semantic search, and conversational systems.","agent;agents;ai;gemini;generative-ai;gpt-4;information-retrieval;large-language-models;llm;machine-learning;nlp;orchestration;python;pytorch;question-answering;rag;retrieval-augmented-generation;semantic-search;summarization;transformers","topic:nlp stars:>=100"
"mikel-brostrom/boxmot","https://github.com/mikel-brostrom/boxmot","mikel-brostrom","Python","8134","False","False","6/26/2020 9:26:23 AM","5/3/2026 2:58:28 PM","BoxMOT: Pluggable python and c++ SOTA multi-object tracking modules with support for axis-aligned and oriented bounding boxes","boosttrack;botsort;bytetrack;deep-learning;deepocsort;machine-learning;mot;mots;multi-object-tracking;multi-object-tracking-segmentation;ocsort;oriented-bounding-box-tracking;segmentation;strongsort;tensorrt;tracking-by-detection;yolo","track language:Python stars:>=50"
"getsentry/sentry","https://github.com/getsentry/sentry","getsentry","Python","43762","False","False","8/30/2010 10:06:41 PM","5/3/2026 6:15:06 PM","Developer-first error tracking and performance monitoring","apm;crash-reporting;crash-reports;csp-report;devops;django;error-logging;error-monitoring;fair-source;hacktoberfest;monitor;monitoring;python;sentry;tag-production","track language:Python stars:>=50"
"rotki/rotki","https://github.com/rotki/rotki","rotki","Python","3829","False","False","3/5/2018 11:26:09 AM","5/3/2026 12:13:27 PM","A portfolio tracking, analytics, accounting and management application that protects your privacy","accounting;analytics;bitcoin;blockchain;cryptocurrencies;cryptocurrency-exchanges;cryptocurrency-portfolio;cryptocurrency-portfolio-tracking;ethereum;hacktoberfest;management;management-system;portfolio-tracker;tracking","track language:Python stars:>=50"
"ultralytics/yolov5","https://github.com/ultralytics/yolov5","ultralytics","Python","57330","False","False","5/18/2020 3:45:11 AM","5/3/2026 3:06:59 PM","YOLOv5 🚀 in PyTorch > ONNX > CoreML > TFLite","coreml;deep-learning;ios;machine-learning;ml;object-detection;onnx;pytorch;tflite;ultralytics;yolo;yolov3;yolov5","topic:machine-learning language:Python stars:>=50"
"allenai/RL4LMs","https://github.com/allenai/RL4LMs","allenai","Python","2387","False","False","8/18/2022 5:29:16 AM","5/1/2026 5:24:38 AM","A modular RL library to fine-tune language models to human preferences","dialogue-generation;language-modeling;machine-translation;natural-language-processing;nlp;reinforcement-learning;summarization;table-to-text;text-generation","topic:machine-translation language:Python stars:>=50"
"clovaai/donut","https://github.com/clovaai/donut","clovaai","Python","6856","False","False","7/20/2022 1:21:19 AM","5/3/2026 3:10:07 PM","Official Implementation of OCR-free Document Understanding Transformer (Donut) and Synthetic Document Generator (SynthDoG), ECCV 2022","computer-vision;document-ai;eccv-2022;multimodal-pre-trained-model;nlp;ocr","nlp language:Python stars:>=50"
"asyml/texar","https://github.com/asyml/texar","asyml","Python","2390","False","False","7/22/2017 7:02:05 PM","5/3/2026 3:39:49 AM","Toolkit for Machine Learning, Natural Language Processing, and Text Generation, in TensorFlow.  This is part of the CASL project: http://casl-project.ai/","bert;casl-project;data-processing;deep-learning;dialog-systems;gpt-2;machine-learning;machine-translation;natural-language-processing;python;tensorflow;texar;text-data;text-generation;xlnet","topic:machine-translation language:Python stars:>=50"
"UFAL-DSG/tgen","https://github.com/UFAL-DSG/tgen","UFAL-DSG","Python","208","False","False","4/22/2015 11:41:23 AM","3/31/2026 2:51:22 PM","Statistical NLG for spoken dialogue systems","computational-linguistics;dialogue;dialogue-systems;natural-language-generation;python;seq2seq;seq2seq-generation;tgen","topic:dialogue language:Python stars:>=50"
"microsoft/presidio","https://github.com/microsoft/presidio","microsoft","Python","7925","False","False","5/4/2018 11:08:58 AM","5/3/2026 5:05:15 PM","An open-source framework for detecting, redacting, masking, and anonymizing sensitive data (PII) across text, images, and structured data. Supports NLP, pattern matching, and customizable pipelines.","anonymization;data-anonymization;data-masking;data-obfuscation;data-privacy;data-redaction;de-identification;guardrails;image-redactor;named-entity-recognition;nlp;personally-identifiable-information;phi;pii;pii-detection;privacy;python;sensitive-data;spacy;transformers","nlp language:Python stars:>=50"
"hplt-project/sacremoses","https://github.com/hplt-project/sacremoses","hplt-project","Python","495","False","False","4/20/2018 3:59:25 AM","4/27/2026 10:00:49 AM","Python port of Moses tokenizer, truecaser and normalizer","machine-translation;nlp;tokenizer","topic:machine-translation language:Python stars:>=50"
"ActivityWatch/activitywatch","https://github.com/ActivityWatch/activitywatch","ActivityWatch","Python","17436","False","False","4/27/2016 3:26:09 PM","5/3/2026 6:50:57 PM","The best free and open-source automated time tracker. Cross-platform, extensible, privacy-focused.","activitywatch;afk;analytics;app;cross-platform;dashboard;productivity;quantified-self;time-tracker;time-tracking;timetracker;timetracking","track language:Python stars:>=50"
"flairNLP/flair","https://github.com/flairNLP/flair","flairNLP","Python","14373","False","False","6/11/2018 11:04:18 AM","5/2/2026 6:37:18 PM","A very simple framework for state-of-the-art Natural Language Processing (NLP)","machine-learning;named-entity-recognition;natural-language-processing;nlp;pytorch;semantic-role-labeling;sequence-labeling;word-embeddings","nlp language:Python stars:>=50 | topic:nlp stars:>=100"
"PostHog/posthog","https://github.com/PostHog/posthog","PostHog","Python","34264","False","False","1/23/2020 10:46:58 PM","5/3/2026 6:59:18 PM","🦔 PostHog is an all-in-one developer platform for building successful products. We offer product analytics, web analytics, session replay, error tracking, feature flags, experimentation, surveys, data warehouse, a CDP, and an AI product assistant to help debug your code, ship features faster, and keep all your usage and customer data in one stack.","ab-testing;ai-analytics;analytics;cdp;data-warehouse;experiments;feature-flags;javascript;product-analytics;python;react;session-replay;surveys;typescript;web-analytics","track language:Python stars:>=50"
"bitextor/bitextor","https://github.com/bitextor/bitextor","bitextor","Python","299","False","False","4/16/2018 10:04:27 AM","4/22/2026 9:52:44 AM","Bitextor generates translation memories from multilingual websites","apertium;bicleaner;bitextor;bleualign;corpus-generator;corpus-processing;corpus-tools;crawler;dictionaries;document-aligner;hunalign;machine-translation;neural-machine-translation;parallel-corpora;sentence-segmentation;statistical-machine-translation;tmx;tokenizer;warc;wget","topic:machine-translation language:Python stars:>=50"
"deeppavlov/DeepPavlov","https://github.com/deeppavlov/DeepPavlov","deeppavlov","Python","6976","False","False","11/17/2017 2:35:29 PM","5/2/2026 2:57:42 PM","An open source library for deep learning end-to-end dialog systems and chatbots.","ai;artificial-intelligence;bot;chatbot;chitchat;deep-learning;deep-neural-networks;dialogue-agents;dialogue-manager;dialogue-systems;entity-extraction;intent-classification;intent-detection;machine-learning;named-entity-recognition;nlp;nlp-machine-learning;question-answering;slot-filling;tensorflow","nlp language:Python stars:>=50"
"Unbabel/OpenKiwi","https://github.com/Unbabel/OpenKiwi","Unbabel","Python","233","False","False","2/4/2019 10:53:37 AM","4/6/2026 9:48:21 AM","Open-Source Machine Translation Quality Estimation in PyTorch","machine-translation;openkiwi;pytorch;pytorch-lightning;quality-estimation;translation-quality-estimation","topic:machine-translation language:Python stars:>=50"
"ogkalu2/comic-translate","https://github.com/ogkalu2/comic-translate","ogkalu2","Python","2553","False","False","1/25/2024 8:45:17 AM","5/3/2026 11:50:21 AM","AI comic and manga translator app for automatically translating comics, manga, manhwa, BDs, fumetti, and more in multiple languages and formats (Images, PDF, EPUB, CBR, CBZ etc).","anime;comics;computer-vision;deep-learning;gui;inpainting;machine-translation;manga;manhua;manhwa;neural-network;ocr;pyside6;python;pytorch;segmentation;text-detection;text-segmentation;translation;webtoons","topic:machine-translation language:Python stars:>=50"
"OpenNMT/OpenNMT-py","https://github.com/OpenNMT/OpenNMT-py","OpenNMT","Python","7004","False","False","2/22/2017 7:01:50 PM","4/26/2026 8:59:52 AM","Open Source Neural Machine Translation and (Large) Language Models in PyTorch","deep-learning;language-model;llms;machine-translation;neural-machine-translation;pytorch","topic:machine-translation language:Python stars:>=50"
"FoundationVision/ByteTrack","https://github.com/FoundationVision/ByteTrack","FoundationVision","Python","6341","False","False","8/27/2021 10:47:57 AM","5/3/2026 5:34:51 PM","[ECCV 2022] ByteTrack: Multi-Object Tracking by Associating Every Detection Box","deployment;multi-object-tracking;pytorch;real-time","track language:Python stars:>=50"
"huggingface/transformers","https://github.com/huggingface/transformers","huggingface","Python","160213","False","False","10/29/2018 1:56:00 PM","5/3/2026 6:57:29 PM","🤗 Transformers: the model-definition framework for state-of-the-art machine learning models in text, vision, audio, and multimodal models, for both inference and training. ","audio;deep-learning;deepseek;gemma;glm;hacktoberfest;llm;machine-learning;model-hub;natural-language-processing;nlp;pretrained-models;python;pytorch;pytorch-transformers;qwen;speech-recognition;transformer;vlm","topic:machine-learning language:Python stars:>=50 | nlp language:Python stars:>=50 | topic:nlp stars:>=100"
"Chia-Hsuan-Lee/DST-as-Prompting","https://github.com/Chia-Hsuan-Lee/DST-as-Prompting","Chia-Hsuan-Lee","Python","65","False","False","9/9/2021 5:38:20 AM","5/1/2025 8:48:37 PM","Source code for Dialogue State Tracking with a Language Model using Schema-Driven Prompting","dialogue;dialogue-state-tracking;natural-language-processing;prompt-tuning;prompting;schema;seq2seq;t5;task-oriented-dialogue","topic:dialogue language:Python stars:>=50"
"nlpdata/dream","https://github.com/nlpdata/dream","nlpdata","Python","78","False","False","2/22/2019 4:01:14 PM","12/15/2025 1:48:07 PM","DREAM: A Challenge Dataset and Models for Dialogue-Based Reading Comprehension","dataset;dialogue;machine-reading-comprehension","topic:dialogue language:Python stars:>=50"
"jayparks/transformer","https://github.com/jayparks/transformer","jayparks","Python","578","False","False","1/4/2018 4:19:25 AM","3/6/2026 12:46:56 PM","A Pytorch Implementation of ""Attention is All You Need"" and ""Weighted Transformer Network for Machine Translation""","attention-is-all-you-need;attention-mechanism;machine-translation;self-attention","topic:machine-translation language:Python stars:>=50"
"microsoft/GODEL","https://github.com/microsoft/GODEL","microsoft","Python","884","False","False","5/10/2022 10:58:14 PM","4/29/2026 6:13:42 PM","Large-scale pretrained models for goal-directed dialog","conversational-ai;data-processing;dialogpt;dialogue;dialogue-systems;grounded-generation;language-grounding;language-model;machine-learning;pretrained-model;pytorch;text-data;text-generation;transformer;transformers","topic:dialogue language:Python stars:>=50"
"arc53/DocsGPT","https://github.com/arc53/DocsGPT","arc53","Python","17869","False","False","2/2/2023 11:03:23 AM","5/3/2026 3:54:16 PM","Private AI platform for agents, assistants and enterprise search. Built-in Agent Builder, Deep research, Document analysis, Multi-model support, and API connectivity for agents.","agent-builder;agents;ai;chatgpt;docsgpt;hacktoberfest;hacktoberfest2025;information-retrieval;language-model;llm;machine-learning;natural-language-processing;python;pytorch;rag;react;search;semantic-search;transformers","topic:machine-learning language:Python stars:>=50"
"eriklindernoren/ML-From-Scratch","https://github.com/eriklindernoren/ML-From-Scratch","eriklindernoren","Python","31413","False","False","2/5/2017 12:11:23 PM","5/3/2026 5:38:10 PM","Machine Learning From Scratch. Bare bones NumPy implementations of machine learning models and algorithms with a focus on accessibility. Aims to cover everything from linear regression to deep learning.","data-mining;data-science;deep-learning;deep-reinforcement-learning;genetic-algorithm;machine-learning;machine-learning-from-scratch","topic:machine-learning language:Python stars:>=50"
"Morizeyao/GPT2-Chinese","https://github.com/Morizeyao/GPT2-Chinese","Morizeyao","Python","7604","False","False","5/31/2019 2:07:50 AM","5/3/2026 1:47:20 PM","Chinese version of GPT2 training code, using BERT tokenizer.","chinese;gpt-2;nlp;text-generation;transformer","nlp language:Python stars:>=50"
"shawnwun/RNNLG","https://github.com/shawnwun/RNNLG","shawnwun","Python","490","False","False","8/19/2016 11:19:08 AM","5/3/2026 3:36:27 AM","RNNLG is an open source benchmark toolkit for Natural Language Generation (NLG) in spoken dialogue system application domains. It is released by Tsung-Hsien (Shawn) Wen from Cambridge Dialogue Systems Group under Apache License 2.0.","benchmark-datasets;deep-learning;dialogue;dialogue-generation;dialogue-systems;machine-learning;natural-language-generation;natural-language-processing;nlg-dataset","topic:dialogue language:Python stars:>=50"
"X-PLUG/ChatPLUG","https://github.com/X-PLUG/ChatPLUG","X-PLUG","Python","324","False","False","4/16/2023 1:40:16 PM","4/17/2026 1:24:20 PM","A Chinese Open-Domain Dialogue System","chat;chatbot;chatgpt;chinese;dialogue;encoder-decoder;instruction-finetuning;knowledge-augment;large-language-models;open-domain-dialogue-system;personality;pretraining","topic:dialogue language:Python stars:>=50"
"virgili0/Virgilio","https://github.com/virgili0/Virgilio","virgili0","Jupyter Notebook","14328","False","False","3/12/2019 6:45:36 PM","5/2/2026 9:15:26 AM","Your new Mentor for Data Science E-Learning.","business-intelligence;computer-vision;data-science;datascience;guide;guidelines;hacktoberfest;learning;learning-python;machine-learning;machine-vision;nlp;path;python;scikit-learn;statistics;study;studypath;tensorflow;virgilio","topic:nlp stars:>=100"
"hiyouga/LlamaFactory","https://github.com/hiyouga/LlamaFactory","hiyouga","Python","70865","False","False","5/28/2023 10:09:12 AM","5/3/2026 6:02:34 PM","Unified Efficient Fine-Tuning of 100+ LLMs & VLMs (ACL 2024)","agent;ai;deepseek;fine-tuning;gemma;gpt;instruction-tuning;large-language-models;llama;llama3;llm;lora;moe;nlp;peft;qlora;quantization;qwen;rlhf;transformers","nlp language:Python stars:>=50 | topic:nlp stars:>=100"
"ultralytics/ultralytics","https://github.com/ultralytics/ultralytics","ultralytics","Python","56706","False","False","9/11/2022 4:39:45 PM","5/3/2026 6:38:41 PM","Ultralytics YOLO 🚀","cli;computer-vision;deep-learning;hub;image-classification;instance-segmentation;machine-learning;object-detection;pose-estimation;python;pytorch;rotated-object-detection;segment-anything;tracking;ultralytics;yolo;yolo-world;yolo11;yolo26;yolov8","topic:machine-learning language:Python stars:>=50"
"Junpliu/ConDigSum","https://github.com/Junpliu/ConDigSum","Junpliu","Python","72","False","False","8/30/2021 9:30:56 AM","4/25/2025 9:03:46 AM","Code for EMNLP 2021 paper ""Topic-Aware Contrastive Learning for Abstractive Dialogue Summarization""","bart;coherence;contrastive-learning;dialogue;self-supervised;sub-summary;summarization;topic","topic:dialogue language:Python stars:>=50"
"persiannlp/parsinlu","https://github.com/persiannlp/parsinlu","persiannlp","Python","168","False","False","10/1/2020 5:16:32 PM","3/27/2026 8:16:36 PM","A comprehensive suite of high-level NLP tasks for Persian language","farsi;machine-translation;mt5-models;natural-language-inference;natural-language-processing;persian;persian-language;query-paraphrasing;reading-comprehension;sentiment-analysis;sentiment-analysis-dataset;textual-entailment","topic:machine-translation language:Python stars:>=50"
"princewen/tensorflow_practice","https://github.com/princewen/tensorflow_practice","princewen","Python","7005","False","False","2/23/2018 6:31:20 AM","5/3/2026 2:56:39 PM","tensorflow实战练习，包括强化学习、推荐系统、nlp等","","nlp language:Python stars:>=50"
"JaidedAI/EasyOCR","https://github.com/JaidedAI/EasyOCR","JaidedAI","Python","29395","False","False","3/14/2020 11:46:39 AM","5/3/2026 4:59:12 PM","Ready-to-use OCR with 80+ supported languages and all popular writing scripts including Latin, Chinese, Arabic, Devanagari, Cyrillic and etc.","cnn;crnn;data-mining;deep-learning;easyocr;image-processing;information-retrieval;lstm;machine-learning;ocr;optical-character-recognition;python;pytorch;scene-text;scene-text-recognition","topic:machine-learning language:Python stars:>=50"
"NathanDuran/Switchboard-Corpus","https://github.com/NathanDuran/Switchboard-Corpus","NathanDuran","Python","73","False","False","11/14/2018 7:08:38 PM","1/27/2026 1:22:02 PM","Utilities for Processing the Switchboard Dialogue Act Corpus","corpus;corpus-data;corpus-processing;corpus-tools;dialogue;dialogue-act;dialogue-data;dialogues;switchboard;switchboard-corpus","topic:dialogue language:Python stars:>=50"
"AgentOps-AI/agentops","https://github.com/AgentOps-AI/agentops","AgentOps-AI","Python","5512","False","False","8/15/2023 11:26:23 PM","5/2/2026 7:11:55 PM","Python SDK for AI agent monitoring, LLM cost tracking, benchmarking, and more. Integrates with most LLMs and agent frameworks including CrewAI, Agno, OpenAI Agents SDK, Langchain, Autogen, AG2, and CamelAI","agent;agentops;agents-sdk;ai;anthropic;autogen;cost-estimation;crewai;evals;evaluation-metrics;groq;langchain;llm;mistral;ollama;openai;openai-agents","track language:Python stars:>=50"
"mgalley/DSTC7-End-to-End-Conversation-Modeling","https://github.com/mgalley/DSTC7-End-to-End-Conversation-Modeling","mgalley","Python","175","False","False","5/29/2018 9:56:20 PM","12/10/2025 11:48:33 AM","Grounded conversational dataset for end-to-end conversational AI (official DSTC7 data)","conversational-ai;dataset;dialogue;dialogue-systems;end-to-end-machine-learning","topic:dialogue language:Python stars:>=50"
"brightmart/text_classification","https://github.com/brightmart/text_classification","brightmart","Python","7942","False","False","5/30/2017 2:25:42 PM","5/1/2026 11:12:02 PM","all kinds of text classification models and more with deep learning","attention-mechanism;classification;convolutional-neural-networks;fasttext;memory-networks;multi-class;multi-label;nlp;sentence-classification;tensorflow;text-classification;textcnn;textrnn","nlp language:Python stars:>=50"
"CLUEbenchmark/CLUEDatasetSearch","https://github.com/CLUEbenchmark/CLUEDatasetSearch","CLUEbenchmark","Python","4433","False","False","2/21/2020 4:01:31 PM","5/1/2026 4:52:18 PM","搜索所有中文NLP数据集，附常用英文NLP数据集","chinese;corpus;datasets;knowledge-graph;machine-reading-comprehension;machine-translation;match;ner;nlp;qa;sentiment-analysis;text-classification;text-similarity;text-summarization","topic:machine-translation language:Python stars:>=50"
"spencermountain/compromise","https://github.com/spencermountain/compromise","spencermountain","JavaScript","12083","False","False","7/5/2011 9:04:38 AM","5/2/2026 7:28:55 PM","modest natural-language processing","named-entity-recognition;nlp;part-of-speech","topic:nlp stars:>=100"
"awslabs/sockeye","https://github.com/awslabs/sockeye","awslabs","Python","1215","False","False","6/8/2017 7:44:30 AM","4/19/2026 1:28:28 PM","Sequence-to-sequence framework with a focus on Neural Machine Translation based on PyTorch","attention-is-all-you-need;attention-mechanism;attention-model;deep-learning;deep-neural-networks;encoder-decoder;machine-learning;machine-translation;neural-machine-translation;pytorch;seq2seq;sequence-to-sequence;sequence-to-sequence-models;sockeye;transformer;transformer-architecture;transformer-network;translation","topic:machine-translation language:Python stars:>=50"
"pytorch/vision","https://github.com/pytorch/vision","pytorch","Python","17657","False","False","11/9/2016 11:11:43 PM","5/3/2026 2:52:08 PM","Datasets, Transforms and Models specific to Computer Vision","computer-vision;machine-learning","topic:machine-learning language:Python stars:>=50"
"NVIDIA-NeMo/NeMo","https://github.com/NVIDIA-NeMo/NeMo","NVIDIA-NeMo","Python","17164","False","False","8/5/2019 8:16:42 PM","5/3/2026 2:43:40 PM","A scalable generative AI framework built for researchers and developers working on Large Language Models, Multimodal, and Speech AI (Automatic Speech Recognition and Text-to-Speech)","asr;deeplearning;generative-ai;machine-translation;neural-networks;speaker-diariazation;speaker-recognition;speech-synthesis;speech-translation;tts","topic:machine-translation language:Python stars:>=50"
"NVlabs/FoundationPose","https://github.com/NVlabs/FoundationPose","NVlabs","Python","3153","False","False","12/12/2023 11:15:54 PM","5/3/2026 10:16:38 AM","[CVPR 2024 Highlight] FoundationPose: Unified 6D Pose Estimation and Tracking of Novel Objects","","track language:Python stars:>=50"
"thu-coai/ConvLab-2","https://github.com/thu-coai/ConvLab-2","thu-coai","Python","465","False","False","2/9/2020 3:48:25 AM","3/14/2026 2:31:56 PM","ConvLab-2: An Open-Source Toolkit for Building, Evaluating, and Diagnosing Dialogue Systems","dialogue;dialogue-systems;task-oriented-dialogue","topic:dialogue language:Python stars:>=50"
"paperless-ngx/paperless-ngx","https://github.com/paperless-ngx/paperless-ngx","paperless-ngx","Python","40197","False","False","2/12/2022 9:56:52 PM","5/3/2026 6:37:53 PM","A community-supported supercharged document management system: scan, index and archive all your documents","angular;archiving;django;dms;document-management;document-management-system;hacktoberfest;machine-learning;ocr;optical-character-recognition;pdf","topic:machine-learning language:Python stars:>=50"
"budzianowski/multiwoz","https://github.com/budzianowski/multiwoz","budzianowski","Python","944","False","False","10/1/2018 7:50:35 PM","4/16/2026 10:43:06 AM","Source code for end-to-end dialogue model from the MultiWOZ paper (Budzianowski et al. 2018, EMNLP)","dialogue;dialogue-library;dialogue-manager;dialogue-systems;dialogues;machine-learning;natural-language-processing;seq2seq","topic:dialogue language:Python stars:>=50"
"jofpin/trape","https://github.com/jofpin/trape","jofpin","Python","8662","False","False","10/31/2017 2:03:57 PM","5/3/2026 6:46:18 PM","People tracker on the Internet: OSINT analysis and research tool by Jose Pino","flask;footprint;hacking;hacking-tool;jose-pino;osint;phising;python;recognition;security;social-engineering;tracking","track language:Python stars:>=50"
