"AnchorRepo","AnchorUrl","CandidateRepo","CandidateUrl","CandidateOwner","CandidateLanguage","CandidateStars","CandidateSubdomain","Rank","Score","Qualified","TopicJaccard","LexicalJaccard","LanguageMatch","StarSimilarity","RecencySimilarity","SubdomainMatch","QueryCoverage","SourceQueries","Description"
"argosopentech/argos-translate","https://github.com/argosopentech/argos-translate","shareAI-lab/learn-claude-code","https://github.com/shareAI-lab/learn-claude-code","shareAI-lab","TypeScript","57868","llm","0","541.34","False","0.0588","0","0","0.5052","1","1","0.3333","topic:llm stars:>=100","Bash is all you need -  A nano claude code–like 「agent harness」, built from 0 to 1"
"argosopentech/argos-translate","https://github.com/argosopentech/argos-translate","paarthneekhara/byteNet-tensorflow","https://github.com/paarthneekhara/byteNet-tensorflow","paarthneekhara","Python","318","deep-learning","0","538.97","False","0.0833","0","1","0.3655","0.8","0","0.3333","topic:machine-translation language:Python stars:>=50","ByteNet for character-level language modelling"
"argosopentech/argos-translate","https://github.com/argosopentech/argos-translate","mangodxd/youtube-auto-dub","https://github.com/mangodxd/youtube-auto-dub","mangodxd","Python","279","deep-learning","0","536.95","False","0.0588","0","1","0.3372","1","0","0.3333","topic:machine-translation language:Python stars:>=50","AI-powered YouTube video dubbing pipeline. Automatically transcribes (Whisper), translates (Google), and generates neural dubbing (Edge-TTS) with smart audio-video synchronization and background music preservation."
"argosopentech/argos-translate","https://github.com/argosopentech/argos-translate","thammegowda/mtdata","https://github.com/thammegowda/mtdata","thammegowda","Python","163","nlp","0","532.91","False","0.0769","0","1","0.221","1","0","0.3333","topic:machine-translation language:Python stars:>=50","A tool that locates, downloads, and extracts machine translation corpora"
"argosopentech/argos-translate","https://github.com/argosopentech/argos-translate","srvk/how2-dataset","https://github.com/srvk/how2-dataset","srvk","Python","193","nlp","0","530.07","False","0.0667","0","1","0.2575","1","0","0.3333","topic:machine-translation language:Python stars:>=50","This repository contains code and metadata of How2 dataset"
"argosopentech/argos-translate","https://github.com/argosopentech/argos-translate","microsoft/VibeVoice","https://github.com/microsoft/VibeVoice","microsoft","Python","46308","","0","521.87","False","0","0","1","0.5535","1","0","0.3333","open-source language:Python stars:>=50","Open-Source Frontier Voice AI"
"argosopentech/argos-translate","https://github.com/argosopentech/argos-translate","argoproj/argoproj","https://github.com/argoproj/argoproj","argoproj","Python","742","","0","521.09","False","0","0","1","0.5491","1","0","0.3333","argos language:Python stars:>=50","Common project repo for all Argo Projects"
"argosopentech/argos-translate","https://github.com/argosopentech/argos-translate","bitextor/bitextor","https://github.com/bitextor/bitextor","bitextor","Python","299","deep-learning","0","519.96","False","0.037","0","1","0.3522","1","0","0.3333","topic:machine-translation language:Python stars:>=50","Bitextor generates translation memories from multilingual websites"
"argosopentech/argos-translate","https://github.com/argosopentech/argos-translate","ItzCrazyKns/Vane","https://github.com/ItzCrazyKns/Vane","ItzCrazyKns","TypeScript","34115","llm","0","508.48","False","0","0","0","0.6199","1","1","0.3333","topic:llm stars:>=100","Vane is an AI-powered answering engine."
"argosopentech/argos-translate","https://github.com/argosopentech/argos-translate","yistLin/pytorch-dual-learning","https://github.com/yistLin/pytorch-dual-learning","yistLin","Python","164","deep-learning","0","503.91","False","0.1","0","1","0.2224","0.6","0","0.3333","topic:machine-translation language:Python stars:>=50","Implementation of Dual Learning NMT on PyTorch"
"argosopentech/argos-translate","https://github.com/argosopentech/argos-translate","asgeirtj/system_prompts_leaks","https://github.com/asgeirtj/system_prompts_leaks","asgeirtj","","39399","llm","0","503.01","False","0","0","0","0.5886","1","1","0.3333","topic:llm stars:>=100","Extracted system prompts from ChatGPT (GPT-5.5 Thinking), Claude (Opus 4.7, Opus 4.6, Sonnet 4.6, Claude Code), Gemini (3.1 Pro, 3 Flash, Gemini CLI), Grok (4.3 beta), Perplexity, and more. Updated regularly."
"argosopentech/argos-translate","https://github.com/argosopentech/argos-translate","milvus-io/milvus","https://github.com/milvus-io/milvus","milvus-io","Go","44098","llm","0","498.73","False","0","0","0","0.5642","1","1","0.3333","topic:llm stars:>=100","Milvus is a high-performance, cloud-native vector database built for scalable vector ANN search"
"argosopentech/argos-translate","https://github.com/argosopentech/argos-translate","mudler/LocalAI","https://github.com/mudler/LocalAI","mudler","Go","46017","llm","0","497.11","False","0","0","0","0.5549","1","1","0.3333","topic:llm stars:>=100","LocalAI is the open-source AI engine. Run any model - LLMs, vision, voice, image, video - on any hardware. No GPU required."
"argosopentech/argos-translate","https://github.com/argosopentech/argos-translate","jeecgboot/JeecgBoot","https://github.com/jeecgboot/JeecgBoot","jeecgboot","Java","46069","llm","0","497.07","False","0","0","0","0.5547","1","1","0.3333","topic:llm stars:>=100","AI低代码平台，支持「低代码 + 零代码」双模式：零代码 5 分钟搭建业务系统，低代码模式一键生成前后端代码。 内置AI 应用，支持AI聊天、知识库、流程编排、MCP与插件，支持各种模型。Skills能力实现：一句话画流程图、设计表单、生成系统。 引领 AI生成→在线配置→代码生成→手工合并的开发模式，解决Java项目80%的重复工作，快速提高效率，又不失灵活性。"
"argosopentech/argos-translate","https://github.com/argosopentech/argos-translate","upstash/context7","https://github.com/upstash/context7","upstash","TypeScript","54326","llm","0","490.8","False","0","0","0","0.5189","1","1","0.3333","topic:llm stars:>=100","Context7 Platform -- Up-to-date code documentation for LLMs and AI code editors"
"argosopentech/argos-translate","https://github.com/argosopentech/argos-translate","langgenius/dify","https://github.com/langgenius/dify","langgenius","TypeScript","139926","llm","0","488.18","False","0.037","0","0","0.3134","1","1","0.3333","topic:llm stars:>=100","Production-ready platform for agentic workflow development."
"argosopentech/argos-translate","https://github.com/argosopentech/argos-translate","Mintplex-Labs/anything-llm","https://github.com/Mintplex-Labs/anything-llm","Mintplex-Labs","JavaScript","59435","llm","0","487.39","False","0","0","0","0.4994","1","1","0.3333","topic:llm stars:>=100","The all-in-one AI productivity accelerator. On device and privacy first with no annoying setup or configuration."
"argosopentech/argos-translate","https://github.com/argosopentech/argos-translate","persiannlp/parsinlu","https://github.com/persiannlp/parsinlu","persiannlp","Python","168","nlp","0","487.19","False","0.0526","0","1","0.2276","0.8","0","0.3333","topic:machine-translation language:Python stars:>=50","A comprehensive suite of high-level NLP tasks for Persian language"
"argosopentech/argos-translate","https://github.com/argosopentech/argos-translate","csebuetnlp/banglanmt","https://github.com/csebuetnlp/banglanmt","csebuetnlp","Python","153","deep-learning","0","486.29","False","0.0556","0","1","0.2074","0.8","0","0.3333","topic:machine-translation language:Python stars:>=50","This repository contains the code and data of the paper titled ""Not Low-Resource Anymore: Aligner Ensembling, Batch Filtering, and New Datasets for Bengali-English Machine Translation"" published in Proceedings of the 2020 Conference on Empirical Methods in Natural Language Processing (EMNLP 2020), November 16 - November 20, 2020."
"argosopentech/argos-translate","https://github.com/argosopentech/argos-translate","Shark-NLP/CoNT","https://github.com/Shark-NLP/CoNT","Shark-NLP","Python","152","deep-learning","0","486.04","False","0.0833","0","1","0.206","0.6","0","0.3333","topic:machine-translation language:Python stars:>=50","[NeurIPS'22 Spotlight] Data and code for our paper CoNT: Contrastive Neural Text Generation "
"argosopentech/argos-translate","https://github.com/argosopentech/argos-translate","public-apis/public-apis","https://github.com/public-apis/public-apis","public-apis","Python","430245","","0","482.17","False","0.05","0","1","0.0695","1","0","0.3333","open-source language:Python stars:>=50","A collective list of free APIs"
"argosopentech/argos-translate","https://github.com/argosopentech/argos-translate","CermakM/argo-python-dsl","https://github.com/CermakM/argo-python-dsl","CermakM","Python","55","","0","481.82","False","0.0909","0","1","0","0.8","0","0.3333","argos language:Python stars:>=50","Python DSL for Argo Workflows | Mirrored to https://github.com/argoproj-labs/argo-python-dsl"
"argosopentech/argos-translate","https://github.com/argosopentech/argos-translate","eooce/python-xray-argo","https://github.com/eooce/python-xray-argo","eooce","Python","211","","0","473.44","False","0","0","1","0.2768","1","0","0.3333","argos language:Python stars:>=50","python环境搭建Argo-xray节点，输出sub文件和订阅，python环境通用项目"
"argosopentech/argos-translate","https://github.com/argosopentech/argos-translate","LiberAI/NSpM","https://github.com/LiberAI/NSpM","LiberAI","Python","224","deep-learning","0","466.61","False","0.0455","0","1","0.2897","0.6","0","0.3333","topic:machine-translation language:Python stars:>=50","🤖 Neural SPARQL Machines for Knowledge Graph Question Answering."
"argosopentech/argos-translate","https://github.com/argosopentech/argos-translate","firecrawl/firecrawl","https://github.com/firecrawl/firecrawl","firecrawl","TypeScript","114400","llm","0","462.5","False","0","0","0","0.3572","1","1","0.3333","topic:llm stars:>=100","🔥 The API to search, scrape, and interact with the web for AI"
"argosopentech/argos-translate","https://github.com/argosopentech/argos-translate","ollama/ollama","https://github.com/ollama/ollama","ollama","Go","170593","llm","0","447.32","False","0","0","0","0.2704","1","1","0.3333","topic:llm stars:>=100","Get up and running with Kimi-K2.5, GLM-5, MiniMax, DeepSeek, gpt-oss, Qwen, Gemma and other models."
"argosopentech/argos-translate","https://github.com/argosopentech/argos-translate","affaan-m/everything-claude-code","https://github.com/affaan-m/everything-claude-code","affaan-m","JavaScript","172286","llm","0","446.94","False","0","0","0","0.2683","1","1","0.3333","topic:llm stars:>=100","The agent harness performance optimization system. Skills, instincts, memory, security, and research-first development for Claude Code, Codex, Opencode, Cursor and beyond."
"argosopentech/argos-translate","https://github.com/argosopentech/argos-translate","titusjan/argos","https://github.com/titusjan/argos","titusjan","Python","195","computer-vision","0","445.46","False","0","0","1","0.2597","0.8","0","0.3333","argos language:Python stars:>=50","Argos: a data viewer that can read HDF5, NetCDF4, and other file formats."
"argosopentech/argos-translate","https://github.com/argosopentech/argos-translate","CloudWithVarJosh/ArgoCD-Basics-To-Production","https://github.com/CloudWithVarJosh/ArgoCD-Basics-To-Production","CloudWithVarJosh","Python","68","mlops","0","430.78","False","0","0","1","0.033","1","0","0.3333","argos language:Python stars:>=50","ArgoCD-Basics-to-Production is a beginner-friendly repository designed to help you understand GitOps and Argo CD from fundamentals to real-world production use. It covers GitOps concepts, Argo CD architecture, and hands-on deployment workflows, organized as a progressive learning series."
"argosopentech/argos-translate","https://github.com/argosopentech/argos-translate","iam-veeramalla/Realtime-MLOps-Project","https://github.com/iam-veeramalla/Realtime-MLOps-Project","iam-veeramalla","Python","61","mlops","0","426.72","False","0","0","1","0.0098","1","0","0.3333","argos language:Python stars:>=50","Realtime MLOps Implementation using DVC, Docker, GitHub Actions, Kubernetes, KServe and Argo CD."
"argosopentech/argos-translate","https://github.com/argosopentech/argos-translate","angadsingh/argos-presence","https://github.com/angadsingh/argos-presence","angadsingh","Python","71","reinforcement","0","425.73","False","0","0.0667","1","0.0423","0.6","0","0.3333","argos language:Python stars:>=50","a robust room presence solution for home automation with nearly no false negatives"
"argosopentech/argos-translate","https://github.com/argosopentech/argos-translate","angadsingh/argos","https://github.com/angadsingh/argos","angadsingh","Python","133","computer-vision","0","406.01","False","0","0","1","0.1772","0.6","0","0.3333","argos language:Python stars:>=50","a spacial-temporal pattern detection system for home automation"
"argosopentech/argos-translate","https://github.com/argosopentech/argos-translate","AI3lab/argo-workflow-runner","https://github.com/AI3lab/argo-workflow-runner","AI3lab","Python","99","","0","369.88","False","0","0","1","0.1136","0.4","0","0.3333","argos language:Python stars:>=50","Workflow runner engine for argo framework"
"argosopentech/argos-translate","https://github.com/argosopentech/argos-translate","publicscience/argos","https://github.com/publicscience/argos","publicscience","Python","50","","0","325","False","0","0","1","0","0.2","0","0.3333","argos language:Python stars:>=50","Know more with less"
