"AnchorRepo","AnchorUrl","CandidateRepo","CandidateUrl","CandidateOwner","CandidateLanguage","CandidateStars","CandidateSubdomain","Rank","Score","Qualified","TopicJaccard","LexicalJaccard","LanguageMatch","StarSimilarity","RecencySimilarity","SubdomainMatch","QueryCoverage","SourceQueries","Description"
"argosopentech/argos-translate","https://github.com/argosopentech/argos-translate","AdrianBZG/llama-multimodal-vqa","https://github.com/AdrianBZG/llama-multimodal-vqa","AdrianBZG","Python","52","llm","0","667.86","False","0.0476","0","1","0","0.8","1","0.3333","topic:language-models language:Python stars:>=50","Multimodal Instruction Tuning for Llama 3"
"argosopentech/argos-translate","https://github.com/argosopentech/argos-translate","kellyjonbrazil/jc","https://github.com/kellyjonbrazil/jc","kellyjonbrazil","Python","8592","","0","667.7","False","0.0909","0","1","0.9193","1","0","0.3333","topic:linux language:Python stars:>=50","CLI tool and python library that converts the output of popular command-line tools, file-types, and common strings to JSON, YAML, or Dictionaries. This allows piping of output to tools like jq and simplifying automation scripts."
"argosopentech/argos-translate","https://github.com/argosopentech/argos-translate","sezanzeb/input-remapper","https://github.com/sezanzeb/input-remapper","sezanzeb","Python","5596","","0","667.06","False","0.0769","0","1","0.9876","1","0","0.3333","topic:linux language:Python stars:>=50","🎮 ⌨ An easy to use tool to change the behaviour of your input devices."
"argosopentech/argos-translate","https://github.com/argosopentech/argos-translate","zq1997/deepin-wine","https://github.com/zq1997/deepin-wine","zq1997","Python","5288","","0","664.91","False","0.0769","0","1","0.9753","1","0","0.3333","topic:linux language:Python stars:>=50","【deepin源移植】Debian/Ubuntu上的QQ/微信快速安装方式"
"argosopentech/argos-translate","https://github.com/argosopentech/argos-translate","persepolisdm/persepolis","https://github.com/persepolisdm/persepolis","persepolisdm","Python","7299","editor","0","661.31","False","0.0769","0","1","0.9547","1","0","0.3333","topic:linux language:Python stars:>=50","Persepolis is a download manager written in Python."
"argosopentech/argos-translate","https://github.com/argosopentech/argos-translate","hgmzhn/manga-translator-ui","https://github.com/hgmzhn/manga-translator-ui","hgmzhn","Python","1505","computer-vision","0","660.44","False","0.125","0","1","0.7025","1","0","0.3333","topic:machine-translation language:Python stars:>=50","基于 manga-image-translator 的开源漫画翻译工具。支持日/韩/美漫自动翻译，内置 OpenAI、Gemini 等 5 种翻译引擎，并提供可视化编辑器自由调整文本样式。一键安装，开箱即用。如果喜欢，欢迎点亮 ⭐ Star 支持！"
"argosopentech/argos-translate","https://github.com/argosopentech/argos-translate","hugsy/gef","https://github.com/hugsy/gef","hugsy","Python","8142","data-science","0","659.92","False","0.08","0","1","0.931","1","0","0.3333","topic:linux language:Python stars:>=50","GEF (GDB Enhanced Features) - a modern experience for GDB with advanced debugging capabilities for exploit devs & reverse engineers on Linux"
"argosopentech/argos-translate","https://github.com/argosopentech/argos-translate","donnemartin/gitsome","https://github.com/donnemartin/gitsome","donnemartin","Python","7675","","0","659.4","False","0.0769","0","1","0.9438","1","0","0.3333","topic:linux language:Python stars:>=50","A supercharged Git/GitHub command line interface (CLI).  An official integration for GitHub and GitHub Enterprise: https://github.com/works-with/category/desktop-tools"
"argosopentech/argos-translate","https://github.com/argosopentech/argos-translate","giampaolo/psutil","https://github.com/giampaolo/psutil","giampaolo","Python","11153","","0","657.78","False","0.0909","0","1","0.8627","1","0","0.3333","topic:linux language:Python stars:>=50","Cross-platform lib for process and system monitoring in Python"
"argosopentech/argos-translate","https://github.com/argosopentech/argos-translate","dschep/ntfy","https://github.com/dschep/ntfy","dschep","Python","4959","","0","657.52","False","0.0714","0","1","0.9614","1","0","0.3333","topic:linux language:Python stars:>=50","🖥️📱🔔 A utility for sending notifications, on demand and when commands finish."
"argosopentech/argos-translate","https://github.com/argosopentech/argos-translate","seemoo-lab/opendrop","https://github.com/seemoo-lab/opendrop","seemoo-lab","Python","9599","","0","656.67","False","0.0833","0","1","0.8952","1","0","0.3333","topic:linux language:Python stars:>=50","An open Apple AirDrop implementation written in Python"
"argosopentech/argos-translate","https://github.com/argosopentech/argos-translate","xfangfang/Macast","https://github.com/xfangfang/Macast","xfangfang","Python","6830","","0","654.6","False","0.0667","0","1","0.9691","1","0","0.3333","topic:linux language:Python stars:>=50","Macast is a cross-platform application which using mpv as DLNA Media Renderer."
"argosopentech/argos-translate","https://github.com/argosopentech/argos-translate","pwndbg/pwndbg","https://github.com/pwndbg/pwndbg","pwndbg","Python","10388","data-science","0","653.67","False","0.0833","0","1","0.8781","1","0","0.3333","topic:linux language:Python stars:>=50","Exploit Development and Reverse Engineering with GDB & LLDB Made Easy"
"argosopentech/argos-translate","https://github.com/argosopentech/argos-translate","ufal/neuralmonkey","https://github.com/ufal/neuralmonkey","ufal","Python","418","deep-learning","0","649.33","False","0.1667","0","1","0.4247","1","0","0.3333","topic:machine-translation language:Python stars:>=50","An open-source tool for sequence learning in NLP built on TensorFlow."
"argosopentech/argos-translate","https://github.com/argosopentech/argos-translate","reflex-dev/reflex","https://github.com/reflex-dev/reflex","reflex-dev","Python","28355","data-science","0","646.39","False","0.1176","0","1","0.6601","1","0","0.3333","open-source language:Python stars:>=50","🕸️ Web apps in pure Python 🐍"
"argosopentech/argos-translate","https://github.com/argosopentech/argos-translate","JoeanAmier/XHS-Downloader","https://github.com/JoeanAmier/XHS-Downloader","JoeanAmier","Python","11028","","0","645.63","False","0.0769","0","1","0.8651","1","0","0.3333","topic:linux language:Python stars:>=50","小红书（XiaoHongShu、RedNote）链接提取/作品采集工具：提取账号发布、收藏、点赞、专辑作品链接；提取搜索结果作品、用户链接；采集小红书作品信息；提取小红书作品下载地址；下载小红书作品文件"
"argosopentech/argos-translate","https://github.com/argosopentech/argos-translate","HunxByts/GhostTrack","https://github.com/HunxByts/GhostTrack","HunxByts","Python","12503","","0","643.62","False","0.08","0","1","0.8379","1","0","0.3333","topic:linux language:Python stars:>=50","Useful tool to track location or mobile number"
"argosopentech/argos-translate","https://github.com/argosopentech/argos-translate","boltgolt/howdy","https://github.com/boltgolt/howdy","boltgolt","Python","7491","","0","641.09","False","0.0556","0","1","0.9491","1","0","0.3333","topic:linux language:Python stars:>=50","🛡️ Windows Hello™ style facial authentication for Linux"
"argosopentech/argos-translate","https://github.com/argosopentech/argos-translate","Gallopsled/pwntools","https://github.com/Gallopsled/pwntools","Gallopsled","Python","13412","","0","640.96","False","0.08","0","1","0.8226","1","0","0.3333","topic:linux language:Python stars:>=50","CTF framework and exploit development library"
"argosopentech/argos-translate","https://github.com/argosopentech/argos-translate","SFTtech/openage","https://github.com/SFTtech/openage","SFTtech","Python","14192","","0","638.81","False","0.08","0","1","0.8103","1","0","0.3333","topic:linux language:Python stars:>=50","Clone of the Age of Empires II engine 🚀 "
"argosopentech/argos-translate","https://github.com/argosopentech/argos-translate","pyscript/pyscript","https://github.com/pyscript/pyscript","pyscript","Python","18693","","0","638.16","False","0.0909","0","1","0.7505","1","0","0.3333","open-source language:Python stars:>=50","An open source platform for Python in the browser. https://pyscript.net Docs: https://docs.pyscript.net/ Try it: https://pyscript.com/ Community: https://discord.gg/HxvBtukrg2"
"argosopentech/argos-translate","https://github.com/argosopentech/argos-translate","evilsocket/opensnitch","https://github.com/evilsocket/opensnitch","evilsocket","Python","13568","","0","637.75","False","0.0769","0","1","0.8201","1","0","0.3333","topic:linux language:Python stars:>=50","OpenSnitch is a GNU/Linux interactive application firewall inspired by Little Snitch."
"argosopentech/argos-translate","https://github.com/argosopentech/argos-translate","JoeanAmier/TikTokDownloader","https://github.com/JoeanAmier/TikTokDownloader","JoeanAmier","Python","14259","","0","635.86","False","0.0769","0","1","0.8093","1","0","0.3333","topic:linux language:Python stars:>=50","TikTok 发布/喜欢/合辑/直播/视频/图集/音乐；抖音发布/喜欢/收藏/收藏夹/视频/图集/实况/直播/音乐/合集/评论/账号/搜索/热榜数据采集工具/下载工具"
"argosopentech/argos-translate","https://github.com/argosopentech/argos-translate","xxh/xxh","https://github.com/xxh/xxh","xxh","Python","5987","reinforcement","0","632.94","False","0.037","0","1","0.9977","1","0","0.3333","topic:linux language:Python stars:>=50","🚀 Bring your favorite shell wherever you go through the ssh. Xonsh shell, fish, zsh, osquery and so on."
"argosopentech/argos-translate","https://github.com/argosopentech/argos-translate","fail2ban/fail2ban","https://github.com/fail2ban/fail2ban","fail2ban","Python","17671","computer-vision","0","630.48","False","0.08","0","1","0.7627","1","0","0.3333","topic:linux language:Python stars:>=50","Daemon to ban hosts that cause multiple authentication errors"
"argosopentech/argos-translate","https://github.com/argosopentech/argos-translate","AI-secure/InfoBERT","https://github.com/AI-secure/InfoBERT","AI-secure","Python","85","llm","0","628.44","False","0.0714","0","1","0.0809","0.2","1","0.3333","topic:language-models language:Python stars:>=50","[ICLR 2021] ""InfoBERT: Improving Robustness of Language Models from An Information Theoretic Perspective"" by Boxin Wang, Shuohang Wang, Yu Cheng, Zhe Gan, Ruoxi Jia, Bo Li, Jingjing Liu"
"argosopentech/argos-translate","https://github.com/argosopentech/argos-translate","agent0ai/agent-zero","https://github.com/agent0ai/agent-zero","agent0ai","Python","17490","reinforcement","0","628.1","False","0.0769","0","1","0.765","1","0","0.3333","topic:linux language:Python stars:>=50","Agent Zero AI framework"
"argosopentech/argos-translate","https://github.com/argosopentech/argos-translate","AdnanHodzic/auto-cpufreq","https://github.com/AdnanHodzic/auto-cpufreq","AdnanHodzic","Python","7509","","0","627","False","0.04","0","1","0.9486","1","0","0.3333","topic:linux language:Python stars:>=50","Automatic CPU speed & power optimizer for Linux"
"argosopentech/argos-translate","https://github.com/argosopentech/argos-translate","pipekit/argo-workflows-ci-example","https://github.com/pipekit/argo-workflows-ci-example","pipekit","Python","56","llm","0","625","False","0","0","1","0","0.8","1","0.3333","argos language:Python stars:>=50","An example CI leveraging Argo Workflows"
"argosopentech/argos-translate","https://github.com/argosopentech/argos-translate","espnet/espnet","https://github.com/espnet/espnet","espnet","Python","9824","deep-learning","0","619.92","False","0.0435","0","1","0.8902","1","0","0.3333","topic:machine-translation language:Python stars:>=50","End-to-End Speech Processing Toolkit"
"argosopentech/argos-translate","https://github.com/argosopentech/argos-translate","AsyncFuncAI/deepwiki-open","https://github.com/AsyncFuncAI/deepwiki-open","AsyncFuncAI","Python","16065","","0","618.35","False","0.0625","0","1","0.7834","1","0","0.3333","open-source language:Python stars:>=50","Open Source DeepWiki: AI-Powered Wiki Generator for GitHub/Gitlab/Bitbucket Repositories. Join the discord: https://discord.gg/gMwThUMeme"
"argosopentech/argos-translate","https://github.com/argosopentech/argos-translate","sebastianruder/NLP-progress","https://github.com/sebastianruder/NLP-progress","sebastianruder","Python","22971","nlp","0","617.74","False","0.0769","0","1","0.7058","1","0","0.3333","topic:machine-translation language:Python stars:>=50","Repository to track the progress in Natural Language Processing (NLP), including the datasets and the current state-of-the-art for the most common NLP tasks."
"argosopentech/argos-translate","https://github.com/argosopentech/argos-translate","soxoj/maigret","https://github.com/soxoj/maigret","soxoj","Python","23099","editor","0","617.53","False","0.0769","0","1","0.7046","1","0","0.3333","open-source language:Python stars:>=50","🕵️‍♂️ Collect a dossier on a person by username from 3000+ sites"
"argosopentech/argos-translate","https://github.com/argosopentech/argos-translate","NVIDIA-NeMo/NeMo","https://github.com/NVIDIA-NeMo/NeMo","NVIDIA-NeMo","Python","17163","deep-learning","0","612.53","False","0.0588","0","1","0.7691","1","0","0.3333","topic:machine-translation language:Python stars:>=50","A scalable generative AI framework built for researchers and developers working on Large Language Models, Multimodal, and Speech AI (Automatic Speech Recognition and Text-to-Speech)"
"argosopentech/argos-translate","https://github.com/argosopentech/argos-translate","ictnlp/StreamSpeech","https://github.com/ictnlp/StreamSpeech","ictnlp","Python","1263","nlp","0","610.52","False","0.0769","0","1","0.6645","1","0","0.3333","topic:machine-translation language:Python stars:>=50","StreamSpeech is an “All in One” seamless model for offline and simultaneous speech recognition, speech translation and speech synthesis."
"argosopentech/argos-translate","https://github.com/argosopentech/argos-translate","THUNLP-MT/THUMT","https://github.com/THUNLP-MT/THUMT","THUNLP-MT","Python","706","deep-learning","0","609.21","False","0.1","0","1","0.5383","1","0","0.3333","topic:machine-translation language:Python stars:>=50","An open-source neural machine translation toolkit developed by Tsinghua Natural Language Processing Group"
"argosopentech/argos-translate","https://github.com/argosopentech/argos-translate","netbox-community/netbox","https://github.com/netbox-community/netbox","netbox-community","Python","20410","","0","603","False","0.0556","0","1","0.7314","1","0","0.3333","open-source language:Python stars:>=50","The premier source of truth powering network automation. Open source under Apache 2. Try NetBox Cloud free: https://netboxlabs.com/products/free-netbox-cloud/"
"argosopentech/argos-translate","https://github.com/argosopentech/argos-translate","EdinburghNLP/nematus","https://github.com/EdinburghNLP/nematus","EdinburghNLP","Python","803","deep-learning","0","599.09","False","0.0833","0","1","0.5662","1","0","0.3333","topic:machine-translation language:Python stars:>=50","Open-Source Neural Machine Translation in Tensorflow"
"argosopentech/argos-translate","https://github.com/argosopentech/argos-translate","Maluuba/nlg-eval","https://github.com/Maluuba/nlg-eval","Maluuba","Python","1394","nlp","0","598.29","False","0.087","0","1","0.6859","0.8","0","0.3333","topic:machine-translation language:Python stars:>=50","Evaluation code for various unsupervised automated metrics for Natural Language Generation."
"argosopentech/argos-translate","https://github.com/argosopentech/argos-translate","jumpserver/jumpserver","https://github.com/jumpserver/jumpserver","jumpserver","Python","30372","editor","0","594.15","False","0.0625","0","1","0.6451","1","0","0.3333","open-source language:Python stars:>=50","JumpServer is an open-source Privileged Access Management (PAM) platform that provides DevOps and IT teams with on-demand and secure access to SSH, RDP, Kubernetes, Database and RemoteApp endpoints through a web browser."
"argosopentech/argos-translate","https://github.com/argosopentech/argos-translate","zulip/zulip","https://github.com/zulip/zulip","zulip","Python","25132","","0","592.46","False","0.0526","0","1","0.6863","1","0","0.3333","open-source language:Python stars:>=50","Zulip server and web application. Open-source team chat that helps teams stay productive and focused."
"argosopentech/argos-translate","https://github.com/argosopentech/argos-translate","rsennrich/Bleualign","https://github.com/rsennrich/Bleualign","rsennrich","Python","314","nlp","0","588.49","False","0.1111","0","1","0.3628","1","0","0.3333","topic:machine-translation language:Python stars:>=50","Machine-Translation-based sentence alignment tool for parallel text"
"argosopentech/argos-translate","https://github.com/argosopentech/argos-translate","Helsinki-NLP/Opus-MT","https://github.com/Helsinki-NLP/Opus-MT","Helsinki-NLP","Python","810","deep-learning","0","584.42","False","0.0667","0","1","0.5681","1","0","0.3333","topic:machine-translation language:Python stars:>=50","Open neural machine translation models and web services"
"argosopentech/argos-translate","https://github.com/argosopentech/argos-translate","odoo/odoo","https://github.com/odoo/odoo","odoo","Python","50433","","0","582.91","False","0.0714","0","1","0.535","1","0","0.3333","open-source language:Python stars:>=50","Odoo. Open Source Apps To Grow Your Business."
"argosopentech/argos-translate","https://github.com/argosopentech/argos-translate","sherlock-project/sherlock","https://github.com/sherlock-project/sherlock","sherlock-project","Python","82828","reinforcement","0","581.59","False","0.0909","0","1","0.4273","1","0","0.3333","topic:linux language:Python stars:>=50","Hunt down social media accounts by username across social networks"
"argosopentech/argos-translate","https://github.com/argosopentech/argos-translate","iam-veeramalla/Jenkins-Zero-To-Hero","https://github.com/iam-veeramalla/Jenkins-Zero-To-Hero","iam-veeramalla","Python","9667","mlops","0","581.4","False","0","0","1","0.8937","1","0","0.3333","argos language:Python stars:>=50","Install Jenkins, configure Docker as slave, set up cicd, deploy applications to k8s using Argo CD in GitOps way."
"argosopentech/argos-translate","https://github.com/argosopentech/argos-translate","freqtrade/freqtrade","https://github.com/freqtrade/freqtrade","freqtrade","Python","49706","","0","575.43","False","0.0625","0","1","0.5382","1","0","0.3333","open-source language:Python stars:>=50","Free, open source crypto trading bot"
"argosopentech/argos-translate","https://github.com/argosopentech/argos-translate","frappe/erpnext","https://github.com/frappe/erpnext","frappe","Python","33484","","0","573.32","False","0.0435","0","1","0.624","1","0","0.3333","open-source language:Python stars:>=50","Free and Open Source Enterprise Resource Planning (ERP)"
"argosopentech/argos-translate","https://github.com/argosopentech/argos-translate","argoproj-labs/hera","https://github.com/argoproj-labs/hera","argoproj-labs","Python","896","","0","571.11","False","0.0476","0","1","0.59","1","0","0.3333","argos language:Python stars:>=50","Hera makes Python code easy to orchestrate on Argo Workflows through native Python integrations. It lets you construct and submit your Workflows entirely in Python. ⭐️ Remember to star!"
"argosopentech/argos-translate","https://github.com/argosopentech/argos-translate","couler-proj/couler","https://github.com/couler-proj/couler","couler-proj","Python","943","mlops","0","571.1","False","0.0455","0","1","0.6011","1","0","0.3333","argos language:Python stars:>=50","Unified Interface for Constructing and Managing Workflows on different workflow engines, such as Argo Workflows, Tekton Pipelines, and Apache Airflow."
"argosopentech/argos-translate","https://github.com/argosopentech/argos-translate","UlionTse/translators","https://github.com/UlionTse/translators","UlionTse","Python","2729","nlp","0","570.55","False","0","0","1","0.8317","1","0","0.3333","argos language:Python stars:>=50","Translators is a library that aims to bring free, multiple, enjoyable translations to individuals and students in Python.  「翻译官」是一个旨在用Python为个人和学生带来免费、多样、愉快翻译的库。"
"argosopentech/argos-translate","https://github.com/argosopentech/argos-translate","google-deepmind/alphafold","https://github.com/google-deepmind/alphafold","google-deepmind","Python","14553","","0","565.86","False","0","0","1","0.8049","1","0","0.3333","open-source language:Python stars:>=50","Open source code for AlphaFold 2."
"argosopentech/argos-translate","https://github.com/argosopentech/argos-translate","fauxpilot/fauxpilot","https://github.com/fauxpilot/fauxpilot","fauxpilot","Python","14744","","0","565.36","False","0","0","1","0.8021","1","0","0.3333","open-source language:Python stars:>=50","FauxPilot - an open-source alternative to GitHub Copilot server"
"argosopentech/argos-translate","https://github.com/argosopentech/argos-translate","janhq/jan","https://github.com/janhq/jan","janhq","TypeScript","42339","llm","0","560.28","False","0.0667","0","0","0.573","1","1","0.3333","topic:llm stars:>=100","Jan is an open source alternative to ChatGPT that runs 100% offline on your computer."
"argosopentech/argos-translate","https://github.com/argosopentech/argos-translate","ActivityWatch/activitywatch","https://github.com/ActivityWatch/activitywatch","ActivityWatch","Python","17433","mlops","0","558.99","False","0","0","1","0.7657","1","0","0.3333","open-source language:Python stars:>=50","The best free and open-source automated time tracker. Cross-platform, extensible, privacy-focused."
"argosopentech/argos-translate","https://github.com/argosopentech/argos-translate","home-assistant/core","https://github.com/home-assistant/core","home-assistant","Python","86899","","0","557.95","False","0.0667","0","1","0.4169","1","0","0.3333","open-source language:Python stars:>=50",":house_with_garden: Open source home automation that puts local control and privacy first."
"argosopentech/argos-translate","https://github.com/argosopentech/argos-translate","521xueweihan/HelloGitHub","https://github.com/521xueweihan/HelloGitHub","521xueweihan","Python","154482","","0","557.91","False","0.0909","0","1","0.2919","1","0","0.3333","open-source language:Python stars:>=50",":octocat: 分享 GitHub 上有趣、入门级的开源项目。Share interesting, entry-level open source projects on GitHub."
"argosopentech/argos-translate","https://github.com/argosopentech/argos-translate","stitionai/devika","https://github.com/stitionai/devika","stitionai","Python","19505","reinforcement","0","554.73","False","0","0","1","0.7413","1","0","0.3333","open-source language:Python stars:>=50","Devika is the first open-source implementation of an Agentic Software Engineer. Initially started as an open-source alternative to Devin."
"argosopentech/argos-translate","https://github.com/argosopentech/argos-translate","rasbt/LLMs-from-scratch","https://github.com/rasbt/LLMs-from-scratch","rasbt","Jupyter Notebook","91846","llm","0","552.67","False","0.0909","0","0","0.4048","1","1","0.3333","topic:llm stars:>=100","Implement a ChatGPT-like LLM in PyTorch from scratch, step by step"
"argosopentech/argos-translate","https://github.com/argosopentech/argos-translate","euroargodev/argopy","https://github.com/euroargodev/argopy","euroargodev","Python","225","","0","550.87","False","0.0833","0","1","0.2907","1","0","0.3333","argos language:Python stars:>=50","A python library for Argo data beginners and experts"
"argosopentech/argos-translate","https://github.com/argosopentech/argos-translate","Z4nzu/hackingtool","https://github.com/Z4nzu/hackingtool","Z4nzu","Python","70579","computer-vision","0","550.86","False","0.05","0","1","0.462","1","0","0.3333","topic:linux language:Python stars:>=50","ALL IN ONE Hacking Tool For Hackers"
"argosopentech/argos-translate","https://github.com/argosopentech/argos-translate","rtk-ai/rtk","https://github.com/rtk-ai/rtk","rtk-ai","Rust","40245","llm","0","547.2","False","0.05","0","0","0.584","1","1","0.3333","topic:llm stars:>=100","CLI proxy that reduces LLM token consumption by 60-90% on common dev commands. Single Rust binary, zero dependencies"
"argosopentech/argos-translate","https://github.com/argosopentech/argos-translate","Unbabel/OpenKiwi","https://github.com/Unbabel/OpenKiwi","Unbabel","Python","233","deep-learning","0","546.42","False","0.0769","0","1","0.2982","1","0","0.3333","topic:machine-translation language:Python stars:>=50","Open-Source Machine Translation Quality Estimation in PyTorch"
"argosopentech/argos-translate","https://github.com/argosopentech/argos-translate","resemble-ai/chatterbox","https://github.com/resemble-ai/chatterbox","resemble-ai","Python","24551","","0","545.98","False","0","0","1","0.6913","1","0","0.3333","open-source language:Python stars:>=50","SoTA open-source TTS"
"argosopentech/argos-translate","https://github.com/argosopentech/argos-translate","subframe7536/maple-font","https://github.com/subframe7536/maple-font","subframe7536","Python","25588","editor","0","544.41","False","0","0","1","0.6824","1","0","0.3333","open-source language:Python stars:>=50","Maple Mono: Open source monospace font with round corner, ligatures and Nerd-Font icons for IDE and terminal, fine-grained customization options. 带连字和控制台图标的圆角等宽字体，中英文宽度完美2:1，细粒度的自定义选项"
