"AnchorRepo","AnchorUrl","CandidateRepo","CandidateUrl","CandidateOwner","CandidateLanguage","CandidateStars","CandidateSubdomain","Rank","Score","Qualified","TopicJaccard","LexicalJaccard","LanguageMatch","StarSimilarity","RecencySimilarity","SubdomainMatch","QueryCoverage","SourceQueries","Description"
"argosopentech/argos-translate","https://github.com/argosopentech/argos-translate","mangopy/Confucius-tool-learning","https://github.com/mangopy/Confucius-tool-learning","mangopy","Python","158","llm","0","769.32","False","0.0909","0","1","0.2143","1","1","0.3333","topic:language-models language:Python stars:>=50","Official Repo for AAAI 2024 paper ""Confucius: Iterative Tool Learning from Introspection Feedback by Easy-to-Difficult Curriculum"""
"argosopentech/argos-translate","https://github.com/argosopentech/argos-translate","Vision-CAIR/MiniGPT-4","https://github.com/Vision-CAIR/MiniGPT-4","Vision-CAIR","Python","25725","llm","0","769.21","False","0","0","1","0.6812","1","1","0.3333","open-source language:Python stars:>=50","Open-sourced codes for MiniGPT-4 and MiniGPT-v2 (https://minigpt-4.github.io, https://minigpt-v2.github.io/)"
"argosopentech/argos-translate","https://github.com/argosopentech/argos-translate","theblackcat102/language-models-are-knowledge-graphs-pytorch","https://github.com/theblackcat102/language-models-are-knowledge-graphs-pytorch","theblackcat102","Python","170","llm","0","765.27","False","0.1111","0","1","0.2301","0.8","1","0.3333","topic:language-models language:Python stars:>=50","Language models are open knowledge graphs ( non official implementation )"
"argosopentech/argos-translate","https://github.com/argosopentech/argos-translate","uzaymacar/attention-mechanisms","https://github.com/uzaymacar/attention-mechanisms","uzaymacar","Python","379","llm","0","763.47","False","0.0476","0","1","0.4035","1","1","0.3333","topic:machine-translation language:Python stars:>=50","Implementations for a family of attention mechanisms, suitable for all kinds of natural language processing tasks and compatible with TensorFlow 2.0 and Keras."
"argosopentech/argos-translate","https://github.com/argosopentech/argos-translate","fishaudio/fish-speech","https://github.com/fishaudio/fish-speech","fishaudio","Python","30048","llm","0","763.31","False","0","0","1","0.6475","1","1","0.3333","open-source language:Python stars:>=50","SOTA Open Source TTS"
"argosopentech/argos-translate","https://github.com/argosopentech/argos-translate","petals-infra/chat.petals.dev","https://github.com/petals-infra/chat.petals.dev","petals-infra","Python","319","llm","0","761.45","False","0.0526","0","1","0.3662","1","1","0.3333","topic:language-models language:Python stars:>=50","💬 Chatbot web app + HTTP and Websocket endpoints for LLM inference with the Petals client"
"argosopentech/argos-translate","https://github.com/argosopentech/argos-translate","mit-han-lab/hardware-aware-transformers","https://github.com/mit-han-lab/hardware-aware-transformers","mit-han-lab","Python","338","llm","0","760.51","False","0.0769","0","1","0.3787","0.8","1","0.3333","topic:machine-translation language:Python stars:>=50","[ACL'20] HAT: Hardware-Aware Transformers for Efficient Natural Language Processing"
"argosopentech/argos-translate","https://github.com/argosopentech/argos-translate","ZhuLinsen/daily_stock_analysis","https://github.com/ZhuLinsen/daily_stock_analysis","ZhuLinsen","Python","33758","llm","0","758.88","False","0","0","1","0.6222","1","1","0.3333","topic:llm stars:>=100","LLM驱动的 A/H/美股智能分析器：多数据源行情 + 实时新闻 + LLM决策仪表盘 + 多渠道推送，零成本定时运行，纯白嫖. LLM-powered stock analysis system for A/H/US markets."
"argosopentech/argos-translate","https://github.com/argosopentech/argos-translate","khoj-ai/khoj","https://github.com/khoj-ai/khoj","khoj-ai","Python","34361","llm","0","758.21","False","0","0","1","0.6183","1","1","0.3333","topic:llm stars:>=100","Your AI second brain. Self-hostable. Get answers from the web or your docs. Build custom agents, schedule automations, do deep research. Turn any online or local LLM into your personal, autonomous AI (gpt, claude, gemini, llama, qwen, mistral). Get started - free."
"argosopentech/argos-translate","https://github.com/argosopentech/argos-translate","Sea-Snell/JAXSeq","https://github.com/Sea-Snell/JAXSeq","Sea-Snell","Python","209","llm","0","758.08","False","0.0667","0","1","0.2747","1","1","0.3333","topic:language-models language:Python stars:>=50","Train very large language models in Jax."
"argosopentech/argos-translate","https://github.com/argosopentech/argos-translate","HKUDS/LightRAG","https://github.com/HKUDS/LightRAG","HKUDS","Python","34683","llm","0","757.86","False","0","0","1","0.6163","1","1","0.3333","topic:llm stars:>=100","[EMNLP2025] ""LightRAG: Simple and Fast Retrieval-Augmented Generation"""
"argosopentech/argos-translate","https://github.com/argosopentech/argos-translate","chatchat-space/Langchain-Chatchat","https://github.com/chatchat-space/Langchain-Chatchat","chatchat-space","Python","37951","llm","0","754.43","False","0","0","1","0.5968","1","1","0.3333","topic:llm stars:>=100","Langchain-Chatchat（原Langchain-ChatGLM）基于 Langchain 与 ChatGLM, Qwen 与 Llama 等语言模型的 RAG 与 Agent 应用 | Langchain-Chatchat (formerly langchain-ChatGLM), local knowledge based LLM (like ChatGLM, Qwen and Llama) RAG and Agent app with langchain "
"argosopentech/argos-translate","https://github.com/argosopentech/argos-translate","QuivrHQ/quivr","https://github.com/QuivrHQ/quivr","QuivrHQ","Python","39123","llm","0","753.28","False","0","0","1","0.5902","1","1","0.3333","topic:llm stars:>=100","Opiniated RAG for integrating GenAI in your apps 🧠   Focus on your product rather than the RAG. Easy integration in existing products with customisation!  Any LLM: GPT4, Groq, Llama. Any Vectorstore: PGVector, Faiss. Any Files. Anyway you want."
"argosopentech/argos-translate","https://github.com/argosopentech/argos-translate","tomekkorbak/pretraining-with-human-feedback","https://github.com/tomekkorbak/pretraining-with-human-feedback","tomekkorbak","Python","181","llm","0","752.64","False","0.0667","0","1","0.2437","1","1","0.3333","topic:language-models language:Python stars:>=50","Code accompanying the paper Pretraining Language Models with Human Preferences"
"argosopentech/argos-translate","https://github.com/argosopentech/argos-translate","HKUDS/nanobot","https://github.com/HKUDS/nanobot","HKUDS","Python","41543","llm","0","751","False","0","0","1","0.5771","1","1","0.3333","topic:llm stars:>=100","""🐈 nanobot: The Ultra-Lightweight Personal AI Agent"""
"argosopentech/argos-translate","https://github.com/argosopentech/argos-translate","datawhalechina/hello-agents","https://github.com/datawhalechina/hello-agents","datawhalechina","Python","42276","llm","0","750.33","False","0","0","1","0.5733","1","1","0.3333","topic:llm stars:>=100","📚 《从零开始构建智能体》——从零开始的智能体原理与实践教程"
"argosopentech/argos-translate","https://github.com/argosopentech/argos-translate","zhayujie/CowAgent","https://github.com/zhayujie/CowAgent","zhayujie","Python","43978","llm","0","748.83","False","0","0","1","0.5648","1","1","0.3333","topic:llm stars:>=100","CowAgent (chatgpt-on-wechat) 是基于大模型的超级AI助理，能主动思考和任务规划、访问操作系统和外部资源、创造和执行Skills、通过长期记忆和知识库不断成长，比OpenClaw更轻量和便捷。同时支持微信、飞书、钉钉、企微、QQ、公众号、网页等接入，可选择DeepSeek/OpenAI/Claude/Gemini/ MiniMax/Qwen/GLM/LinkAI，能处理文本、语音、图片和文件，可快速搭建个人AI助理和企业数字员工。"
"argosopentech/argos-translate","https://github.com/argosopentech/argos-translate","Picovoice/picollm","https://github.com/Picovoice/picollm","Picovoice","Python","311","llm","0","747.74","False","0.0385","0","1","0.3607","1","1","0.3333","topic:language-models language:Python stars:>=50","On-device LLM Inference Powered by X-Bit Quantization"
"argosopentech/argos-translate","https://github.com/argosopentech/argos-translate","BerriAI/litellm","https://github.com/BerriAI/litellm","BerriAI","Python","45528","llm","0","747.52","False","0","0","1","0.5572","1","1","0.3333","topic:llm stars:>=100","Python SDK, Proxy Server (AI Gateway) to call 100+ LLM APIs in OpenAI (or native) format, with cost tracking, guardrails, loadbalancing and logging. [Bedrock, Azure, OpenAI, VertexAI, Cohere, Anthropic, Sagemaker, HuggingFace, VLLM, NVIDIA NIM]"
"argosopentech/argos-translate","https://github.com/argosopentech/argos-translate","oobabooga/textgen","https://github.com/oobabooga/textgen","oobabooga","Python","46924","llm","0","746.37","False","0","0","1","0.5507","1","1","0.3333","open-source language:Python stars:>=50","Open-source desktop app for local LLMs. Text, vision, tool-calling, OpenAI/Anthropic-compatible API."
"argosopentech/argos-translate","https://github.com/argosopentech/argos-translate","run-llama/llama_index","https://github.com/run-llama/llama_index","run-llama","Python","49104","llm","0","744.64","False","0","0","1","0.5408","1","1","0.3333","topic:llm stars:>=100","LlamaIndex is the leading document agent and OCR platform"
"argosopentech/argos-translate","https://github.com/argosopentech/argos-translate","Significant-Gravitas/AutoGPT","https://github.com/Significant-Gravitas/AutoGPT","Significant-Gravitas","Python","183948","llm","0","744.46","False","0.0556","0","1","0.254","1","1","0.3333","topic:llm stars:>=100","AutoGPT is the vision of accessible AI for everyone, to use and to build on. Our mission is to provide the tools, so that you can focus on what matters."
"argosopentech/argos-translate","https://github.com/argosopentech/argos-translate","retarfi/language-pretraining","https://github.com/retarfi/language-pretraining","retarfi","Python","50","llm","0","743.75","False","0.1875","0","1","0","0.4","1","0.3333","topic:language-models language:Python stars:>=50","Pre-training Language Models for Japanese"
"argosopentech/argos-translate","https://github.com/argosopentech/argos-translate","xark-argo/argo","https://github.com/xark-argo/argo","xark-argo","Python","679","llm","0","742.73","False","0","0","1","0.5299","1","1","0.3333","argos language:Python stars:>=50","ARGO is an open-source AI Agent platform that brings Local Manus to your desktop. With one-click model downloads, seamless closed LLM integration, and offline-first RAG knowledge bases, ARGO becomes a DeepResearch powerhouse for autonomous thinking, task planning, and 100% of your data stays locally. Support Win/Mac/Docker."
"argosopentech/argos-translate","https://github.com/argosopentech/argos-translate","JuliusBrussee/caveman","https://github.com/JuliusBrussee/caveman","JuliusBrussee","Python","52658","llm","0","741.99","False","0","0","1","0.5256","1","1","0.3333","topic:llm stars:>=100","🪨 why use many token when few token do trick — Claude Code skill that cuts 65% of tokens by talking like caveman"
"argosopentech/argos-translate","https://github.com/argosopentech/argos-translate","alanarazi7/TabSTAR","https://github.com/alanarazi7/TabSTAR","alanarazi7","Python","83","llm","0","738.26","False","0.0833","0","1","0.0758","1","1","0.3333","topic:language-models language:Python stars:>=50","TabSTAR: A Tabular Foundation Model for Tabular Data with Text Fields"
"argosopentech/argos-translate","https://github.com/argosopentech/argos-translate","mininet/mininet","https://github.com/mininet/mininet","mininet","Python","5799","","0","737.64","False","0.1538","0","1","0.9953","1","0","0.3333","topic:linux language:Python stars:>=50","Emulator for rapid prototyping of Software Defined Networks"
"argosopentech/argos-translate","https://github.com/argosopentech/argos-translate","unslothai/unsloth","https://github.com/unslothai/unsloth","unslothai","Python","63479","llm","0","734.89","False","0","0","1","0.4851","1","1","0.3333","topic:llm stars:>=100","Web UI for training and running open models like Gemma 4, Qwen3.6, DeepSeek, gpt-oss locally."
"argosopentech/argos-translate","https://github.com/argosopentech/argos-translate","TauricResearch/TradingAgents","https://github.com/TauricResearch/TradingAgents","TauricResearch","Python","63710","llm","0","734.75","False","0","0","1","0.4843","1","1","0.3333","topic:llm stars:>=100","TradingAgents: Multi-Agents LLM Financial Trading Framework"
"argosopentech/argos-translate","https://github.com/argosopentech/argos-translate","unclecode/crawl4ai","https://github.com/unclecode/crawl4ai","unclecode","Python","64926","llm","0","734.03","False","0","0","1","0.4802","1","1","0.3333","open-source language:Python stars:>=50","🚀🤖 Crawl4AI: Open-source LLM Friendly Web Crawler & Scraper. Don't be shy, join here: https://discord.gg/jP8KfhDhyN"
"argosopentech/argos-translate","https://github.com/argosopentech/argos-translate","zjunlp/DART","https://github.com/zjunlp/DART","zjunlp","Python","131","llm","0","733.37","False","0.0588","0","1","0.1739","1","1","0.3333","topic:language-models language:Python stars:>=50","[ICLR 2022] Differentiable Prompt Makes Pre-trained Language Models Better Few-shot Learners"
"argosopentech/argos-translate","https://github.com/argosopentech/argos-translate","FoundationAgents/MetaGPT","https://github.com/FoundationAgents/MetaGPT","FoundationAgents","Python","67644","llm","0","732.47","False","0","0","1","0.4713","1","1","0.3333","topic:llm stars:>=100","🌟 The Multi-Agent Framework: First AI Software Company, Towards Natural Language Programming"
"argosopentech/argos-translate","https://github.com/argosopentech/argos-translate","OpenHands/OpenHands","https://github.com/OpenHands/OpenHands","OpenHands","Python","72535","llm","0","729.82","False","0","0","1","0.4561","1","1","0.3333","topic:llm stars:>=100","🙌 OpenHands: AI-Driven Development"
"argosopentech/argos-translate","https://github.com/argosopentech/argos-translate","ajenti/ajenti","https://github.com/ajenti/ajenti","ajenti","Python","7927","","0","727.4","False","0.1538","0","1","0.9368","1","0","0.3333","topic:linux language:Python stars:>=50","Ajenti Core and stock plugins"
"argosopentech/argos-translate","https://github.com/argosopentech/argos-translate","vllm-project/vllm","https://github.com/vllm-project/vllm","vllm-project","Python","78900","llm","0","726.62","False","0","0","1","0.4378","1","1","0.3333","topic:llm stars:>=100","A high-throughput and memory-efficient inference and serving engine for LLMs"
"argosopentech/argos-translate","https://github.com/argosopentech/argos-translate","infiniflow/ragflow","https://github.com/infiniflow/ragflow","infiniflow","Python","79508","llm","0","726.33","False","0","0","1","0.4362","1","1","0.3333","open-source language:Python stars:>=50","RAGFlow is a leading open-source Retrieval-Augmented Generation (RAG) engine that fuses cutting-edge RAG with Agent capabilities to create a superior context layer for LLMs"
"argosopentech/argos-translate","https://github.com/argosopentech/argos-translate","kivy/kivy","https://github.com/kivy/kivy","kivy","Python","18926","","0","725.87","False","0.1333","0","1","0.7478","1","0","0.6667","topic:linux language:Python stars:>=50 | open-source language:Python stars:>=50","Open source UI framework written in Python, running on Windows, Linux, macOS, Android and iOS"
"argosopentech/argos-translate","https://github.com/argosopentech/argos-translate","wxjiao/ParroT","https://github.com/wxjiao/ParroT","wxjiao","Python","177","llm","0","719.74","False","0.0588","0","1","0.2388","0.8","1","0.3333","topic:machine-translation language:Python stars:>=50","The ParroT framework to enhance and regulate the Translation Abilities during Chat based on open-sourced LLMs (e.g., LLaMA-7b, Bloomz-7b1-mt) and human written translation and evaluation data."
"argosopentech/argos-translate","https://github.com/argosopentech/argos-translate","MrS0m30n3/youtube-dl-gui","https://github.com/MrS0m30n3/youtube-dl-gui","MrS0m30n3","Python","9434","editor","0","718.76","False","0.1","0.0714","1","0.899","1","0","0.3333","topic:linux language:Python stars:>=50","A cross platform front-end GUI of the popular youtube-dl written in wxPython."
"argosopentech/argos-translate","https://github.com/argosopentech/argos-translate","malteos/llm-datasets","https://github.com/malteos/llm-datasets","malteos","Python","64","llm","0","718.51","False","0.1","0","1","0.0201","0.8","1","0.3333","topic:language-models language:Python stars:>=50","A collection of datasets for language model pretraining including scripts for downloading, preprocesssing, and sampling."
"argosopentech/argos-translate","https://github.com/argosopentech/argos-translate","Nayjest/lm-proxy","https://github.com/Nayjest/lm-proxy","Nayjest","Python","115","llm","0","714.65","False","0.0435","0","1","0.1458","1","1","0.3333","topic:language-models language:Python stars:>=50","OpenAI-compatible HTTP LLM proxy / gateway for multi-provider inference (Google, Anthropic, OpenAI, PyTorch). Lightweight, extensible Python/FastAPI—use as library or standalone service."
"argosopentech/argos-translate","https://github.com/argosopentech/argos-translate","vbario/sleeping-llm","https://github.com/vbario/sleeping-llm","vbario","Python","61","llm","0","711.72","False","0.0667","0","1","0.0098","1","1","0.3333","topic:language-models language:Python stars:>=50","A language model that forms persistent memories from conversation and maintains them through sleep. MEMIT weight editing + null-space-constrained maintenance."
"argosopentech/argos-translate","https://github.com/argosopentech/argos-translate","NousResearch/hermes-agent","https://github.com/NousResearch/hermes-agent","NousResearch","Python","130246","llm","0","707.57","False","0","0","1","0.329","1","1","0.3333","topic:llm stars:>=100","The agent that grows with you"
"argosopentech/argos-translate","https://github.com/argosopentech/argos-translate","bleachbit/bleachbit","https://github.com/bleachbit/bleachbit","bleachbit","Python","5050","","0","706.43","False","0.125","0","1","0.9653","1","0","0.3333","topic:linux language:Python stars:>=50","BleachBit system cleaner for Windows and Linux"
"argosopentech/argos-translate","https://github.com/argosopentech/argos-translate","open-webui/open-webui","https://github.com/open-webui/open-webui","open-webui","Python","135275","llm","0","706.13","False","0","0","1","0.3208","1","1","0.3333","topic:llm stars:>=100","User-friendly AI Interface (Supports Ollama, OpenAI API, ...)"
"argosopentech/argos-translate","https://github.com/argosopentech/argos-translate","hplt-project/sacremoses","https://github.com/hplt-project/sacremoses","hplt-project","Python","495","nlp","0","705.74","False","0.2222","0","1","0.4614","1","0","0.3333","topic:machine-translation language:Python stars:>=50","Python port of Moses tokenizer, truecaser and normalizer"
"argosopentech/argos-translate","https://github.com/argosopentech/argos-translate","jcyk/gtos","https://github.com/jcyk/gtos","jcyk","Python","191","llm","0","701.49","False","0.0909","0","1","0.2553","0.4","1","0.3333","topic:machine-translation language:Python stars:>=50","Code for AAAI2020 paper ""Graph Transformer for Graph-to-Sequence Learning"""
"argosopentech/argos-translate","https://github.com/argosopentech/argos-translate","ogkalu2/comic-translate","https://github.com/ogkalu2/comic-translate","ogkalu2","Python","2553","deep-learning","0","701.02","False","0.12","0.0385","1","0.8172","1","0","0.3333","topic:machine-translation language:Python stars:>=50","AI comic and manga translator app for automatically translating comics, manga, manhwa, BDs, fumetti, and more in multiple languages and formats (Images, PDF, EPUB, CBR, CBZ etc)."
"argosopentech/argos-translate","https://github.com/argosopentech/argos-translate","r0x0r/pywebview","https://github.com/r0x0r/pywebview","r0x0r","Python","5880","","0","699.71","False","0.1111","0","1","0.9983","1","0","0.3333","topic:linux language:Python stars:>=50","Build GUI for your Python program with JavaScript, HTML, and CSS"
"argosopentech/argos-translate","https://github.com/argosopentech/argos-translate","spack/spack","https://github.com/spack/spack","spack","Python","5024","","0","699.62","False","0.1176","0","1","0.9642","1","0","0.3333","topic:linux language:Python stars:>=50","A flexible package manager that supports multiple versions, configurations, platforms, and compilers."
"argosopentech/argos-translate","https://github.com/argosopentech/argos-translate","naver/disco","https://github.com/naver/disco","naver","Python","75","llm","0","690.7","False","0.0625","0","1","0.054","0.8","1","0.3333","topic:language-models language:Python stars:>=50","A Toolkit for Distributional Control of Generative Models"
"argosopentech/argos-translate","https://github.com/argosopentech/argos-translate","OpenNMT/OpenNMT-tf","https://github.com/OpenNMT/OpenNMT-tf","OpenNMT","Python","1484","deep-learning","0","685.87","False","0.1538","0","1","0.6995","1","0","0.3333","topic:machine-translation language:Python stars:>=50","Neural machine translation and sequence learning using TensorFlow"
"argosopentech/argos-translate","https://github.com/argosopentech/argos-translate","oxpig/CaLM","https://github.com/oxpig/CaLM","oxpig","Python","54","llm","0","685","False","0.0667","0","1","0","0.8","1","0.3333","topic:language-models language:Python stars:>=50","Protein language model trained on coding DNA"
"argosopentech/argos-translate","https://github.com/argosopentech/argos-translate","hust-open-atom-club/linux-insides-zh","https://github.com/hust-open-atom-club/linux-insides-zh","hust-open-atom-club","Python","7657","nlp","0","680.26","False","0.1","0","1","0.9443","1","0","0.3333","topic:linux language:Python stars:>=50","Linux 内核揭秘"
"argosopentech/argos-translate","https://github.com/argosopentech/argos-translate","CLUEbenchmark/CLUEDatasetSearch","https://github.com/CLUEbenchmark/CLUEDatasetSearch","CLUEbenchmark","Python","4433","nlp","0","678.98","False","0.1","0","1","0.937","1","0","0.3333","topic:machine-translation language:Python stars:>=50","搜索所有中文NLP数据集，附常用英文NLP数据集"
"argosopentech/argos-translate","https://github.com/argosopentech/argos-translate","pywinauto/pywinauto","https://github.com/pywinauto/pywinauto","pywinauto","Python","5995","","0","677.81","False","0.087","0","1","0.9975","1","0","0.3333","topic:linux language:Python stars:>=50","Windows GUI Automation with Python (based on text properties)"
"argosopentech/argos-translate","https://github.com/argosopentech/argos-translate","rsennrich/subword-nmt","https://github.com/rsennrich/subword-nmt","rsennrich","Python","2271","deep-learning","0","676.13","False","0.0769","0.0667","1","0.7918","1","0","0.3333","topic:machine-translation language:Python stars:>=50","Unsupervised Word Segmentation for Neural Machine Translation and Text Generation"
"argosopentech/argos-translate","https://github.com/argosopentech/argos-translate","waydroid/waydroid","https://github.com/waydroid/waydroid","waydroid","Python","11286","","0","675.52","False","0.1111","0","1","0.8601","1","0","0.3333","topic:linux language:Python stars:>=50","Waydroid uses a container-based approach to boot a full Android system on a regular GNU/Linux system like Ubuntu."
"argosopentech/argos-translate","https://github.com/argosopentech/argos-translate","donnemartin/saws","https://github.com/donnemartin/saws","donnemartin","Python","5302","","0","674.04","False","0.087","0","1","0.9759","1","0","0.3333","topic:linux language:Python stars:>=50","A supercharged AWS command line interface (CLI)."
"argosopentech/argos-translate","https://github.com/argosopentech/argos-translate","bottlesdevs/Bottles","https://github.com/bottlesdevs/Bottles","bottlesdevs","Python","8362","","0","672.62","False","0.0952","0","1","0.9252","1","0","0.3333","topic:linux language:Python stars:>=50","Run Windows software and games on Linux"
"argosopentech/argos-translate","https://github.com/argosopentech/argos-translate","pdfarranger/pdfarranger","https://github.com/pdfarranger/pdfarranger","pdfarranger","Python","5427","","0","671.66","False","0.0833","0","1","0.9809","1","0","0.3333","topic:linux language:Python stars:>=50","Small python-gtk application, which helps the user to merge or split PDF documents and rotate, crop and rearrange their pages using an interactive and intuitive graphical interface."
"argosopentech/argos-translate","https://github.com/argosopentech/argos-translate","Unbabel/COMET","https://github.com/Unbabel/COMET","Unbabel","Python","743","deep-learning","0","671.15","False","0.1667","0","1","0.5494","1","0","0.3333","topic:machine-translation language:Python stars:>=50"," A Neural Framework for MT Evaluation"
"argosopentech/argos-translate","https://github.com/argosopentech/argos-translate","aidlearning/AidLearning-FrameWork","https://github.com/aidlearning/AidLearning-FrameWork","aidlearning","Python","5769","editor","0","670.99","False","0.08","0","1","0.9942","1","0","0.3333","topic:linux language:Python stars:>=50","🔥🔥🔥AidLearning is a powerful AIOT development platform, AidLearning builds a linux env supporting GUI, deep learning and visual IDE on Android...Now Aid supports CPU+GPU+NPU for inference with high performance acceleration...Linux on Android or HarmonyOS "
"argosopentech/argos-translate","https://github.com/argosopentech/argos-translate","bilel-bj/ROSGPT_Vision","https://github.com/bilel-bj/ROSGPT_Vision","bilel-bj","Python","104","llm","0","669.11","False","0.0526","0","1","0.1242","0.6","1","0.3333","topic:language-models language:Python stars:>=50","Commanding robots using only Language Models' prompts"
