"AnchorRepo","AnchorUrl","CandidateRepo","CandidateUrl","CandidateOwner","CandidateLanguage","CandidateStars","CandidateSubdomain","Rank","Score","Qualified","TopicJaccard","LexicalJaccard","LanguageMatch","StarSimilarity","RecencySimilarity","SubdomainMatch","QueryCoverage","SourceQueries","Description"
"huggingface/datasets","https://github.com/huggingface/datasets","janhq/jan","https://github.com/janhq/jan","janhq","TypeScript","42352","llm","0","588.34","False","0.0435","0","0","0.8526","1","1","0.3333","topic:llm stars:>=100","Jan is an open source alternative to ChatGPT that runs 100% offline on your computer."
"huggingface/datasets","https://github.com/huggingface/datasets","encode/django-rest-framework","https://github.com/encode/django-rest-framework","encode","Python","29991","","0","587.32","False","0","0","1","0.9276","1","0","0.3333","d language:Python stars:>=50","Web APIs for Django. 🎸"
"huggingface/datasets","https://github.com/huggingface/datasets","upstash/context7","https://github.com/upstash/context7","upstash","TypeScript","54353","llm","0","587.1","False","0.0526","0","0","0.7984","1","1","0.3333","topic:llm stars:>=100","Context7 Platform -- Up-to-date code documentation for LLMs and AI code editors"
"huggingface/datasets","https://github.com/huggingface/datasets","guofei9987/scikit-opt","https://github.com/guofei9987/scikit-opt","guofei9987","Python","6529","","0","586.89","False","0.0357","0","1","0.7414","1","0","0.3333","topic:artificial-intelligence language:Python stars:>=50","Genetic Algorithm, Particle Swarm Optimization, Simulated Annealing, Ant Colony Optimization Algorithm,Immune Algorithm, Artificial Fish Swarm Algorithm, Differential Evolution and TSP(Traveling salesman) "
"huggingface/datasets","https://github.com/huggingface/datasets","NVlabs/neuralangelo","https://github.com/NVlabs/neuralangelo","NVlabs","Python","4591","deep-learning","0","586.37","False","0.05","0","1","0.6649","1","0","0.3333","topic:computer-vision language:Python stars:>=50","Official implementation of ""Neuralangelo: High-Fidelity Neural Surface Reconstruction"" (CVPR 2023)"
"huggingface/datasets","https://github.com/huggingface/datasets","github/spec-kit","https://github.com/github/spec-kit","github","Python","92303","","0","585.51","False","0.0455","0","1","0.6834","1","0","0.3333","topic:ai language:Python stars:>=50","💫 Toolkit to help you get started with Spec-Driven Development"
"huggingface/datasets","https://github.com/huggingface/datasets","rtk-ai/rtk","https://github.com/rtk-ai/rtk","rtk-ai","Rust","40571","llm","0","582.98","False","0.0357","0","0","0.8619","1","1","0.3333","topic:llm stars:>=100","CLI proxy that reduces LLM token consumption by 60-90% on common dev commands. Single Rust binary, zero dependencies"
"huggingface/datasets","https://github.com/huggingface/datasets","milvus-io/milvus","https://github.com/milvus-io/milvus","milvus-io","Go","44103","llm","0","574.94","False","0.0303","0","0","0.8438","1","1","0.3333","topic:llm stars:>=100","Milvus is a high-performance, cloud-native vector database built for scalable vector ANN search"
"huggingface/datasets","https://github.com/huggingface/datasets","mingrammer/diagrams","https://github.com/mingrammer/diagrams","mingrammer","Python","42237","","0","574.31","False","0","0","1","0.8532","1","0","0.3333","d language:Python stars:>=50",":art: Diagram as Code for prototyping cloud system architectures"
"huggingface/datasets","https://github.com/huggingface/datasets","shareAI-lab/learn-claude-code","https://github.com/shareAI-lab/learn-claude-code","shareAI-lab","TypeScript","57935","llm","0","573.3","False","0.04","0","0","0.7846","1","1","0.3333","topic:llm stars:>=100","Bash is all you need -  A nano claude code–like 「agent harness」, built from 0 to 1"
"huggingface/datasets","https://github.com/huggingface/datasets","Jon-Becker/prediction-market-analysis","https://github.com/Jon-Becker/prediction-market-analysis","Jon-Becker","Python","3249","data-science","0","569.14","False","0.0455","0","1","0.5899","1","0","0.3333","largest language:Python stars:>=50","A framework for collecting and analyzing prediction market data, including the largest publicly available dataset of Polymarket and Kalshi market and trade data."
"huggingface/datasets","https://github.com/huggingface/datasets","firecrawl/firecrawl","https://github.com/firecrawl/firecrawl","firecrawl","TypeScript","114615","llm","0","565.92","False","0.0606","0","0","0.6364","1","1","0.3333","topic:llm stars:>=100","🔥 The API to search, scrape, and interact with the web for AI"
"huggingface/datasets","https://github.com/huggingface/datasets","Mintplex-Labs/anything-llm","https://github.com/Mintplex-Labs/anything-llm","Mintplex-Labs","JavaScript","59463","llm","0","562.78","False","0.0294","0","0","0.7789","1","1","0.3333","topic:llm stars:>=100","The all-in-one AI productivity accelerator. On device and privacy first with no annoying setup or configuration."
"huggingface/datasets","https://github.com/huggingface/datasets","langgenius/dify","https://github.com/langgenius/dify","langgenius","TypeScript","139973","llm","0","556.72","False","0.0588","0","0","0.593","1","1","0.3333","topic:llm stars:>=100","Production-ready platform for agentic workflow development."
"huggingface/datasets","https://github.com/huggingface/datasets","django/django","https://github.com/django/django","django","Python","87391","","0","546.68","False","0","0","1","0.6953","1","0","0.3333","d language:Python stars:>=50","The Web framework for perfectionists with deadlines."
"huggingface/datasets","https://github.com/huggingface/datasets","deepseek-ai/DeepSeek-V3","https://github.com/deepseek-ai/DeepSeek-V3","deepseek-ai","Python","103362","","0","540.3","False","0","0","1","0.6589","1","0","0.3333","d language:Python stars:>=50",""
"huggingface/datasets","https://github.com/huggingface/datasets","affaan-m/everything-claude-code","https://github.com/affaan-m/everything-claude-code","affaan-m","JavaScript","172584","llm","0","534.95","False","0.0435","0","0","0.5476","1","1","0.3333","topic:llm stars:>=100","The agent harness performance optimization system. Skills, instincts, memory, security, and research-first development for Claude Code, Codex, Opencode, Cursor and beyond."
"huggingface/datasets","https://github.com/huggingface/datasets","holoviz/datashader","https://github.com/holoviz/datashader","holoviz","Python","3542","","0","531.51","False","0","0","1","0.6086","1","0","0.3333","largest language:Python stars:>=50","Quickly and accurately render even the largest data."
"huggingface/datasets","https://github.com/huggingface/datasets","ytdl-org/youtube-dl","https://github.com/ytdl-org/youtube-dl","ytdl-org","Python","140185","editor","0","528.72","False","0","0","1","0.5927","1","0","0.3333","d language:Python stars:>=50","Command-line program to download videos from YouTube.com and other video sites"
"huggingface/datasets","https://github.com/huggingface/datasets","ollama/ollama","https://github.com/ollama/ollama","ollama","Go","170612","llm","0","526.26","False","0.0333","0","0","0.5501","1","1","0.3333","topic:llm stars:>=100","Get up and running with Kimi-K2.5, GLM-5, MiniMax, DeepSeek, gpt-oss, Qwen, Gemma and other models."
"huggingface/datasets","https://github.com/huggingface/datasets","yt-dlp/yt-dlp","https://github.com/yt-dlp/yt-dlp","yt-dlp","Python","160369","editor","0","523.61","False","0","0","1","0.5635","1","0","0.3333","d language:Python stars:>=50","A feature-rich command-line audio/video downloader"
"huggingface/datasets","https://github.com/huggingface/datasets","FreedomIntelligence/OpenClaw-Medical-Skills","https://github.com/FreedomIntelligence/OpenClaw-Medical-Skills","FreedomIntelligence","Python","2232","","0","513.97","False","0","0","1","0.5084","1","0","0.3333","largest language:Python stars:>=50","The largest open-source medical AI skills library for OpenClaw🦞."
"huggingface/datasets","https://github.com/huggingface/datasets","mazen160/secrets-patterns-db","https://github.com/mazen160/secrets-patterns-db","mazen160","Python","1439","computer-vision","0","497.3","False","0","0","1","0.4131","1","0","0.3333","largest language:Python stars:>=50","Secrets Patterns DB: The largest open-source Database for detecting secrets, API keys, passwords, tokens, and more."
"huggingface/datasets","https://github.com/huggingface/datasets","probonopd/irdb","https://github.com/probonopd/irdb","probonopd","Python","1263","","0","492.34","False","0","0","1","0.3848","1","0","0.3333","largest language:Python stars:>=50","One of the largest crowd-sourced, manufacturer-independent databases of infrared remote control codes on the web, and aspiring to become the most comprehensive and most accurate one"
"huggingface/datasets","https://github.com/huggingface/datasets","Icyrockton/MegaVul","https://github.com/Icyrockton/MegaVul","Icyrockton","Python","148","deep-learning","0","467.86","False","0.0476","0","1","0","1","0","0.3333","largest language:Python stars:>=50","MegaVul - The largest, high-quality, extensible, continuously updated, C/C++/Java vulnerability dataset"
"huggingface/datasets","https://github.com/huggingface/datasets","liamdugan/raid","https://github.com/liamdugan/raid","liamdugan","Python","185","computer-vision","0","462.5","False","0.0417","0","1","0","1","0","0.3333","largest language:Python stars:>=50","RAID is the largest and most challenging benchmark for AI-generated text detection. (ACL 2024)"
"huggingface/datasets","https://github.com/huggingface/datasets","oxbshw/ultimate-n8n-ai-workflows","https://github.com/oxbshw/ultimate-n8n-ai-workflows","oxbshw","Python","533","","0","459.6","False","0","0","1","0.1977","1","0","0.3333","largest language:Python stars:>=50"," The largest high-quality open-source library of +3400 n8n AI workflows – ready to use, extend, and contribute."
"huggingface/datasets","https://github.com/huggingface/datasets","dimagi/commcare-hq","https://github.com/dimagi/commcare-hq","dimagi","Python","521","editor","0","458.74","False","0","0","1","0.1928","1","0","0.3333","largest language:Python stars:>=50","CommCareHQ is the server backend for CommCare, the world's largest platform for designing, managing, and deploying robust, offline-first, mobile applications to frontline workers worldwide"
"huggingface/datasets","https://github.com/huggingface/datasets","uni-medical/STU-Net","https://github.com/uni-medical/STU-Net","uni-medical","Python","368","computer-vision","0","445.55","False","0","0","1","0.1175","1","0","0.3333","largest language:Python stars:>=50","The largest pre-trained medical image segmentation model (1.4B parameters) based on the largest public dataset (>100k annotations), up until April 2023."
"huggingface/datasets","https://github.com/huggingface/datasets","liuxu77/LargeST","https://github.com/liuxu77/LargeST","liuxu77","Python","278","","0","434.93","False","0","0","1","0.0567","1","0","0.3333","largest language:Python stars:>=50","LargeST: A Benchmark Dataset for Large-Scale Traffic Forecasting (NeurIPS 2023)"
"huggingface/datasets","https://github.com/huggingface/datasets","syntaxticsugr/ViPER4Android-Presets","https://github.com/syntaxticsugr/ViPER4Android-Presets","syntaxticsugr","Python","199","","0","425","False","0","0","1","0","1","0","0.3333","largest language:Python stars:>=50","Largest collection of DDC, Kernel & Preset for ViPER4Android"
"huggingface/datasets","https://github.com/huggingface/datasets","m-bain/CondensedMovies","https://github.com/m-bain/CondensedMovies","m-bain","Python","198","nlp","0","425","False","0","0","1","0","1","0","0.3333","largest language:Python stars:>=50","Story-Based Retrieval with Contextual Embeddings. Largest freely available movie video dataset. [ACCV'20]"
"huggingface/datasets","https://github.com/huggingface/datasets","sakha1370/OpenRay","https://github.com/sakha1370/OpenRay","sakha1370","Python","179","mlops","0","425","False","0","0","1","0","1","0","0.3333","largest language:Python stars:>=50","OpenRay is one of the largest open-source systems for collecting, validating, and curating free proxy servers. It runs hourly through a three-stage pipeline to remove dead proxies and maintain high-quality lists by protocol and country. Originally built for Iran, it now serves users worldwide."
"huggingface/datasets","https://github.com/huggingface/datasets","pageauc/motion-track","https://github.com/pageauc/motion-track","pageauc","Python","153","mlops","0","425","False","0","0","1","0","1","0","0.3333","largest language:Python stars:>=50","Windows, Unix, Raspberry Pi Motion Tracking Demo.  Tracks movement in camera view and returns  X, Y Position of Largest Moving Contour in Camera View - See Moved GitHub Project Links"
"huggingface/datasets","https://github.com/huggingface/datasets","zzndream/ShipRSImageNet","https://github.com/zzndream/ShipRSImageNet","zzndream","Python","140","computer-vision","0","425","False","0","0","1","0","1","0","0.3333","largest language:Python stars:>=50","ShipRSImageNet is the largest ship detection dataset in the Computer Vision and Earth Vision communities."
"huggingface/datasets","https://github.com/huggingface/datasets","marcelbinz/Psych-201","https://github.com/marcelbinz/Psych-201","marcelbinz","Python","90","","0","425","False","0","0","1","0","1","0","0.3333","largest language:Python stars:>=50","Largest, cross-domain data set of human behavior."
"huggingface/datasets","https://github.com/huggingface/datasets","Henshall/BitcoinPrivateKeyHunter","https://github.com/Henshall/BitcoinPrivateKeyHunter","Henshall","Python","89","","0","425","False","0","0","1","0","1","0","0.3333","largest language:Python stars:>=50","This python project lets you hunt for public and private matching key pairs from bitcoin addresses with the largest number of bitcoins. Simply run the script to start hunting and if your lucky (extremely lucky) cash out on millions of dollars of bitcoin.)"
"huggingface/datasets","https://github.com/huggingface/datasets","EnquanYang2022/3CAD","https://github.com/EnquanYang2022/3CAD","EnquanYang2022","Python","61","computer-vision","0","425","False","0","0","1","0","1","0","0.3333","largest language:Python stars:>=50","AAAI-2025: The largest and first anomaly detection dataset dedicated to 3C product quality control"
"huggingface/datasets","https://github.com/huggingface/datasets","Berkeley-Large-RAG/RAG-DS-Serve","https://github.com/Berkeley-Large-RAG/RAG-DS-Serve","Berkeley-Large-RAG","Python","50","deep-learning","0","425","False","0","0","1","0","1","0","0.3333","largest language:Python stars:>=50","DS SERVE: The Largest Open Vector Store over Pretain Data; A Framework for Efficient and Scalable Neural Retrieval"
"huggingface/datasets","https://github.com/huggingface/datasets","OpenStitching/lir","https://github.com/OpenStitching/lir","OpenStitching","Python","191","","0","400","False","0","0","1","0","0.8","0","0.3333","largest language:Python stars:>=50","Largest Interior/Inscribed Rectangle implementation in Python. "
"huggingface/datasets","https://github.com/huggingface/datasets","NoorBayan/Diwan","https://github.com/NoorBayan/Diwan","NoorBayan","Python","182","reinforcement","0","400","False","0","0","1","0","0.8","0","0.3333","largest language:Python stars:>=50","Diwan is the largest Arabic poetry dataset, containing nearly 500,000 poems and over 15 million verses. It spans various poetic forms, meters, styles, and themes, from ancient to modern times. The dataset is organized into categories to support research in Arabic literature, prosody, and natural language processing."
"huggingface/datasets","https://github.com/huggingface/datasets","devoxi/lttb-py","https://github.com/devoxi/lttb-py","devoxi","Python","90","","0","400","False","0","0","1","0","0.8","0","0.3333","largest language:Python stars:>=50","Largest-Triangle-Three-Buckets (LTTB) downsampling algorithm in Python"
"huggingface/datasets","https://github.com/huggingface/datasets","IllinoisGraphBenchmark/IGB-Datasets","https://github.com/IllinoisGraphBenchmark/IGB-Datasets","IllinoisGraphBenchmark","Python","86","reinforcement","0","400","False","0","0","1","0","0.8","0","0.3333","largest language:Python stars:>=50","Largest realworld open-source graph dataset - Worked done under IBM-Illinois Discovery Accelerator Institute and Amazon Research Awards and in collaboration with NVIDIA Research."
"huggingface/datasets","https://github.com/huggingface/datasets","omegalabsinc/omegalabs-bittensor-subnet","https://github.com/omegalabsinc/omegalabs-bittensor-subnet","omegalabsinc","Python","60","editor","0","400","False","0","0","1","0","0.8","0","0.3333","largest language:Python stars:>=50","The World's Largest Decentralized AGI Multimodal Dataset"
"huggingface/datasets","https://github.com/huggingface/datasets","mengsig/DomiRank","https://github.com/mengsig/DomiRank","mengsig","Python","51","","0","400","False","0","0","1","0","0.8","0","0.3333","largest language:Python stars:>=50","a repository for DomiRank along with some code to do efficient node removals and largest-connected-component sampling of massive networks"
"huggingface/datasets","https://github.com/huggingface/datasets","pogam/ExtractRect","https://github.com/pogam/ExtractRect","pogam","Python","51","","0","375","False","0","0","1","0","0.6","0","0.3333","largest language:Python stars:>=50","find the largest rectangle inscribed in a non-convex polygon"
