"AnchorRepo","AnchorUrl","CandidateRepo","CandidateUrl","CandidateOwner","CandidateLanguage","CandidateStars","CandidateSubdomain","Rank","Score","Qualified","TopicJaccard","LexicalJaccard","LanguageMatch","StarSimilarity","RecencySimilarity","SubdomainMatch","QueryCoverage","SourceQueries","Description"
"huggingface/datasets","https://github.com/huggingface/datasets","Aastha2104/Parkinson-Disease-Prediction","https://github.com/Aastha2104/Parkinson-Disease-Prediction","Aastha2104","Python","194","llm","0","650","False","0","0","1","0","1","1","0.3333","largest language:Python stars:>=50","Introduction  Parkinson’s Disease is the second most prevalent neurodegenerative disorder after Alzheimer’s, affecting more than 10 million people worldwide. Parkinson’s is characterized primarily by the deterioration of motor and cognitive ability. There is no single test which can be administered for diagnosis. Instead, doctors must perform a careful clinical analysis of the patient’s medical history. Unfortunately, this method of diagnosis is highly inaccurate. A study from the National Institute of Neurological Disorders finds that early diagnosis (having symptoms for 5 years or less) is only 53% accurate. This is not much better than random guessing, but an early diagnosis is critical to effective treatment. Because of these difficulties, I investigate a machine learning approach to accurately diagnose Parkinson’s, using a dataset of various speech features (a non-invasive yet characteristic tool) from the University of Oxford. Why speech features? Speech is very predictive and characteristic of Parkinson’s disease; almost every Parkinson’s patient experiences severe vocal degradation (inability to produce sustained phonations, tremor, hoarseness), so it makes sense to use voice to diagnose the disease. Voice analysis gives the added benefit of being non-invasive, inexpensive, and very easy to extract clinically. Background  Parkinson's Disease  Parkinson’s is a progressive neurodegenerative condition resulting from the death of the dopamine containing cells of the substantia nigra (which plays an important role in movement). Symptoms include: “frozen” facial features, bradykinesia (slowness of movement), akinesia (impairment of voluntary movement), tremor, and voice impairment. Typically, by the time the disease is diagnosed, 60% of nigrostriatal neurons have degenerated, and 80% of striatal dopamine have been depleted. Performance Metrics  TP = true positive, FP = false positive, TN = true negative, FN = false negative Accuracy: (TP+TN)/(P+N) Matthews Correlation Coefficient: 1=perfect, 0=random, -1=completely inaccurate Algorithms Employed  Logistic Regression (LR): Uses the sigmoid logistic equation with weights (coefficient values) and biases (constants) to model the probability of a certain class for binary classification. An output of 1 represents one class, and an output of 0 represents the other. Training the model will learn the optimal weights and biases. Linear Discriminant Analysis (LDA): Assumes that the data is Gaussian and each feature has the same variance. LDA estimates the mean and variance for each class from the training data, and then uses properties of statistics (Bayes theorem , Gaussian distribution, etc) to compute the probability of a particular instance belonging to a given class. The class with the largest probability is the prediction. k Nearest Neighbors (KNN): Makes predictions about the validation set using the entire training set. KNN makes a prediction about a new instance by searching through the entire set to find the k “closest” instances. “Closeness” is determined using a proximity measurement (Euclidean) across all features. The class that the majority of the k closest instances belong to is the class that the model predicts the new instance to be. Decision Tree (DT): Represented by a binary tree, where each root node represents an input variable and a split point, and each leaf node contains an output used to make a prediction. Neural Network (NN): Models the way the human brain makes decisions. Each neuron takes in 1+ inputs, and then uses an activation function to process the input with weights and biases to produce an output. Neurons can be arranged into layers, and multiple layers can form a network to model complex decisions. Training the network involves using the training instances to optimize the weights and biases. Naive Bayes (NB): Simplifies the calculation of probabilities by assuming that all features are independent of one another (a strong but effective assumption). Employs Bayes Theorem to calculate the probabilities that the instance to be predicted is in each class, then finds the class with the highest probability. Gradient Boost (GB): Generally used when seeking a model with very high predictive performance. Used to reduce bias and variance (“error”) by combining multiple “weak learners” (not very good models) to create a “strong learner” (high performance model). Involves 3 elements: a loss function (error function) to be optimized, a weak learner (decision tree) to make predictions, and an additive model to add trees to minimize the loss function. Gradient descent is used to minimize error after adding each tree (one by one). Engineering Goal  Produce a machine learning model to diagnose Parkinson’s disease given various features of a patient’s speech with at least 90% accuracy and/or a Matthews Correlation Coefficient of at least 0.9. Compare various algorithms and parameters to determine the best model for predicting Parkinson’s.  Dataset Description  Source: the University of Oxford 195 instances (147 subjects with Parkinson’s, 48 without Parkinson’s) 22 features (elements that are possibly characteristic of Parkinson’s, such as frequency, pitch, amplitude / period of the sound wave) 1 label (1 for Parkinson’s, 0 for no Parkinson’s) Project Pipeline  pipeline  Summary of Procedure  Split the Oxford Parkinson’s Dataset into two parts: one for training, one for validation (evaluate how well the model performs) Train each of the following algorithms with the training set: Logistic Regression, Linear Discriminant Analysis, k Nearest Neighbors, Decision Tree, Neural Network, Naive Bayes, Gradient Boost Evaluate results using the validation set Repeat for the following training set to validation set splits: 80% training / 20% validation, 75% / 25%, and 70% / 30% Repeat for a rescaled version of the dataset (scale all the numbers in the dataset to a range from 0 to 1: this helps to reduce the effect of outliers) Conduct 5 trials and average the results Data  a_o  a_r  m_o  m_r  Data Analysis  In general, the models tended to perform the best (both in terms of accuracy and Matthews Correlation Coefficient) on the rescaled dataset with a 75-25 train-test split. The two highest performing algorithms, k Nearest Neighbors and the Neural Network, both achieved an accuracy of 98%. The NN achieved a MCC of 0.96, while KNN achieved a MCC of 0.94. These figures outperform most existing literature and significantly outperform current methods of diagnosis. Conclusion and Significance  These robust results suggest that a machine learning approach can indeed be implemented to significantly improve diagnosis methods of Parkinson’s disease. Given the necessity of early diagnosis for effective treatment, my machine learning models provide a very promising alternative to the current, rather ineffective method of diagnosis. Current methods of early diagnosis are only 53% accurate, while my machine learning model produces 98% accuracy. This 45% increase is critical because an accurate, early diagnosis is needed to effectively treat the disease. Typically, by the time the disease is diagnosed, 60% of nigrostriatal neurons have degenerated, and 80% of striatal dopamine have been depleted. With an earlier diagnosis, much of this degradation could have been slowed or treated. My results are very significant because Parkinson’s affects over 10 million people worldwide who could benefit greatly from an early, accurate diagnosis. Not only is my machine learning approach more accurate in terms of diagnostic accuracy, it is also more scalable, less expensive, and therefore more accessible to people who might not have access to established medical facilities and professionals. The diagnosis is also much simpler, requiring only a 10-15 second voice recording and producing an immediate diagnosis. Future Research  Given more time and resources, I would investigate the following: Create a mobile application which would allow the user to record his/her voice, extract the necessary vocal features, and feed it into my machine learning model to diagnose Parkinson’s. Use larger datasets in conjunction with the University of Oxford dataset. Tune and improve my models even further to achieve even better results. Investigate different structures and types of neural networks. Construct a novel algorithm specifically suited for the prediction of Parkinson’s. Generalize my findings and algorithms for all types of dementia disorders, such as Alzheimer’s. References  Bind, Shubham. ""A Survey of Machine Learning Based Approaches for Parkinson Disease Prediction."" International Journal of Computer Science and Information Technologies 6 (2015): n. pag. International Journal of Computer Science and Information Technologies. 2015. Web. 8 Mar. 2017. Brooks, Megan. ""Diagnosing Parkinson's Disease Still Challenging."" Medscape Medical News. National Institute of Neurological Disorders, 31 July 2014. Web. 20 Mar. 2017. Exploiting Nonlinear Recurrence and Fractal Scaling Properties for Voice Disorder Detection', Little MA, McSharry PE, Roberts SJ, Costello DAE, Moroz IM. BioMedical Engineering OnLine 2007, 6:23 (26 June 2007) Hashmi, Sumaiya F. ""A Machine Learning Approach to Diagnosis of Parkinson’s Disease.""Claremont Colleges Scholarship. Claremont College, 2013. Web. 10 Mar. 2017. Karplus, Abraham. ""Machine Learning Algorithms for Cancer Diagnosis."" Machine Learning Algorithms for Cancer Diagnosis (n.d.): n. pag. Mar. 2012. Web. 20 Mar. 2017. Little, Max. ""Parkinsons Data Set."" UCI Machine Learning Repository. University of Oxford, 26 June 2008. Web. 20 Feb. 2017. Ozcift, Akin, and Arif Gulten. ""Classifier Ensemble Construction with Rotation Forest to Improve Medical Diagnosis Performance of Machine Learning Algorithms."" Computer Methods and Programs in Biomedicine 104.3 (2011): 443-51. Semantic Scholar. 2011. Web. 15 Mar. 2017. ""Parkinson’s Disease Dementia."" UCI MIND. N.p., 19 Oct. 2015. Web. 17 Feb. 2017. Salvatore, C., A. Cerasa, I. Castiglioni, F. Gallivanone, A. Augimeri, M. Lopez, G. Arabia, M. Morelli, M.c. Gilardi, and A. Quattrone. ""Machine Learning on Brain MRI Data for Differential Diagnosis of Parkinson's Disease and Progressive Supranuclear Palsy.""Journal of Neuroscience Methods 222 (2014): 230-37. 2014. Web. 18 Mar. 2017. Shahbakhi, Mohammad, Danial Taheri Far, and Ehsan Tahami. ""Speech Analysis for Diagnosis of Parkinson’s Disease Using Genetic Algorithm and Support Vector Machine.""Journal of Biomedical Science and Engineering 07.04 (2014): 147-56. Scientific Research. July 2014. Web. 2 Mar. 2017. ""Speech and Communication."" Speech and Communication. Parkinson's Disease Foundation, n.d. Web. 22 Mar. 2017. Sriram, Tarigoppula V. S., M. Venkateswara Rao, G. V. Satya Narayana, and D. S. V. G. K. Kaladhar. ""Diagnosis of Parkinson Disease Using Machine Learning and Data Mining Systems from Voice Dataset."" SpringerLink. Springer, Cham, 01 Jan. 1970. Web. 17 Mar. 2017."
"huggingface/datasets","https://github.com/huggingface/datasets","graphdeco-inria/gaussian-splatting","https://github.com/graphdeco-inria/gaussian-splatting","graphdeco-inria","Python","21628","computer-vision","0","649.74","False","0.0556","0","1","0.9985","1","0","0.3333","topic:computer-vision language:Python stars:>=50","Original reference implementation of ""3D Gaussian Splatting for Real-Time Radiance Field Rendering"""
"huggingface/datasets","https://github.com/huggingface/datasets","nari-labs/dia","https://github.com/nari-labs/dia","nari-labs","Python","19294","","0","645.92","False","0.0556","0","1","0.9767","1","0","0.3333","d language:Python stars:>=50","A TTS model capable of generating ultra-realistic dialogue in one pass."
"huggingface/datasets","https://github.com/huggingface/datasets","hpcaitech/ColossalAI","https://github.com/hpcaitech/ColossalAI","hpcaitech","Python","41375","deep-learning","0","644.33","False","0.0769","0","1","0.8577","1","0","0.3333","topic:ai language:Python stars:>=50","Making large AI models cheaper, faster and more accessible"
"huggingface/datasets","https://github.com/huggingface/datasets","roboflow/rf-detr","https://github.com/roboflow/rf-detr","roboflow","Python","6911","computer-vision","0","642.62","False","0.0952","0","1","0.7537","1","0","0.3333","topic:computer-vision language:Python stars:>=50","[ICLR 2026] RF-DETR is a real-time object detection and segmentation model architecture developed by Roboflow, SOTA on COCO, designed for fine-tuning."
"huggingface/datasets","https://github.com/huggingface/datasets","hzwer/ECCV2022-RIFE","https://github.com/hzwer/ECCV2022-RIFE","hzwer","Python","5411","deep-learning","0","642.35","False","0.1053","0","1","0.7006","1","0","0.3333","topic:computer-vision language:Python stars:>=50","ECCV2022 - Real-Time Intermediate Flow Estimation for Video Frame Interpolation"
"huggingface/datasets","https://github.com/huggingface/datasets","camel-ai/owl","https://github.com/camel-ai/owl","camel-ai","Python","19730","reinforcement","0","641.77","False","0.05","0","1","0.9815","1","0","0.3333","topic:artificial-intelligence language:Python stars:>=50","🦉 OWL: Optimized Workforce Learning for General Multi-Agent Assistance in Real-World Task Automation"
"huggingface/datasets","https://github.com/huggingface/datasets","docling-project/docling","https://github.com/docling-project/docling","docling-project","Python","59067","","0","641.57","False","0.0333","0","1","0.7804","1","0","0.6667","topic:ai language:Python stars:>=50 | d language:Python stars:>=50","Get your documents ready for gen AI"
"huggingface/datasets","https://github.com/huggingface/datasets","dmMaze/BallonsTranslator","https://github.com/dmMaze/BallonsTranslator","dmMaze","Python","4760","deep-learning","0","639.17","False","0.1071","0","1","0.6728","1","0","0.3333","topic:computer-vision language:Python stars:>=50","深度学习辅助漫画翻译工具, 支持一键机翻和简单的图像/文本编辑 | Yet another computer-aided comic/manga translation tool powered by deeplearning"
"huggingface/datasets","https://github.com/huggingface/datasets","ShangtongZhang/reinforcement-learning-an-introduction","https://github.com/ShangtongZhang/reinforcement-learning-an-introduction","ShangtongZhang","Python","14640","reinforcement","0","638.37","False","0.0588","0","1","0.9167","1","0","0.3333","topic:artificial-intelligence language:Python stars:>=50","Python Implementation of Reinforcement Learning: An Introduction"
"huggingface/datasets","https://github.com/huggingface/datasets","Tencent/tencent-ml-images","https://github.com/Tencent/tencent-ml-images","Tencent","Python","3076","deep-learning","0","632.03","False","0.1176","0","1","0.578","1","0","0.3333","largest language:Python stars:>=50","Largest multi-label image database; ResNet-101 model; 80.73% top-1 acc on ImageNet"
"huggingface/datasets","https://github.com/huggingface/datasets","microsoft/qlib","https://github.com/microsoft/qlib","microsoft","Python","41915","deep-learning","0","630.85","False","0.0625","0","1","0.8549","1","0","0.3333","d language:Python stars:>=50","Qlib is an AI-oriented Quant investment platform that aims to use AI tech to empower Quant Research, from exploring ideas to implementing productions. Qlib supports diverse ML modeling paradigms, including supervised learning, market dynamics modeling, and RL, and is now equipped with https://github.com/microsoft/RD-Agent to automate R&D process."
"huggingface/datasets","https://github.com/huggingface/datasets","facefusion/facefusion","https://github.com/facefusion/facefusion","facefusion","Python","28124","","0","630.67","False","0.0455","0","1","0.9415","1","0","0.3333","topic:ai language:Python stars:>=50","Industry leading face manipulation platform"
"huggingface/datasets","https://github.com/huggingface/datasets","oraios/serena","https://github.com/oraios/serena","oraios","Python","23773","editor","0","629.48","False","0.037","0","1","0.978","1","0","0.3333","topic:ai language:Python stars:>=50","A powerful MCP toolkit for coding, providing semantic retrieval and editing capabilities  - the IDE for your agent"
"huggingface/datasets","https://github.com/huggingface/datasets","Comfy-Org/ComfyUI","https://github.com/Comfy-Org/ComfyUI","Comfy-Org","Python","111196","deep-learning","0","627.53","False","0.1","0","1","0.643","1","0","0.3333","topic:ai language:Python stars:>=50","The most powerful and modular diffusion model GUI, api and backend with a graph/nodes interface."
"huggingface/datasets","https://github.com/huggingface/datasets","idealo/imagededup","https://github.com/idealo/imagededup","idealo","Python","5624","deep-learning","0","627.34","False","0.087","0","1","0.709","1","0","0.3333","topic:computer-vision language:Python stars:>=50","😎 Finding duplicate images made easy!"
"huggingface/datasets","https://github.com/huggingface/datasets","Layout-Parser/layout-parser","https://github.com/Layout-Parser/layout-parser","Layout-Parser","Python","5729","deep-learning","0","624.78","False","0.0833","0","1","0.713","1","0","0.3333","topic:computer-vision language:Python stars:>=50","A Unified Toolkit for Deep Learning Based Document Image Analysis"
"huggingface/datasets","https://github.com/huggingface/datasets","OpenBB-finance/OpenBB","https://github.com/OpenBB-finance/OpenBB","OpenBB-finance","Python","66927","reinforcement","0","623.49","False","0.0741","0","1","0.7533","1","0","0.3333","topic:ai language:Python stars:>=50","Financial data platform for analysts, quants and AI agents."
"huggingface/datasets","https://github.com/huggingface/datasets","mage-ai/mage-ai","https://github.com/mage-ai/mage-ai","mage-ai","Python","8712","mlops","0","621.95","False","0.0625","0","1","0.804","1","0","0.3333","topic:artificial-intelligence language:Python stars:>=50","🧙 Build, run, and manage data pipelines for integrating and transforming data."
"huggingface/datasets","https://github.com/huggingface/datasets","Asabeneh/30-Days-Of-Python","https://github.com/Asabeneh/30-Days-Of-Python","Asabeneh","Python","62000","editor","0","621.79","False","0.069","0","1","0.7699","1","0","0.3333","d language:Python stars:>=50","The 30 Days of Python programming challenge is a step-by-step guide to learn the Python programming language in 30 days. This challenge may take more than 100 days. Follow your own pace. These videos may help too: https://www.youtube.com/channel/UC7PNRuno1rzYPb1xLa4yktw"
"huggingface/datasets","https://github.com/huggingface/datasets","agno-agi/agno","https://github.com/agno-agi/agno","agno-agi","Python","39891","reinforcement","0","621.48","False","0.05","0","1","0.8656","1","0","0.3333","topic:ai language:Python stars:>=50","Run agents as production software."
"huggingface/datasets","https://github.com/huggingface/datasets","OlafenwaMoses/ImageAI","https://github.com/OlafenwaMoses/ImageAI","OlafenwaMoses","Python","8868","deep-learning","0","620.92","False","0.0606","0","1","0.8079","1","0","0.3333","topic:artificial-intelligence language:Python stars:>=50","A python library built to empower developers to build applications and systems  with self-contained Computer Vision capabilities"
"huggingface/datasets","https://github.com/huggingface/datasets","asgeirtj/system_prompts_leaks","https://github.com/asgeirtj/system_prompts_leaks","asgeirtj","","39415","llm","0","608.19","False","0.0625","0","0","0.8682","1","1","0.3333","topic:llm stars:>=100","Extracted system prompts from ChatGPT (GPT-5.5 Thinking), Claude (Opus 4.7, Opus 4.6, Sonnet 4.6, Claude Code), Gemini (3.1 Pro, 3 Flash, Gemini CLI), Grok (4.3 beta), Perplexity, and more. Updated regularly."
"huggingface/datasets","https://github.com/huggingface/datasets","scikit-image/scikit-image","https://github.com/scikit-image/scikit-image","scikit-image","Python","6507","computer-vision","0","604.62","False","0.0556","0","1","0.7407","1","0","0.3333","topic:computer-vision language:Python stars:>=50","Image processing in Python"
"huggingface/datasets","https://github.com/huggingface/datasets","roboflow/sports","https://github.com/roboflow/sports","roboflow","Python","4962","deep-learning","0","604.32","False","0.0667","0","1","0.6818","1","0","0.3333","topic:computer-vision language:Python stars:>=50","computer vision and sports"
"huggingface/datasets","https://github.com/huggingface/datasets","mudler/LocalAI","https://github.com/mudler/LocalAI","mudler","Go","46030","llm","0","602.29","False","0.0625","0","0","0.8345","1","1","0.3333","topic:llm stars:>=100","LocalAI is the open-source AI engine. Run any model - LLMs, vision, voice, image, video - on any hardware. No GPU required."
"huggingface/datasets","https://github.com/huggingface/datasets","D4Vinci/Scrapling","https://github.com/D4Vinci/Scrapling","D4Vinci","Python","42786","","0","599.53","False","0.0286","0","1","0.8504","1","0","0.3333","topic:ai language:Python stars:>=50","🕷️ An adaptive Web Scraping framework that handles everything from a single request to a full-scale crawl!"
"huggingface/datasets","https://github.com/huggingface/datasets","jeecgboot/JeecgBoot","https://github.com/jeecgboot/JeecgBoot","jeecgboot","Java","46070","llm","0","598.95","False","0.0588","0","0","0.8343","1","1","0.3333","topic:llm stars:>=100","AI低代码平台，支持「低代码 + 零代码」双模式：零代码 5 分钟搭建业务系统，低代码模式一键生成前后端代码。 内置AI 应用，支持AI聊天、知识库、流程编排、MCP与插件，支持各种模型。Skills能力实现：一句话画流程图、设计表单、生成系统。 引领 AI生成→在线配置→代码生成→手工合并的开发模式，解决Java项目80%的重复工作，快速提高效率，又不失灵活性。"
"huggingface/datasets","https://github.com/huggingface/datasets","emmabostian/developer-portfolios","https://github.com/emmabostian/developer-portfolios","emmabostian","Python","22363","","0","598.47","False","0","0","1","0.9913","1","0","0.3333","d language:Python stars:>=50","A list of developer portfolios for your inspiration"
"huggingface/datasets","https://github.com/huggingface/datasets","Vonng/ddia","https://github.com/Vonng/ddia","Vonng","Python","22988","","0","597.43","False","0","0","1","0.9853","1","0","0.3333","d language:Python stars:>=50","《Designing Data-Intensive Application》DDIA 第一版 / 第二版 中文翻译"
"huggingface/datasets","https://github.com/huggingface/datasets","deepseek-ai/DeepSeek-OCR","https://github.com/deepseek-ai/DeepSeek-OCR","deepseek-ai","Python","23039","","0","597.34","False","0","0","1","0.9848","1","0","0.3333","d language:Python stars:>=50","Contexts Optical Compression"
"huggingface/datasets","https://github.com/huggingface/datasets","deepseek-ai/DeepSeek-Coder","https://github.com/deepseek-ai/DeepSeek-Coder","deepseek-ai","Python","23229","","0","597.03","False","0","0","1","0.983","1","0","0.3333","d language:Python stars:>=50","DeepSeek Coder: Let the Code Write Itself"
"huggingface/datasets","https://github.com/huggingface/datasets","stitionai/devika","https://github.com/stitionai/devika","stitionai","Python","19505","reinforcement","0","596.33","False","0","0","1","0.979","1","0","0.3333","d language:Python stars:>=50","Devika is the first open-source implementation of an Agentic Software Engineer. Initially started as an open-source alternative to Devin."
"huggingface/datasets","https://github.com/huggingface/datasets","plotly/dash","https://github.com/plotly/dash","plotly","Python","24170","data-science","0","595.52","False","0","0","1","0.9744","1","0","0.3333","d language:Python stars:>=50","Data Apps & Dashboards for Python. No JavaScript Required."
"huggingface/datasets","https://github.com/huggingface/datasets","spotDL/spotify-downloader","https://github.com/spotDL/spotify-downloader","spotDL","Python","24625","","0","594.81","False","0","0","1","0.9704","1","0","0.3333","d language:Python stars:>=50","Download your Spotify playlists and songs along with album art and metadata (from YouTube if a match is found)."
"huggingface/datasets","https://github.com/huggingface/datasets","mikf/gallery-dl","https://github.com/mikf/gallery-dl","mikf","Python","18035","computer-vision","0","593.35","False","0","0","1","0.962","1","0","0.3333","d language:Python stars:>=50","Command-line program to download image galleries and collections from several image hosting sites"
"huggingface/datasets","https://github.com/huggingface/datasets","apple/ml-stable-diffusion","https://github.com/apple/ml-stable-diffusion","apple","Python","17847","","0","592.95","False","0","0","1","0.9597","1","0","0.3333","d language:Python stars:>=50","Stable Diffusion with Core ML on Apple Silicon"
"huggingface/datasets","https://github.com/huggingface/datasets","STVIR/pysot","https://github.com/STVIR/pysot","STVIR","Python","4602","computer-vision","0","591.46","False","0.0556","0","1","0.6655","1","0","0.3333","topic:computer-vision language:Python stars:>=50","SenseTime Research platform for single object tracking, implementing algorithms like SiamRPN and SiamMask."
