"FullName","Url","Owner","Language","Stars","Fork","Archived","CreatedAt","UpdatedAt","Description","Topics","SourceQueries"
"LeCAR-Lab/model-based-diffusion","https://github.com/LeCAR-Lab/model-based-diffusion","LeCAR-Lab","Python","333","False","False","5/22/2024 7:10:43 PM","5/1/2026 5:06:44 AM","Official implementation for the paper ""Model-based Diffusion for Trajectory Optimization"". Model-based diffusion (MBD) is a novel diffusion-based trajectory optimization framework that employs a dynamics model to run the reverse denoising process to generate high-quality trajectories.","control;diffusion;diffusion-models;optimization;planning;rl;sampling-methods;trajectory;trajectory-optimization;zeroth-order-optimization","topic:control language:Python stars:>=50"
"Comfy-Org/ComfyUI","https://github.com/Comfy-Org/ComfyUI","Comfy-Org","Python","111105","False","False","1/17/2023 3:15:56 AM","5/3/2026 4:37:08 AM","The most powerful and modular diffusion model GUI, api and backend with a graph/nodes interface.","ai;comfy;comfyui;python;pytorch;stable-diffusion","topic:ai language:Python stars:>=50 | c language:Python stars:>=50"
"ray-project/ray","https://github.com/ray-project/ray","ray-project","Python","42404","False","False","10/25/2016 7:38:30 PM","5/3/2026 3:44:13 AM","Ray is an AI compute engine. Ray consists of a core distributed runtime and a set of AI Libraries for accelerating ML workloads.","data-science;deep-learning;deployment;distributed;hyperparameter-optimization;hyperparameter-search;large-language-models;llm;llm-inference;llm-serving;machine-learning;optimization;parallel;python;pytorch;ray;reinforcement-learning;rllib;serving;tensorflow","topic:llm stars:>=100"
"2noise/ChatTTS","https://github.com/2noise/ChatTTS","2noise","Python","39189","False","False","5/27/2024 6:26:49 PM","5/2/2026 4:56:35 PM","A generative speech model for daily dialogue.","agent;chat;chatgpt;chattts;chinese;chinese-language;english;english-language;gpt;llm;llm-agent;natural-language-inference;python;text-to-speech;torch;torchaudio;tts","c language:Python stars:>=50 | topic:llm stars:>=100"
"ungoogled-software/ungoogled-chromium","https://github.com/ungoogled-software/ungoogled-chromium","ungoogled-software","Python","26439","False","False","6/12/2015 10:24:24 PM","5/3/2026 2:34:57 AM","Google Chromium, sans integration with Google","chromium;control;google-chromium;inox;iridium;privacy;transparency","topic:control language:Python stars:>=50 | c language:Python stars:>=50"
"ZhengyiLuo/PULSE","https://github.com/ZhengyiLuo/PULSE","ZhengyiLuo","Python","351","False","False","3/9/2024 9:02:35 PM","4/29/2026 8:48:44 AM","Official Implementation of the ICLR 2024 spotlight paper: Universal Humanoid Motion Representations for Physics-Based Control","control;humanoid;isaac-gym;reinforcement-learning;simulation","topic:control language:Python stars:>=50"
"lxa9867/ControlVAR","https://github.com/lxa9867/ControlVAR","lxa9867","Python","127","False","False","7/26/2024 6:00:19 AM","3/20/2026 1:01:51 AM","This is the official implementation for ControlVAR.","autoregressive;conditional-generation;control;diffusion-models;geneartive-models;image-generation;vision-transformer","topic:control language:Python stars:>=50"
"TauricResearch/TradingAgents","https://github.com/TauricResearch/TradingAgents","TauricResearch","Python","63186","False","False","12/28/2024 3:31:08 AM","5/3/2026 4:46:02 AM","TradingAgents: Multi-Agents LLM Financial Trading Framework","agent;finance;llm;multiagent;trading","topic:llm stars:>=100"
"OpenBB-finance/OpenBB","https://github.com/OpenBB-finance/OpenBB","OpenBB-finance","Python","66894","False","False","12/20/2020 10:46:38 AM","5/3/2026 4:21:52 AM","Financial data platform for analysts, quants and AI agents.","ai;crypto;derivatives;economics;equity;finance;fixed-income;machine-learning;openbb;options;python;quantitative-finance;stocks","topic:ai language:Python stars:>=50"
"suixin1424/mouse_control","https://github.com/suixin1424/mouse_control","suixin1424","Python","201","False","False","1/23/2024 12:52:50 PM","5/2/2026 2:20:50 PM","一种基于神经网络来模拟人手移动鼠标的方法","control;deep-learning;mouse","topic:control language:Python stars:>=50"
"langchain-ai/langchain","https://github.com/langchain-ai/langchain","langchain-ai","Python","135651","False","False","10/17/2022 2:58:36 AM","5/3/2026 4:04:41 AM","The agent engineering platform","agents;ai;ai-agents;anthropic;chatgpt;deepagents;enterprise;framework;gemini;generative-ai;langchain;langgraph;llm;multiagent;open-source;openai;pydantic;python;rag","topic:ai language:Python stars:>=50 | topic:llm stars:>=100"
"Significant-Gravitas/AutoGPT","https://github.com/Significant-Gravitas/AutoGPT","Significant-Gravitas","Python","183947","False","False","3/16/2023 9:21:07 AM","5/3/2026 3:54:05 AM","AutoGPT is the vision of accessible AI for everyone, to use and to build on. Our mission is to provide the tools, so that you can focus on what matters.","agentic-ai;agents;ai;artificial-intelligence;autonomous-agents;claude;gpt;llama-api;llm;openai;python","topic:ai language:Python stars:>=50 | topic:llm stars:>=100"
"openai/openai-agents-python","https://github.com/openai/openai-agents-python","openai","Python","25785","False","False","3/11/2025 3:42:36 AM","5/3/2026 4:14:44 AM","A lightweight, powerful framework for multi-agent workflows","agents;ai;framework;llm;openai;python","topic:ai language:Python stars:>=50"
"chatchat-space/Langchain-Chatchat","https://github.com/chatchat-space/Langchain-Chatchat","chatchat-space","Python","37950","False","False","3/31/2023 12:12:45 PM","5/2/2026 1:34:33 PM","Langchain-Chatchat（原Langchain-ChatGLM）基于 Langchain 与 ChatGLM, Qwen 与 Llama 等语言模型的 RAG 与 Agent 应用 | Langchain-Chatchat (formerly langchain-ChatGLM), local knowledge based LLM (like ChatGLM, Qwen and Llama) RAG and Agent app with langchain ","chatbot;chatchat;chatglm;chatgpt;embedding;faiss;fastchat;gpt;knowledge-base;langchain;langchain-chatglm;llama;llm;milvus;ollama;qwen;rag;retrieval-augmented-generation;streamlit;xinference","c language:Python stars:>=50 | topic:llm stars:>=100"
"Total-RD/pymgrid","https://github.com/Total-RD/pymgrid","Total-RD","Python","214","False","False","3/18/2020 11:37:39 PM","4/30/2026 3:12:24 AM","pymgrid is a python library to generate and simulate a large number of microgrids.","control;energy-management-systems;microgrid;microgrid-model;reinforcement-learning","topic:control language:Python stars:>=50"
"LeCAR-Lab/CoVO-MPC","https://github.com/LeCAR-Lab/CoVO-MPC","LeCAR-Lab","Python","142","False","False","6/22/2023 9:48:06 AM","4/14/2026 2:48:44 AM","Official implementation for the paper ""CoVO-MPC: Theoretical Analysis of Sampling-based MPC and Optimal Covariance Design"" accepted by L4DC 2024. CoVO-MPC is an optimal sampling-based MPC algorithm. ","control;drone;mpc;quadrotor;sampling-methods;zeroth-order-optimization","topic:control language:Python stars:>=50"
"crewAIInc/crewAI","https://github.com/crewAIInc/crewAI","crewAIInc","Python","50497","False","False","10/27/2023 3:26:59 AM","5/3/2026 4:11:48 AM","Framework for orchestrating role-playing, autonomous AI agents. By fostering collaborative intelligence, CrewAI empowers agents to work together seamlessly, tackling complex tasks.","agents;ai;ai-agents;aiagentframework;llms","topic:ai language:Python stars:>=50 | c language:Python stars:>=50"
"ankitaggarwal011/PyCNN","https://github.com/ankitaggarwal011/PyCNN","ankitaggarwal011","Python","543","False","False","12/5/2014 7:38:52 PM","4/10/2026 7:32:41 AM","Image Processing with Cellular Neural Networks in Python","cellular;cnn;cnn-processors;computer-science;computer-vision;control;corner-detection;cross-platform;edge-detection;feedback;image-processing;library;neural-network;paper;python","topic:control language:Python stars:>=50"
"browser-use/browser-use","https://github.com/browser-use/browser-use","browser-use","Python","91746","False","False","10/31/2024 4:00:56 PM","5/3/2026 4:44:58 AM","🌐 Make websites accessible for AI agents. Automate tasks online with ease.","ai-agents;ai-tools;browser-automation;browser-use;llm;playwright;python","topic:llm stars:>=100"
"ccxt/ccxt","https://github.com/ccxt/ccxt","ccxt","Python","42174","False","False","5/14/2017 3:41:56 PM","5/3/2026 3:58:46 AM","A cryptocurrency trading API with more than 100 exchanges in JavaScript / TypeScript / Python / C# / PHP / Go ","altcoin;api;arbitrage;bitcoin;bot;btc;crypto;cryptocurrencies;cryptocurrency;eth;ethereum;exchange;invest;library;market-data;memecoin;merchant;strategy;trade;trading","c language:Python stars:>=50"
"OpenBMB/MiniCPM-o","https://github.com/OpenBMB/MiniCPM-o","OpenBMB","Python","24488","False","False","1/29/2024 5:30:33 AM","5/2/2026 10:13:53 PM","A Gemini 2.5 Flash Level MLLM for Vision, Speech, and Full-Duplex Multimodal Live Streaming on Your Phone","minicpm;minicpm-v;multi-modal","c language:Python stars:>=50"
"tii-racing/drone-racing-dataset","https://github.com/tii-racing/drone-racing-dataset","tii-racing","Python","117","False","False","8/6/2023 1:57:57 PM","5/1/2026 8:06:55 AM","A fully-annotated, open-design dataset of autonomous and piloted high-speed flight","autonomous-robots;computer-vision;control;dataset;drone-racing;inertial-data;motion-capture;motion-capture-data;path-planning;quadrotor;robotics;ros2;scene-understanding;vision;visual-inertial-odometry","topic:control language:Python stars:>=50"
"rtk-ai/rtk","https://github.com/rtk-ai/rtk","rtk-ai","Rust","40153","False","False","1/22/2026 4:54:16 PM","5/3/2026 4:46:22 AM","CLI proxy that reduces LLM token consumption by 60-90% on common dev commands. Single Rust binary, zero dependencies","agentic-coding;ai-coding;anthropic;claude-code;cli;command-line-tool;cost-reduction;developer-tools;llm;open-source;productivity;rust;token-optimization","topic:llm stars:>=100"
"kohonda/mppi_playground","https://github.com/kohonda/mppi_playground","kohonda","Python","212","False","False","11/22/2023 12:18:14 PM","4/24/2026 3:29:55 PM","Model Predictive Path Integral Control (MPPI) with PyTorch","control;gpu-acceleration;gymnasium;model-predictive-control;motion-planning;mppi;pytorch","topic:control language:Python stars:>=50"
"hacksider/Deep-Live-Cam","https://github.com/hacksider/Deep-Live-Cam","hacksider","Python","92565","False","False","9/24/2023 1:19:31 PM","5/3/2026 3:22:06 AM","real time face swap and one-click video deepfake with only a single image","ai;ai-deep-fake;ai-face;ai-webcam;artificial-intelligence;deep-fake;deepfake;deepfake-webcam;faceswap;fake-webcam;gan;real-time-deepfake;realtime;realtime-deepfake;realtime-face-changer;video-deepfake;webcam;webcamera","topic:ai language:Python stars:>=50 | c language:Python stars:>=50"
"facefusion/facefusion","https://github.com/facefusion/facefusion","facefusion","Python","28117","False","False","8/17/2023 7:59:55 PM","5/3/2026 1:55:17 AM","Industry leading face manipulation platform","ai;deep-fake;deepfake;face-swap;faceswap;lip-sync;lipsync","topic:ai language:Python stars:>=50"
