"FullName","Url","Owner","Language","Stars","Fork","Archived","CreatedAt","UpdatedAt","Description","Topics","SourceQueries"
"microsoft/AI-For-Beginners","https://github.com/microsoft/AI-For-Beginners","microsoft","Jupyter Notebook","47148","False","False","3/3/2021 4:27:36 PM","5/3/2026 5:46:05 PM","12 Weeks, 24 Lessons, AI for All!","ai;artificial-intelligence;cnn;computer-vision;deep-learning;gan;machine-learning;microsoft-for-beginners;nlp;rnn","topic:deep-learning stars:>=100"
"SqueezeAILab/KVQuant","https://github.com/SqueezeAILab/KVQuant","SqueezeAILab","Python","421","False","False","1/31/2024 5:30:10 PM","4/30/2026 4:09:38 AM","[NeurIPS 2024] KVQuant: Towards 10 Million Context Length LLM Inference with KV Cache Quantization","compression;efficient-inference;efficient-model;large-language-models;llama;llm;localllama;localllm;mistral;model-compression;natural-language-processing;quantization;small-models;text-generation;transformer","topic:compression language:Python stars:>=50"
"HomebrewML/revlib","https://github.com/HomebrewML/revlib","HomebrewML","Python","132","False","False","8/17/2021 9:01:10 PM","2/2/2026 11:17:56 AM","Simple and efficient RevNet-Library for PyTorch with XLA and DeepSpeed support and parameter offload","deep-learning;deepspeed;momentumnet;pytorch;revnet;tpu;xla","deepspeed language:Python stars:>=50"
"PKU-Alignment/safe-rlhf","https://github.com/PKU-Alignment/safe-rlhf","PKU-Alignment","Python","1599","False","False","5/15/2023 11:47:08 AM","5/1/2026 5:19:26 AM","Safe RLHF: Constrained Value Alignment via Safe Reinforcement Learning from Human Feedback","ai-safety;alpaca;beaver;datasets;deepspeed;gpt;large-language-models;llama;llm;llms;reinforcement-learning;reinforcement-learning-from-human-feedback;rlhf;safe-reinforcement-learning;safe-reinforcement-learning-from-human-feedback;safe-rlhf;safety;transformer;transformers;vicuna","deepspeed language:Python stars:>=50"
"LambdaLabsML/distributed-training-guide","https://github.com/LambdaLabsML/distributed-training-guide","LambdaLabsML","Python","609","False","False","7/31/2024 4:11:23 PM","4/29/2026 5:19:26 AM","Best practices & guides on how to write distributed pytorch training code","cluster;cuda;deepspeed;distributed-training;fsdp;gpu;gpu-cluster;kuberentes;lambdalabs;mpi;nccl;pytorch;sharding;slurm","deepspeed language:Python stars:>=50"
"huggingface/transformers","https://github.com/huggingface/transformers","huggingface","Python","160213","False","False","10/29/2018 1:56:00 PM","5/3/2026 6:57:29 PM","🤗 Transformers: the model-definition framework for state-of-the-art machine learning models in text, vision, audio, and multimodal models, for both inference and training. ","audio;deep-learning;deepseek;gemma;glm;hacktoberfest;llm;machine-learning;model-hub;natural-language-processing;nlp;pretrained-models;python;pytorch;pytorch-transformers;qwen;speech-recognition;transformer;vlm","topic:deep-learning stars:>=100"
"zhaoyue-zephyrus/npq-vit","https://github.com/zhaoyue-zephyrus/npq-vit","zhaoyue-zephyrus","Python","208","False","False","6/11/2024 6:05:28 PM","4/22/2026 9:46:17 AM","[ICLR 2025] Binary Spherical Quantization + [CVPR 2026] Leech Spherical Quantization","compression;quantization;vector-quantization;visual-tokenizer","topic:compression language:Python stars:>=50"
"BVLC/caffe","https://github.com/BVLC/caffe","BVLC","C++","34624","False","False","9/12/2013 6:39:48 PM","5/3/2026 3:13:57 AM","Caffe: a fast open framework for deep learning.","deep-learning;machine-learning;vision","topic:deep-learning stars:>=100"
"amirgholami/ZeroQ","https://github.com/amirgholami/ZeroQ","amirgholami","Python","282","False","False","11/20/2019 4:40:20 PM","3/13/2026 2:38:20 AM","[CVPR'20] ZeroQ: A Novel Zero Shot Quantization Framework","compression;efficient-model;efficient-neural-networks;quantization;quantized-neural-networks","topic:compression language:Python stars:>=50"
"microsoft/qlib","https://github.com/microsoft/qlib","microsoft","Python","41915","False","False","8/14/2020 6:46:00 AM","5/3/2026 6:01:55 PM","Qlib is an AI-oriented Quant investment platform that aims to use AI tech to empower Quant Research, from exploring ideas to implementing productions. Qlib supports diverse ML modeling paradigms, including supervised learning, market dynamics modeling, and RL, and is now equipped with https://github.com/microsoft/RD-Agent to automate R&D process.","algorithmic-trading;auto-quant;deep-learning;finance;fintech;investment;machine-learning;paper;platform;python;quant;quant-dataset;quant-models;quantitative-finance;quantitative-trading;research;research-paper;stock-data","d language:Python stars:>=50 | topic:deep-learning stars:>=100"
"jackaduma/Alpaca-LoRA-RLHF-PyTorch","https://github.com/jackaduma/Alpaca-LoRA-RLHF-PyTorch","jackaduma","Python","60","False","False","4/18/2023 6:03:08 AM","4/23/2026 11:53:03 AM","A full pipeline to finetune Alpaca LLM with LoRA and RLHF on consumer hardware. Implementation of RLHF (Reinforcement Learning with Human Feedback) on top of the Alpaca architecture. Basically ChatGPT but with Alpaca","alpaca;chatgpt;deepspeed;finetune;gpt;llama;llm;lora;peft;ppo;pytorch;reward-models;rlhf","deepspeed language:Python stars:>=50"
"x011/SecretPixel","https://github.com/x011/SecretPixel","x011","Python","344","False","False","2/4/2024 12:39:18 AM","4/24/2026 4:30:38 PM","SecretPixel is a cutting-edge steganography tool designed to securely conceal sensitive information within images. It stands out in the realm of digital steganography by combining advanced encryption, compression, and a seeded Least Significant Bit (LSB) technique to provide a robust solution for embedding data undetectably.","aes-256;aes-encryption;cipher;compression;cryptography;data-exfiltration;encryption;hacking;hacking-tool;hide-files;hide-files-in-image;image-steganography;lsb-steganography;privacy;rsa-cryptography;security;security-tools;steganography;steganography-algorithms;stego","topic:compression language:Python stars:>=50"
"onekey-sec/unblob","https://github.com/onekey-sec/unblob","onekey-sec","Python","2489","False","False","6/8/2021 7:15:33 AM","5/2/2026 8:13:41 AM","Extract files from any kind of container formats","archive;compression;extraction;filesystem;python","topic:compression language:Python stars:>=50"
"JMS1717/8mb.local","https://github.com/JMS1717/8mb.local","JMS1717","Python","846","False","False","11/3/2025 3:01:56 AM","5/2/2026 6:31:40 AM","a free local self hosted video compressor webui designed for performance and ease of use. inspired by 8mb.video","celery;compression;docker;fastapi;ffmpeg;gpu-acceleration;self-hosted;svelte","topic:compression language:Python stars:>=50"
"huggingface/datasets","https://github.com/huggingface/datasets","huggingface","Python","21483","False","False","3/26/2020 9:23:22 AM","5/3/2026 11:48:10 AM","🤗 The largest hub of ready-to-use datasets for AI models with fast, easy-to-use and efficient data manipulation tools","ai;artificial-intelligence;computer-vision;dataset-hub;datasets;deep-learning;huggingface;llm;machine-learning;natural-language-processing;nlp;numpy;pandas;pytorch;speech;tensorflow","d language:Python stars:>=50"
"ray-project/ray","https://github.com/ray-project/ray","ray-project","Python","42411","False","False","10/25/2016 7:38:30 PM","5/3/2026 6:40:53 PM","Ray is an AI compute engine. Ray consists of a core distributed runtime and a set of AI Libraries for accelerating ML workloads.","data-science;deep-learning;deployment;distributed;hyperparameter-optimization;hyperparameter-search;large-language-models;llm;llm-inference;llm-serving;machine-learning;optimization;parallel;python;pytorch;ray;reinforcement-learning;rllib;serving;tensorflow","topic:deep-learning stars:>=100"
"DuaneNielsen/DeepInfomaxPytorch","https://github.com/DuaneNielsen/DeepInfomaxPytorch","DuaneNielsen","Python","321","False","False","10/15/2018 5:34:54 AM","2/24/2026 9:33:04 PM","Learning deep representations by mutual information estimation and maximization","autoencoder;compression;deep-learning;pytorch","topic:compression language:Python stars:>=50"
"lepotekil/MsfMania","https://github.com/lepotekil/MsfMania","lepotekil","Python","518","False","False","6/28/2019 11:24:43 AM","4/23/2026 11:01:57 PM","Python AV Evasion Tools","compression;cross-platform;crosscompiler;docker;edr-evasion;encoding;encryption;modular;monolith;obfuscation;pe-format;pentesting;polymorphism;post-exploitation;python3;red-teaming;shellcode-injection","topic:compression language:Python stars:>=50"
"jackaduma/ChatGLM-LoRA-RLHF-PyTorch","https://github.com/jackaduma/ChatGLM-LoRA-RLHF-PyTorch","jackaduma","Python","138","False","False","4/18/2023 6:03:53 AM","4/23/2026 11:53:11 AM","A full pipeline to finetune ChatGLM LLM with LoRA and RLHF on consumer hardware. Implementation of RLHF (Reinforcement Learning with Human Feedback) on top of the ChatGLM architecture. Basically ChatGPT but with ChatGLM","chatglm;chatglm-6b;chatgpt;deepspeed;finetune;gpt;llama;llm;lora;peft;ppo;pytorch;reward-models;rlhf","deepspeed language:Python stars:>=50"
"YihangChen-ee/FCGS","https://github.com/YihangChen-ee/FCGS","YihangChen-ee","Python","233","False","False","10/1/2024 7:19:53 AM","5/1/2026 2:48:20 AM",":rocket:  [ICLR 2025] Pytorch implementation of 'Fast Feedforward 3D Gaussian Splatting Compression'","3dgs;compression;fast;optimization-free","topic:compression language:Python stars:>=50"
"HKUDS/DeepTutor","https://github.com/HKUDS/DeepTutor","HKUDS","Python","23090","False","False","12/28/2025 3:35:54 PM","5/3/2026 6:45:24 PM","""DeepTutor: Agent-Native Personalized Learning Assistant""","ai-agents;ai-tutor;clawdbot;cli-tool;deepresearch;interactive-learning;large-language-models;multi-agent-systems;rag","d language:Python stars:>=50"
"wei-potato/Train-llm-from-scratch","https://github.com/wei-potato/Train-llm-from-scratch","wei-potato","Python","162","False","False","6/29/2024 3:09:42 AM","4/8/2026 8:45:14 AM","使用deepspeed从头开始训练一个LLM,经过pretrain和sft阶段,验证llm学习知识、理解语言、回答问题的能力","","deepspeed language:Python stars:>=50"
"OpenMOSS/CoLLiE","https://github.com/OpenMOSS/CoLLiE","OpenMOSS","Python","420","False","False","4/2/2023 11:10:19 AM","3/31/2026 3:53:23 AM","Collaborative Training of Large Language Models in an Efficient Way","deep-learning;deepspeed;nlp;pytorch","deepspeed language:Python stars:>=50"
"mv-lab/swin2sr","https://github.com/mv-lab/swin2sr","mv-lab","Python","686","False","False","9/18/2022 1:02:13 PM","4/30/2026 9:01:29 AM","[ECCV] Swin2SR: SwinV2 Transformer for Compressed Image Super-Resolution and Restoration.  Advances in Image Manipulation (AIM) workshop ECCV 2022. Try it out! over 3.3M runs https://replicate.com/mv-lab/swin2sr","compression;compression-artifact-reduction;computer-vision;deblocking;deep-learning;denoising;eccv2022;image-denoising;image-processing;image-restoration;image-sr;image-super-resolution;jpeg;low-level-vision;ntire;super-resolution;swin2sr;swinir;transformer;vision-transformer","topic:compression language:Python stars:>=50"
"mxmlnkn/ratarmount","https://github.com/mxmlnkn/ratarmount","mxmlnkn","Python","1253","False","False","2/20/2019 3:23:31 PM","5/1/2026 5:02:26 PM","Access large archives as a filesystem efficiently, e.g., TAR, RAR, ZIP, GZ, BZ2, XZ, ZSTD archives","bz2;bzip2;compression;filesystem;fuse;gz;gzip;mergefs;mounting;overlayfs;python;random-access;rar;tar;tar-archive;unionfs;xz;zip;zstandard;zstd","topic:compression language:Python stars:>=50"
"YihangChen-ee/HAC-plus","https://github.com/YihangChen-ee/HAC-plus","YihangChen-ee","Python","196","False","False","1/21/2025 7:51:54 AM","4/28/2026 3:30:58 AM","💪  [TPAMI 2025] Pytorch implementation of 'HAC++: Towards 100X Compression of 3D Gaussian Splatting'","3dgs;compression;context-model;hash-grid","topic:compression language:Python stars:>=50"
"Fugaku-LLM/DeepSpeedFugaku","https://github.com/Fugaku-LLM/DeepSpeedFugaku","Fugaku-LLM","Python","137","False","False","5/8/2024 10:46:39 PM","4/15/2026 11:55:23 AM","","","deepspeed language:Python stars:>=50"
"horseee/LLM-Pruner","https://github.com/horseee/LLM-Pruner","horseee","Python","1124","False","False","5/17/2023 4:58:28 PM","5/2/2026 2:32:45 PM","[NeurIPS 2023] LLM-Pruner: On the Structural Pruning of Large Language Models. Support Llama-3/3.1, Llama-2, LLaMA,  BLOOM, Vicuna, Baichuan, TinyLlama, etc.","baichuan;bloom;chatglm;compression;language-model;llama;llama-2;llama3;llm;neurips-2023;pruning;pruning-algorithms;vicuna","topic:compression language:Python stars:>=50"
"KeKsBoTer/c3dgs","https://github.com/KeKsBoTer/c3dgs","KeKsBoTer","Python","394","False","False","12/21/2023 3:30:55 PM","4/23/2026 2:31:41 AM","Compressed 3D Gaussian Splatting for Accelerated Novel View Synthesis","3dgs;compression;gaussian;nerf;rust;wgpu","topic:compression language:Python stars:>=50"
"stanfordnlp/dspy","https://github.com/stanfordnlp/dspy","stanfordnlp","Python","34174","False","False","1/9/2023 9:01:51 PM","5/3/2026 5:54:19 PM","DSPy: The framework for programming—not prompting—language models","","d language:Python stars:>=50"
"hpcaitech/ColossalAI","https://github.com/hpcaitech/ColossalAI","hpcaitech","Python","41375","False","False","10/28/2021 4:19:44 PM","5/3/2026 1:23:48 PM","Making large AI models cheaper, faster and more accessible","ai;big-model;data-parallelism;deep-learning;distributed-computing;foundation-models;heterogeneous-training;hpc;inference;large-scale;model-parallelism;pipeline-parallelism","topic:data-parallelism language:Python stars:>=50 | topic:deep-learning stars:>=100"
"ultralytics/yolov5","https://github.com/ultralytics/yolov5","ultralytics","Python","57330","False","False","5/18/2020 3:45:11 AM","5/3/2026 3:06:59 PM","YOLOv5 🚀 in PyTorch > ONNX > CoreML > TFLite","coreml;deep-learning;ios;machine-learning;ml;object-detection;onnx;pytorch;tflite;ultralytics;yolo;yolov3;yolov5","topic:deep-learning stars:>=100"
"caoscott/SReC","https://github.com/caoscott/SReC","caoscott","Python","1052","False","False","3/17/2020 4:09:46 AM","4/20/2026 1:22:50 PM","PyTorch Implementation of ""Lossless Image Compression through Super-Resolution""","compression;lossless;neural-network;pytorch","topic:compression language:Python stars:>=50"
"bigscience-workshop/Megatron-DeepSpeed","https://github.com/bigscience-workshop/Megatron-DeepSpeed","bigscience-workshop","Python","1439","False","False","7/2/2021 5:40:35 PM","5/3/2026 5:19:56 PM","Ongoing research training transformer language models at scale, including: BERT & GPT-2","","deepspeed language:Python stars:>=50"
"LeanModels/DFloat11","https://github.com/LeanModels/DFloat11","LeanModels","Python","624","False","False","4/15/2025 4:39:29 PM","5/2/2026 5:43:30 AM","DFloat11 [NeurIPS '25]: Lossless Compression of LLMs and DiTs for Efficient GPU Inference","compression;diffusion-models;gpu;llm;lossless-compression-algorithm","topic:compression language:Python stars:>=50"
"zjunlp/KnowLM","https://github.com/zjunlp/KnowLM","zjunlp","Python","1385","False","False","4/1/2023 3:45:31 AM","4/22/2026 4:04:01 AM","An Open-sourced Knowledgable Large Language Model Framework.","bilingual;chinese;deep-learning;deepspeed;english;gpt-3;instructie;instruction-following;instruction-tuning;instructions;knowlm;language-model;large-language-models;llama;lora;models;pre-trained-language-models;pre-trained-model;pre-training;reasoning","deepspeed language:Python stars:>=50"
"tensorflow/model-optimization","https://github.com/tensorflow/model-optimization","tensorflow","Python","1569","False","False","10/31/2018 8:34:28 PM","5/3/2026 10:50:04 AM","A toolkit to optimize ML models for deployment for Keras and TensorFlow, including quantization and pruning.","compression;deep-learning;keras;machine-learning;ml;model-compression;optimization;pruning;quantization;quantized-networks;quantized-neural-networks;quantized-training;sparsity;tensorflow","topic:compression language:Python stars:>=50"
"ZhuLinsen/daily_stock_analysis","https://github.com/ZhuLinsen/daily_stock_analysis","ZhuLinsen","Python","33845","False","False","1/10/2026 6:43:20 AM","5/3/2026 6:52:21 PM","LLM驱动的 A/H/美股智能分析器：多数据源行情 + 实时新闻 + LLM决策仪表盘 + 多渠道推送，零成本定时运行，纯白嫖. LLM-powered stock analysis system for A/H/US markets.","agent;ai;aigc;gemini;llm;quant;quantitative-trading;rag;stock","d language:Python stars:>=50"
"teamtee/Qwen2-Audio-finetune","https://github.com/teamtee/Qwen2-Audio-finetune","teamtee","Python","52","False","False","2/17/2025 3:07:39 AM","4/10/2026 5:43:12 AM","This is a repository for fine-tuning Qwen2-Audio, currently supporting Distributed Data Parallel (DDP) and  DeepSpeed.","","deepspeed language:Python stars:>=50"
"mvanhorn/last30days-skill","https://github.com/mvanhorn/last30days-skill","mvanhorn","Python","24651","False","False","1/23/2026 8:37:37 PM","5/3/2026 6:36:39 PM","AI agent skill that researches any topic across Reddit, X, YouTube, HN, Polymarket, and the web - then synthesizes a grounded summary","ai-prompts;ai-skill;bluesky;claude;claude-code;clawhub;deep-research;hackernews;instagram;openclaw;polymarket;recency;reddit;research;social-media;tiktok;trends;twitter;web-search;youtube","d language:Python stars:>=50"
"binref/refinery","https://github.com/binref/refinery","binref","Python","842","False","False","12/14/2019 12:32:06 PM","4/30/2026 11:04:12 PM","High Octane Triage Analysis","commandline;compression;cryptography;malware-analysis;triage","topic:compression language:Python stars:>=50"
"hkproj/pytorch-transformer-distributed","https://github.com/hkproj/pytorch-transformer-distributed","hkproj","Python","96","False","False","12/8/2023 12:52:38 AM","4/16/2026 3:42:02 PM","Distributed training (multi-node) of a Transformer model","collective-communication;data-parallelism;deep-learning;distributed-data-parallel;distributed-training;gradient-accumulation;machine-learning;model-parallelism;pytorch;tutorial","topic:data-parallelism language:Python stars:>=50"
"git-cloner/llama2-lora-fine-tuning","https://github.com/git-cloner/llama2-lora-fine-tuning","git-cloner","Python","176","False","False","7/21/2023 2:37:33 PM","1/6/2026 2:15:20 AM","llama2 finetuning with deepspeed and lora","deepspeed;finetuning;llama2;lora","deepspeed language:Python stars:>=50"
"MAC-AutoML/MindPipe","https://github.com/MAC-AutoML/MindPipe","MAC-AutoML","Python","603","False","False","1/22/2026 6:54:26 AM","5/3/2026 3:40:19 PM","A powerful model compression framework for LLMs and LVLMs, adapted for NVIDIA GPUs and Huawei Ascend NPUs.","automatic-compression;compression;deployment;evaluation;huawei-ascend-npus;large-language-models;large-vision-language-models;llama;llava;minicpm;nvidia-gpus;pruning;quantization;qwen","topic:compression language:Python stars:>=50"
"apple/ml-stable-diffusion","https://github.com/apple/ml-stable-diffusion","apple","Python","17847","False","False","11/16/2022 12:48:18 AM","5/3/2026 7:17:55 AM","Stable Diffusion with Core ML on Apple Silicon","","d language:Python stars:>=50"
"mikf/gallery-dl","https://github.com/mikf/gallery-dl","mikf","Python","18035","False","False","10/12/2014 7:38:05 PM","5/3/2026 6:30:01 PM","Command-line program to download image galleries and collections from several image hosting sites","danbooru;deviantart;downloader;gallery;kemono;mangadex;pixiv;tumblr;twitter","d language:Python stars:>=50"
"wenwei202/terngrad","https://github.com/wenwei202/terngrad","wenwei202","Python","182","False","False","5/21/2017 2:34:51 AM","11/6/2025 8:04:19 AM","Ternary Gradients to Reduce Communication in Distributed Deep Learning (TensorFlow)","data-parallelism;deep-learning;deep-neural-networks;distributed-training;quantization;sgd","topic:data-parallelism language:Python stars:>=50"
"chrissimpkins/Crunch","https://github.com/chrissimpkins/Crunch","chrissimpkins","Python","3423","False","False","4/10/2016 3:12:10 AM","4/20/2026 1:19:55 PM","Insane(ly slow but wicked good) PNG image optimization","compression;image;image-compression;image-processing;image-quality;images;lossy;lossy-compression;macos;png;png-compression;pngquant;zopflipng","topic:compression language:Python stars:>=50"
"sunzeyeah/RLHF","https://github.com/sunzeyeah/RLHF","sunzeyeah","Python","287","False","False","2/17/2023 3:27:53 PM","4/15/2026 5:04:26 AM","Implementation of Chinese ChatGPT","chatgpt;deep-learning;deepspeed;glm;nlp;pangu;pytorch","deepspeed language:Python stars:>=50"
"CMU-Perceptual-Computing-Lab/openpose","https://github.com/CMU-Perceptual-Computing-Lab/openpose","CMU-Perceptual-Computing-Lab","C++","34060","False","False","4/24/2017 2:06:31 PM","5/3/2026 1:59:40 PM","OpenPose: Real-time multi-person keypoint detection library for body, face, hands, and foot estimation","caffe;computer-vision;cpp;cvpr-2017;deep-learning;face;foot-estimation;hand-estimation;human-behavior-understanding;human-pose;human-pose-estimation;keypoint-detection;keypoints;machine-learning;multi-person;opencv;openpose;pose;pose-estimation;real-time","topic:deep-learning stars:>=100"
"streamlit/streamlit","https://github.com/streamlit/streamlit","streamlit","Python","44432","False","False","8/24/2019 12:14:52 AM","5/3/2026 6:55:12 PM","Streamlit — A faster way to build and share data apps.","data-analysis;data-science;data-visualization;deep-learning;developer-tools;machine-learning;python;streamlit","topic:deep-learning stars:>=100"
"emmabostian/developer-portfolios","https://github.com/emmabostian/developer-portfolios","emmabostian","Python","22363","False","False","9/13/2019 2:18:58 PM","5/3/2026 6:19:17 PM","A list of developer portfolios for your inspiration","","d language:Python stars:>=50"
"explosion/spaCy","https://github.com/explosion/spaCy","explosion","Python","33538","False","False","7/3/2014 3:15:40 PM","5/3/2026 11:00:34 AM","💫 Industrial-strength Natural Language Processing (NLP) in Python","ai;artificial-intelligence;cython;data-science;deep-learning;entity-linking;machine-learning;named-entity-recognition;natural-language-processing;neural-network;neural-networks;nlp;nlp-library;python;spacy;text-classification;tokenization","topic:deep-learning stars:>=100"
"roboflow/supervision","https://github.com/roboflow/supervision","roboflow","Python","38299","False","False","11/28/2022 2:08:44 PM","5/3/2026 6:29:42 PM","We write your reusable computer vision tools. 💜","classification;coco;computer-vision;deep-learning;hacktoberfest;image-processing;instance-segmentation;low-code;machine-learning;metrics;object-detection;oriented-bounding-box;pascal-voc;python;pytorch;tensorflow;tracking;video-processing;yolo","topic:deep-learning stars:>=100"
"openvinotoolkit/nncf","https://github.com/openvinotoolkit/nncf","openvinotoolkit","Python","1156","False","False","5/13/2020 4:41:05 PM","5/1/2026 9:30:33 AM","Neural Network Compression Framework for enhanced OpenVINO™ inference","bert;classification;compression;deep-learning;genai;llm;mixed-precision-training;nlp;object-detection;onnx;openvino;pruning;pytorch;quantization;quantization-aware-training;semantic-segmentation;sparsity;tensorflow;transformers","topic:compression language:Python stars:>=50"
"PaddlePaddle/PaddleSlim","https://github.com/PaddlePaddle/PaddleSlim","PaddlePaddle","Python","1613","False","False","12/16/2019 2:56:50 AM","5/1/2026 6:16:58 PM","PaddleSlim is an open-source library for deep model compression and architecture search.","bert;compression;detection;distillation;ernie;nas;pruning;quantization;segmentation;sparsity;tensorrt;transformer;yolov5;yolov6;yolov7","topic:compression language:Python stars:>=50"
"encode/django-rest-framework","https://github.com/encode/django-rest-framework","encode","Python","29991","False","False","3/2/2011 5:13:56 PM","5/3/2026 3:15:18 PM","Web APIs for Django. 🎸","api;django;python;rest","d language:Python stars:>=50"
"keras-team/keras","https://github.com/keras-team/keras","keras-team","Python","64057","False","False","3/28/2015 12:35:42 AM","5/3/2026 6:45:46 PM","Deep Learning for humans","data-science;deep-learning;jax;machine-learning;neural-networks;python;pytorch;tensorflow","topic:deep-learning stars:>=100"
"CorentinJ/Real-Time-Voice-Cloning","https://github.com/CorentinJ/Real-Time-Voice-Cloning","CorentinJ","Python","59711","False","False","5/26/2019 8:56:15 AM","5/3/2026 6:01:13 PM","Clone a voice in 5 seconds to generate arbitrary speech in real-time","deep-learning;python;pytorch;tensorflow;tts;voice-cloning","topic:deep-learning stars:>=100"
"quic/aimet","https://github.com/quic/aimet","quic","Python","2608","False","False","4/21/2020 6:57:10 PM","5/3/2026 3:42:19 PM","AIMET is a library that provides advanced quantization and compression techniques for trained neural network models.","auto-ml;compression;deep-learning;deep-neural-networks;machine-learning;network-compression;network-quantization;open-source;opensource;pruning;quantization","topic:compression language:Python stars:>=50"
"coqui-ai/TTS","https://github.com/coqui-ai/TTS","coqui-ai","Python","45211","False","False","5/20/2020 3:45:28 PM","5/3/2026 3:53:02 PM","🐸💬 - a deep learning toolkit for Text-to-Speech, battle-tested in research and production","deep-learning;glow-tts;hifigan;melgan;multi-speaker-tts;python;pytorch;speaker-encoder;speaker-encodings;speech;speech-synthesis;tacotron;text-to-speech;tts;tts-model;vocoder;voice-cloning;voice-conversion;voice-synthesis","topic:deep-learning stars:>=100"
