"FullName","Url","Owner","Language","Stars","Fork","Archived","CreatedAt","UpdatedAt","Description","Topics","SourceQueries"
"doocs/source-code-hunter","https://github.com/doocs/source-code-hunter","doocs","Java","23131","False","False","10/28/2019 1:35:10 AM","5/2/2026 6:21:32 AM","😱 从源码层面，剖析挖掘互联网行业主流技术的底层实现原理，为广大开发者 “提升技术深度” 提供便利。目前开放 Spring 全家桶，Mybatis、Netty、Dubbo 框架，及 Redis、Tomcat 中间件等","dubbo;mybatis;netty;redis;sourcecode-analysis;spring","s language:Java stars:>=50"
"StarRocks/starrocks","https://github.com/StarRocks/starrocks","StarRocks","Java","11633","False","False","9/4/2021 2:29:35 AM","5/2/2026 4:54:55 PM","The world's fastest open query engine for sub-second analytics both on and off the data lakehouse. With the flexibility to support nearly any scenario, StarRocks provides best-in-class performance for multi-dimensional analytics, real-time analytics, and ad-hoc queries. A Linux Foundation project.","analytics;big-data;cloudnative;database;datalake;delta-lake;distributed-database;hudi;iceberg;join;lakehouse;lakehouse-platform;mpp;olap;real-time-analytics;real-time-updates;realtime-database;sql;star-schema;vectorized","s language:Java stars:>=50"
"xuchengsheng/spring-reading","https://github.com/xuchengsheng/spring-reading","xuchengsheng","Java","9926","False","False","9/15/2023 6:42:44 AM","5/2/2026 6:44:02 AM","涵盖了 Spring 框架的核心概念和关键功能，包括控制反转（IOC）容器的使用，面向切面编程（AOP）的原理与实践，事务管理的方式与实现，Spring MVC 的流程与控制器工作机制，以及 Spring 中数据访问、安全、Boot 自动配置等方面的深入研究。此外，它还包含了 Spring 事件机制的应用、高级主题如缓存抽象和响应式编程，以及对 Spring 源码的编程风格与设计模式的深入探讨。","annotations;awareinterface;backenddevelopment;java;javabackend;mybatis;mybatis-plus;opensource;servlet;sourcecodeanalysis;spring;spring-aop;spring-boot;spring-cloud;spring-data-jpa;spring-security;springboot2;springframework;springmvc;web","s language:Java stars:>=50"
"chatchat-space/Langchain-Chatchat","https://github.com/chatchat-space/Langchain-Chatchat","chatchat-space","Python","37950","False","False","3/31/2023 12:12:45 PM","5/2/2026 1:34:33 PM","Langchain-Chatchat（原Langchain-ChatGLM）基于 Langchain 与 ChatGLM, Qwen 与 Llama 等语言模型的 RAG 与 Agent 应用 | Langchain-Chatchat (formerly langchain-ChatGLM), local knowledge based LLM (like ChatGLM, Qwen and Llama) RAG and Agent app with langchain ","chatbot;chatchat;chatglm;chatgpt;embedding;faiss;fastchat;gpt;knowledge-base;langchain;langchain-chatglm;llama;llm;milvus;ollama;qwen;rag;retrieval-augmented-generation;streamlit;xinference","topic:llm stars:>=100"
"rasbt/LLMs-from-scratch","https://github.com/rasbt/LLMs-from-scratch","rasbt","Jupyter Notebook","91824","False","False","7/23/2023 6:15:57 PM","5/2/2026 3:32:05 PM","Implement a ChatGPT-like LLM in PyTorch from scratch, step by step","ai;artificial-intelligence;chatbot;chatgpt;deep-learning;from-scratch;generative-ai;gpt;language-model;large-language-models;llm;machine-learning;neural-networks;python;pytorch;transformers","topic:llm stars:>=100"
"mimno/Mallet","https://github.com/mimno/Mallet","mimno","Java","1025","False","False","4/2/2014 7:10:38 PM","5/1/2026 4:16:20 PM","MALLET is a Java-based package for statistical natural language processing, document classification, clustering, topic modeling, information extraction, and other machine learning applications to text.","","statistical language:Java stars:>=50"
"QuivrHQ/quivr","https://github.com/QuivrHQ/quivr","QuivrHQ","Python","39123","False","False","5/12/2023 11:53:30 PM","5/2/2026 4:48:49 PM","Opiniated RAG for integrating GenAI in your apps 🧠   Focus on your product rather than the RAG. Easy integration in existing products with customisation!  Any LLM: GPT4, Groq, Llama. Any Vectorstore: PGVector, Faiss. Any Files. Anyway you want.","ai;api;chatbot;chatgpt;database;docker;framework;frontend;groq;html;javascript;llm;openai;postgresql;privacy;rag;react;security;typescript;vector","topic:llm stars:>=100"
"forezp/SpringCloudLearning","https://github.com/forezp/SpringCloudLearning","forezp","Java","17965","False","False","4/8/2017 10:06:56 AM","5/1/2026 4:44:29 AM","《史上最简单的Spring Cloud教程源码》","consul;eureka;feign;finchley;gateway;hystrix;hystrix-dashboard;hystrix-turbine;ribbon;sleuth;spring;spring-boot;spring-cloud;springbootadmin;zuul","s language:Java stars:>=50"
"unslothai/unsloth","https://github.com/unslothai/unsloth","unslothai","Python","63459","False","False","11/29/2023 4:50:09 PM","5/2/2026 5:42:23 PM","Web UI for training and running open models like Gemma 4, Qwen3.6, DeepSeek, gpt-oss locally.","agent;deepseek;fine-tuning;gemma;gemma3;gpt-oss;llama;llama3;llm;llms;mistral;openai;qwen;reinforcement-learning;self-hosted;text-to-speech;tts;ui;unsloth","topic:llm stars:>=100"
"daimajia/AndroidSwipeLayout","https://github.com/daimajia/AndroidSwipeLayout","daimajia","Java","12375","False","False","8/25/2014 4:09:33 AM","4/29/2026 1:43:37 PM","The Most Powerful Swipe Layout!","","s language:Java stars:>=50"
"c2mon/c2mon","https://github.com/c2mon/c2mon","c2mon","Java","72","False","False","6/28/2016 10:15:26 PM","4/19/2026 9:00:05 AM","CERN Control and Monitoring Platform ","c2mon;cern;cern-control;clustering;gnu-lgplv3;monitoring;scada","topic:clustering language:Java stars:>=50"
"IJ-Apps/Image-Classification-App-with-Custom-TensorFlow-Model","https://github.com/IJ-Apps/Image-Classification-App-with-Custom-TensorFlow-Model","IJ-Apps","Java","101","False","False","2/26/2022 11:28:16 PM","3/12/2026 1:27:54 PM","Learn how to code your own neural network in Python, then deploy it in an Image Classification App using TensorFlow Lite.","android;classification;image-classification;tensorflow;tensorflow-lite","topic:classification language:Java stars:>=50"
"SonarSource/sonarqube","https://github.com/SonarSource/sonarqube","SonarSource","Java","10502","False","False","1/5/2011 11:05:17 AM","5/2/2026 9:58:03 AM","Continuous Inspection","code-quality;sonarqube;static-analysis","s language:Java stars:>=50"
"supertokens/supertokens-core","https://github.com/supertokens/supertokens-core","supertokens","Java","15027","False","False","1/5/2020 1:30:52 PM","5/2/2026 4:21:04 PM","Open source alternative to Auth0 / Firebase Auth / AWS Cognito ","auth0;authentication;aws-cognito;email-password;email-password-login;firebase-auth;hacktoberfest;java;keycloak;login;oauth;password;passwordless;passwordless-authentication;passwordless-login;session-management;signin;social-login;supertokens","s language:Java stars:>=50"
"apache/shardingsphere","https://github.com/apache/shardingsphere","apache","Java","20716","False","False","1/18/2016 12:49:26 PM","5/2/2026 4:11:35 AM","Empowering Data Intelligence with Distributed SQL for Sharding, Scalability, and Security Across All Databases.","bigdata;data-encryption;data-pipeline;database;database-cluster;database-gateway;database-middleware;distributed-database;distributed-sql-database;distributed-transaction;encrypt;mysql;postgresql;read-write-splitting;shard;sql","s language:Java stars:>=50"
"langchain-ai/langchain","https://github.com/langchain-ai/langchain","langchain-ai","Python","135632","False","False","10/17/2022 2:58:36 AM","5/2/2026 5:26:56 PM","The agent engineering platform","agents;ai;ai-agents;anthropic;chatgpt;deepagents;enterprise;framework;gemini;generative-ai;langchain;langgraph;llm;multiagent;open-source;openai;pydantic;python;rag","topic:llm stars:>=100"
"scwang90/SmartRefreshLayout","https://github.com/scwang90/SmartRefreshLayout","scwang90","Java","25163","False","False","6/2/2017 9:52:50 AM","5/2/2026 10:00:39 AM","🔥下拉刷新、上拉加载、二级刷新、淘宝二楼、RefreshLayout、OverScroll，Android智能下拉刷新框架，支持越界回弹、越界拖动，具有极强的扩展性，集成了几十种炫酷的Header和 Footer。","android;android-ui;footer;header;overscroll;pull-to-refresh;pulltorefresh;refreshlayout","s language:Java stars:>=50"
"mkulesh/microMathematics","https://github.com/mkulesh/microMathematics","mkulesh","Java","647","False","False","7/29/2017 7:26:37 PM","4/25/2026 9:30:16 AM","microMathematics Plus - Extended visual calculator","android;calculator;computer-algebra-system;mathematical-calculations;mathematical-expressions;plotting","topic:computer-algebra-system language:Java stars:>=50"
"jeecgboot/JeecgBoot","https://github.com/jeecgboot/JeecgBoot","jeecgboot","Java","46068","False","False","11/26/2018 10:40:00 AM","5/2/2026 4:43:16 PM","AI低代码平台，支持「低代码 + 零代码」双模式：零代码 5 分钟搭建业务系统，低代码模式一键生成前后端代码。 内置AI 应用，支持AI聊天、知识库、流程编排、MCP与插件，支持各种模型。Skills能力实现：一句话画流程图、设计表单、生成系统。 引领 AI生成→在线配置→代码生成→手工合并的开发模式，解决Java项目80%的重复工作，快速提高效率，又不失灵活性。","activiti;agent;ai;antd;claude-code;cli;codegenerator;codex;flowable;langchain4j;llm;low-code;mcp;mybatis-plus;rag;skills;spring-ai;springboot;springcloud;vue3","topic:llm stars:>=100"
"apache/incubator-seata","https://github.com/apache/incubator-seata","apache","Java","25968","False","False","12/28/2018 8:37:22 AM","5/2/2026 6:03:34 AM",":fire: Seata is an easy-to-use, high-performance, open source distributed transaction solution.","at;consistency;distributed-transaction;microservice;saga;tcc;xa","s language:Java stars:>=50"
"EdwardRaff/JSAT","https://github.com/EdwardRaff/JSAT","EdwardRaff","Java","799","False","False","3/24/2015 2:53:51 AM","4/26/2026 4:31:53 AM","Java Statistical Analysis Tool, a Java library for Machine Learning ","java;jsat;machine-learning;machine-learning-algorithms;machine-learning-library;svm;tsne","statistical language:Java stars:>=50"
"spring-projects/spring-boot","https://github.com/spring-projects/spring-boot","spring-projects","Java","80552","False","False","10/19/2012 3:02:57 PM","5/2/2026 4:57:39 PM","Spring Boot helps you to create Spring-powered, production-grade applications and services with absolute minimum fuss.","framework;java;spring;spring-boot","s language:Java stars:>=50"
"HMS-Core/hms-ml-demo","https://github.com/HMS-Core/hms-ml-demo","HMS-Core","Java","371","False","False","5/22/2020 1:55:19 AM","4/24/2026 5:19:57 PM","HMS ML Demo provides an example of integrating Huawei ML Kit service into applications. This example demonstrates how to integrate services provided by ML Kit, such as face detection, text recognition, image segmentation, asr, and tts. ","asr;audio-file-transcription;bank-card-recognition;classification;deep-learning;document;face-detection;face-recognition;hms;huawei;id-card-recognition;image-segmentation;kotlin-android;language-detection;machine-learning;object-detection-and-tracking;ocr;text-to-speech;text-translation;tts-android","topic:classification language:Java stars:>=50"
"patrickzib/SFA","https://github.com/patrickzib/SFA","patrickzib","Java","323","False","False","2/22/2016 2:32:19 PM","4/7/2026 9:23:32 AM","Scalable Time Series Data Analytics","classification;indexing;similarity-measures;time-series","topic:classification language:Java stars:>=50"
"vllm-project/vllm","https://github.com/vllm-project/vllm","vllm-project","Python","78859","False","False","2/9/2023 11:23:20 AM","5/2/2026 5:35:32 PM","A high-throughput and memory-efficient inference and serving engine for LLMs","amd;blackwell;cuda;deepseek;deepseek-v3;gpt;gpt-oss;inference;kimi;llama;llm;llm-serving;model-serving;moe;openai;pytorch;qwen;qwen3;tpu;transformer","topic:llm stars:>=100"
"TooTallNate/Java-WebSocket","https://github.com/TooTallNate/Java-WebSocket","TooTallNate","Java","10806","False","False","1/20/2010 11:33:04 PM","5/1/2026 7:06:30 PM","A barebones WebSocket client and server implementation written in 100% Java.","","s language:Java stars:>=50"
"BerriAI/litellm","https://github.com/BerriAI/litellm","BerriAI","Python","45484","False","False","7/27/2023 12:09:52 AM","5/2/2026 5:38:27 PM","Python SDK, Proxy Server (AI Gateway) to call 100+ LLM APIs in OpenAI (or native) format, with cost tracking, guardrails, loadbalancing and logging. [Bedrock, Azure, OpenAI, VertexAI, Cohere, Anthropic, Sagemaker, HuggingFace, VLLM, NVIDIA NIM]","ai-gateway;anthropic;azure-openai;bedrock;gateway;langchain;litellm;llm;llm-gateway;llmops;mcp-gateway;openai;openai-proxy;vertex-ai","topic:llm stars:>=100"
"android-async-http/android-async-http","https://github.com/android-async-http/android-async-http","android-async-http","Java","10595","False","False","2/20/2011 3:25:07 AM","5/2/2026 9:59:08 AM","An asynchronous, callback-based Http client for Android built on top of Apache's HttpClient libraries.","android;java","s language:Java stars:>=50"
"alibaba/Alink","https://github.com/alibaba/Alink","alibaba","Java","3616","False","False","9/30/2018 6:36:11 AM","4/24/2026 6:03:56 AM","Alink is the Machine Learning algorithm platform based on Flink, developed by the PAI team of Alibaba computing platform. ","apriori;classification;clustering;data-mining;feature-engineering;flink;flink-machine-learning;flink-ml;fm;graph-algorithms;graph-embedding;kafka;machine-learning;recommender;recommender-system;regression;statistics;word2vec;xgboost","topic:classification language:Java stars:>=50 | topic:clustering language:Java stars:>=50"
"FoundationAgents/MetaGPT","https://github.com/FoundationAgents/MetaGPT","FoundationAgents","Python","67631","False","False","6/30/2023 9:04:55 AM","5/2/2026 4:52:23 PM","🌟 The Multi-Agent Framework: First AI Software Company, Towards Natural Language Programming","agent;gpt;llm;metagpt;multi-agent","topic:llm stars:>=100"
"Waikato/moa","https://github.com/Waikato/moa","Waikato","Java","655","False","False","5/2/2014 5:44:33 AM","4/20/2026 11:52:21 AM","MOA is an open source framework for Big Data stream mining. It includes a collection of machine learning algorithms (classification, regression, clustering, outlier detection, concept drift detection and recommender systems) and tools for evaluation.","clustering;data-stream-mining;java;machine-learning;machine-learning-algorithms;moa;streaming-algorithms","topic:clustering language:Java stars:>=50"
"Mintplex-Labs/anything-llm","https://github.com/Mintplex-Labs/anything-llm","Mintplex-Labs","JavaScript","59410","False","False","6/4/2023 2:29:14 AM","5/2/2026 4:52:44 PM","The all-in-one AI productivity accelerator. On device and privacy first with no annoying setup or configuration.","ai-agents;custom-ai-agents;deepseek;kimi;llama3;llm;lmstudio;local-llm;localai;mcp;mcp-servers;moonshot;multimodal;no-code;ollama;qwen3;rag;vector-database;web-scraping","topic:llm stars:>=100"
"ItzCrazyKns/Vane","https://github.com/ItzCrazyKns/Vane","ItzCrazyKns","TypeScript","34106","False","False","4/9/2024 10:51:32 AM","5/2/2026 5:24:13 PM","Vane is an AI-powered answering engine.","ai-agents;ai-search-engine;answering-engine;artificial-intelligence;llm;machine-learning;open-source-ai-search-engine;perplexica;rag;search-engine;searxng;searxng-copilot;self-hosted-ai;vane","topic:llm stars:>=100"
"NousResearch/hermes-agent","https://github.com/NousResearch/hermes-agent","NousResearch","Python","129430","False","False","7/22/2025 10:22:28 PM","5/2/2026 5:42:40 PM","The agent that grows with you","ai;ai-agent;ai-agents;anthropic;chatgpt;claude;claude-code;clawdbot;codex;hermes;hermes-agent;llm;moltbot;nous-research;openai;openclaw","topic:llm stars:>=100"
"PAMGuard/PAMGuard","https://github.com/PAMGuard/PAMGuard","PAMGuard","Java","63","False","False","1/7/2022 10:43:12 AM","5/1/2026 9:58:29 AM","Detection, Classification, and Localisation of marine mammal and other bioacoustic signals","bats;classification;detection;dolphins;localisation;whales","topic:classification language:Java stars:>=50"
"run-llama/llama_index","https://github.com/run-llama/llama_index","run-llama","Python","49098","False","False","11/2/2022 4:24:54 AM","5/2/2026 5:07:21 PM","LlamaIndex is the leading document agent and OCR platform","agents;application;data;fine-tuning;framework;llamaindex;llm;multi-agents;rag;vector-database","topic:llm stars:>=100"
"spinnaker/spinnaker","https://github.com/spinnaker/spinnaker","spinnaker","Java","9722","False","False","7/2/2014 7:02:36 PM","5/2/2026 9:41:37 AM","Spinnaker is an open source, multi-cloud continuous delivery platform for releasing software changes with high velocity and confidence.","continuous-delivery;continuous-deployment;spinnaker","s language:Java stars:>=50"
"browser-use/browser-use","https://github.com/browser-use/browser-use","browser-use","Python","91692","False","False","10/31/2024 4:00:56 PM","5/2/2026 5:42:48 PM","🌐 Make websites accessible for AI agents. Automate tasks online with ease.","ai-agents;ai-tools;browser-automation;browser-use;llm;playwright;python","topic:llm stars:>=100"
"mudler/LocalAI","https://github.com/mudler/LocalAI","mudler","Go","46011","False","False","3/18/2023 10:58:02 PM","5/2/2026 5:28:41 PM","LocalAI is the open-source AI engine. Run any model - LLMs, vision, voice, image, video - on any hardware. No GPU required.","agents;ai;api;audio-generation;decentralized;distributed;image-generation;libp2p;llama;llm;mamba;mcp;musicgen;object-detection;rerank;stable-diffusion;text-generation;tts","topic:llm stars:>=100"
"ksoichiro/Android-ObservableScrollView","https://github.com/ksoichiro/Android-ObservableScrollView","ksoichiro","Java","9613","False","False","11/8/2014 2:45:20 PM","5/2/2026 9:59:42 AM","Android library to observe scroll events on scrollable views.","android;android-library;android-ui;material-design","s language:Java stars:>=50"
"yuliskov/SmartTube","https://github.com/yuliskov/SmartTube","yuliskov","Java","29905","False","False","7/28/2020 12:53:52 PM","5/2/2026 5:42:51 PM","Browse media content with your own rules on Android TV","android;android-tv;android-tv-box;java;kotlin;retrofit2;rxjava-android","s language:Java stars:>=50"
"2noise/ChatTTS","https://github.com/2noise/ChatTTS","2noise","Python","39189","False","False","5/27/2024 6:26:49 PM","5/2/2026 4:56:35 PM","A generative speech model for daily dialogue.","agent;chat;chatgpt;chattts;chinese;chinese-language;english;english-language;gpt;llm;llm-agent;natural-language-inference;python;text-to-speech;torch;torchaudio;tts","topic:llm stars:>=100"
"Hidendra/Plugin-Metrics","https://github.com/Hidendra/Plugin-Metrics","Hidendra","Java","84","False","False","11/27/2011 1:59:18 PM","11/6/2025 3:04:00 AM","Metrics tools designed for minecraft plugins to gather statistical data","","statistical language:Java stars:>=50"
"android10/Android-CleanArchitecture","https://github.com/android10/Android-CleanArchitecture","android10","Java","15548","False","False","8/19/2014 2:09:26 PM","5/2/2026 9:59:37 AM","This is a sample app that is part of a series of blog posts I have written about how to architect an android application using Uncle Bob's clean architecture approach.","android;android-application;android-architecture;android-cleanarchitecture;android-development;architectural;java","s language:Java stars:>=50"
"SeleniumHQ/selenium","https://github.com/SeleniumHQ/selenium","SeleniumHQ","Java","34073","False","False","1/14/2013 9:40:56 PM","5/2/2026 2:25:11 PM","A browser automation framework and ecosystem.","dotnet;java;javascript;python;ruby;rust;selenium;webdriver","s language:Java stars:>=50"
"TauricResearch/TradingAgents","https://github.com/TauricResearch/TradingAgents","TauricResearch","Python","61738","False","False","12/28/2024 3:31:08 AM","5/2/2026 5:41:38 PM","TradingAgents: Multi-Agents LLM Financial Trading Framework","agent;finance;llm;multiagent;trading","topic:llm stars:>=100"
"wcmc-its/ReCiter","https://github.com/wcmc-its/ReCiter","wcmc-its","Java","54","False","False","3/28/2015 4:30:11 PM","4/27/2026 1:03:24 PM","ReCiter: an enterprise open source author disambiguation system for academic institutions","algorithm;aws;awscodebuild;awscodepipeline;clustering;dynamodb;elasticbeanstalk;entity-resolution;java;machine-learning-algorithms;maven;pubmed;reciter;s3;scopus;spring-boot","topic:clustering language:Java stars:>=50"
"langgenius/dify","https://github.com/langgenius/dify","langgenius","TypeScript","139872","False","False","4/12/2023 7:40:24 AM","5/2/2026 4:51:57 PM","Production-ready platform for agentic workflow development.","agent;agentic-ai;agentic-framework;agentic-workflow;ai;automation;gemini;genai;gpt;gpt-4;llm;low-code;mcp;nextjs;no-code;openai;orchestration;python;rag;workflow","topic:llm stars:>=100"
"apache/commons-math","https://github.com/apache/commons-math","apache","Java","643","False","False","10/8/2014 7:00:06 AM","4/25/2026 6:00:09 AM","Apache Commons Math","clustering;fitting;integration;interpolation;java;least-squares;math;optimization;polynomial;solver;stat;transforms","topic:clustering language:Java stars:>=50"
"HKUDS/LightRAG","https://github.com/HKUDS/LightRAG","HKUDS","Python","34674","False","False","10/2/2024 11:57:54 AM","5/2/2026 4:24:18 PM","[EMNLP2025] ""LightRAG: Simple and Fast Retrieval-Augmented Generation""","genai;gpt;gpt-4;graphrag;knowledge-graph;large-language-models;llm;rag;retrieval-augmented-generation","topic:llm stars:>=100"
"tgsmith61591/clust4j","https://github.com/tgsmith61591/clust4j","tgsmith61591","Java","166","False","False","11/11/2015 11:48:25 PM","3/25/2026 2:16:58 AM","A suite of classification clustering algorithm implementations for Java. A number of partitional, hierarchical and density-based algorithms including DBSCAN, k-Means, k-Medoids, MeanShift, Affinity Propagation, HDBSCAN and more.","clustering;clustering-algorithm;kernel-functions;machine-learning","topic:clustering language:Java stars:>=50"
"CWTSLeiden/networkanalysis","https://github.com/CWTSLeiden/networkanalysis","CWTSLeiden","Java","153","False","False","10/19/2018 9:41:56 AM","3/24/2026 9:11:28 AM","Java package that provides data structures and algorithms for network analysis.","clustering;clustering-algorithm;community-detection;java;layout;layout-algorithm;leiden-algorithm;louvain-algorithm;mapping;network-analysis;vos-technique","topic:clustering language:Java stars:>=50"
"yudaocode/SpringBoot-Labs","https://github.com/yudaocode/SpringBoot-Labs","yudaocode","Java","20091","False","False","9/12/2018 2:51:46 PM","5/2/2026 11:25:19 AM","一个涵盖六个专栏：Spring Boot 2.X、Spring Cloud、Spring Cloud Alibaba、Dubbo、分布式消息队列、分布式事务的仓库。希望胖友小手一抖，右上角来个 Star，感恩 1024","activemq;dubbo;kafka;rabbitmq;rocketmq;spring-boot;spring-cloud;spring-cloud-alibaba","s language:Java stars:>=50"
"opensearch-project/OpenSearch","https://github.com/opensearch-project/OpenSearch","opensearch-project","Java","12850","False","False","1/29/2021 10:10:00 PM","5/2/2026 2:14:59 PM","🔎 Open source distributed and RESTful search engine.","analytics;apache2;foss;java;search;search-engine","s language:Java stars:>=50"
"spring-projects/spring-framework","https://github.com/spring-projects/spring-framework","spring-projects","Java","59894","False","False","12/8/2010 4:04:45 AM","5/2/2026 4:58:33 PM","Spring Framework","framework;spring;spring-framework","s language:Java stars:>=50"
"elki-project/elki","https://github.com/elki-project/elki","elki-project","Java","831","False","False","3/4/2015 2:45:49 PM","4/9/2026 3:49:10 PM","ELKI Data Mining Toolkit ","anomalydetection;cluster-analysis;clustering;data-analysis;data-mining;data-mining-algorithms;data-science;distance-functions;index;indexing;java;machine-learning;outlier-detection;outliers;time-series;visualization","topic:clustering language:Java stars:>=50"
"khoj-ai/khoj","https://github.com/khoj-ai/khoj","khoj-ai","Python","34353","False","False","8/16/2021 1:48:44 AM","5/2/2026 4:57:11 PM","Your AI second brain. Self-hostable. Get answers from the web or your docs. Build custom agents, schedule automations, do deep research. Turn any online or local LLM into your personal, autonomous AI (gpt, claude, gemini, llama, qwen, mistral). Get started - free.","agent;ai;assistant;chat;chatgpt;emacs;image-generation;llama3;llamacpp;llm;obsidian;obsidian-md;offline-llm;productivity;rag;research;self-hosted;semantic-search;stt;whatsapp-ai","topic:llm stars:>=100"
"richardstartin/multi-matcher","https://github.com/richardstartin/multi-matcher","richardstartin","Java","93","False","False","3/1/2018 11:00:59 AM","4/12/2026 2:19:39 PM","simple rules engine","classification;classifier;decision-table;decision-tree","topic:classification language:Java stars:>=50"
"juergenlerner/eventnet","https://github.com/juergenlerner/eventnet","juergenlerner","Java","50","False","False","12/17/2018 3:07:36 PM","4/15/2026 2:22:51 AM","Event network analyzer (eventnet): statistical analysis of networks of relational events.","","statistical language:Java stars:>=50"
"Tencent/fast-causal-inference","https://github.com/Tencent/fast-causal-inference","Tencent","Java","182","False","False","7/5/2023 9:35:26 AM","5/2/2026 1:48:02 PM","It is a high-performance causal inference (statistical model) computing library based on OLAP, which solves the performance bottleneck of the existing statistical model library (R/Python) under big data","","statistical language:Java stars:>=50"
