"FullName","Url","Owner","Language","Stars","Fork","Archived","CreatedAt","UpdatedAt","Description","Topics","SourceQueries"
"shareAI-lab/learn-claude-code","https://github.com/shareAI-lab/learn-claude-code","shareAI-lab","TypeScript","57848","False","False","6/29/2025 3:34:15 PM","5/3/2026 4:52:24 AM","Bash is all you need -  A nano claude code–like 「agent harness」, built from 0 to 1","agent;agent-development;ai-agent;claude;claude-code;educational;llm;python;teaching;tutorial","topic:llm stars:>=100"
"ageitgey/face_recognition","https://github.com/ageitgey/face_recognition","ageitgey","Python","56364","False","False","3/3/2017 9:52:39 PM","5/2/2026 9:19:47 PM","The world's simplest facial recognition api for Python and the command line","face-detection;face-recognition;machine-learning;python","s language:Python stars:>=50"
"0x4m4/hexstrike-ai","https://github.com/0x4m4/hexstrike-ai","0x4m4","Python","8473","False","False","7/10/2025 5:53:18 PM","5/3/2026 2:15:54 AM","HexStrike AI MCP Agents is an advanced MCP server that lets AI agents (Claude, GPT, Copilot, etc.) autonomously run 150+ cybersecurity tools for automated pentesting, vulnerability discovery, bug bounty automation, and security research. Seamlessly bridge LLMs with real-world offensive security capabilities.","0x4m4;ai;ai-agents;ai-cybersecurity;ai-hacking;ai-penetration-testing;ai-security-tool;artificial-intelligence;ctf-tools;generative-ai;hexstrike;kali-linux;kali-tools;llm;llm-integration;mcp;mcp-server;mcp-tools;pentesting;pentesting-tools","run language:Python stars:>=50"
"pypa/pipx","https://github.com/pypa/pipx","pypa","Python","12777","False","False","10/6/2018 6:47:46 PM","5/2/2026 7:29:38 PM","Install and Run Python Applications in Isolated Environments","cli;hacktoberfest;pip;pypi;python;venv","run language:Python stars:>=50"
"certbot/certbot","https://github.com/certbot/certbot","certbot","Python","33019","False","False","11/12/2014 2:52:20 AM","5/2/2026 2:31:59 PM","Certbot is EFF's tool to obtain certs from Let's Encrypt and (optionally) auto-enable HTTPS on your server.  It can also act as a client for any other CA that uses the ACME protocol.","acme;acme-client;certbot;certificate;letsencrypt;python","s language:Python stars:>=50"
"mvanhorn/last30days-skill","https://github.com/mvanhorn/last30days-skill","mvanhorn","Python","24602","False","False","1/23/2026 8:37:37 PM","5/3/2026 4:59:02 AM","AI agent skill that researches any topic across Reddit, X, YouTube, HN, Polymarket, and the web - then synthesizes a grounded summary","ai-prompts;ai-skill;bluesky;claude;claude-code;clawhub;deep-research;hackernews;instagram;openclaw;polymarket;recency;reddit;research;social-media;tiktok;trends;twitter;web-search;youtube","s language:Python stars:>=50"
"ScrapeGraphAI/Scrapegraph-ai","https://github.com/ScrapeGraphAI/Scrapegraph-ai","ScrapeGraphAI","Python","23442","False","False","1/27/2024 4:54:38 PM","5/3/2026 2:14:20 AM","Python scraper based on AI","ai-crawler;ai-scraping;ai-search;crawler;data-extraction;firecrawl-alternative;large-language-model;llm;markdown;rag;scraping;scraping-python;web-crawler;web-crawlers;web-data;web-data-extraction;web-scraper;web-scraping;web-search;webscraping","s language:Python stars:>=50"
"OpenMOSS/MOSS-TTS-Nano","https://github.com/OpenMOSS/MOSS-TTS-Nano","OpenMOSS","Python","2603","False","False","4/10/2026 4:25:07 PM","5/3/2026 3:19:24 AM","MOSS-TTS-Nano is an open-source multilingual tiny speech generation model from MOSI.AI and the OpenMOSS team. With only 0.1B parameters, it is designed for realtime speech generation, can run directly on CPU without a GPU, and keeps the deployment stack simple enough for local demos, web serving, and lightweight product integration.","audio-tokenizer;chinese;english;multi-modality;multilingual;realtime;streaming-audio;tts;voice-clone","run language:Python stars:>=50"
"deepseek-ai/DeepSeek-V3","https://github.com/deepseek-ai/DeepSeek-V3","deepseek-ai","Python","103352","False","False","12/26/2024 9:52:40 AM","5/3/2026 4:15:10 AM","","","s language:Python stars:>=50"
"nextlevelbuilder/ui-ux-pro-max-skill","https://github.com/nextlevelbuilder/ui-ux-pro-max-skill","nextlevelbuilder","Python","73343","False","False","11/30/2025 11:36:31 AM","5/3/2026 4:59:40 AM","An AI SKILL that provide design intelligence for building professional UI/UX multiple platforms","ai-skills;antigravity;claude;claude-code;codex;command-line;copilot;cursor-ai;html5;kiro;landing-page;mobile-ui;qoder;react;tailwindcss;trae;ui-design;uikit;windsurf-ai","s language:Python stars:>=50"
"kosty-cloud/kosty","https://github.com/kosty-cloud/kosty","kosty-cloud","Python","268","False","False","10/26/2025 8:45:50 AM","4/26/2026 9:33:16 PM","Scan 30+ AWS services. Find cost waste. Detect security gaps. Map your attack surface. One command.","api-gateway;attack-surface;aws;aws-audit;bedrock;cloud;cloud-security;cost-optimization;devops;devsecops;finops;iam;privilege-escalation;python;sagemaker;waf","topic:cost-optimization language:Python stars:>=50"
"RVC-Boss/GPT-SoVITS","https://github.com/RVC-Boss/GPT-SoVITS","RVC-Boss","Python","57132","False","False","1/14/2024 6:05:21 PM","5/3/2026 4:50:23 AM","1 min voice data can also be used to train a good TTS model! (few shot voice cloning)","text-to-speech;tts;vits;voice-clone;voice-cloneai;voice-cloning","s language:Python stars:>=50"
"opengeos/geospatial-data-catalogs","https://github.com/opengeos/geospatial-data-catalogs","opengeos","Python","638","False","False","12/22/2022 7:54:55 PM","5/2/2026 5:44:38 AM","A list of open geospatial datasets available on AWS, Earth Engine, Planetary Computer, NASA CMR, and STAC Index","amazon;aws;cloud-computing;earth-engine;geospatial;geospatial-data;nasa-data;opan-data;open-access;satellite-imagery","topic:cloud-computing language:Python stars:>=50"
"rasbt/LLMs-from-scratch","https://github.com/rasbt/LLMs-from-scratch","rasbt","Jupyter Notebook","91842","False","False","7/23/2023 6:15:57 PM","5/3/2026 4:58:57 AM","Implement a ChatGPT-like LLM in PyTorch from scratch, step by step","ai;artificial-intelligence;chatbot;chatgpt;deep-learning;from-scratch;generative-ai;gpt;language-model;large-language-models;llm;machine-learning;neural-networks;python;pytorch;transformers","topic:llm stars:>=100"
"Ebazhanov/linkedin-skill-assessments-quizzes","https://github.com/Ebazhanov/linkedin-skill-assessments-quizzes","Ebazhanov","Python","28729","False","False","7/13/2019 7:52:56 PM","5/3/2026 4:39:29 AM","Full reference of LinkedIn answers 2024 for skill assessments (aws-lambda, rest-api, javascript, react, git, html, jquery, mongodb, java, Go, python, machine-learning, power-point) linkedin excel test lösungen, linkedin machine learning test LinkedIn test questions and answers ","answers;assessment;english;exam;france;german;golang;hacktoberfest;hacktoberfest2020;hacktoberfest2021;hacktoberfest2022;hacktoberfest2023;hacktoberfest2024;hacktoberfest2025;linkedin;linkedin-questions;quiz;quiz-questions;skills","s language:Python stars:>=50"
"AUTOMATIC1111/stable-diffusion-webui","https://github.com/AUTOMATIC1111/stable-diffusion-webui","AUTOMATIC1111","Python","162693","False","False","8/22/2022 2:05:26 PM","5/3/2026 4:12:10 AM","Stable Diffusion web UI","ai;ai-art;deep-learning;diffusion;gradio;image-generation;image2image;img2img;pytorch;stable-diffusion;text2image;torch;txt2img;unstable;upscaling;web","s language:Python stars:>=50"
"pyinfra-dev/pyinfra","https://github.com/pyinfra-dev/pyinfra","pyinfra-dev","Python","4972","False","False","10/19/2014 7:37:45 PM","5/2/2026 9:56:51 PM","🔧 pyinfra turns Python code into shell commands and runs them on your servers. Execute ad-hoc commands and write declarative operations. Target SSH servers, local machine and Docker containers. Fast and scales from one server to thousands.","cloud-management;configuration-management;high-performance;infrastructure;pyinfra;python;remote-execution","topic:cloud-management language:Python stars:>=50"
"ranaroussi/yfinance","https://github.com/ranaroussi/yfinance","ranaroussi","Python","23340","False","False","5/21/2017 10:16:15 AM","5/3/2026 12:52:12 AM","Download market data from Yahoo! Finance's API","financial-data;fix-yahoo-finance;market-data;pandas;python;stock-data;yahoo-finance;yahoo-finance-api","s language:Python stars:>=50"
"janhq/jan","https://github.com/janhq/jan","janhq","TypeScript","42335","False","False","8/17/2023 2:17:10 AM","5/3/2026 4:09:16 AM","Jan is an open source alternative to ChatGPT that runs 100% offline on your computer.","chatgpt;gpt;llamacpp;llm;localai;open-source;self-hosted;tauri","topic:llm stars:>=100"
"mishal23/virtual-clinic","https://github.com/mishal23/virtual-clinic","mishal23","Python","97","False","False","2/11/2018 6:10:55 PM","4/27/2026 1:18:09 PM","Virtual Clinic - An Integrated Care System","aws;cloud-computing;django;healthcare;heroku;software-engineering;srs-document;travis-ci;uml-diagrams;virtual-clinic","topic:cloud-computing language:Python stars:>=50"
"HKUDS/nanobot","https://github.com/HKUDS/nanobot","HKUDS","Python","41537","False","False","2/1/2026 7:16:15 AM","5/3/2026 4:55:13 AM","""🐈 nanobot: The Ultra-Lightweight Personal AI Agent""","ai;ai-agent;ai-agents;anthropic;chatgpt;claude;claude-code;codex;llm;nanobot;openai;openclaw","topic:llm stars:>=100"
"browser-use/web-ui","https://github.com/browser-use/web-ui","browser-use","Python","15922","False","False","1/2/2025 1:29:44 AM","5/2/2026 11:23:36 PM","🖥️ Run AI Agent in your browser.","","run language:Python stars:>=50"
"chubin/cheat.sh","https://github.com/chubin/cheat.sh","chubin","Python","41314","False","False","5/7/2017 9:40:56 PM","5/3/2026 4:21:12 AM","the only cheat sheet you need","cheatsheet;cli;command-line;curl;documentation;examples;hacktoberfest2021;help;terminal;tldr","s language:Python stars:>=50"
"pgiri/asyncoro","https://github.com/pgiri/asyncoro","pgiri","Python","50","False","False","7/25/2012 2:41:37 PM","1/15/2025 10:32:22 PM","Python framework for asynchronous, concurrent, distributed, network programming with coroutines","asynchronous-programming;cloud-computing;concurrent-programming;distributed-computing","topic:cloud-computing language:Python stars:>=50"
"jupyter/docker-stacks","https://github.com/jupyter/docker-stacks","jupyter","Python","8427","False","False","7/15/2015 3:30:00 PM","5/1/2026 12:05:55 AM","Ready-to-run Docker images containing Jupyter applications","docker;ipython;ipython-notebook;jupyter;jupyter-notebook;jupyter-notebooks;jupyterhub;jupyterlab;notebook;python","run language:Python stars:>=50"
"project-koku/koku","https://github.com/project-koku/koku","project-koku","Python","308","False","False","3/23/2018 2:29:23 PM","5/1/2026 12:23:25 PM","An open source solution for cost management of cloud and hybrid cloud environments.","cloud;cost;cost-control;cost-estimation;cost-optimization;koku","topic:cost-optimization language:Python stars:>=50"
"upstash/context7","https://github.com/upstash/context7","upstash","TypeScript","54316","False","False","3/26/2025 11:40:39 PM","5/3/2026 4:17:23 AM","Context7 Platform -- Up-to-date code documentation for LLMs and AI code editors","llm;mcp;mcp-server;vibe-coding","topic:llm stars:>=100"
"streamlit/streamlit","https://github.com/streamlit/streamlit","streamlit","Python","44427","False","False","8/24/2019 12:14:52 AM","5/3/2026 12:31:47 AM","Streamlit — A faster way to build and share data apps.","data-analysis;data-science;data-visualization;deep-learning;developer-tools;machine-learning;python;streamlit","s language:Python stars:>=50"
"aws-solutions/cost-optimizer-for-amazon-workspaces","https://github.com/aws-solutions/cost-optimizer-for-amazon-workspaces","aws-solutions","Python","104","False","False","5/3/2017 5:26:44 PM","4/19/2026 12:32:23 PM","This solution analyzes all of your Amazon WorkSpaces usage data and automatically converts the WorkSpace to the most cost-effective billing option (hourly or monthly), depending on your individual usage. Use this with a single account, or with AWS Organizations across multiple accounts, to help you monitor your WorkSpace usage and optimize costs.","aws;aws-solutions;cost-optimization;device-managment;virtual-desktop-optimization-tool","topic:cost-optimization language:Python stars:>=50"
"sherlock-project/sherlock","https://github.com/sherlock-project/sherlock","sherlock-project","Python","82821","False","False","12/24/2018 2:30:48 PM","5/3/2026 4:57:15 AM","Hunt down social media accounts by username across social networks","cli;cti;cybersecurity;forensics;hacktoberfest;information-gathering;infosec;linux;osint;pentesting;python;python3;reconnaissance;redteam;sherlock;tools","s language:Python stars:>=50"
"mudler/LocalAI","https://github.com/mudler/LocalAI","mudler","Go","46014","False","False","3/18/2023 10:58:02 PM","5/3/2026 4:50:35 AM","LocalAI is the open-source AI engine. Run any model - LLMs, vision, voice, image, video - on any hardware. No GPU required.","agents;ai;api;audio-generation;decentralized;distributed;image-generation;libp2p;llama;llm;mamba;mcp;musicgen;object-detection;rerank;stable-diffusion;text-generation;tts","topic:llm stars:>=100"
"zhayujie/CowAgent","https://github.com/zhayujie/CowAgent","zhayujie","Python","43976","False","False","8/7/2022 8:33:41 AM","5/3/2026 4:14:51 AM","CowAgent (chatgpt-on-wechat) 是基于大模型的超级AI助理，能主动思考和任务规划、访问操作系统和外部资源、创造和执行Skills、通过长期记忆和知识库不断成长，比OpenClaw更轻量和便捷。同时支持微信、飞书、钉钉、企微、QQ、公众号、网页等接入，可选择DeepSeek/OpenAI/Claude/Gemini/ MiniMax/Qwen/GLM/LinkAI，能处理文本、语音、图片和文件，可快速搭建个人AI助理和企业数字员工。","ai;ai-agent;chatgpt-on-wechat;claude;deepseek;dingtalk;feishu-bot;gemini;kimi;linkai;llm;mcp;multi-agent;openai;openclaw;python3;qwen;skills;wechat;weixin","topic:llm stars:>=100"
"FoundationAgents/MetaGPT","https://github.com/FoundationAgents/MetaGPT","FoundationAgents","Python","67643","False","False","6/30/2023 9:04:55 AM","5/3/2026 4:30:16 AM","🌟 The Multi-Agent Framework: First AI Software Company, Towards Natural Language Programming","agent;gpt;llm;metagpt;multi-agent","topic:llm stars:>=100"
"deezer/spleeter","https://github.com/deezer/spleeter","deezer","Python","28197","False","False","9/26/2019 3:40:46 PM","5/2/2026 8:47:29 PM","Deezer source separation library including pretrained models.","audio-processing;bass;deep-learning;deezer;drums;model;pretrained-models;python;tensorflow;vocals","s language:Python stars:>=50"
"spotDL/spotify-downloader","https://github.com/spotDL/spotify-downloader","spotDL","Python","24621","False","False","7/6/2016 6:19:20 PM","5/3/2026 3:43:18 AM","Download your Spotify playlists and songs along with album art and metadata (from YouTube if a match is found).","download-music;hacktoberfest;mp3;music;playlists;python;song;song-lyrics;spotdl;spotdl-cli;spotify;youtube-music","s language:Python stars:>=50"
"agno-agi/agno","https://github.com/agno-agi/agno","agno-agi","Python","39877","False","False","5/4/2022 3:23:02 PM","5/3/2026 4:14:18 AM","Run agents as production software.","agents;ai;ai-agents;developer-tools;python","run language:Python stars:>=50"
"Fosowl/agenticSeek","https://github.com/Fosowl/agenticSeek","Fosowl","Python","26170","False","False","2/19/2025 6:03:06 PM","5/3/2026 4:27:18 AM","Fully Local Manus AI. No APIs, No $200 monthly bills. Enjoy an autonomous agent that thinks, browses the web, and code for the sole cost of electricity. 🔔 Official updates only via twitter @Martin993886460 (Beware of fake account)","agentic-ai;agents;ai;autonomous-agents;deepseek-r1;llm;llm-agents;voice-assistant","s language:Python stars:>=50"
"tatsu-lab/stanford_alpaca","https://github.com/tatsu-lab/stanford_alpaca","tatsu-lab","Python","30259","False","False","3/10/2023 11:33:09 PM","5/3/2026 4:55:53 AM","Code and documentation to train Stanford's Alpaca models, and generate the data.","deep-learning;instruction-following;language-model","s language:Python stars:>=50"
"vllm-project/vllm","https://github.com/vllm-project/vllm","vllm-project","Python","78892","False","False","2/9/2023 11:23:20 AM","5/3/2026 4:48:33 AM","A high-throughput and memory-efficient inference and serving engine for LLMs","amd;blackwell;cuda;deepseek;deepseek-v3;gpt;gpt-oss;inference;kimi;llama;llm;llm-serving;model-serving;moe;openai;pytorch;qwen;qwen3;tpu;transformer","topic:llm stars:>=100"
"lemony-ai/cascadeflow","https://github.com/lemony-ai/cascadeflow","lemony-ai","Python","792","False","False","10/24/2025 11:08:44 AM","5/3/2026 1:36:45 AM","Cascading runtime for AI agents. Optimize cost, latency, quality, and policy decisions inside the agent loop.","agent;ai;anthropic;api;budgets;claude;cost-optimization;cost-transparency;google-adk;gpt;huggingface;llm;model-cascading;n8n;ollama;openai;python;together-ai;typescript;vllm","topic:cost-optimization language:Python stars:>=50"
"QuivrHQ/quivr","https://github.com/QuivrHQ/quivr","QuivrHQ","Python","39123","False","False","5/12/2023 11:53:30 PM","5/3/2026 4:47:04 AM","Opiniated RAG for integrating GenAI in your apps 🧠   Focus on your product rather than the RAG. Easy integration in existing products with customisation!  Any LLM: GPT4, Groq, Llama. Any Vectorstore: PGVector, Faiss. Any Files. Anyway you want.","ai;api;chatbot;chatgpt;database;docker;framework;frontend;groq;html;javascript;llm;openai;postgresql;privacy;rag;react;security;typescript;vector","topic:llm stars:>=100"
"Mintplex-Labs/anything-llm","https://github.com/Mintplex-Labs/anything-llm","Mintplex-Labs","JavaScript","59429","False","False","6/4/2023 2:29:14 AM","5/3/2026 4:07:00 AM","The all-in-one AI productivity accelerator. On device and privacy first with no annoying setup or configuration.","ai-agents;custom-ai-agents;deepseek;kimi;llama3;llm;lmstudio;local-llm;localai;mcp;mcp-servers;moonshot;multimodal;no-code;ollama;qwen3;rag;vector-database;web-scraping","topic:llm stars:>=100"
"deepspeedai/DeepSpeed","https://github.com/deepspeedai/DeepSpeed","deepspeedai","Python","42239","False","False","1/23/2020 6:35:18 PM","5/3/2026 4:52:24 AM","DeepSpeed is a deep learning optimization library that makes distributed training and inference easy, efficient, and effective.","billion-parameters;compression;data-parallelism;deep-learning;gpu;inference;machine-learning;mixture-of-experts;model-parallelism;pipeline-parallelism;pytorch;trillion-parameters;zero","s language:Python stars:>=50"
"unslothai/unsloth","https://github.com/unslothai/unsloth","unslothai","Python","63472","False","False","11/29/2023 4:50:09 PM","5/3/2026 4:52:00 AM","Web UI for training and running open models like Gemma 4, Qwen3.6, DeepSeek, gpt-oss locally.","agent;deepseek;fine-tuning;gemma;gemma3;gpt-oss;llama;llama3;llm;llms;mistral;openai;qwen;reinforcement-learning;self-hosted;text-to-speech;tts;ui;unsloth","topic:llm stars:>=100"
"ARYANK-08/breaking-Prod","https://github.com/ARYANK-08/breaking-Prod","ARYANK-08","Python","62","False","False","6/14/2024 9:34:28 PM","4/27/2026 8:31:30 AM","aryan learns ai and all cool stuff over here :)","aws;cloud;cloud-computing;cybersecurity;django;docker;ec2-instance;kubernetes;networking;python;ruby;ruby-on-rails","topic:cloud-computing language:Python stars:>=50"
"casualsnek/cassowary","https://github.com/casualsnek/cassowary","casualsnek","Python","3491","False","False","10/10/2021 7:30:02 PM","5/2/2026 10:52:18 PM","Run Windows Applications on Linux as if they are native, Use linux applications to launch files files located in windows vm without needing to install applications on vm. With easy to use configuration GUI","linux;opensource;python;vm;winapps;windows","run language:Python stars:>=50"
"eriklindernoren/ML-From-Scratch","https://github.com/eriklindernoren/ML-From-Scratch","eriklindernoren","Python","31409","False","False","2/5/2017 12:11:23 PM","5/2/2026 10:59:13 PM","Machine Learning From Scratch. Bare bones NumPy implementations of machine learning models and algorithms with a focus on accessibility. Aims to cover everything from linear regression to deep learning.","data-mining;data-science;deep-learning;deep-reinforcement-learning;genetic-algorithm;machine-learning;machine-learning-from-scratch","s language:Python stars:>=50"
"firecrawl/firecrawl","https://github.com/firecrawl/firecrawl","firecrawl","TypeScript","114348","False","False","4/15/2024 9:02:29 PM","5/3/2026 4:55:40 AM","🔥 The API to search, scrape, and interact with the web for AI","ai;ai-agents;ai-crawler;ai-scraping;ai-search;crawler;data-extraction;html-to-markdown;llm;markdown;scraper;scraping;web-crawler;web-data;web-data-extraction;web-scraper;web-scraping;web-search;webscraping","topic:llm stars:>=100"
"huggingface/smolagents","https://github.com/huggingface/smolagents","huggingface","Python","27052","False","False","12/5/2024 11:28:04 AM","5/3/2026 4:41:02 AM","🤗 smolagents: a barebones library for agents that think in code.","","s language:Python stars:>=50"
"containers/podman-compose","https://github.com/containers/podman-compose","containers","Python","6060","False","False","3/4/2019 8:52:30 AM","5/3/2026 12:11:32 AM","a script to run docker-compose.yml using podman","docker-compose;linux-containers;podman;rootless-containers","run language:Python stars:>=50"
"deepseek-ai/DeepSeek-OCR","https://github.com/deepseek-ai/DeepSeek-OCR","deepseek-ai","Python","23030","False","False","10/17/2025 6:14:27 AM","5/3/2026 4:24:13 AM","Contexts Optical Compression","","s language:Python stars:>=50"
"seehiong/ats-buddy","https://github.com/seehiong/ats-buddy","seehiong","Python","65","False","False","9/29/2025 3:40:40 AM","5/2/2026 2:58:20 PM","ATS Buddy is a production-ready, serverless AI resume analyzer built on AWS Bedrock (Nova Lite). It intelligently compares resumes against job descriptions, providing compatibility scores, missing keyword detection, and AI-powered resume enhancements—all while ensuring enterprise-grade PII protection and cost-efficient auto-scaling.","ai;amazon-bedrock;ats;aws;aws-comprehend;aws-lambda;aws-textract;cost-optimization;dynamodb;hackathon;job-matching;mit-license;pii-protection;python;resume-analyzer;resume-optimization;s3;serverless","topic:cost-optimization language:Python stars:>=50"
"jcjorel/ec2-spot-converter","https://github.com/jcjorel/ec2-spot-converter","jcjorel","Python","199","False","False","12/21/2020 10:13:52 AM","4/6/2026 3:04:58 AM","A tool to convert AWS EC2 instances back and forth between On-Demand and Spot billing models.","billing-model;conversion;converter;cost-optimization;ec2;ec2-on-demand;ec2-spot;ec2-spot-instances;spot;tool","topic:cost-optimization language:Python stars:>=50"
"terrytangyuan/distributed-ml-patterns","https://github.com/terrytangyuan/distributed-ml-patterns","terrytangyuan","Python","501","False","False","1/15/2021 7:51:37 PM","4/22/2026 11:11:50 AM","Distributed Machine Learning Patterns from Manning Publications by Yuan Tang https://bit.ly/2RKv8Zo","argo;argo-workflows;book;cloud-computing;cloud-native;data-science;devops;distributed-machine-learning;distributed-systems;kubeflow;kubernetes;large-scale-machine-learning;machine-learning;machine-learning-pipelines;manning-publications;mlops;python;tensorflow","topic:cloud-computing language:Python stars:>=50"
"SimplifyJobs/Summer2026-Internships","https://github.com/SimplifyJobs/Summer2026-Internships","SimplifyJobs","Python","44406","False","False","5/23/2020 8:53:18 PM","5/3/2026 4:30:46 AM","Collection of Summer 2026 tech internships!","internships;interview-preparation;jobs;university","s language:Python stars:>=50"
"ZhuLinsen/daily_stock_analysis","https://github.com/ZhuLinsen/daily_stock_analysis","ZhuLinsen","Python","33727","False","False","1/10/2026 6:43:20 AM","5/3/2026 4:54:19 AM","LLM驱动的 A/H/美股智能分析器：多数据源行情 + 实时新闻 + LLM决策仪表盘 + 多渠道推送，零成本定时运行，纯白嫖. LLM-powered stock analysis system for A/H/US markets.","agent;ai;aigc;gemini;llm;quant;quantitative-trading;rag;stock","s language:Python stars:>=50 | topic:llm stars:>=100"
"lavie/runlike","https://github.com/lavie/runlike","lavie","Python","2927","False","False","6/4/2015 5:12:31 AM","4/29/2026 9:52:11 AM","Given an existing docker container, prints the command line necessary to run a copy of it.","docker;docker-container;python","run language:Python stars:>=50"
"NousResearch/hermes-agent","https://github.com/NousResearch/hermes-agent","NousResearch","Python","130021","False","False","7/22/2025 10:22:28 PM","5/3/2026 4:57:43 AM","The agent that grows with you","ai;ai-agent;ai-agents;anthropic;chatgpt;claude;claude-code;clawdbot;codex;hermes;hermes-agent;llm;moltbot;nous-research;openai;openclaw","topic:llm stars:>=100"
"alexcasalboni/ssm-cache-python","https://github.com/alexcasalboni/ssm-cache-python","alexcasalboni","Python","209","False","False","2/21/2018 9:39:55 AM","8/23/2025 6:09:01 PM","AWS System Manager Parameter Store caching client for Python","amazon-web-services;aws;aws-lambda;aws-s3;cloud-computing;parameter-store;python;python2;python3","topic:cloud-computing language:Python stars:>=50"
